Hiker trail name,Hiker Journal Link,Journal Story,Start location,Destination,date,Today Miles
Raccoon,https://www.trailjournals.com//journal/entry/666076,"Leaving Kinsman’s Notch the trail went right up for about 800 feet before turning into a gradual climb of another 500 feet before dropping us down 500 feet so we could start the climb up Wolf Mountain
This climb covered 900 feet up and 1000 down. It was challenging. But nothing compared to South Kinsman. 
South Kinsman was 1500 feet. Steep. After the first 900 feet of Rick to rock climbing I had to put my poles away and clamber or scramble up the rocks.    The most challenging climb so far. 
About halfway up Kinsman, as I was crossing a small one step east creek after a marshy area, I was standing on a rock when I lost my balance. I spun backwards and landed on my shoulder ending up on my back in the marsh.  I was a turtle who could not right himself or get up. Unclipped my pack and was able to get up and asses the damage. Wet pants wet boots wrenched shoulder. But otherwise ok. 
About 3/4 of the way up I noticed that my garmin transponder was not on my pack. I keep it clipped to the front shoulder strap. It was gone!  This is the device that lets my friends and family see where I am. This is the device that allows me to txt When I have no cell service!  This is the device that will allow me to send an SOS if I have an emergency!  
Luckily I was high enough on the mountain to have cell service.   I was able to track myself and see where the device was. Great to give my a general location but not sure I would be able to pinpoint the exact spot if my cell service didn’t hold. 
Now I dropped my pack in the woods and headed back down the rock trail. After about 0.1 miles I ran into Seadog who picked up my garmin!  It was hanging on a branch near the spot where I fell. It would seem that somehow the carabiner unclipped and it landed in this branch, or the branch slipped into the carabiner and unclipped it. It’s a mystery how this could have happened. It’s amazing that Seadog found it on the tree and decided not to leave it for someone else to find. 
We had a great view behind us. We could see Mt Moosilauke.  It’s always great to be able to see where you have been. It’s not always easy to look ahead to where you are going without having a map.  Mostly we only is an app called Far Out which doesn’t give one a sense of the surrounding area. 
Dropping down a few hundred feet brought us to the climb of North Kinsman and another steep decent down to the pond and the lodge. 
My knee is a bit sore. It’s tight at night but I hardly notice it during the day 
This has been some tough hiking.  However the weather has been beautiful and I have been really enjoying the hiking.","Kinsman Notch
",Kinsman Pond Shelter,"Jun 21, Wed",11.50
Raccoon,https://www.trailjournals.com//journal/entry/666078,"Garfield Ridge Shelter 15.1
Leaving the shelter this morning we immediately descended. I lost the trail as we crossed over a creek. I was standing in the woods and the trail just disappeared!  Turned around and went to the creek. Actually a waterfall. Not big but tumbling down the mountain. All along the trail there have been white blazes. A 2”x6” white strip of paint on tres or rocks.  When there is a turn there will be two blazes which will generally indicate a turn and in which direction. The Appalachian Mountain Club (AMC) doesn’t seem to follow the apple of these blazes like everywhere else we have been. Also side trails are marked by a blue or other color blaze. 
I backtracked to the trail just before it crossed the waterfall. No double blaze!  I looked down the waterfall and sure enough there was a blaze about 100 feet down the waterfall. So down I go. Scrambling down this creek/waterfall for about 500 ft.  Left the creek but kept going down and often scrambling down rock faces for about 1000 ft. 
After descending two miles we arrived at the Lonesome Lake Hut, the first of the AMC run huts. These are hotels in the woods for hikers. You get dinner, a bed with pillow and two blankets and breakfast in the morning.  Great place to stay except.  Except for the fact that you must reserve in advance which is difficult sometimes for us the predict more than a few days in advance and we often don’t have cell service. Oh and the cost is $150/night per person non-refundable non-transferable. 
But the huts are fabulous. The leave the leftovers out for hikers to eat.  They also have fresh baked goods. For $2 and they have some hiker resupply stuff 
After such a slow start, I think it took Tim 2 1/2 hours to get down and it took me 1 1/2, we were questioning if we would make it through the planned 15 miles. Continued on down. We started at 3750 ft and went back down to 1500 ft to cross under I 93. 
Headed straight back up to 4755 ft for the summit of Little Haystack Mountain. A challenging climb withe some scrambling it boy was it worth it.  It was a beautiful day, not a cloud in the sky and we were above tree line again. Looking ahead we could see our first presidential mountain, Mt Lincoln.  A clear walk across relatively smooth path. Stopped on Lincoln to take in the views. Clear view of Mt Washington, the highest peak until Mt Katahdin. All around all one can see are mountains. The look like waves rolling out in all directions. Photos just can’t capture to complexity and depth of what you see up here. As humans walking or driving around down in the valley you just  can’t comprehend have vast this are is. 
Luckily for us the hiking was easier up here so we made up some time. Of course we dropped off these ranges so we could fit in one more 900 ft climb over Mt Wolf.  Descending Wolf I had my head down watching my footsteps and just trying to get to the shelter just as quick as I could. As I was going down it wasn’t very fast. I know I should have been close to the shelter but wasn’t seeing any sign. It felt wrong.  Sure enough the next blaze I saw was BLUE!  Now I had to go back up the f’in mountain 0.2 miles. 
We all made the shelter by 7. Our latest arrival.   PS we all agreed that the photo does not capture the immensity and depth of the views","
",Garfield Ridge Shelter,"Jun 22, Thu",15.10
Raccoon,https://www.trailjournals.com//journal/entry/666168,"Leaving Garfield we immediately started climbing. Up and over Mt Garfield which set us up to up and over South Twin Mt. A 800 ft steep ascent followed by a 1300 ft steep ascent. 
To complete the day we then had a long rocky, descent. Luckily this brought us down to a flat 4 mile final stretch to the shelter. It was nice to finish a long day with an easy stretch. 
Weather has been beautiful these past few days. Warm but not hot. Wish it could stay this way. The forecast for the foreseeable future is rain, thunderstorms, lightning.","Garfield Ridge Shelter
",Ethan Pond Shelter,"Jun 23, Fri",14.50
Raccoon,https://www.trailjournals.com//journal/entry/666169,"The AMC predates the AT. I don’t know how long. The AMC was granted the authority to build the hut and trail system long before the AT was conceived by the US Forest Service. The entire White Mountain area is covered in trails and huts. The Crawford Trail which goes up to Mt Washington was created in 1819. The AT not until the 30’s I believe. 
The AT has shelters and tent spots that are free to hikers.  It so in the Whites. You are very limited in where you can stay that doesn’t require a reservation and $150 a night. The tent sites are all wood platforms. Great if you have a free standing tent which many people have. Thru-hikers tend to have tents that must be staked out. But you can’t drive a stack into a piece of wood. 
These limitations, plus the threat of rain and thunderstorms for the next week are making it difficult to pick our next site. 
Coming down the mountain we had no reception so could not even try to make a reservation at the next Hut. 3 miles down we go to route302. The AMC  visitor center was up the road 2 miles. Tim got down a bit after I so we started up the road. Luckily we got a ride. 
At the center I was able to make a reservation for the Mizpah hut, only 3 miles from the center. The rain was rolling in. Clouds concealed the mountains. Not knowing how difficult a climb we had ahead, Tim started out. I had to wait for Seadog so I availed myself of the breakfast buffet 
Just as I was leaving, the rain let loose. Donned my rain gear. Got about 1/4 mile and the rain slackened and the climb started. Off came the rain gear. 
The climb was not too difficult and the hut was dry. 
Tomorrow we have a 5 mile hike to the Lake of the Clouds hut which is at the base of Mt Washington. This will leave us a short 1.5 mile climb to summit. 
My son Ian and my friend John Broshard were planning to meet us at Lake of the Clouds and hike two days with us. Due to the weather they both decided not to come. As much as I am disappointed, I am glad they did not come and have to deal with such crappy conditions. 
When we attempt the summit we will be above treeline for 8 miles. Should we be exposed to lightning we will be in danger. The have called for thunderstorms all day today but so far nothing. Not even that much rain. We will be tracking the weather to see if we can cross safely. 
Our destination is a tent site about 11 miles from our hut. Would have been a magnificent view if the weather was in our favor. Now it’s just miles we have to cross to move forward. If waiting a day or two would have given us clear weather we would have waited. At this point the forecast for the next six days is the same.  So we just have to hike in the rain.","Ethan Pond Shelter
",Mizpah Shelter ,"Jun 24, Sat",9.40
Raccoon,https://www.trailjournals.com//journal/entry/666189,"An easy 5 miles up to the next Hut. This was a nero to set us up for the hard day traversing the Presidential loop. The weather today is iffy. Rain and thunderstorms. We don’t want to be on the exposed heights if there is a chance of lightning. 
tomorrow the weather is supposed to not have thunderstorms so that is our planned day to get across   
The huts generally have bunk rooms that sleep12-18 people in triple bunks. Dinner is served promptly at six, breakfast at seven. Most of the people here are day hikers. It makes it easy to hike for several days as you hop from but to hit.  You don’t need as much gear and food so it make for a light pack. 
I plan to come back and hike these mountains with Theresa","Mizpah Shelter 9.4
",Lakes of the Clouds Hut,"Jun 25, Sun",4.70
Raccoon,https://www.trailjournals.com//journal/entry/666230,"Today we were planning to do the Presidential loop.  From the 8 o'clock position at Lakes of the Clouds, the plan was to hike to the 2 o'clock position and stop at the Osgood Tent site about 11 miles.  Forecast - rain, wind, but not thunderstorms until tonight.  If we were feeling up to it at mile 11, we were going to continue down to the 4 o'clock position and stay at the Joe Dodge Lodge, about 15 miles.
Tim started at about 7:30 and Seadog and I followed about 8 or so. I left the hut in shorts and a T-shirt but as soon as I turned the corner of the hut the wind hit me.  Back inside to down rain gear - pants and jacket.  As we were already at 5000 ft, the climb to Mt Washington at 6,293 was not that high.  The trail was not bad, a little rocky but generally easy to get up.  We were in the clouds so there was a constant moisture in the air even when it wasn't raining. The rain came and went periodically up the mountain.  The trail was full of running and standing water.  Just water everywhere.  There apparently was 4 inches of rain last night with the full thunderstorm/lighting package.  I never heard it.
On top of Mt Washington I was to meet Tim.  Visibility was 25 ft.  A local hiker we were with, John, had said that the top was closed for renovations.  Three of the buildings i could find said closed for renovations.  The fourth, a gift shop and hiker lounge should have been open 15 minutes ago.  I tried using my phone to see if I could find out anything about the visitor center, but everything was wet so I couldn't get the phone to do anything.  Couldn't even take a picture.  I didn't see Tim anywhere so I assumed he just went forward.
Leaving the summit we went down the north side of the mt.  Had to cross over the cog-railway track.  The trail crossed the track at what seemed like the track's highest elevation from grade - about 4 ft.  I learned here that the metal tip of my pole had come off.  The track was supported by several stacked rail ties.  As i planned my tipless pole it skidded off and I fell off the track. Hit my quad on the rail ties but fortunately landed on my back on my pack.  The pack saved my back.
Picked myself up and moved forward.  About 1 mile down the trail I was able to find a leeward spot.  Dug out a dry cloth from my pack to dry the phone.  Noted Tim had been waiting at the Visitor center on top and was wondering where we were.  Apparently I didn't search in the right place.  He made the decision to skip the rest of the hike and take a shuttle bus to the Joe Dodge Lodge since he did not want to tent in the rain and he knew it would be difficult to finish the hike to Joe Dodge.  I was able to make a call to Tim and review the strategy.  Hopefully Joe Dodge would be my finish.
At this point I told Seadog that I was going to put the press on so that I could make it to Joe Dodge, or at least had the option to try after we got to the Osgood tentsite.  Almost immediately Seadog was dropping off.  He was spending time talking to John instead of hiking.  I would periodically wait for him to catch up.  Luckily it did because I did not secure the raincover on my pack after talking to Tim and it blew off without my knowledge.
Seadog fell so again I was waiting.  He was ok but taking his good ole time.  I decided I just had to go at my pace.  Pushing up and around Mt Jefferson (sometimes the trail avoids the peak - rarely but this time there was no point in making the summit as you couldn't see a thing) the wind was blowing at about 50 mph with a driving rain and mist.  Luckily it was off my back right shoulder.
Made it 7 miles to Madison hut at 1:00.  That was a long 5 hour hike for 7 miles.  The hope was that after the Madison descent, the trail would become easier.  Waited till 1:30 and messaged Seadog.  No response.  John did make it to the shelter and he told be that Seadog had fallen again and broke the handle off of one pole.  He stopped to fix it and told John he would be slowing down.
So up the boulder Mt Madison.  I had to put my poles away and simple scramble up the 1/2 mile to the summit.  Somewhere in there, as i had stretched my arms above me to pull up I heard a pop and felt stabbing pain in my left shoulder.  I quickly pulled my arm back and heard another pop and the stabbing pain went away.  The shoulder was a little sore.  I figured I must have dislocated my shoulder, not the gruesome dislocation I imagined where you have to go have someone relocate it, but only partially (I had no idea if that was possible, only what I imagined).  My choice was to go back to the hut where they would tell me I had to hike down the mountain to get attention since I was not incapacitated in anyway, or continue on.  So on I went.
At the top of Madison, I was again in the driving wind, but now I had turned the corner and was headed into the wind.  Down the eastern side of Madison it was bolder hopping in the rain and wind.  Still worried about lightening and thunderstorms (even though not forecast) I wanted to get down below the tree line.  One and a half miles to the tree line - stopping at rock cairns waiting for the mist to move so I could see the next cairn, I finally made it to the tree line about 3:30.  I figure I was hiking at around 1 hour per mile.Out of the wind finally, fewer rocks on the trail, I was able to go a little quicker.  Made it to Osgood around 4:00 leaving only 5 more miles to go.  Still no word from Seadog.  The 5 miles to Joe Dodge was relatively flat as it went along the contour lines through the woods.  Other than two angry stream crossings, the trail was good.  At the stream there was no way to get across by rock hopping.  At this point you just decide to step in the stream and soak your shoes.  Anything else is just adding risk.  Sloshing out of the stream I made Joe Dodge at 6:30 - 5 hours for 8 miles.What a please Joe Dodge was.  It's more of a hotel than a hut.  They had HOT SHOWERS!  A boot dryer (really for snowshoeing) and hot food.  Met up with couple, Strider(?) and Songbird, whom we have crossed paths with before.  They are in their 50 I'm guessing.  They had made the same hike from Madison in 7 hours.   Songbird had decided to end her hike as she needed to get back to work in July (see was allowed 4 1/2 months off) and she didn't see the point in hiking in the rain for another week.","Lakes of the Clouds Hut
",Joe Dodge Lodge,"Jun 26, Mon",14.90
Raccoon,https://www.trailjournals.com//journal/entry/666232,"We have a zero after one more night.  So looking forward to taking a whole day off.  
Forecast - rain! 
Didn't really feel like hiking today.  Tim left early as always, I lingered another hour so didn't get out the door until 8:30.
Todays hike featured not one, not two, not three, not four, but five mountain climbs.  The first being the longest at 3000 ft.  The remaining were from 500-900 feet.  Somewhere during the second descent, as i was lowering myself down another rock face, my shoulder popped again.  It quickly popped in again but at this point I decided I needed to see a doctor. While my shoulder was a little painful it was not prohibiting my movement.  My fear was that it would become fully dislocated while hiking up or down a rockwall or that I would slip on a rock or a wet board or a root.  There I would be without the ability to use my shoulder.  I decided to go off trail and get it looked at.
My googling of a shoulder separation, even partial, was that I would be in a sling for 4 weeks and then a course of rehab.  The reality being that I was done for the season.  The idea of not finishing even the northern half was disappointing.  The idea of not hiking in the rain for two more weeks was a relief.  My bigger concern is that I have just gotten my health back after the cancer and now I may be incapacitated for another month or two.  Hopefully that's not the case.
Arrived at IMP shelter, a nice four sided shelter with an open door.  Diner was in the rain sitting on a low log.  Didn't linger over dinner.  Had a conversation with Tim about my leaving the trail in Gorham.  He is of a like mind and understood that I need to stop and see what up with the shoulder.","Joe Dodge Lodge
",Imp Shelter,"Jun 27, Tue",13.10
Raccoon,https://www.trailjournals.com//journal/entry/666234,"With rain in the afternoon forecast we both left the shelter around 6:30.  Eight miles with some small climbs and a long downhill.  We wanted to beat the rain before getting to town.
Trail had a climb to start then several smaller, more gradual climbs, kinda feels like the mountains are getting more gentle.  Still wet but not a lot of running water.  Arrived at Rattle River which also was heavily swollen.  Not way around or over so we committed to fording the rivers (3 crossings).  Cleaned our boots off, but now our feet were soaked - a recipe for blisters for sure.  Only another 1 1/2 to the road to Gorham so not too bad.  
Was hoping to get a shuttle ride, but none of the services were responding.  With a 3 mile walk to town and rain just starting, we began the road walk while trying to hitch a ride.  Two bearded old guys aren't usually gettin a ride, but we got lucky and caught a ride.
At the post office, Tim's box had not arrived - apparently it was in Maine, I picked up my resupply and the replacement pack that Osprey offered after the squeaking noise I had reported 6 weeks ago.   Right next to the post office was a liquor store.  Store celebrate/commiserate my last day we got a bottle of bourbon and some bitters.  Off to the bar for a beer and pulled pork sandwich.  At the bar I asked the bartender for a couple of slice of orange.  She did even better by giving me a whole orange.
We drank a bit that afternoon.  Had dinner and in bed by 8.  My outbound bus is at 7:50 to Boston.  From there I will stop at Ian and Jackies house for a few days, and then a train to home.  I have an appointment on Thursday.
As of now I am planning one more entry as I believe I will not be hiking more this year.  Once I have a prognosis I will make one more entry.","Imp Shelter
",Gorham NH,"Jun 28, Wed",8
