Hiker trail name,Hiker Journal Link,Journal Story,Start location,Destination,date,Today Miles
Raccoon,https://www.trailjournals.com//journal/entry/663462,"All I could think about this morning was Jamberry Jam 
Spent the night in a shelter with American Fido and Oz while a newcomer Jkwim tented   I may have his name wrong today but I’ll get it right soon. He is from Athens GA and is section hiking to CT. He worked at the CertainTeed plant in Athens the same time is was doing the rebuild there. Small world!  He plans to finish in CT about the same time we will pass so I expect we will be seeing him several times 
after leaving the knob I kept thinking of the time Tony and hiked from the Lehigh west. When we crossed over the Northeast Extension in it must have been July, we sat down in the wild blueberry plant and just ate blueberries. This then brought to mind that bears like blueberries. So then I connected Jamberry Jam. It was a book that both Katelyn and Ian had to be read many many times. I think there was a cassette tape where the bear read the story. I couldn’t get out of my head the way he said Jamberry. Stretching the an out so it sounded like Jaaaaaambery Jam! Yeah!  Couldn’t get any more than then but since it was a glorious sunny spring day and trail became relatively easy after the first mile of rocks I had a most enjoyable morning hike. 
The trail was rerouted since I was last o. It. It now runs on the north side of Blue Mt and one gets to look out over the Lehigh river and palmerton. This is the only spot I have run into that is covered with wild blueberries. Sorry I’ll be missing them 
Meet Jkwim at the water spot before heading 1000 feet down to cross the Lehigh. Yes and then go up 1000 feet to get back up to the ridge. I think over the four rivers in PA this is the most difficult. Up the other side I kept thinking of the time Theresa Liam and I hike it. Of course Liam was capering ahead and all we could do is worry that he might slip. At what age does one stop doing that?
Two more nights and two more days and we are in Delaware Water Gap for a zero day.  Looking forward to washing my clothes, a good shower and maybe a Phil’s game on TV
Looking forward to next week as Liam May be able to join us for a couple of days the photo is the wild blueberry fields","Bake Oven Knob
",Tent Site near Little Gap,"May 08, Mon",12.90
Raccoon,https://www.trailjournals.com//journal/entry/663511,Rocksylvania. Yup that is how the hikers refer to our fair state. Let me explainin My experience hiking across 225 miles (15 more on our last day tomorrow) there are four general types of rock formations lect over by our friends the Ice Age. Type 1. The large car and refrigerator type boulder formation. I like this type. It makes me feel like a kid. You get to clamber from boulder to boulder   Sometimes you feel it’s a bit risky like the Knives Edge or the east side of the Lehigh Gap. It’s fun in an adolescent sort of way Type 2 these areas are just chock full of rocks. The saving grace is that there are big rocks mixt in. You cross these like you are crossing g a stream. Albeit a stream of rocks. These can go on for 1/4 or more.  It you get to step from big rock to big rock avoiding all the smaller stuff i between. I like these. Again it’s like crossing a stream but you are actually just walking down the rock stream Type 3. This is where it starts to get tricky   There are  bunch of small rocks and larger ones mixed in. You try stepping from one big one to the next but you always fall into the rock stream. You start to curse Type 4. Type 4 challenges your every footfall. These are Rick stream without any large rocks   Every step is a decision. Do I step on this pointy rock? Do is squeeze my foot between these two rocks?  Invariably you miss and you step on the pointy part in the middle of your foot.  Or you miss and get jabbed in the side of your foot or your ankle or you stub your toe or your trip etc etc etc. And now you are really cursing and just focused on getting out of the rock stream. Everyone is looking dory to the end of Rocksylvania The light at the end of the day is Dietzi’s tavern in Wind Gap. He allows hikers to set up tents in the back yard of the bar. Beautiful grass lot. He will give us coffee in the morning and drive us the mile back to the trail. All he asks in return is that we have a few beers at the bar and maybe a burger!  What a deal!,"Tent Site near Little Gap
",Wind Gap,"May 09, Tue",16
Raccoon,https://www.trailjournals.com//journal/entry/663627,"Well PA didn’t make it an easy exit   We had a longish 16 mile hike to the Water Gap to finish the state and take our zero day. But it was more rocks. About the first 10-22 miles was more of the same. Thankfully the last few miles were a bit better. A little disappointed that we never got a good view of the gap
We have been seeing more ticks about. In fact a meet a woman who had one crawling up her face. Yes I did her the service of removing it. 
Spent the night in Marty’s Old Yellow House it’s a hostel or B&B in progress. He is a carpenter and home builder by trade. How he did that I can’t imagine. He has a million things in progress but nothing is finished. He was painting exterior, putting in a brick walk, rewiring, wallpapering, remodeling the kitchen, refinishing wood floors, building a staircase in the barn etc etc etc. nice guy and maybe worth a trip there in 3 years.","Wind Gap
",Delaware Water Gap - Marty’s Old Yellow House,"May 10, Wed",16.50
Raccoon,https://www.trailjournals.com//journal/entry/663682,"Heading for the section that I first hiked when I was 18. We had planned to hike a 15 and a 10 but we want to trim some days in anticipation of going slow over the mountains up north.  So a 25 is in the cards. What a mistake. I spent 11:30 to make that distance. That includes the stops. There were enough rocks to make it still challenging. Not as bad as PA but bad enough. I think 20 would have been just fine. 
Tim saw his first rattlesnake on the trail and we heard cayotes in the night. But I slept straight through the night as exhausted as I was. 
My nephew Zach and his wife Anthonia are planning to meet us on the trail tomorrow","Delaware Water Gap - Marty’s Old Yellow House
",Brink Road Shelter ,"May 12, Fri",24.90
Raccoon,https://www.trailjournals.com//journal/entry/663906,"we planned to shorten our day based on the long day yesterday so only 15.5. Yeah that’s not short but the shelters and water are not  easily available here. 
I know there are rocks everywhere but I am just wishing for a little easy walking sometime 
Meet Zach and Anthonia at Sunrise Mt. I was good to have family join for part of the hike. They were fresh and energetic unlike us who are not quite so. 
When we got to the shelter turn off we realize we had another .4 miles to go. They try to put the shelters near water so this one was a hike.","Brink Road Shelter 
",Rutherford Shelter ,"May 13, Sat",15.50
Raccoon,https://www.trailjournals.com//journal/entry/663907,"I am glad I can sleep through noise. Last night we were visited by a whiporwill. Started signing around dinner and didn’t stop until 5:30 AM. 
It’s like the bird doesn’t need to breath  tim said he was up all night.
Today we passed High Point State Park. Thinking about the time I did the Longest Day Ride with Bob Caldwell. Which is the reason I met Theresa.  Glad I did that ride!
Finally turned off the mountain ridge to head east across the northern border of NJNY. It was nice to walk across the rolling fields. 
Did I mention the ticks?  I think we had two ticks between us through MD and PA some 260 miles. We have had close to twenty so far in NJ. And we have seen more snakes in the past two days   Tim is mortally afraid of them and of course he has seen the most including a rattlesnake","Rutherford Shelter 
",Pochunck Mt Shelter,"May 14, Sun",15.50
Raccoon,https://www.trailjournals.com//journal/entry/663908,"completed state number 3. Only 11 to go
the last day in Jersey was a fairly early day. We even got a photo of the tops of the city. We are on this outdoorsy adventure it you can still see NY.  
Heading for our first stealth site. A camping spot on a flat pirate of ground just big enough to fit a tent on there are no amenities. Your tent site usually has some rocks and roots that you just have to sleep around the best you can.","Pochunck Mt Shelter
",Stealth site southern NY,"May 15, Mon",16
Raccoon,https://www.trailjournals.com//journal/entry/663909,"To stay on our schedule we planned to hike 22. However the Mew York State of Mind hasn’t been kind. NY show’s relatively flat. The realtors that it just goes up and down in 100 200 and 300 foot steep mini climbs. 
About 7 miles in we adjusted the plan. Hike 17 miles to route 17. If we we’re feeling good then do then next five to the shelter else get an Uber to a hotel
well it wasn’t kind. I wish the photos would show the perspective one has when staring up a 150 foot climb. It’s a wall of rock that you have to go over. Put your poles away because they just get the way. You need both hands to grasp the Eddie’s of rock and pull you and your 30lb pack up. Oh yes the. You have to go down 
 Before arriving at 17 there were three of these rock wall’s immediately after each other.  Then down a steep slippery 700 foot slope where you would slide for thirty feet if you lost your footing 
goung through this gauntlet I decided I needed to take a break. Slow down.  
No pictures as they don’t convey the reality of the climbs","Stealth site southern NY
",Hampton Inn,"May 16, Tue",17.60
Raccoon,https://www.trailjournals.com//journal/entry/663983,,"Hampton Inn
",West Mountain Shelter,"May 17, Wed",13.30
Raccoon,https://www.trailjournals.com//journal/entry/663982,"Well it was cold again last night. I was thinking that I might not need my cold weather stuff but it was in the low 30’s. Not as bad as in PA but cold. 
You could see NYC clearly from this shelter and at night it was lit up   The photo doesn’t do it justice 
Short day today.  Up and down Bear Mt. It was a park in the 20’s. The trail up was gradual and full of stairs. The way down was steep but all stairs 
We are taking it easy for  coupme of days as Tim has a mild (I hope) case of shine splints on one leg","West Mountain Shelter
",Bear Mt NY,"May 18, Thu",5.70
Raccoon,https://www.trailjournals.com//journal/entry/664126,"Leaving the Bear Mt motor lodge run by a racist   Glad to be out of there 
Yesterday Tim iced his shin and took advil but it seemed worse this morning We planned another light day to see if his leg would improve 
headed through the zoo on amour way out. Got to see a bear!
the Graymoor site is a religious center that gas hosted hikers since 1970. We camped at a baseball field with a pavilion, running water, a cold shower and a portapotty 
Tim decided that he couldn’t go on. Fortunately friends and former coworkers Sean and Gary live in the area. Tim will take 7-8 days off to see if he heals enough to continue 
Tomorrow I’m on my own. It’s supposed to rain so I will head out early to minimize the exposure","Bear Mt NY
",Graymoor Tent Site,"May 19, Fri",7.30
Raccoon,https://www.trailjournals.com//journal/entry/664128,Almost made it before the rain started. Had to hike the last 3 miles in the rain. I was hoping that I would get my trail legs. Not sure that they will come. I find that I am slower than when I started and that uphill seems to be harder. Hope it changes. Still trying for 15 miles a day bury it is wearing Fortunately it’s warm enough that I can hike without rain gear. You get wet but the rain gear only makes one sweat unless you slow way down. It’s been a misty buggy rainy day. Not much to cheer about except not have to set up a tent in the rain!  The shelters make this much easier,"Graymoor Tent Site
",Canopus Lake,"May 20, Sat",11.90
Raccoon,https://www.trailjournals.com//journal/entry/664249,Had a nice run today. Mostly ridges and the rocks were not too troublesome   It’s getting a little buggy. Why they fly into your eyeballs and nose and especially your ears I don’t know but it makes me want to get a bug net. Slept in the tent last night as the bugs were a little bad. I was the only hiker in camp until someone rolled in around 9. Still a little worn out. Finding the uphills are slow going. Makes me wonder if I can keep this up,"Canopus Lake
",Morgan Stewart Shelter,"May 21, Sun",16
Raccoon,https://www.trailjournals.com//journal/entry/664251,"I was dragging this morning until I spoke w Theresa and Liam. They gave me the boost I needed 
Almost jumped in a lake to swim but I was late to meet Sean and didn’t want to keep him waiting 
Met Sean Murphy and his parents John and Betsy. I thought we were meeting six miles from my start but there was a miscommunication. It was six miles from the end. At any rate it was good to meet them. John and Betsy have offered to host my zero day and it will work out well as they are so flexible. Looking forward to being off on Thursday 
The soles of my feet are getting sore. Not blistered but that may be next. Will have two short days and a zero to recover 
had a great time talking with Sean about his life’s and his hiking w family and of course catching up on work projects 
Sean taught me cribbage which reminded me of my Aunt Marion (even though she played Canasta not Cribbage).","Morgan Stewart Shelter
",Wiley Shelter,"May 22, Mon",16.60
Raccoon,https://www.trailjournals.com//journal/entry/664250,My feet seemed ok after sleeping. No apparent blisters. A few calluses but that is good. Hiking about 12 today. Still trying to get a little rest and recovery. Beautiful day hiking. Had time to stop and smell the flowers. Since MD we have been hiking through Mt laurel and rhododendron forest.  I think we I am ahead of the bloom by a week or two. Hopefully it catches up  CT has been pleasant to hike through.  Mostly soft ground minimal rocks. It does have a few steep shorter climbs but all in all pretty easy Sean hiked to the shelter w me before heading home to his family. Had a great time catching up on his family and work at ACE. Spent the afternoon relaxing and reading. Sounds like Liam my have finally found a place to stay while in Seattle. It’s near to his plant so that will minimize his commute,"Wiley Shelter
",My Algo Shelter,"May 23, Tue",12.80
Raccoon,https://www.trailjournals.com//journal/entry/664412,Four miles walking along the Housatonic river. Piece of cake. Still no blisters. I may have dodged a bullet there. Still no prognosis on Tim but he is making plans to join me next week in the hopes that it is positive Had a late morning as NI big miles today and John and Betsy Murphy have grandcid duty till 5. They were early and met me with watermelon and a banana and a cold drink.  What a pleasure!  When you do t have the simple things you appreciate them more Betsy made salmon and swordfish and mixed vegetables and potatoes and salad. All the things I don’t get out of the dehydrated trail food. Betsy and John have hiked the PCT and done a lot of day and weekend hiking. We shared stories and adventures. They gave me a preview of the Presidentials which is really helpful and John and Dave are hoping to meet us therethat’s John and Betsy in front of their amazing rhododendron,"My Algo Shelter
",CT Route 4 outside Cornwall Bridge,"May 24, Wed",11.40
Raccoon,https://www.trailjournals.com//journal/entry/664701,"Had a great day recovering with the Murphy’s
Note their amazing rhododendron","CT Route 4 outside Cornwall Bridge
",The Murphys,"May 25, Thu",0
Raccoon,https://www.trailjournals.com//journal/entry/664702,"Another short day.  I had wanted to continue on to pick up my resupply in Falls Village but it would have meant a 17.4 mile day plus the shelter was 0.4 miles down a steep trail 
So instead I had another pretty day in CT. Soft trails no big climbs and improving weather. My night at the Murphy’s allowed me to escape another night in the 30’s
Meet two flipfloppers at camp. Emily and Scroggin. Emily is a young woman from Australia so it’s fun to listen to her talk. Scroggin - can’t tell her age -is American but lives in Australia. The two of them have been traveling together 
I was also concerned about my feet but thankfully they seem fine after the rest. So I’m going to assume all is wellAnd sometimes the privy is not very private but it certainly brings you back to nature","The Murphys
",Belter’s Campsite,"May 26, Fri",11.10
Raccoon,https://www.trailjournals.com//journal/entry/664703,"Wanted to do more but no camping/water available in a reasonable spot. Heard from Tim. He’s planning to rejoin on Tuesday or Wednesday. His leg is not 100% but he hopes it will continue to heal. I am worried that it will only get worse but will support his decision. It either will or won’t get better. We will call Gary Hida (friend) on Sunday as he has offered to host us for a night and return us to the trail. 
With that in mind I am trying to not get to far into MA so today’s distance helps that cause 
My feet seem to be back to normal. That means sore and tired but I no longer have that tingling feeling as if blisters will erupt
In camp early. Riga had a picnic table with a nice view overlooking the valley    Scroggin and Emily pulled in about 1 1/2 hour later. Later a couple of GA boys pulled in.  They get in set up a tent get something to eat and go to bed. Not a lot of socializing","Belter’s Campsite
",Riga Shelter,"May 27, Sat",13.60
Raccoon,https://www.trailjournals.com//journal/entry/664704,"Last night it was warm. This morning I was able to just wear shorts and a shirt. 
Planning 10 today and 16 tomorrow for the Gary pickup on Monday. I would even the days out but there is no camping in the low valley
So three summits today. Bear Mt. Highest point in CT. A easy gentle climb. I sat at the summit for a while and enjoyed the view
Race ledges was a series of steep ledges. I sat up here for about a half hour. Had lunch. Enjoyed the sunshine and confirmed the arrangements with Tim and Gary. Gary is sou fan awful lot of driving to help us out. It great of him
Race ledges leaded to - yup Mt Race. Not much of a summit as it’s still tree covered at 2361 ft. An easy climb as well. 
Next up - er down - is Sage’s Ravine. About a half mile of rugged trail next to a the most picturesque stream yet. My favorite spot so far. I need to see if I can find a shorter path to it so I can bring Theresa 
And finally Mt Everett. When I first saw the name I thought it said Everest. It was steep. About 800 ft with rocks and the steepest longest climb so far 
My east 10 mile day turned into not easy. But. It seemed easier than my hiking last week. I think the zero and these shorter days have been like Liam said a recovery week. 
Scroggin made it to camp but Emily had to leave the trail for a stomach ailment 
It seems as if I encounter people for about 2-3 days and then our paths diverge","Riga Shelter
",Glenn Brooke Shelter ,"May 28, Sun",10.10
Raccoon,https://www.trailjournals.com//journal/entry/664705,A relatively easy day but I was anxious to get my mileage up. We should be averaging 14 miles and the recent string of 10 mile days is putting us behind our hoped for dates. Came down from Mt Everett along a 3 mile trail so nothing like the ascent which seemed like 1/2 mile up. But then I crossed a valley for about 5 miles. Other than the mosquito infested bogs it was not too bad. Finished with some gradual uphill climbs to round out the dayMet Gary and Tim about 3 in the afternoon when I started at 7:30. So 15 is very doable and maybe even 17. With Tim back we will only do 10 mile days to see if his shin holds up,"Glenn Brooke Shelter 
",MA Route 23,"May 29, Mon",16.30
Raccoon,https://www.trailjournals.com//journal/entry/664752,"Had a very easy day so Tim could test his leg. We are only doing 10 miles, stopping frequently and going about 45 minutes a mile which is about twice my normal rate and 15 minutes slower than Tim’s normal. He is being very cautious which is good 
Let’s hope he heals while walking 
This site was once a 93 person Shaker Village   There were farm implements and old stone walls left over","MA Route 23
",Shaker Campsite ,"May 30, Tue",9.20
Raccoon,https://www.trailjournals.com//journal/entry/664888,"A chilly morning. Just a reminder that the cold is never really gone the further north we go
Got up late and left about a half hour after Tim. We stopped at a roadside stand   I was disappointed as I was hoping for a sandwich but they only had candy and soda and ice cream. As that was all they had I got some as I am running a bit low on food as we are doing the slow walk. 
All day I was trying to stay connected to the world via my phone as Theresa and Liam were flying to Seattle. Often I can just get a txt in and out but can’t make a call. Happily their travel was uneventful and they arrived safely. 
I can make the next reprovisioning in Dalton but need to seriously consider the next 10 days. My supplies need to last that long and it may be too much to pack. If we are going to take longer it will become a bigger issue.  I think we pass through a town or two which may ease the food situation 
The shelter is fabulous. It’s actually a two story cabin with a caretaker. It was  sunny and clear so I got to go for my first swim in the pond!
Tim thinks his leg is not getting worse. Next week we will have to up the miles to get through the 10 day food stretch","Shaker Campsite 
",Upper Goose Pond Shelter ,"May 31, Wed",10.10
Raccoon,https://www.trailjournals.com//journal/entry/664890,"Nancy, the caretaker of the shelter made pancakes for us this morning. We were there with a group of 8-9 hikers from GA. While the pancakes were good we only had 3 a piece, just enough to get started 
We then came up with the plan to have second breakfast at a motel up the road. Hikers talk about how great it is and it is supposed to have food. Alas when we got there they told us because of COVID they no like her serve breakfast. A great disappointment 
Passed over the Mass Turnpike. It a good reference for where we are in the world. Sometimes you lose track of these things Met a flip flipper like us   Comparing notes we realized that we are more than 1/4 through the hike and halfway to Katahdin . Big milestones that I didn’t realize we passed 
Spent a mile or two walking with Frizzle.  She’s is from MA and has hiked from GA. Coincidentally she also had a case of shin splints. She worked through them but it took weeks. 
And finally. There is very little to see here in MA. The pond was great but the trail has no views of anything.  We hike in the woods for hours and “summit” the peaks but they are just points in a map and the trail goes down instead of up. The miles go by but I’m looking for a place to sit and admire the view","Upper Goose Pond Shelter 
",Cookie Lady ‘s Yard,"Jun 01, Thu",11
Raccoon,https://www.trailjournals.com//journal/entry/664913,"We had such great plans for the day
Short 10 mile hike into Dalton. Go to the bar and get a beer.  Stop at the post office and get our supplies. Visit the community center for a free shower and then an Italian dinner. And then Uber to our hostel
Well some of it worked. The beer was excellent. The shower fantastic. The post office no problem. Then the rain started and we had an hour to kill before the restaurant opened. So what’s a person to do but go get another beer!  
The restaurant which had great photos of Italian dishes basically was a pizza joint. And tasteless pizza at that. The wine was not good either. So we finished up and tried to get an Uber. No go. No Ubers available. Looked at our options. Hike 3 miles. Hitchhike 20 miles   And it was threatening to rain. Luckily the hostel offered to drive back to town to pick us up. 
Well then we got to the hostel. They have Wi-Fi but it’s so weak one can’t connect. The water is a hose at the house.   Well I give up. The day is not a total waste but enough disappointment to dampen the day. Good thing tomorrow is a brand new day","Cookie Lady ‘s Yard
",Zero Day Hostel,"Jun 02, Fri",9.60
