Hiker trail name,Hiker Journal Link,Journal Story,Start location,Destination,date,Today Miles
Raccoon,https://www.trailjournals.com//journal/entry/654215,"Well here we are on April 19. The day before we start our NOBO Flip Flip. So thankful for my wife Theresa and my friend Peggy for taking Tim and I to the start in Harper’s Ferry. 
It promises to be a beautiful start to a long anticipated adventure   I will miss my beautiful wife and my family","Harper's Ferry
",Harper’s Ferry,"Apr 19, Wed",0
Raccoon,https://www.trailjournals.com//journal/entry/662410,had a grand start to my adventure   It was a beautiful day warm but not hot. Theresa Peggy and Tim were with me. Tim and I have jointly agreed to take the first week easy. We plan to average 12ish. That leave a lot of time at camp but this is a marathon so we will start slow and see what we can do later. Looking forward to a hot shower at my sister Claire’s on day 7. It was great to start this hike with my wife   She has shown me that we can do more than we think we are able   As Nike says just go out and do it  I am looking forward to her joint us again   Maybe at Katahdin or again at Harper’s Ferry for the southern leg,"Harper’s Ferry
",Crompton Gap,"Apr 20, Thu",10.10
Raccoon,https://www.trailjournals.com//journal/entry/662477,Another beautiful warm day. It’s great to be out in the spring sunshine. Had breakfast with my friend Tom. He is working south. Our plan was to stop at Pine Knob shelter but after looking at the rain we decided we wanted to be at Ravens Rock as early as we could on Saturday as the rain is due at 2  Stopped at the original Washington Monument  it was built 60 yrs before that other one   Was running a little low on water when lo and behold an Angel appeared.  Pick (Pick of the Litter) was out dispensing Gatorade  this was a great pick me up and got me though the extra mile and a half,"Crampton Gap
",Annapolis Rocks,"Apr 21, Fri",14.10
Raccoon,https://www.trailjournals.com//journal/entry/662513,"The goal today - avoid the rain.  Ravens Rock is 11.9 miles away and we have been managing 2/hr including stops  We are concerned that it will fill up before or arrival so we got an early start
I left Tim at about mile 2. It was a tough day as it had three climbs the hardest at at end. Started spitting when I was .2 out  Tim arrived about 20 minutes later  
ten minutes later the rain came  
the only mishap being that I cracked the screen of the Kindle that Ian let me use  I was looking forward to a couple of hours of reading. Guess I’ll just have to nap","Annapolis Rocks
",Raven Rock,"Apr 22, Sat",11.90
Raccoon,https://www.trailjournals.com//journal/entry/662634,"The run in to Raven Rock was hard.  We were pushing the speed and there was a final steep long climb up to the shelter.  I was worried that the trail was going to wear me down after that day. Fortunately today was easier, the weather was cooler and I felt good. 
Completed our first state when we crossed the Mason Dixon line into PA. One state done 13 to go.
 Tim and I leapfrogged the day and arrived at the shelter mid afternoon.  We decided to stay in the shelter as it was promised to be a cold night. Had my first equipment failure today. One of the extra tough bags Tim and I use to collect water had a leak. Not to worry as I carry a spare","Raven Rock
",Tumbling Run Shelter,"Apr 23, Sun",13.20
Raccoon,https://www.trailjournals.com//journal/entry/662637,"I guess the best place to start is while asleep, or while trying to sleep.  Went to bed around 6 just to get out of the cold.  You basically endure the night when you are not warm. We normally get up at 6 and do breakfast and break camp and get on the trail by 7:30-8. At five am I formulated a new plan. Get up skip breakfast and get hiking to warm up.  At six I crawled out of the warmth and put on my cold hiking clothes and two extra shirts and my winter coat and my rain gear.  Nope still cold. 
Tim was going to follow his morning routine despite the cold 
Went to grab my food bag which was hanging up to keep away from the bears and other critters. It’s up about 15 ft in the air  When I got over to my bag it was sitting on the ground with scrapes and scratches all over. No sign of bear prints so I figured a raccoon had figured out how to jump over to the pole and unhook the bag. No matter at this point as I just wanted to get moving
Fortunately the trail out was an uphill climb.  That warmed me right up. 
When I stopped at and nice sunny shelter for breakfast I found that the raccoon had punctured 4 out of 5 of my special odorless food bags. Luckily they only damaged a few bars and my powdered eggs.  I bear bag didn’t stop it’s claws from puncturing the bag but they couldn’t cut it and open it up. So it worked as advertised!
went down to fill up on water and found my second (spare) water bag developed the same leak!  I can manage the leak by holding that spot closed while using my other hand to squeeze the bag to filter the water  hope it doesn’t spring another leak 
Aside from the climb out in the morning it was a pleasant day cold but short sleeves and gloves were all that were needed  passed through Caladonia State Park  Remembering family hikes while at Nawakwa 
Arrived at Quarry gap shelter through a tunnel of rhododendrons  this would be a beautiful walk when they are in bloom 
Met Tom x the caretaker of the shelter  he keeps it lick  a luxury accommodation  there are pansies and Lillie’s and hanging plants  he had just freshly painted the floors  there is a hanging chair a bench in the sun and a spring ten yards from the entrance 
One can easily see the care and time Jim had invested over the years  We hikers would not be able to do what we do without the support of Jim and the thousands of volunteers up and down the trail
oh and it’s going to be freezing again tonight  sleeping in my tent in the hopes it adds 5 degrees of heat  
I’m planning g on an early exit tomorrow","Tumbling Run Shelter
",Quarry Gap,"Apr 24, Mon",13.20
Raccoon,https://www.trailjournals.com//journal/entry/662750,"So I slept in the tent and yes it was warmer.  Tim said it was generally warmer and he slept in the shelter. I read the thermometer (yes the finer shelters have a thermometer) it said 30 so I don’t believe Tim’s assessment.  I went to bed with my socks my long PJs, a tee shirt a long shirt a button up long sleeve shirt my winter coat my sleeping bag liner and of course my bag.  Other than my rank hiking attire I had no other clothes to put on. So yes it was warmer. I slept till 4:30 before the cold work me. 
On waking Tom was still planning on eating in the cold  Like yesterday I set out  Again thankful for a long uphill out of camp to warm the bones (Hah the Body).  
The day steadily improved. Was hiking in a tshirt and pants after an hour. 
Had thoughts of The Last if the Mohicans and dad as that was one of his favorites. I felt I was one of the Iroquois (yea I know it’s the wrong state) walking the ancient pathways. But they would not have taken us up and down every hill between here and there
Or original plan had been to hike to Tom’s Run shelter, about four miles shorter, bit both Tim and I were running low on cooking fuel. As there was a general store at Pine grove we decided to go the additional miles    This store is the site of the infamous midway point where NOBO thru hikes eat a half gallon of ice cream  We we’re concerned that had store would close sooner than the 7pm time listed in the AT guide so I pressed on alone.  Upon arrival I found the store to be closed but fortunately the owners daughter was there making preparations to open and she let me buy the last canister of fuel  
We camped at the state park on a beautiful grassy patch.  More importantly the sun was shining and the temperature was pleasant.  It was the first time in the trip that I was relaxed at camp  
Although it was going to be cold at night the temps were going to be in the low 30s and I had learned to wear everything, the night did not hold as much dread as the last two nights","Quarry Gap
",Pine Grove Furnace State Park,"Apr 25, Tue",17.30
Raccoon,https://www.trailjournals.com//journal/entry/662769,"Woke up to a light rain but the cold snap is over.  Tim decide to skip breakfast and get on the trail. We headed out separately but I gave him bum directions. I planned to hit the pavilion and the big bathroom by Fuller lake. As I needed water and a bathroom that’s were I headed first and made coffee figuring Tim would be by shortly.  Tim went to the pavilion and had a bar breakfast figuring I’d be by shortly.   When I was done I thought I had missed Tim so I headed out. Well after five miles of not catching him I realized I was ahead and not behind. The day became sunny but slight cool. When I got to Tagg Run I decided to sit at the bridge and wait
Claire picked us up around 12:30. I was great to get off the trail and get a hot shower and sleep in a bed   She had prepared chicken and Ailsa/Brad’s famous giant sweet potatoes for lunch and for dinner.  After relaxing with a couple of Guinness and Paddy’s, Bob cooked a roast in the Sous vide with asparagus and baked potatoes. Excellent diner accompanied by Aja and Holly. 
We couldn’t have had a much welcoming and accommodating hostess and host. 
Thank you again sis","Pine Grove Furnace State Park
",PA 34,"Apr 26, Wed",8.60
Raccoon,https://www.trailjournals.com//journal/entry/662802,"After the wonderful evening and dinner Claire had hot breakfast for before dropping us off at the trail. Wish she could be at every trail stop
Headed to Boiling Springs for some needed supplies at the outfitters. 
Camp is a nice grassy nook just outside of town with a picnic table. We are the only ones here at 6:45. It’s amazing. I’m not even wearing a coat. To bed early as we are setting a 4 AM alarm to get on the trail. We have a flat 13 m run across the Cumberland Valley before the final mile and a half with a climb of 1000 ft. Oh and it’s supposed to rain starting at 9 all day. Hence the early start to minimize the rain exposure 
First Snake sighting. Tim spotted it and yelp like a child  oh Yeah tim has been giving nothing it Sh**about not having a bear vault  I had to put some of his food in my bear bag because it wouldn’t fit in his vault!","PA 34
",Boiling Springs,"Apr 27, Thu",10.10
Raccoon,https://www.trailjournals.com//journal/entry/662897,"Woke up at four AM to get an early start. It’s supposed to rain the next three days. If we can get to the shelter(a three sided building with a roof) today we will spend the next night in a hostel (a multi bed room for cheap. Comes with a shower) and get a hot showers and a warm bed before spending another day in the rain on Sunday. 
Tim and I decided to split for the day so we could each go at our own pace. Began the mornings hike at 5:15 with headlamps. The breeze is picking up but the hike is 12 miles of flat across the Cumberland Valley. I kept up a 3 mph for most of the day
Not much to tell about the hike as I had my head down and just focused on speed. Made it just past RTP 81 before I had ti put on my rain gear. The rain was light but the combination of wet and a 15 mph wind quickly chilled me. At around mile 10 the rain started. So 2 miles more across the valley before hitting the 1000 for climb up to the ridge 
When I arrived at the shelter it was empty. Unfortunately the floor was made of six inch boards with gaps between the boards. The wind was coming in the open side and up through the floorboards. 
I immediately got out of my damp clothes and put on my dry set and every dry piece I had. Since we skipped breakfast I made oatmeal coffee and hot chocolate. This helped to counter the chill I had gotten but now completely banish it. Pretty much curled up in my sleeping bag and took a nap. 
Found a tarp in the shelter that was big enough to cover the open side   This helped cut the wind   Later to hikers Scape Goat and Mule pulled in.  They stated in GA in March and are planning be done by June 1. 3 months - they are averaging 20 m a day
the wind dropped around ten PM and I finally got warm  
the wind dropped around ten PM","Boiling Springs
",Darlington Shelter,"Apr 28, Fri",14.80
Raccoon,https://www.trailjournals.com//journal/entry/662899,"Woke up to a weather surprise. It was supposed to rain but the updated report was for no rain all day. Yippee!
Took my time with breakfast as there was no rush for weather. Tim not feeling all that well. 
Easy start to the day but around mile 7 the rocks started. These are the type of paths that you have no choice but to walk on the rocks -  and no they are not flat. Most times it’s the edge of a rocks or a jumble of rocks   It’s hard to step in between because there is no In between 
The hostel in Duncannon has a rack of bucks in one room with a couple of chairs and sofas. And most important hot showers heat and a bed. 
We are contemplating or hike tomorrow. The weather is calling for 1-2 inches of rain","Darlington Shelter
",Duncannon,"Apr 29, Sat",11.40
Raccoon,https://www.trailjournals.com//journal/entry/662926,"Took our first Zero Day (hiked zero miles) as Tim was not feeling well yesterday. The benefit (and I think Tim secretly planned this) is that we didn’t have to hike in the pouring rain today. No worries that day will come. 
The hostel gave me a chance to recover from the stolen credit card number we experienced on my third day. 
We are already planning on how to make up for this day. 
We were planning a zero next weekend. Zeros are good for your body and mind to recover from the rigors of daily long distance hiking. 
In the next five days we have three consecutive 18 m days. It will be our next challenge","Duncannon
",Duncannon,"Apr 30, Sun",0
Raccoon,https://www.trailjournals.com//journal/entry/662997,"Today is about setting us up for the next three days. We are only planning 11ish miles because the following three days are 18 milers. This is our next test of what we can sustain. Our 12 mile average leaves too much time at camp. We are hiking 5-6 hours. I’d like to get it up to the 7-9 hour range. At 2 mph that’s 14-18 a day. Our trek to the schuylkill will take five days of 10.9, 18, 18, 18 and 8  
What governs our stops is the availability of water and shelters. In general we try not to sleep out in the pouring rain and only tent 1-2 nights in the rain. It’s important not to let our sleeping gear get wet as it is still dropping into the thirties at night 
Daytime highs are only in the 50s with sporadic rain. Tonight in the valley the low is 39. Up here on the mountain I expect low thirties and rain. So a shelter makes life much easier
Left the Susquehanna Valley this morning. It’s incredible how much noise mankind makes with its highways. I heard trucks and trains for 6 miles after crossing the river 
Met Katelyn and Thermal at the shelter.  They were just having lunch before pushing on to Clark’s Creek. They left HF in the 15 so I expect to catch them again in a day or so
Hansel and the other German kid stoped in as well before pushing on
Tim had a better day today   He is currently taking a nap because he can
Ran across an interesting seed pod that I’ve never seen before. If anyone knows what it is please let me know","Duncannon
",Peter’s Mt Shelter,"May 01, Mon",10.90
Raccoon,https://www.trailjournals.com//journal/entry/663162,"Peter’s shelter was a huge place. It had a loft and a picnic table inside. It could sleep about 30 if it was raining hard enough 
When I arrived Thermal and Katelyn were eating their lunch  they are also flip flopping. They are from Phoenix and Thermal has his name because even in AZ he wears thermal base layer. He must hate the cold here. 
As big as the shelter was it still felt cold. There was a wind and the temperatures got into the low 30’s again. 
I skipped breakfast again and decided I would stop at Clark’s creek about mile 7. As we were planning an 18, stopping for a break would be a good idea 
Walking is a great way to warm up even when there is light rain.  Sitting in a shelter you get no heat from moving as you have no place to roam. 
Passed Katelyn and Thermal just before the creek. After a long wet descent, there were multiple springs with fresh flow from the rains running down the trails. They are headed to the same shelter as us for the night 
While walking down the trails you could hear all the water running underneath the rocks   It would pop out here and there
Almost couldn’t get across the creek due the flooding from all the rain
leaving the creek I passed remnants of the old coal and iron mining operations   The creek was stained orange from all the iron and coal littered the rail line we walked for a bit.  
The day was on and off rain but seemed to be improving ever so slowly. Arrived at the Rausch shelter after a long 18. Tim and Thermal and Katelyn joined shortly thereafter 
I now have a trail name thanks to Katelyn. After telling my bear bag raccoon story she first suggested Bear Hang bit after some back and forth Raccoon seemed to have a  ether story
oh and I almost forgot. Micheal Dresser was the winner of name that object in yesterday’s picture. It is a GALL. A fall is an incubator for a type of wasp. If I had better internet I’d have more info. As with getting a new car after finding one gall I started to see them everywhere","Peter’s Mt Shelter
",Rausch Gap,"May 02, Tue",18
Raccoon,https://www.trailjournals.com//journal/entry/663190,"yes another cold night. I had planned to sleep in my tent for a little extra warmth but the threat of rain keeps me in the shelter. It’s just less hassle because I don’t have to pack a wet tent. 
Hiked most of the day with Tim. I felt out of rhythm because I had to keep taking clothes on and off   We keep hoping for a bit of warmth from the sun but it never happens. 
I stopped with about 6 to go. Sitting on an outcropping looking west towards Harrisburg. The N-S run of the Appalachian mts makes a sweeping curve to headed east across PA. As I was sitting there in the feeble excuse for a sun, I could see the rain marching in from the west. Tim passed and did stop. I put my full rain gear on And proceeded onward. 
I put it into high gear and made good time. And wouldn’t you know it, the rain never came  passed Tim and a few section hikers .  
Kevin and Chris you’ll appreciate this. Two miles to go and I meet the Beer Angel in the form of Applejack a through hiker from 2016  he was about 400 yards from his car and was happy to meet me  he had come out for an overnight hike and had brought Troeg’s Double Bock beer to dispense to any through hikers  I grabbed one for Tim as well and packed it up to the shelter. Needless to say it was most enjoyed after our s conf long day
this shelter had four walls, seats with backs and games  Alas it didn’t have heat and it was another cold night","Rausch Gap
",501 Shelter,"May 03, Wed",17.50
Raccoon,https://www.trailjournals.com//journal/entry/663192,"well we are starting our third week   The two long days didn’t kill us. We will step back a bit the next few days. 
It was cold again even in four walls. I have decided to up my sleeping bag gear. Saw a minus 20 degree bag. That should do the trick 
A througyhiker by the name of Atticus spent the night I. The key to a short hike duration is to hike many hours as he is not a fast hiker. To this end he preps his breakfast the night before. In a large Gatorade bottle he fills it 3/4 with water adds instant coffee and a carnation instant breakfast w protein and he pours in a pack of oatmeal.  Not sure that’s for me
The good news is that the forecast for tomorrow actually includes the sun. Let’s hope","501 Shelter
",Eagles Nest,"May 04, Thu",14.90
Raccoon,https://www.trailjournals.com//journal/entry/663315,"i actually slept well last night. Still bundled up as it gets to the low 40s. 
Met Candy and SimCard.  Candy suggests a 25 degree bag liner. We are stopping at Canbellas when we r in town. 
The day was wonderful. Had sunshine all the way into port Clinton. The trail was fairly easily annd we only had a short 8 miles to town.  And the the rains came (figuratively ).
Arrived town about 11:30. The post office where we were picking up our supplies was not open till 12:30. We were planning on catching a shuttle to cabellas a little after one. So we went to the hotel and got a beer. Now 12:05. I called to verify the pickup location and time and the woman told me 12:15!  Downed our beer and walked cross town. No shuttle. I call again and this woman says no not 12:15 1 and it’s always been 1. ok more time to kill
we run up to the post office and my box is not there. Of course I don’t have tracking number. I cobble together enough supplies for my leftovers and Tim’s oversupply and what’s in the hiker box so cover that issue 
 Kw I try calling the next PO to insure this is not a bigger problem. I’m automated phone hell for half hour till I get through. Good News. My next box is in position 
on to Cabellas where they only have one item on my ten item list. Good news is that we bump into Lost and  Stampede. Two guys our age who started the same day. We had crossed paths a couple of times but they were decidedly ahead.  It both of them were out of action due to shin splints
They are planning to rest a few days and jump ahead to NJ to avoid the PA rocks. As they will the restart slowly we are likely to catch up to them
Made our way back to the hotel thanks to a trail Angel who spotted us at cabellas and offered us a ride 
had a great dinner and more beer at the hotel before hiking up the 1000 foot climb to the tent site.  We decided on the extra hike to shorten the following days hike
If I can ever get it loaded I saw a newt at our campsite. It reminded me of the time I took my son Ian the the Delaware water gap to hike. We stayed up towards Sunfish pond but never got more than 1/4 miles because he became occupied with the newts and frogs.","Eagles Nest
",Pocahontas Tent Site,"May 05, Fri",11.90
Raccoon,https://www.trailjournals.com//journal/entry/663318,"Had our first fire last night. The night was calm and comfortable to start   Went to sleep with just PJs and until 4 in the morning it was fine. Then it got cold. Nonetheless it was a good night of sleep  and the day will end with a spaghetti diner. Friends Dirk and Sherri and brings us diner tonight!  The shelter is on a road so it works. What’s best is we don’t have to hike after eating. It’s all I will be thinking about 
Passed Pulpit Rock and The Pinnacle just east of Hawk Mountain. Ran through some rocky stretches but a lot of our hike today was through state hunting forest so we were on dirt roads. Got into the shelter around 2:30 and spent a pleasant afternoon in the sun. I even got to stomp on my dirty hiking clothes while I took a dribble shower in the not warm solar shower. At least I feel like my clothes got a little less dirty
Liam is trying to join us for an overnight hike. Tying to figure out the logistics. He only has three weeks for shipping out to Seattle for an internship with  Boeing. We’ll see if we can manage the logistics will everything else on his plate. Tonight should be a warm night. Looking forward to it. Tomorrow we leave early.  Have a huge climb first thing followed by a series of rocks.","Pocahontas Tent Site
",Ecksville Shelter,"May 06, Sat",11.90
Raccoon,https://www.trailjournals.com//journal/entry/663334,"This section is the where I have hiked most with Theresa. When I first met her I was excited first by the fact that I met her on a bike ride. I told her about my hikes with Tony and she was game to go on a hike. We did a day hike on this section and I was further impressed by her outdoorsyness (is that a word). I know I had a great time and she stuck around so I guess she did too. On this first hike I told her about my wish to hike the AT. She supported my desire and liked a guy who had goals. My timing could have been better but. . .
As the years went by we returned to this section. hiking Hawk Mountain and the areas around Port Clinton. She brought me up to Lake Placid and we hiked and snowshoes the mountains there. I was so glad to meet and fall in love with such a caring and energetic and beautiful woman who shared my athletic passions
Today we leave Ecksville and have a 1000 ft climb up to the ridge. This section becomes very rocky. Passing great views on rock outcrops known Adams The Pulpit, The Pinnacle, Dan’s Pulpit (got a religious theme going here) the Knives Edge, Bear Rocks and Bake Oven Knob 
Turns out each of these and in many places in between there are just a jumble of rocks left over from the ice age. PA was the southern limit of the glaciers.  They carried all the rock on the leading edge and deposited them in PA","Ecksville Shelter
",Bake Oven Knob,"May 07, Sun",17.40
