Hiker trail name,Hiker Journal Link,Journal Story,Start location,Destination,date,Today Miles
Appalachian Trail Thru Hike,https://www.trailjournals.com//journal/entry/637246,"The day was a good one, despite the fact we started off backwards. In order to get back to where we left for the trail magic we had to walk back to the last white blaze we passed(according to Deferred). She is what is known as a “Purist” in that she has to complete/pass every white blaze for it to count. She’ll just keep us honest I guess.
Due to that diversion, we walked back 1.2 miles, then had to go NOBO back 1.2 miles. We then had a plan to walk ~17 miles, so a 19.4 mile day. We are terrible at slowing down apparently.
I mentioned to the tramily that I’ve been wanting to stealth camp(camping at an unmarked site in woods) recently, as I was tired of the crowds at shelters and wanted a quiet night.
After an exhausting day we set down our packs and ate a quick dinner. As I set up my hammock I felt some light rain. We were exposed on a ridge line with wind occasionally whipping through.
You know how I mentioned I may want a bigger tarp? I was wrong. I needed a bigger tarp.
It became apparent quickly in the night that I was in for a rough go. No matter how tightly I tied my tarp down the wind would inevitably pick it up and I would receive a face full of ice cold rain. I slowly felt my hammock and underquilt beginning to get damp from the rain. I tried to readjust my tarp but the changing wind direction plus relentless rain made my tiny tarp utterly useless.  
Despite mother natures best efforts (at times the wind was so great my hammock/trees I was attached to shook violently) I survived the night. I curled up in a tight ball right in the center of my hammock where the tarp mainly was, and managed to stay dry enough to maintain some warmth. I managed to get 2 hours of sleep, and planned to hike 30 miles to Erwin the next day to dry off.
In the morning I heard Steve rummaging around in his tent and I told him about my night and my subsequent plan. He was surprised to hear I had such a rough night, he knew it was bad but managed to stay dry. Apparently Caveman overheard my troubles and offered me a coffee(I took him up on a Hot Chocolate instead).
Between the condolences for my rough night followed immediately of poking fun at me for being a hammock camper, it made me grateful for my Tramily. They supported me and agreed with my plan to shoot for Erwin(although the plan changed to we’d get a ride from road in 20 miles instead of doing 30).
Those miles were rough. I was exhausted, wet, and grumpy. I’m surprised Deferred hiked with me at all at first because of how miserable I was. I just felt foolish and unprepared, but I must learn from it.
We had really amazing conversations about a variety of really varied and sometimes difficult topics. We both have very different upbringings, viewpoints, and life experiences; and the conversations flow with respect, open-mindedness and introspection.
And today with us feeling so crappy and needing good distractions meant our conversations kicked ass. We both learned a lot and I grew a-lot of respect for her as a person.
We got to Spivey Gap(20 miles completed) and quickly realized e we had 0 service to call a shuttle. We ran up and down the road looking for service with Steve and Deferred half-heartedly hitch hiking. I connected with a shuttle, and arranged a pick up. Shortly after hanging up a young woman and man rolled into the lot we were in, then started turning to go back to Erwin. We made eye contact and I shot out my thumb. She stopped and asked if we needed a ride.
Yes we did. First successful hitchhike!
I called the shuttle to cancel and were driven in by 2 lovely people who were checking out the place they planned to day hike then heading back home to Erwin. The trail provides I guess?
We stayed at Uncle Johnnys and to be honest the bunk house smelled like a gym locker room and had the heat and humidity of a sauna. It was welcome compared to my prior night.
The important thing about that night is I survived. It was incredibly unpleasant. At times I was contemplating how to deal with hypothermia if it arose. But I survived. 
And at no point did quitting even cross my mind. Suffering in life is inevitable, and if I grow to accept that I will be a stronger person for it.","Geralds Gap?
",Spivy Gap,"May 09, Sun",20
Appalachian Trail Thru Hike,https://www.trailjournals.com//journal/entry/637247,"We finally got to try another thing I was curious about- Slack Packing. That is when you arrange your hiking to not require you to carry your pack for a number of miles. In this case, we were technically 10 miles before Uncle Johnnys, so we would leave our bags there, get a shuttle back to Spivy gap and hike the 10 miles back.
It was a lovely walk. We spoke in depth about religion, as Steve and Deferred are both strong believers in Christianity, and I identify as Atheist. It was insightful to hear about their relationship with Jesus, their faith in the unknown, and conviction in their beliefs.
And they dealt with my incessant questions, nit picking, and thoughts. Which was nice of them.
They know I’m in an ambiguous relationship with organized religion and they don’t try to push their beliefs, nor me push mine on them.
Its spectacular how well people can communicate when there is mutual respect and understanding.
Also we saw a barn owl up really close in the middle of the day. That was really amazing.
We later rode bikes into Erwin(with Deferred breaking hers at towns edge), I ate far too much Mexican foos, played cards, then went to bed. It was a good day.","Spivy Gap
",Uncle Johnnys,"May 11, Tue",10
Appalachian Trail Thru Hike,https://www.trailjournals.com//journal/entry/637249,"McDonalds doesn’t serve lunch food until 10:30am? Was this common knowledge? I knew they served breakfast in the morning but didn’t realize they didn’t serve lunch until 10:30am. I was thoroughly annoyed when I learned that, especially knowing the breakfast shuttle be leaving town at 10:30am.
I ended up getting my healthy complete breakfast of a cheeseburger and fries at Pals across the street. It was sub-par at best.
I still want Wendys. And a hot tub. Alas, I can only dream.
The day was just... cold. Dark. It rained all morning and there was just a chill in the air that wouldn’t go away. Some people barely left their hammocks all day(looking at you Deferred).
I met this woman named Jackie Rose who was super down in the dumps. She had bags under her eyes, a defeated look and slouched posture. It was clear she was struggling with something fierce.
I gave it the college try. My whole life I have been very good at and enjoyed taking one on one with people and helping them problem solve, build confidence, and complete goals. My favorite/best jobs always revolved around that core duty.
In highschool I was a tutor.College I was a personal trainer.Now I am a Physical Therapist.
I love helping people and building them up.
But some people can’t be helped. And that’s something I am learning, slowly and reluctantly. It will have to come from within her to complete this trail, but realistically I highly doubt she will. She doesn’t have a clear vision, no discernible reasons to continue on the trail beyond her hating her last job, and had an incredibly negative perspective. Tough combo to walk 2000+ miles.
The day was mainly uneventful. Steve watched movies, Caveman edited his latest video, and Deferred cocooned in her hammock.
It was a lazy day, as we couldn’t go anywhere because we were leaving for trail days the next morning.
The craziest thing? I began to miss hiking halfway through the day. I think I may be addicted.","Uncle Johnnys
",Nowhere,"May 12, Wed",0
Appalachian Trail Thru Hike,https://www.trailjournals.com//journal/entry/637250,"I came to trail days with 2 distinct yet equally important goals. I wanted to talk gear with some vendors and buy a new tarp, and I wanted to do some hippie shit.
I achieved both.
We shuttled from Erwin Tennessee to Damascus, where Trail Days always takes place. Its basically a music festival without music and less trash left behind (leave no trace runs deep).
We chose to set up in the field, as we heard it was quieter than the woods. We figured we could party if we wanted and leave when we were done.
Welllll setting up a hammock in a field (soccer field to be precise) is difficult when you are in a hammock. So me and Deferred needed to set up in the woods next to the field (luckily it wasn’t the rowdy woods).
We wandered around the first day, coming across... interesting people in the woods. A lot of face tattoos, strange outfits and stranger vibes. But I lived in NYC for a few years and we just call that Tuesday.
We got free food pretty often, people just offered as you passed, setting up tables of trail magic. It was highly welcome.
After we got our bearings, before going to sleep I asked the group if they would go to the drum circle the next night with me. They all agreed, with the condition they wouldn’t have to participate. Of course they wouldn’t have to, but I can be quite persuasive.
The next day I met with some vendors and started taking hammocks with some incredibly knowledgeable people. I learned that I know nothing about hammocking and there was massive amounts of room for improvement in my setup. Fantastic news if you ask me.
I was recommended to meet Dutch, from Dutchware gear to discuss options and potentially buy a tarp. Let me tell you, he is a stand up guy. He patiently and throughly explained his system, how to use it and its benefits. He had previously thru hiked(2006) and was one of the only hammock capers back then. So he developed his company out of the need for quality hammock camping gear.
Well we figured out the best option was a 11ft rectangular Dyneema tarp with 6 potential tie outs and his rigging system. My current tarp is essentially a diamond that just barely covers my hammock, and is about 64 square feet, and weighs a femur shattering 9.7 ounces!
The tarp I will be receiving will be around 2x the coverage and ~2 ounces lighter. It wasn’t cheap, but with my birthday coming up my parents were generous enough to offer to get it for me as a birthday present.
Thanks Mom and Dad!
So I got the hammock, but there was another thing on my list...
Here is what I wrote the night of my dancing around a fire. I wanted to write it with the experience still fresh in my mind:
What an experience trail days has already become. From the strange, to the fascinating, to the primal, it was an experience.
I can’t capture it with words. I wish I could, and I’ll try my absolute best to describe it.
My best comparison: it’s like a second cousins birthday party where you know some of the people, there’s copious amounts of alcohol, and you have a blast by the end.
Tonight I saw such amazing things. I saw a group of homo sapients dance around a large fire chanting. There were minimal if any cell phones recording. People were existing in the moment, for the moment, and just devolving to a more primitive state. 
I saw all this because I was in the center of it.
We all had some drinks at our tents as the evening transitioned to night. We were sharing stories about strange occurrences on the trail, the group was Steve, Deferred, Caveman(the to be named Tramily); Machine, Trip, Deja Vu(who I swear I’ve met before), Blu-Ray and smoritto(.com). Also we had met a girl named Hannah who was doing her own hike across country from Cali->Virgina(not the American Discovery Trail, one she mapped out). She had already hiked 2700 miles and only had 350 left to go. Very interesting journey. 
After the sun set you could hear the drums start. I was curious how bold Steve/Deferred would be, and was pleasantly surprised to see their enthusiasm about going to the drum circle.
Granted their enthusiasm was at best reluctant curiosity. But we still went so: Score!
We showed up to the large field with about 150-200 people surrounding: a massive bonfire, 3 large plastic drums being beaten mercilessly, and  people dancing around a tiki torch.
I saw the 2 people dancing around the tiki torch and figured that would be a good place to start. I jumped into the open circle and proceeded to
TearUpTheDancefloor.
Anyone who has seen me dance likely are not too surprised by this. I love dancing. I get to move my body any way that pleases me, while allowing music to flow through me. I don’t dance “well” per se, I just have a grand ole time. I began encouraging people on the edges of the circle to start dancing, and man did we dance.
The drums had an ever present pounding that made your heart beat harder, as you move with this mass of people. It was hypnotizing.
I swear this was the most hippie-shit I have ever done in my life.
They started a few chants of just repeated “Heys” in a beat. The kind of Hey that doesn’t come from your mouth. It comes from your chest. I dare you to try in right now. Try chanting “Hey” from your chest for like 10 seconds. Its super energizing in a crowd of 100. Trust me.
I went back out to the Tramily(who were right in the mix of crowd) and asked them how they were doing.
Steve was smiling saying how he saw me dancing in there.
Deferred looked half horrified, half terrified.
Caveman had the face of honest intrigue mixed with pure enjoyment.
So it was going super well so far. As we stood there, I asked Deferred to yell as loudly as she could. Like she didn’t have a care in the world what people thought. Just yell.
She was reluctant.
Steve joined me in encouraging her to yell. We agreed to all yell at same time so she wouldn’t have to yell alone. So Caveman counted down from 3 and we all yelled.
We all yelled. 
Then I wanted to up the ante. I always go by the philosophy that if I act like a complete fool with no reservations, that it takes the pressure off everyone else to have fun. 
So, at Steves(Teflon may be his trail name) suggest/dared me to take my shirt off and dance near the massive bonfire.
So I did. And it was wild. The bonfire was easily 20ft wide and people were going in a circle around it and limboing. I began requesting lower and lower limbos managing to get as low as my waist. Trail legs seem to be multi-functional...
I wanted to get the crowd riled up so I stepped in the pit, hit my foot on a 6 ft log repeatedly while hollering my lungs out. The embers jumped 20 ft as the crowd exploded in war cries.
Ok now it feels like I’m writing Lord of the Flies. But I mean, this whole event could have been in that book and fit perfectly.
Nonetheless, after meeting some nice people(Indy who can limbo like no other), and me acting like a total lunatic; I sought out the tramily to recover my clothes. Steve(Teflon?) had been tasked with the important duty of making sure I don’t lose my clothes and freeze to death. He did a stellar job. If you ever need someone to hold things responsibly Steve is your guy.
We all worked our way back into the crowd by the tiki torches. We were dancing closer and closer to the drums when suddenly Deja Vu pointed out that Blu Ray was in middle of the drums banging away. It was awesome to see, he was crushing it, and just completely absorbed in the moment.
I started to encourage Steve to go on the drums, but he repeatedly denied it. I tried to negotiate, offering the unopened beer I had for him to go on the drums. I thought it was a fair deal but he persisted. He told me pressuring him would make him less likely to do it.
Ok forget pressure then. Lets make this epic.
I went to the center of the crowd by the tiki torch and began to shout like an old squire,
“Is there anyone at ALL that can help these drummers? Are there any musically talented people available?”
I looked around dramatically when I saw Caveman raise his hand. I called on him and he pointed to Teflon(Steve!). This time it stuck. He strutted over to the drums and after being briefly interrupted, was then handed a mallet drum with by none-other than Miss Janet(the most famous trail angel). It was nothing short of poetic.
Steve proceeded to rock the drums fitting right into the rhythm, adding variety even guiding the tempo.
As he continued to rock, the guy next to me was trying to start a chant. So I told him my plan to start one and he agreed to help.
I waited until a slight opening in the drumming then yelled at the top of my lungs,
“ When I say Hey you say Ho!”
Hey!- Ho(only the one helping me responded)
Hey!- Ho(now about 10 people respond
Hey- HO!! (Nearly the whole crowd is responding at this point)
This continued for ~10 more times, me yelling “Hey!” alone and having 200 people respond “Ho”. I had to call it quits to prevent my vocal chords from snapping after shouting for so long. I had been looking up and when I looked down I found Caveman grinning ear to ear saying “That was awesome”
I agreed wholeheartedly.
Later we all were dancing while Steve (Teflon!?) was pounding the drum, even Deferred was in the middle of the crowd bobbing to the music. It was great to see her enjoying the experience.
Beyond dancing, fire dancing shows, limboing,I had such interesting interactions too. I heard this guy(Woodman) and girl(Hippie Singular Rocks Plural) having an intense discussion in the most stereotypical Long Island achcent I’va eva hearrrd. It was absolutely absurd but downright hilarious.
I couldn’t reconnect with the Tramily toward the end. They all seemed to go there own way, hope they all got home safely.
There are strange people in the woods.
Strange people indeed.","
",Damascus Virgina,"May 13, Thu",0
Appalachian Trail Thru Hike,https://www.trailjournals.com//journal/entry/637251,"We got what we needed out of trail days. All of us had our boundaries pushed, learned something about themselves, and got a hell of a story out of the experience.
So we planned to escape Trail days a bit early and get back on the trail. Honestly we were all missing it. Crazy right?!?
Steve managed to get us a ride with one of the people from Southern Ohio Trail Magic(his friends who were doing trail magic at the event) who took us right back to where we left off.
We were on the trail for only 4 miles to get to the shelter we planned to stay, but there were very limited hammocking options with an abnormally large number of hammockers.
I haven’t been keeping an official count but my guessitimate would be its about 1:5 ratio of hammock:tenters. 
For whatever reason this shelter was more like 1:1, with very limited trees.
I decided to journey onward to a campsite only a short walk away to set up alone, figuring that after all the social interaction of trail days it may be good to be alone.
And it feels nice.
Despite the twigs actively breaking around my hammock and dogs howling in the distance. At least I hope its dogs.
Eh, what’s the fun if you don’t get scared every now and then?
Happy trails!","Uncle Johnnys
",Clyde Mountain Shelter,"May 15, Sat",4
Appalachian Trail Thru Hike,https://www.trailjournals.com//journal/entry/638293,"These trail journals don’t feel as necessary right now. It’s funny, because something that was so novel at first has already become routine.
Over the past few days we have been moving, quite fast.
Caveman wants to get to Damascus(126 miles away) before Saturday so he can receive his package.
126 miles over 6 days, just need to average more than 20 miles a day.
Crazy that this is now considered an attainable goal. 
So far we have done a 24.8 mike day, a 22 mile day, and an 18 mile day. We don’t need to rush too much because we plan to do the “Damascus Marathon” which is a 26.2 mile stretch from Iron Mountain Shelter to Damascus. The elevation profile is supposedly one of the easiest on the AT, and shouldn’t be too bad.
There were a few noteworthy events over the past few days I would highlight. One is I was charged by what I thought was a grouse that scared the crap out of me. Deferred nearly stepped on a 3-4 ft black snake. And also she finally lead hiking after claiming to be too slow and was literally the fastest hiker I’ve ever seen.
Roan mountains was an interesting change of pace for the AT. The AT is affectionately referred to as “The Green Tunnel” as you are often so surrounded by trees that it obscures any views beyond a short distance. In the Roan Mountains we hiked over many “balds” which are tops of mountains with no tree coverage. It was amazing to be able to see miles of the trail unfolding ahead of us and being exposed to views all around us. 
While me Steve and Deferred hiked, I noticed a man coming up quickly from behind us. This always strikes me, as I have stated in the past its rare for people to pass me while on the move. I realized as he got closer it was the Machine!
He asked to pass us which we let him, then I kept up with him as Steve and Deferred hiked slightly slower behind. Me and Machine had many interesting conversations, the man has no filter and neither do I, so we shared a lot in a short amount of time. Keeping pace with his 3 mph pace(I normally average 2.5mph) while having intense conversations was something that I actually thoroughly enjoyed. It made the next 8 miles fly by.
We stayed that night at Station 19e, a hostel right off the highway. I got to pet a big dog named Diesel and it was nice.
Kinda run-of-the-mill day upon reflection.","Clyde Mountain Shelter
",Station at 19e,"May 16, Sun",0
