Hiker trail name,Hiker Journal Link,Journal Story,Start location,Destination,date,Today Miles
Appalachian Trail Thru Hike,https://www.trailjournals.com//journal/entry/640970,"Pennsylvania is tough. It is rocky, there is a distinct lack of water and it is hot. But for whatever sick reason, I really enjoy it.
Maybe it was the fact I was completely over Virginia/hiking in the south. Maybe it’s that I am getting too familiar territory. Maybe I really enjoy technical hiking.
Realistically it’s all three.
When I say technical hiking I am referring to hiking which actually requires some degree of attention/skill/balance to complete. A large majority of the hiking in the south was walking in well manicured paths with smooth dirt and no major obstacles. No roots to avoid, rocks to hop on, just walking. In the woods. In other words, BORING.
Pennsylvania is widely considered one of the hardest, if not the hardest state for the entire Appalachian trail. I actually had done sections of Pennsylvania prior because I knew it’s infamy and wanted to test my metal. I distinctly remember completing my 20 mile section hike with Josh and Kevin with sore feet but a new confidence that I could complete the Appalachian Trail. 
What I didn’t know at the time was how much I actually prefer the challenge.
For me, walking 20+ miles a day can get a bit dull. It’s why I have trouble writing Trail journals. It’d be like me asking you to write a journal about your job every day. Yeah for the first week or two you can describe different daily habits, or people you work with, but after a while it would begin to feel less important to write about. I mean, most days the most significant thing is how sore my feet get. Or what I made for dinner.
Pennsylvania gave me a new challenge which was quite fun. The rocks on the trail I feel can be split into two categories: Ankle Breakers and Rock Hoppers.
Rock hoppers are large enough boulders (anywhere from the size of a dog to size of a bus) embedded in the ground you can jump on top of with relative safety. Sometimes we would be jumping from one rock to another with a 10 foot drop between, but that is just motivation to stay on top of your game. I think of it as a puzzle, almost a chess game, I need to plan my next 5 moves to ensure I stay on trail, don’t slip off a rock, and move as quickly as possible. I thought I was very proficient in rock  hopping, then halfway through a boulder field whereI was struggling at 1-1.5mph, Caveman skipped past me with ease going easily 3mph, an ego check at its purest.
Ankle breakers are just as their name implies. They function for one reason and one reason only, to break your ankles any way they can. They are small, often loose or sharp, and can hide in leaves or in loose dirt. They are deadly because they are so small and unstable you can’t really trust your footing on them so you have to avoid them. The problem is often in trying to avoid them you end up taking way too big of steps, where there is often a hidden sharp rock eager to stab the sole of your foot, and in doing so, stab my soul.
Both require constant attention, even a momentary thought or distraction can lead to a rolled ankle, a fall between the rocks, or sometimes the consequences could be more dire. This attention forces you to clear all other thoughts you may have, you can’t think about the friends/family you miss, or the things you’d rather be doing, all you need is focus.
Which is why I love it. Its also why I was so scared when I started getting lightheaded during our second to last day in Pennsylvania. I have a problem known as “electrolyte sensitivity”, which simply means if I don’t have enough Sodium/Potassium and water I can(and have in the past) faint. The entire hike I have not had a problem with this despite the fact I have gotten extremely dehydrated a few times now.
When we left Caveman Mother’s home there was a very intense scramble up the side of the mountain. Add in sweltering heat(~100 degrees and humid) means I was working hard. The final problem was my pack was the heaviest it has ever been because we were carrying all the water we needed for 16 miles until our next good water source.
The strange part was I felt good going up the entire scramble. I was moving faster than everyone else in the group and feeling confident in my feet and progress. After the scramble I was walking with Deferred when I suddenly started feeling faint. It felt like it did when I previously fainted, and we were walking with the ankle breakers all around us. We still had another 10 miles to go to get to water and I knew I wasn’t feeling well enough to do it. 
I told the group to go on if they wanted to, and I would stop when I felt I couldn’t go on and try to collect water with my tarp from the rainstorm coming that night. They, of course, rejected the part of leaving me and we established a new plan(love these people). There was 1 water source before the 16 mile mark, but it was a half mile off trail. It may not sound like much, but to add an entire mile to your hike just to get water is ridiculous. To give yourself an idea of how much that sucks next time you want water go for a mile walk around your neighborhood before filling up at your fridge. Its not fun.
We set up camp; then me and Deferred began our trek to the water source. Supposedly the source is a half mile down the windy road that passes through there, so at least we wouldn’t have to worry about rocks!
As we walked, we both began to lose confidence we would find this source, and the journey would even be worth it. As we descended a pick up truck passed us and I stuck my thumb out. A guy(about 18 years old) and girl(same age) stopped and asked what we needed. I told him we were looking for a water source down this road and would appreciate a lift. He told us to hop in and to tell him to stop when we see it.
We rode in the back of his truck looking for the markers mentioned in the app(orange tape on some trees) and were dismayed we found nothing. He drove for about 5 minutes before he asked us where it was, and we told him we truthfully had no idea if it even existed. He responded saying he could bring us to a water source but it would be a bit far, and he would be willing to take us there and back.
God bless this young man, his parents raised him right!
We sat in the back for a good 20 minutes as we got a tour of rural Pennsylvania, wondering where on earth this spring could be. We finally arrived, filled up as quickly as possible and rode back.
When I got out I told him how much what he did meant to me, how I was having a rough day and really needed his help. I asked his name so I could properly tell this story;
So Ryan this one’s to you. From the bottom of my heart, Thank you.","
",View Entry,"Jul 09, Fri",0
Appalachian Trail Thru Hike,https://www.trailjournals.com//journal/entry/640968,"We’ve managed thus far to avoid really being “vortexed” into a place. Being vortexed means you had no intention to stay as long as you ended up staying. 
We did get vortexed one time earlier in the trail, into Weary Feet Hostel, as we were supposed to hike a few miles past it but ended up staying the night.
Well, we ended up getting vortexed again, and it was an incredibly pleasant experience.
Caveman mentioned to us a few weeks ago that when we were in New Jersey he had a friend who would like to get dinner with us. At least, that’s what I remember him telling us about the plan.
So, as the day drew nearer we got more insight into the plan, which evolved into being picked up at the border of Pennsylvania/New Jersey, then going back to her home and potentially taking a zero day there. A zero was more than welcome because of how sore my feet had become over the past few days due to the constant barrage of rocks.
It was an unremarkable hiking day into the Delaware Water Gap, and beyond a fantastic homemade root beer I got right before meeting up with Hazel at the parking lot is barely memorable.
Me and Caveman crossed the final bridge, exiting Pennsylvania for good and walked to the parking lot to meet Hazel(Caveman’s Caving Companion). Deferred met her mom/grandpa(who were nice enough to get us our favorite thing: Gatorade) for some much needed family time; me Caveman and Teflon went with Hazel to her car.
Hazel walked past me as I loaded my bag and one of the first things she said to me:
“Oh my God you smell awful, we are driving with the windows down!”
I was immediately a fan. I always appreciate honesty and I had zero doubts that was going to be the norm with Hazel.
We got in the car and right away I started getting what I’ve been searching for over the last 1000 miles, gossip about Caveman. Hazel would tell story after embarrassing story about Caveman while he repeatedly denied them and claimed they were all lies. He does the same thing when we tell his embarrassing stories so I knew they were the real deal.
Oh, and I should mention, Hazel either unknowingly or knowingly started calling me “Sweet Cheeks” instead of Sweet Talker, which I kinda loved as a name. I told her I would be honored if she only referred to me as Sweet Cheeks, which she did.
We were laughing and swapping stories the whole way to her house, and when we got there she immediately set out snacks: chips, vegetables, hummus, guacamole; it. was. heaven.
She told us we would be having ribs for dinner, and to make ourselves at home. I showered, changed into clean clothes and felt like a new man.
We sat for dinner and it was mind bogglingly good. The ribs fell off the bone, the sauce complimenting the meat perfectly, with potato salad, roasted corn and Cole slaw to boot. It was heavenly to have a home cooked meal, with food of a quality I have not had in months. We didn’t stay up late that night despite us knowing we would take a zero the next day, as we were beat from hiking in the heat.
The next day was very productive. We did laundry(even cleaning my sleeping bag), went to REI(I got wilderness wipes GAME CHANGER, will explain later), ate way too much bread at Panera, then went back to Hazel’s. Caveman began hinting at taking a second zero, as his feet were in rough shape from Pennsylvania and the weather was supposed to be horrid the next day. 
This is what Caveman always does and it cracks me up. He doesn’t say “we should do x” he ‘suggests’ we do x 4 times in 10 minutes. He always says “I’m just laying out the options” and if you ask his opinion or preference he refuses to take a stance. But then he suggests x again. So I read between the very spread out lines, the man is not a mystery.
Hazel told us we are welcome to a second zero and we plan to head out the next morning at 7am, so that means up and eating by 6:30am.
I awake the next morning to the most heavenly sentence I’ve heard all trip.
“If you want to go back to sleep you can, it seems like you guys are taking a second zero.”
I’ve been vortexed, and I couldn’t be happier.
We ate an amazing breakfast with eggs, home fries, sausage and bacon; a breakfast of champions. We immediately start trying to get in touch with Deferred, as we told her last the plan was to hike out and she likes getting pretty early starts. I was afraid she would already be on trail, and we would be more likely to end up not taking the second zero. Fortunately she texted us asking where Hazel lived and came out to us to stay the night.
I made one main request when I arrived at Hazel’s. I noticed her board game collection within minutes of arriving and wanted to play some of the games she had as I’ve heard good things about them. We ended up playing Dominion and Splendor, both good games but I truly loved Splendor.
Dominion is a deck building game with cards that cost a certain amount of gold where you need to balance what types of cards you have and how they interact.
I sucked at it. My strategy was questionable at best and I got last. By a lot.
Splendor, on the other hand, was similar to Ticket to Ride, a game I enjoy, and Japeer another game I like. I understood the goals of the game pretty quickly and developed a strong strategy and rules for how to play my turns. I also engineered a plan to focus on Deferred and how close she was to winning so they wouldn’t see how close I was, and it worked. We played 2 games and I won both of them. I felt like a total badass. Which after writing out the fact I feel badass for winning board games seems super lame. But hey, badass comes in many forms. 🤷‍♂️ 
We then ordered Indian food for dinner (which was lovely) and finished up some shows we had started previously.
Let me tell you, I sat inside in the a/c for 95% of those days. We watched tv(Alone a game show where survival experts try to live in remote places for as long as possible, HIGHLY RECOMMEND) played games, ate food, made endless jokes with Hazel and it was lovely. Absolutely: refreshing, revitalizing, reinvigorating, reanimating.
It’s funny, because ever since we hit the half way point I’ve been feeling a little “burnt out” about the trail. It’s just so long. I mean, I’ve been out here for 2.5 months and I’m just past halfway there. We are on schedule (in fact, faster than I anticipated) but it’s still a LONG time to be living this way. Every day in the woods, every day our feet hurting, every day your clothes becoming soaked in sweat, drying, then getting soaked again. Every day is a challenge.
That’s why I’m here though. I knew it was going to be physically challenging, and honestly, that’s probably the easiest part. The emotional challenge of being away from family, friends, work, my other hobbies(I’m missing the hell out of gardening), is a lot. We have covered a lot of ground and still have a lot to go.
People like Hazel help more than they realize. The kindness, generosity, and humanity she showed us was instrumental in me recovering emotionally from the burn out I’ve been feeling. She was nothing short of a wonderful host and I am beyond grateful for all she did for us.
Also, I totally blushed almost every time she called me Sweet Cheeks. But I mean come on, who wouldn’t blush at a name like that?!?","
",Hazels House,"Jul 11, Sun",0
Appalachian Trail Thru Hike,https://www.trailjournals.com//journal/entry/642021,"I arrived to New York much like my first time ever, beat up, crying, and glad I wasn’t in Jersey. I didn’t even have my mom to comfort me this time!
I’ve section hiked parts of New York prior, and remember lots of rocks, roots and no crazy climbs. Well, the section I didn’t hike yet, the part right when you enter New York is brutal.
It’s been hot. I know I’ve complained about this a dozen times, and you likely roll your eyes thinking “What did you expect hiking in mid July?”
Well I don’t know what I expected and don’t appreciate your tone very much.
Nonetheless, we hiked 6 miles to a farm right off the trail that has homemade ice cream, fresh grown fruit and so much more. I decided to get a chocolate ice cream (thank God the half gallon challenge didn’t kill ice cream for me), some grapes, a peach, bananas and salsa/chips(split with Deferred).
I learned a good lesson that day.
(Salsa+Ice Cream) x 1000 ft climb= unhappy Sweet Talker
But before I got to do the climb I had one of the most unpleasant experiences that is incredibly private and embarrassing.
Which I will now described in great detail.
My stomach started hurting shortly after eating the salsa(ice cream was already done, afraid it was going to melt), and even worse is I tend to not digest food super well in the heat. So, I decided to go find a rest room to relieve myself. I was deflated when the cashier informed me the rest room were porta-potties. I was devastated when I saw they were sitting in direct sunlight.
I got into the toilet (surprisingly clean) and began my work. The heat began creeping steadily. Have you ever sat in your car in the middle of the summer in direct sunlight? How long did you last without a/c?
Well now add in the fact you are pooping. It was a real shitty situation.
After building two impressive puddles of leg sweat under me I finally finished my business. I got out and began mentally preparing myself for the climb. I told the Tramily my toilet tribulations and then informed them I planned to go slow up the next climb.
Of course I didn’t. I listened to my pump up playlist and flew up the hill like there was a fire under my feet. Maybe it was my competitive side coming out, maybe I wanted to look badass in front of the day hikers, maybe I wanted to prove to myself I wasn’t feeling sick. Maybe I’m crazy. 
I don’t know but all I know is it was a bad idea.
We climbed the hill, and I waited at a nearby stream for them to catch up. Caveman arrived, said it looked like a good place to soak and immediately stripped to his underwear. I was impressed with his efficiency, I’m so much more showy in my actions. I would have announced I was going to soak, asked others if they wanted to join, then probably would have theatrically entered the water. He just hopped right in. I respected that. I’m still going to be my over the top self though, because it’s more fun.
I joined him in soaking and it was incredibly necessary. It was ~90 degrees out the the humidity was a blanket you felt yourself walking through. We dried off air drying (aint nobody got the weight allowance for a towel!) then continued on with our day.
I ended up feeling pretty ill by the end of the day and I’ve come to the conclusion(with the help of Deferred) it’s because I allow myself to become too dehydrated. I need to drink water more consistently throughout the day to replenish what I lose through my sweat.
Also, on my way down to the water source we soaked at the scourge of mosquitos I have been dealing with since New Jersey may have been the worst I ever experienced. Even before the trail, I’ve always gotten more bug bites than almost anyone I know. I must have sweet blood. Anyway, as I walked down over the course of 20 minutes I killed 8 mosquitoes on my right tricep alone. How many more got away??
I’ve also noticed mosquitoes tend to land close to the same spot as the ones before them. Even after I killed 7 mosquitoes going to the same spot a dumbass 8th mosquito came around and thought it looked like a good spot.
If you walked into a restaurant and had to step over 7 bodies to get to your table would you still eat there?!?
What’s interesting as well is the bug repellent I use (picardin based not Deet) decreases the total number of bites I get (not to 0) but some mosquitoes will still land on a spot that I treated with bug spray. I hate them. I hate them so much. At least they don’t carry diseases(in the US) like ticks do. 
They just suck.
That’s part of it no? They suck, it’s hot, I sweat through every piece of my clothing to the point it feels like I went swimming, yet I still choose to be out here. Every day I make that choice. Hell, I could quit tomorrow. I think almost everyone would be impressed I made it 1400 miles walking in the woods.
But I don’t do this to impress other people. I do this to challenge myself. To grow. To learn about myself and others. To live a lifestyle I will likely never be able to live again (until maybe retirement).
I do this because I can.
I do this because I am Ken.
And I would never want to be anyone else.","
",View Entry,"Jul 17, Sat",0
Appalachian Trail Thru Hike,https://www.trailjournals.com//journal/entry/642022,"Today while we were eating lunch at a deli a man stopped his truck in the middle of the road to ask us some questions.
“Where you guys hiking from?” He yelled from his truck, now in the middle yellow lines to allow traffic to pass.
“Georgia!” We responded
“No shit, that’s awesome!” Then he drove off.
I love New York.
It’s funny, part of the reason I am hiking the trail is to find what part of the country speaks to me. Where my home should be. Where to plant my roots. I always knew it’d be in the north east, but I feel like I’m falling in love with New York like I never had before. The people are kind, genuine, direct, and efficient. It’s so refreshing compared to the fake friendliness combined with the incredibly slow pace of the south. 
Since we have left Pennsylvania we have received more trail magic than we had the entire hike so far. This has been in the form of coolers full of cold drinks, snacks (cookies, chips, etc) to even full blown grilled burgers. Maybe it’s because we are just about in the middle of the bubble, or maybe it’s just the people in the north east get a bad rap.
(The “bubble” is due to large numbers of people leaving at similar times, normally March 1st-15th, and the average pace is around 12 miles a day, so there is a large grouping of people at the same point in trail. We caught up to the bubble despite us leaving in mid April due to our pace, around ~17 miles a day)
All I know is I welcome coolers full of cold drinks on hot humid days. We even hit a trail magic of burgers/cold water right before we got into Harriman State park by a thru hiker from Long Island.
We got into the park, a section of trail I actually hiked prior, leading up to the lemon squeezer. I remembered the trail being beautiful, and more importantly I remember being drawn north. At the time of my section hike I wasn’t even aware of the Appalachian trail yet. I looked up easily accessible hikes, then went because I liked the name of the lemon squeezer. Once on the trail I kept following the white blazes. I remember I even said to the girl I was hiking with, Teddy, “I wonder how far this trail goes”
I left that day feeling like I was pulled down the trail. That it wasn’t enough to wonder what was down the trail but I needed to know.
It wasn’t until years later as I was reading the AWOL book on his hike(highly recommend his book, I believe it’s free) that I realized I was walking the AT. 
Either way, we were hiking through the park and it was even more beautiful than I remembered. The landscape was open, with healthy growth and a forest that inspired wonder. I mentioned to the group it would be a perfect place to see a bear, as there’d be no way it would be startled by us or feel cornered. The space was just too open.
As we hiked we came across an 8 point buck and a doe, fields of delicious blueberries and fantastic interior views. A lot of people really seek out good “views” on their hikes which are often at the top of a mountain or on the edge of a cliff looking out. I find those views nice, even rewarding, but the views I often enjoy the most are those inside the woods. The oddly shaped trees, the mushrooms with vibrant other worldly colors, and so much more. Soaking in my direct surroundings helps ground me and keeps me appreciating the present moment.
Which is why it was so awesome when we were soaking in the forest to realize we were now sharing it with a bear.
Me and Deferred were hiking to find a stealth site, me talking loudly(as I tend to do) when she suddenly goes “Bear!”
I looked and 20 yards away behind a log there was a medium sized black bear moseying up the hill. We stopped dead in our tracks, looking in awe; which the black bear returned with a look of utter indifference and borderline boredom. He watched us for about 5 seconds before continuing his slow lumbering up the hill.
It. Was. Awesome.
I would have been PISSED if I walked 2193.1 miles in the woods and didn’t see a single black bear.
So NY summarized- Way friendlier to hikers than even I expected.Awesome people.Interesting and challenging hiking.Bear.
10/10, would hike here again.
It’s funny, in order to appreciate anything you need to be away from it, and I have a newfound appreciation for New York for sure.","
",View Entry,"Jul 18, Sun",0
