Hiker trail name,Hiker Journal Link,Journal Story,Start location,Destination,date,Today Miles
Appalachian Trail Thru Hike,https://www.trailjournals.com//journal/entry/638887,"We have been very lucky on this trip so far. What I have heard and read about the AT is to expect rain 1 out of every 4 days out here. So far, we are 30+ days in and have had rain 4-5 times total.
That luck did not help today.
We began early from the hostel, bellies full of Wendys from the night prior(thanks Deferred and The John!) and knowing that rain wasn’t just likely, but an inevitability. The forecast said 80% chance of rain and thunderstorms, and damn they really nailed that forecast.
We began the day hiking up a fairly unforgiving climb, ascending 2000ft in ~2 miles. It was grueling, but not terrible, especially since the weather was holding up. We got to a unique shelter(4 walls!) that was a fire warden cabin converted to shelter. The wind whipped outside, the rain started to pick up; and we sat warm and comfortable eating lunch.
Well, mainly comfortable. There was a sketchy man there who said nothing the whole time, wasn’t wearing hiking clothes, and I’m pretty sure he had a hand gun holstered in his belt. Bad vibes all around him.
We hiked on and the rain began to fall slow and steady. As we hiked the rain picked up, to the point where it was a torrential downpour. We were moving through puddles, water streaming down the trail, and I was just struck with the beauty of the woods we were in. How the forest seemed to breath new life with the rain and how refreshing the rain felt.
Then the thunder started.
We knew it was going to be lightning and thunder, and being soaking wet in the middle of the woods with 2 large metal poles is less than ideal. I was timing the difference between seeing a flash of lightning to hearing the thunder. For every 5 seconds between the lightning to thunder it is 1 mile away.
Luckily there wasn’t too much lightning, and the closest it got was ~1 mile away.
That night was the last night I had to spend with my “postage stamp” sized tarp as Josh was due to arrive tomorrow and bring my new tarp.
I stayed dry that night and had to put back all my wet clothes the next day,
So it goes.","
",View Entry,"May 28, Fri",22
Appalachian Trail Thru Hike,https://www.trailjournals.com//journal/entry/638888,"Todays plan centered around meeting up with Josh, who we had made plans for him to fly into Virginia and meeting us around Bland Virginia. It was only 10 miles for us to get there and once again the Virginia terrain was forgiving and mild. 
We covered the distance and got to the road where we planned to meet him by 11am. There were picnic tables there and a family giving out some trail magic of oranges, soda and chips. There son is apparently thru hiking and the family wanted to give back after all he had been getting. It was nice talking to some people from the Northeast(they were from Boston), made me feel more at home. Gotta love the Northeast honesty/attitude.
We grabbed a hitch off the side road, with intentions to go to Dairy Queen for lunch. I was sent out to get the hitch, as it seems sticking my thumb up was more effective for getting a ride than waving at passing cars(looking at you Steve/Deferred). We managed to get a ride from a pick-up truck who brought us right to the dairy queen.
When we got to Dairy Queen I proceeded to do the most Hiker Trash thing I have done yet. I was in the gas station bathroom, noticed a very powerful hand dryer. I looked down at my wet socks/shoes, and then at the hand dryer, as I no longer saw a simple hand dryer, it quickly began to look like a solution to my wet feet. I took one shoe off and started drying my socks (with them still on) and then held my shoe to it to dry it as well.
Well this must have been one of the busiest gas station bathrooms in all of Virginia because in the time it took for me to dry both my feet, I must have moved out of the way for 10 people for them to dry their hands. One guy looked at me and asked “Step in a puddle?” I replied “Yeah, a few.” Understatement of the trail so far.
We ate outside (no inside dining, we needed to use the drive thru window) while waiting for Josh to arrive as the plan was to have his shuttle driver bring us all back to trail in 2 trips, since he could only fit 4 in his car at a time. He arrived with a way too heavy pack, hiking boots(not running shoes like I recommended), and a positive attitude. 1/3 isn’t too bad.
Me, Steve, and Josh took the 10 minute ride up to the trail from Bubba, Josh’s shuttle driver. He smoked the whole way, mainly communicated in grunts and side eyes, but Josh really seemed to like him. I found that interesting. After we got dropped off we were waiting for Bubba to return with Caveman, Deferred, and The John.
And we waited.And waited.And waited.
After about 45 minutes I received a text from Caveman asking if we got dropped off yet because Bubba has yet to return for them. This is when me and Josh began wondering if you are expected to tip shuttle drivers. (Apparently this point is up for debate, most thru hikers do not but some claim you must, who knows)
Well Bubba either did not like the fact Josh didn’t tip, suffered short term memory loss and forgot to pick up the rest of the crew, or got abducted by aliens. I personally believe it to be the latter.
The Tramily was eventually reunited by a woman I met at Bear Gardens hostel who is helping her daughter slack pack for 5-6 weeks on the trail. When I first found out about their arrangement(at Bear Gardens a week ago) I said to the mother “How do I get a deal like that?” She replied “Well she is carrying some extra luggage” I didn’t ask further questions because I wasn’t sure if she was referring to some kind of disability and based on her cryptic response I figured she didn’t want to go into details. I didn’t need the details because her daughter was noticeably pregnant when she arrived a few hours later.
Now I do not want to come across poorly here, and I likely should do more research on the subject before I speak on it, but I do not think you should be doing long distance hiking while pregnant. In order for me to MAINTAIN my weight I need to be eating absurd amounts of food constantly. A woman, literally building a person inside her body, will have such intense metabolic needs there is no realistic way for her to both feed herself and her baby to be. Nonetheless, more power to her, and I wish her and her child the best of health.
I digress.
We hiked only a few miles to a shelter with a horribly far and weak water source; I helped Josh set up his hammock(New Hammock homie!!) and we called it a night.
P.S.My new tarp is epic. It’s 2x the size of my previous tarp and 1 ounce lighter. My femurs won’t break after all 🤗","
",View Entry,"May 29, Sat",12
Appalachian Trail Thru Hike,https://www.trailjournals.com//journal/entry/638889,"We did 16 miles today. They weren’t the meanest miles but I had not realized how good of shape I am in at this point. Watching Josh, who is in reasonably good shape, working out and running before coming out, struggle up hills I barely notice was eye opening. Who would have thought hiking 600 miles would get you in good shape? Not I, not I.
I have been taking a notice to how good of shape I am at this point. When I wake up in the morning and check my watch my resting heart rate is around 40 beats per minute. In my mind, anything below 60 is I’m in running shape, below 50 I’m in the best shape of my life, 40’s is I didn’t know this was possible range. I think I’m going to run a marathon when I’m done with this just to knock that off my bucket list. I mean when am I ever going to be in this good of cardiovascular health again?!?
In short, Josh did well. He pushed himself very hard which I respected, he preferred a pace around 2.0mph, a bit of an adjustment for me and Steve who at this point hike a consistent 2.5mph.
However slow we had to go was more than made up for with the quality of conversations we were able to have. I asked questions about Josh’s Judaism(identity, theory, traditions), Josh asked Steve(Christian, specifically Methodist) about his religious upbringing and perspectives; and many more varied topics that filled the day with thought and insight. I was disappointed that Deferred didn’t join in on the conversations more, or even be present for them. I was interested to see what questions she would have for Josh. Her upbringing, schools and environments means she had only met/interacted with 2 Jewish people in her life. As a New Yorker who honestly loves the Jewish people that fact was mind-boggling to me.
We planned to stay at Dismal Falls, about 2 miles past Weary Feet hostel, but we got sucked into the vortex of the lovely hostel. It was only 5$ to tent, had a 12$ meal of spaghetti which Caveman seemed fixated on, and there were some stellar people there.
I couldn’t help myself to be a pseudo-PT for 2 women I met there: Potato Chip(English woman I diagnosed with Plantar Fasciitis-treatment: new shoes); Sparks (symptoms swelling of ankles diagnosis: anemia?).
We also met Vibes(very funny and likable guy from Alaska), Honey Boo Boo(paramedic from Texas who has a sharp as a tack wit), and Wall-E(beat him in chess 2 times, gets his trail name from cleaning up camp sites).
We played Duroc, ate too much spaghetti and went to bed. What more could you want?
Platinum blazing(jumping from Hostel to hostel) has it’s advantages.","
",Weary Feet Hostel,"May 30, Sun",16
Appalachian Trail Thru Hike,https://www.trailjournals.com//journal/entry/638890,"We are officially 1/4th of the way done with the AT. In some ways I never thought I’d go this far, and in a much more real way I always knew I would.
It’s nice hiking with the group and Josh(Captain Planet now, due to his upcoming internship with the EPA). He fits right in, was filled in on the inside jokes and immediately started cracking some of our own classics.
We were only doing another 16 miles to Woods Hole Hostel, a supposed hippie compound that is a must visit on the trail.
And oh boy it is a hippie compound.
The location is beautiful right away, a farm with garden in front, wooden buildings with character all around, and an amazing view of the valley below you can see while sitting on rocking chairs on the porch. Like something out of a movie.
We were shown around by Moses, another thru hiker who was doing “work for stay” where you complete some chores for the hostel and they let you stay for free. I don’t think I’ll be doing too much of that on this trip, as when I get to a hostel I want to do NOTHING. And to save ~20$ I don’t think it’s worth me doing a few hours of chores. Now, if my chores was an hour or two of PT work.... maybe I would. I really miss my job. I’ve said multiple times, if I could be on trail 5 days a week and work in my clinic back home (shout out to STARS East Meadow Neuro!) the other 2 days I’d be ecstatic.
Nonetheless. I took a warmish 5 minute shower(water shortage) then waited for dinner.
Before dinner the hostel owner had us all circle up and silently reflect on our day, then wanted us to go around and say our name and where we are from. I don’t know if it’sa universal thing, but I always hate these introductions. I get super nervous (which is weird because I love public speaking) and can’t focus on or remember anyone else’s name because I am repeating mine in my own head to prevent myself from forgetting. 
We were told we would be having a vegetable stir fry with tofu for dinner and a salad with all freshly grown/picked produce right from their organic garden. I had casually mentioned earlier that day I could really go for a big salad and damn e we came to the right place.
The food was terrific. I thought it may not be too filling due to lack of meat but it wasn’t even noticeable. The bread they had was home made (insanely good) the salad was fresh with homemade dressing that just made it even more refreshing, and the stir fry was filling and flavorful. Best meal we had on trail so far by a long shot in my opinion.
It costs a 14$ “donation” which I found strange because generally when I purchase goods or services for money it’s called a transaction, but when ringing me up he told me that’s the suggested donation. My suggestion, just charge me for the food. Don’t try to act like I should be acting charitable for an already expensive meal. It was 100% worth the money, hence why I paid it but his wording rubbed me the wrong way. 
After dinner we planned to have a fire and be social with the other tramily there, but between some workers at the hostel having come down with Norovirus(a nasty, highly contagious stomach bug) and a hiker getting it too, it told us its best to be anti social tonight. No problem for me🤪
One lesson for today-
Hippie make crazy good bread.","Weary Feet Hostel
",Woods Hole Hostel,"May 31, Mon",16
Appalachian Trail Thru Hike,https://www.trailjournals.com//journal/entry/638891,"We planned to leave Woods Hole Hostel, hike 11 miles to Pearisburg, resupply and Deferred would stay with The John as he was set to leave the next day. Me and Josh hiked behind the crew as his knee was majorly hurting and he could not move that fast. The crew trekked on ahead and I strategically distracted Josh with various conversations.
We spoke about beliefs in afterlife, his perspective and insight surprised me, I wasn’t aware he had so firmly believe in reincarnation. Ot shocked me because Judaism makes no mention of it, and he had no prior events or recollections in his life that lead to this belief. It seemed to be, just there. Kind of unique and interesting to me, because although my thoughts may seem scattered to an outside perspective, I almost always have a direct line of logic/reasons I believe a certain truth. His truth seemed to just exist inside of him.
We made it to Pearisburg, a Godawful town with a Hardee’s, DQ, Mexican Restaurant, a grocery store and 1.25 motels. Trash. Town.
Me and Josh went to Hardee’s instead of Mexican(where the Tramily ate) because he wanted a burger. And frankly, after all the pain and hardship I have already caused him to suffer, I wasn’t about to deny the man a burger.
We ate outside the DQ, as surprisingly enough a lot of places still have no indoor dining. 
It’s perplexing. Because the second I came to the South it was like Covid never existed. Nobody wears masks (expect workers, who often wear them around their chin, gotta keep on of their chins safe I guess) and people talk about how it was BS. It infuriates me right away and I speak up every time someone starts with that shit. I explain that as a New Yorker I saw how bad Covid was, and to downplay such a tragic loss of life (600,000 American lives lost) is calloused and wrong.
Yettttttt, even with Covid basically not existing in the eyes of the southerners, the chain restaurants are super strict about no eating indoors. It’s annoying at worst but I’ll live.
After we ate I had a scare. I don’t mean to be graphic and I won’t be because I hate even writing it out; but Norovirus has 2 symptoms. One out your front end one out your back. Both unpleasant.
I had one of those while in the bathroom of the grocery store (Don’t worry I made it). My mind immediately went to “Oh shit, I got Norovirus.” 
And I refuse to go into to woods and chance being sick for 3 days in the middle of the woods. No way Josè. I’d like running water at a minimum if I’m going to be going through that.
I told Josh and the tramily my concern and informed them my plan to stay at a motel tonight to see how it progresses.
Remember when I said this garbage town only had 1.25 motels and you thought “hm, that’s a weird number, I hope he explains that.” Well here is your explanation:There are 2 motels in the town-
Is open but at full capacity, on a Tuesday. In the middle of bumblefuck Virginia. WHO IS STAYING AT THESE MOTELS?!?
Was due to open THAT DAY but the inspector who would give them the final pass didn’t show up.
Kill me. Just kill me.
Me and Josh ended up booking an expensive shuttle to a shitty Super8 in a town about 30 minutes away. Have you tried to call a hotel recently? Apparently a lot of chains (looking at you Holiday Inn) don’t even connect you to the front desk, instead you wait on hold for ~20 minutes before a technician who is clearly from India then fumbles around your simple requests for a room and tries to sell you a 120$ a night stay. No thank you.
We had a patient and super helpful shuttle driver Don who made sure we got a good place and made good conversations along the journey. I taught him about PT and pain science and he was super receptive and excited to hear what I had to say. Which was immensely helpful in taking my mind off my rumbling stomach for the long car ride.
We got to the motel and... well... it’s a Super8. Picture it in your mind. Yeah, basically that but maybe 30% blander and relatively clean. Good place to have Noro if any in my opinion.
Our room had 2 giant pictures of the same picture. I found that oddly annoying. Why spend the money on the same picture, 2 times, in the same room? Why not just get 2 different pictures in bulk and put one of each in each room? How much money could they possibly be saving?
Its not important but little things can drive me crazy.
That night Josh got to see Dr. Connolly as I acted as good PT to help his knee. I was able to get the pain down temporarily, but honestly time and more walking would be the best thing for it. Also doing an occasional squat or 2 may help, Josh.
I slept well that night despite the spot light in the parking lots best attempts to keep me awake and felt like it may have been a false alarm.
Hope that holds true until the morning🤞","Woods Hole Hostel
",Super8 in Christiansburg,"Jun 01, Tue",11
Appalachian Trail Thru Hike,https://www.trailjournals.com//journal/entry/639418,"It held true. I was fine and don’t have Norovrirus, thank God.
Me and Josh returned to the trail around 2pm due to having trouble securing a shuttle for a while and the long drive back.
But before I talk about that I got one more thing I need to vent about Super8. Our check out time was 11am. By 9:30am we had house keeping literally enter our room 2 times without knocking. By 10:30 that had gone up to 4 separate times. They did not knock. They just opened the door and said “housekeeping”
How bout you keep out of my room until I leave.
It felt good to be in air conditioning for a night. To be able to shower and not need to aggressively wipe my feet after for fear of athletes foot. Civilization felt good for a bit.
But now we were back in the woods. We did a short day our first day back, with little to note other than a funny difference between me and Josh. When I struggle in the woods, whether it’s up a hill or if the weather is particularly bad, I will create a mantra for myself, as I have mentioned in previous journals. Josh apparently sings to himself, this time from the play Hamilton. Which he performed an entire song from for me. Using falsetto for the women’s parts. It was so nerdy, impressive and funny at the same time.
He needed to sing quite a bit that day to climb those hills but he did them. He’s a trooper.
The next day was similar, these days hiking in Virginia is incredibly boring. There are little to no views, it seems like you just go up 100ft down 100ft and up again. Always surrounded by trees, but honestly often close enough to roads to hear cars. And the water sources are far and inbetween. Its like someone distilled all the worst aspects of hiking and put them together, then stretched that concoction over 700 miles in Virginia. I seriously look forward to getting out of here.
Josh even asked me at one point why I go so fast and not try to take in the surroundings and the most honest answer I could give was- not much interested me about this hiking. The woods look the same as usual, the towns lack any character or services, and Virginia seems to go on forever.
Virginia blues are real apparently...","
",View Entry,"Jun 02, Wed",0
Appalachian Trail Thru Hike,https://www.trailjournals.com//journal/entry/639419,"Irony is present on this trail. Or maybe Josh is just super unlucky. Either way, he missed trail magic 2 times in a row, once by about 4 hours.
I have trouble recalling these days at this point. For context, I am writing this journal on 6/16 due to being behind on journals and my phone breaking. I plan to write up a synopsis of the last 10 days with general timeline of events and will be writing up individual days that had big events.
I apologize for falling behind in journals, as if I was up to date I would have only missed 4 days due to not having a phone. At the same time, the days are becoming more routine, and I’d say 75% of days I missed writing about had little significant events.
Thanks for bearing with me, and continuing  this journey with me.","
",View Entry,"Jun 05, Sat",0
