Hiker trail name,Hiker Journal Link,Journal Story,Start location,Destination,date,Today Miles
Further & Yonder,https://www.trailjournals.com//journal/entry/628964,"Today we left a stealth campsite with a view, really nice, and hiked down into Lehigh Gap to the Lehigh River - saw some Pennsylvania Amish young folks who were going out hiking, and crossed the river bridge.  It was very loud and busy with the trucks and cars whizzing by on the roads, felt glad to cross the streets and head back into the woods.  We had considered going into Palmerton, a nearby town, for phone charging, etc., but with the noise, and the feeling that we still had good energy, went upward to tackle the climb out of Lehigh Gap heading north.  It was definitely up, which is tiring, but also feels good.  The trail eventually opened up to a giant boulder rock field - we had wondered what this would be like - there were warnings about using an alternate trail in bad weather.  Again, it was challenging, with balancing and climbing involved, but also satisfying.  For me, it was just challenging enough, until we got to a couple of spots where I surrendered my poles, had to boost up to climb sideways and up across a rock face placing my boots in crevices to keep going - a little scary with the heavy pack.  Further thought this whole boulder section was the best part of the hike, of course!  :-)  After getting to the top, we began traversing a long ridge with just slight ups and downs.  It was a strangish landscape - this mountain was used as a Zinc smelting location and was a environmental disaster when the smelting stopped in the 1980s (it was a Superfund site with federal cleanup).  The top of the mountain seems to have recovered but with different flora.
We stopped at a meadow area with a view for breakfast, saw Badass Bean and Captain Hook pass by - they were slackpacking that day.  Later we saw them again sitting at a table, feet up, partaking in trail magic soda and chips from Iceman, who generously offered the same to us.  We aired our boots and feet, had a cold drink and delicious salty chips, filled our water bottles, thanked Iceman and moved on (his generosity was so appreciated!).  The next Shelter was a bit too far for us, these ones are quite far apart, like 19 miles, so found a campsite near Delps trail and called it a day.  
~Yonder","Stealth campsite 
",Stealth campsite ,"Jul 01, Wed",15.10
Further & Yonder,https://www.trailjournals.com//journal/entry/628965,"We left campsite with a Pro bar split between us for breakfast, wanting to get on the trail quickly.  We hiked and hiked, the trail is pretty here, with many ferns under the trees, but very much the same over and over, without many landmarks, and of course, the ubiquitous ROCKS to slow us down. We needed to charge our phones, clean up, do laundry and eat some real food, so were determined to get to Wind Gap and get off trail for a town visit.  Stopped at Leroy Smith shelter (with still 9 miles to go) and had breakfast, it was sunny and hot, stayed in the shaded shelter.  Thought we might stay at a motel, but could not get through to anyone.  
Finally arrived at Wind Gap, with the trail dropping us onto a busy, loud road, walked to the motel.  The owner was not there, a resident showed us a room, but we decided to walk into town instead to the laundromat.  We were able to charge phones, clean dishes and wash up at the laundromat (it was nice and clean) and had loads of iced tea and  pizza at a pub across the street.  Fortified, we charged up (ha ha, nope, we actually slowly walked - it was hot!) the hill to the trailhead, and then up out of the gap to a stealth campsite.  
The site was probably the smallest one we stayed at, and right to the side of the trail, but it was nearing 9:00 PM and getting dark fast.  The tent gradually cooled a bit and we slept.
~Yonder","Stealth Campsite 
",Stealth Campsite ,"Jul 02, Thu",9
Further & Yonder,https://www.trailjournals.com//journal/entry/628966,"We woke above Wind Gap, early again at 6:00 AM, as we hoped to hike long and get to Delaware Water Gap today.  However, if we couldn't make it, we could stay at Kirkridge shelter and hike out tomorrow.  The trail continued to have many rocks, we were slow, but eventually reached Kirkridge shelter, actually a very nice shelter.  It has a bit of a view of the distant mountains, a ""porch"" area that is covered, and nice picnic table.  We had our second lunch/dinner here and felt that bittersweet feeling of coming to the end of a backpack trip.
We hiked along the ridge with ups and downs, where we saw this very Zen toad, about 2-3 feet up on his little pedestal rock that was wedged between two limbs.  Eventually we reached Mt. Minsi and a big down to Delaware Water Gap.  We began to see more day hikers as we climbed down for a couple of miles; it took a while, with our tender, tired feet and the heat.  We went to the Church of the Mountains, as this church has a hiker welcome center, and offers hostel and camping space, but it was closed due to COVID.  So instead we went to our car, and headed to a motel in Stroudsberg, as it was already about 7:15 PM.  We enjoyed dinner in Stroudsberg, slept well, and began the trip back home the next morning, enjoying a fun visit to NewSylum Brewery with friends Pam and Jeff in Connecticut.
This was a great trip, challenging due to rocks, but enjoyable.  Real positives were meeting the thru and section hikers, as well as trail angels, along the way, and having some mind space away from the current issues in our world.
Enjoy searching for your wild blue!
~Yonder","Stealth campsite 
",Delaware Water Gap ,"Jul 03, Fri",13.20
Further & Yonder,https://www.trailjournals.com//journal/entry/631338,"Seven weeks after leaving trail we found ourselves following the white blazes again, this time up to the top of Mt Madison in the Whites. Our son Jeremy, newly christened with trail name “Bogs”, joined his friend for a few days hiking SOBO from Grafton Notch to Gorham and needed a ride back to his car. Using this as our excuse Yonder and I loaded up the packs and headed north. We picked up Bogs from the Rattle River Hostel and shuttled him back to his car in Grafton Notch hearing all about his adventures from the last few days including descending the Mahoosic Arm in a rain storm and crawling through the Mahoosic Notch. From there we quickly got back to a trailhead off Rt 16 in NH that was only a few miles from the Osgood tentsite which we arrived at just as it was getting dark.

Being back in our tent in the woods was awesome! We both had our best nights of sleep in weeks, so much so that we didn’t start hiking until very late the next morning which turned out to be a bit of a mistake as we managed to do our typical arriving back in the dark routine after what we thought was going to be a short day.

The hike up Osgood trail to the top of Madison was a steep one and we could see why many of the thru hikers complained about going down it. Shortly after going above tree line some dark clouds quickly moved in and the temperature dropped about 20 degrees and the rain started coming down. Suddenly there were no views and we were questioning how smart it would be to continue. Luckily we had most of our stuff with us in our packs with the exception of our tent which we had left setup at the campsite so we figured we would be OK and forged on. As we got closer to the summit the clouds started to disappear and the sun came out along with the views. It was great to be back on top of the Presidentials again!

From Madison we started down the other side to grab a quick lunch at Madison Spring Hut where we heard they were selling food though they were not fully open for people to stay due to COVID restrictions. This is where the day started getting hard as neither one of us move very fast going down. The plan was to stop at the hut and then move onto the summit of nearby Adams but shortly after arriving at the hut the skies opened up again and more rain dumped down. The timing was great because we were able to run into the hut and wait out the rain while eating one of the delicious burritos they were selling.

Once the rains let up we headed back out on the trail again but it was becoming clear that we would not be summiting Adams today which was covered in a dark black cloud that wasn’t going away anytime soon. Plus it looked like more storms coming our way so it was time to head back down off the ridge. And this is when we got stupid.

We meant to ask the crew at the hut about some of the other trails going back down to make sure we didn’t choose anything crazy. We had heard that Madison Gulf trail was insane (one of my original plans) so luckily we avoided that one but we still managed to make a terrible choice for our way back down. Instead of going back up and over Madison I had the bright idea of taking a cutover trail that went around and was supposedly slightly shorter. My thinking was that this would lessen the risk of being up top if another storm rolled in. As it turns out it only sprinkled off and on for the rest of the day so weather wasn’t even an issue. Adams remained covered in a black cloud so we definitely made the right decision in skipping that but this cutover trail turned out to be a nightmare. It wasn’t even really a trail, it was more like bushwhacking and we were never sure if we were actually on the trail or just lost somewhere in the wilderness for most of it. For some reason though we kept going instead of turning around like we should have. After what turned out to be most of the day we finally made it back to the Osgood Trail (which is also the AT) and we headed down the steep descent back to the campsite where we arrived just after dark completely exhausted. 
We barely hiked 7 miles this day and yet we felt completely wiped. Instead of the 2 to 3 miles an hour we had hiked in PA up here we couldn’t even manage a single mile per hour. The White Mountains are no joke. We were properly humbled.
~Further","Osgood Tent Site
",Osgood Tent Site,"Aug 22, Sat",7
Further & Yonder,https://www.trailjournals.com//journal/entry/631900,"This year continues to be one where plans cannot be made and, if they are, they will be ruined. For this reason I am referring to this as the “Plandemic” of 2020. The plan for this month was to go to a reunion out in Yosemite Park to join our friends who were celebrating their 30 year wedding anniversary. The last time we were at Yosemite was 30 years ago for their wedding and we were not able to take much advantage of the great hiking out there on that last visit. This time we had secured the proper permits for hiking up Half Dome as well as for backcountry camping. We were excited to do some recon on The Muir Trail which happens to be number 2 behind the AT on our hiking bucket list (it’s a big list). Unfortunately these plans had to be scrapped last minute due to all the fires out west and the poor air quality in Yosemite.
So now we found ourselves with a couple of vacation days that we had already scheduled from work and what looked to be some pretty good weather over Columbus Day weekend. What to do? Well, hike the AT of course! Picking a section that we have not hiked yet that was within a few hours drive we decided upon tackling NJ from High Point SP to Longhouse Drive where we had left off a couple of years ago. There are not that many AT miles in NJ but still too many to fit into a long weekend outing so we will need to come back to finish the section from Delaware Water Gap where we left off in July to High Point SP where we hiked from on this trip.

Even though we had hiked for 3 weeks earlier in the summer and also had that quick trip to The Whites it was like we were starting all over again. It took us forever to pack, we took way too much stuff and we still managed to forget things. But we eventually got ourselves down to NJ and on the trail though we had to shorten up the first day and only hike a couple of miles due to our late arrival.

About 5 minutes into the hike we were freezing and made the decision to turn back to the car to grab extra layers. This did indeed keep us warm but added extra weight that we had to deal with for the next 3 days and the worst part was that we finally warmed up about an hour in and never really needed those extra layers for the rest of the trip.

Despite arriving late and carrying way too much stuff it was great to be back on trail.
~Further","NJ 23 (Near High Point SP HQ)
",High Point Shelter,"Oct 08, Thu",2
Further & Yonder,https://www.trailjournals.com//journal/entry/631902,"This morning we were back to our usual routine and it was like we had never gotten off trail. It was great to be waking up in the forest again. Immediately we were impressed by the beauty of NJ, especially at this time of year with the leaves starting to turn colors plus it was the perfect weather for hiking.
The highlight of today was our side trip to the “Secret Shelter”. This is an unofficial shelter located on a nearby trail angel’s property. It was an incredibly scenic spot complete with a friendly donkey and an outlet to charge our phones. 
After our recent adventure in the Whites we found the terrain to be much easier here in NJ. We managed to cover over 12 miles in what felt more like a leisurely stroll than a hike.  

~Further","High Point Shelter
",Pochuck Mt Shelter,"Oct 09, Fri",12.40
Further & Yonder,https://www.trailjournals.com//journal/entry/631903,"Today was filled with many highlights, most notably the many miles of boardwalk through some really scenic wetlands. We also got to experience what could be considered a lowlight which was the most crowded section of trail we had ever hiked on going up “The Stairway to Heaven”. If there’s a bustle in your hedgerow don’t be alarmed now, be very, very annoyed. Hikers know the curse of an “earworm” when song lyrics get stuck in their head for hours and with a section of trail named Stairway to Heaven it is pretty much guaranteed to happen.
Most of our hiking highlights center around food and today was no different. The happiest moment of the day was when we took a break at the Heaven Hill Farm for some cider donuts and cold brew. This proved to be the perfect hiker snack which powered us through the rest of the day. It was extremely frustrating weaving in and out of all the tourists going up The Stairway To Heaven while strung out on donuts and caffeine. Get out of our way people!

Unfortunately, today also marked the end of our short vacation when we finally reached the car we had waiting for us at Longhouse Drive where we had started a previous northbound hike a couple of years prior. Another little section down, many more miles to come. We can’t wait until we step foot on Springer hopefully in March of 2021.

~Further","Pochuck Mt Shelter
",Longhouse Drive,"Oct 10, Sat",13.40
