Hiker trail name,Hiker Journal Link,Journal Story,Start location,Destination,date,Today Miles
Further & Yonder,https://www.trailjournals.com//journal/entry/625278,"This is a shared journal that we will be using to document the hike that my wife Deb (Yonder) and I (Further) plan to start in late April of 2020. We will be part of the “older” crew out on the trail but from what I’ve seen we will have lots of other old geezers out there to keep us company. Things have changed a lot since the mid-70’s when I first discovered the trail and vowed to hike it someday. One thing that has not changed is my desire to hike it. Life may have gotten in the way for awhile but we are now finally able to do this. 
~Steve (Further)",,View Entry,"Dec 14, Sat",0
Further & Yonder,https://www.trailjournals.com//journal/entry/625296,"In 1975, when I was 12 years old, my friend Steve and I somehow convinced our parents to let us hike sections of the Long Trail in Vermont. Two 12 year olds fending for themselves alone in the woods. It was awesome. We would go out for 4 or 5 days at a time with packs that were much heavier than what I hike with now as a full grown adult. I have a very distinct memory around this time of meeting an AT thru-hiker at Stratton Pond who told us he had just walked from Georgia. My little 12 year old mind was blown and the idea of hiking the trail took hold right then and there.
About 10 years after those formative years on the trail I got together with Yonder. Our first “thru-hike” together was the Chilkoot Trail in Alaska. It was only about 35 miles and just a few days on the trail but it was enough to hook Yonder on this whole backpacking thing and in the process I found a hiking partner for life.

Since then we have gone on many more hikes together and completed several sections of the AT as well. But after every trip we were left wanting more. It’s time for more.

~Further",,View Entry,"Dec 15, Sun",0
Further & Yonder,https://www.trailjournals.com//journal/entry/625308,"A few years back we found ourselves in an empty nest situation with both our kids being away at college. Suddenly we were free again and the idea of hiking the AT came right back to us. We got back out on the trail again and slowly upgraded our circa 1970’s gear and replaced everything with newer and lighter equipment. After a few years of this we realized that we weren’t getting any younger and the sections we had been hiking seemed to be getting harder. If we were to wait until we were both comfortably retired this might not happen. Nope, we need to do this now.
So the plan is to commit career suicide by quitting our jobs and hitting the trail. I will be 57 and Yonder will be (gulp) 60. Not really old geezers just yet but not exactly spring chickens either.

To keep in shape for hiking over the last several years we have also gotten into distance running. Through our running club we have secured entries into the 2020 Boston Marathon on April 20th. Because of this we will be starting our hike a week later on April 27th which is later than most. Hopefully the training for Boston will have us in great shape for hiking (assuming the race itself will not beat us up too much). We think that the timing for this will actually work in our favor because it will keep us away from the colder temps and it should also be less crowded on the trail by then. The drawback to this plan is that it will only allow us a little more than 5 months to get to Katahdin before they close it down for the season. This may not be an issue for us though as we may very well skip over some or all of the sections that we have already hiked (Shenandoah, MD, NY, CT, MA, VT and NH). Whether or not to skip sections is something we will have to figure out during the hike. It’s a long way from Springer to Shenandoah so it will give us plenty of time to decide before we are faced with that first choice of skipping a section. And we know the stats about most hikers not finishing and many not even making it past Georgia so we’ll see what happens. We think we can do this but we also know that all it takes is one bad step for plans to change. If that happens so be it but we’ll never know until we try and we are so excited to try!

~Further",,View Entry,"Dec 16, Mon",0
Further & Yonder,https://www.trailjournals.com//journal/entry/626139,"We are now 11 weeks away from our start date and have begun to feel the urgency to step up our planning. Somehow, after 45 years of thinking about this adventure, I suddenly feel like we do not have enough time to properly plan this thing!
We are both going back and forth on what footwear to go with, which sleeping bags, what clothing, mail drops or no mail drops and on and on. But the good news is that some of the more important things have started to fall into place... 
Someone has agreed to rent our house for five full months! This is a huge relief and the part of the plan that we hadn’t fully figured out before committing to this. If we had to continue paying the mortgage for the entire time we will be away we would definitely be broke by the time we got to Maine. Now we will have most of our fixed costs taken care of which will allow us to spend more money while we are hiking (side note: we plan to hit every craft brewery located near the trail along the entire way). Also, we will no longer have the option to come running home the minute things start getting hard since there will already be people living in our house.

We have decided to splurge the night before we hit the trail and will be staying at Amicalola Lodge which we have already reserved. Even better we will have some friends driving up from Florida to pick us up from the airport and bring us to Amicalola. They have even agreed to drive us up to the trailhead on Springer Mt the next morning and will hike the first couple of miles with us.

Another thing to report is that we have already started getting offers of trail magic! Last week we met a former thru hiker who lives near the trail in Pennsylvania who has offered to pick us up and bring us to her home when we are passing by her area. 
There are still more logistics to work out (anyone want to watch our cat for 5 or 6 months?) but we are getting closer to figuring it all out and this is definitely going to happen.

-Further",,View Entry,"Feb 10, Mon",0
Further & Yonder,https://www.trailjournals.com//journal/entry/627576,"Well, I guess it’s time for one of these updates from us. We have decided to heed the ATC’s warnings and stay off trail until further notice. Our original start date of April 28th is not going to happen. We were in the denial stage for quite awhile on this but when our friends called us to let us know that they would not be shuttling us from the airport to Springer we finally accepted the truth. This thru hike will have to be postponed and may not even be able to happen. It’s a small problem compared to what the world as a whole is going through right now but it’s not easy seeing a lifelong dream slip away.
We are now taking things day by day. Both our jobs have allowed us to stay on past our original leaving dates and we are now working from home and still getting paid. Another bit of good news is that our renters have agreed to hold off for a month and will not move in until June 1st. Of course this could also be considered bad news if the trail does not open up by June, not only will our hike still be postponed but we will also be homeless!

Right now we are hoping for the best and have set a new date of May 29th as our official start. I have changed our reservation at the Amicalola Lodge and can hopefully get our airline reservation changed as well. The way things are going this may still be too soon but this is what we are working with for now. Plan B is to do some kind of section hike routine or find another trail to hike that will be less impacted by these virus concerns. Clearly our plan B could use some work. If anyone has any ideas please feel free to share.

One thing that has become clear is that we will not be doing a traditional thru hike starting from Springer and passing every white blaze to Katahdin. We were already questioning if we should hike the sections that we have already completed and now it is clear that we won’t. This still leaves about two thirds of the trail to finish but if we are able to start on May 29th I think we can do it. 
So there is still hope for an epic adventure on the AT in 2020 for Further & Yonder. It will just be a little different than expected.

~Further",,View Entry,"Apr 10, Fri",0
Further & Yonder,https://www.trailjournals.com//journal/entry/628417,"We have decided to pull the plug on this year’s thru hike plans - Yonder really needs to be here for her job and the people who were supposed to rent our house had to pull out of the agreement. All of this along with the ATC still wanting thru hikers to stay off the trail made it clear to us that this wasn’t meant to be for 2020. That’s the bad news.
The good news is that we are both still employed and we will not be homeless while we wait for the trail to open up. The better news is that things actually are starting to open up and we will soon be back on trail for a section hike! 
Our new plan is to do a smaller section hike this year starting on June 13th and then we’ll try the longer hike starting from Springer next April. We both have a lot of vacation time built up so we’ll be able to take 3 weeks and still get a pretty good hike in this year despite all the pandemic craziness. We’ve decided to tackle the rocks of Pennsylvania. If they are as tough as everyone says they are it will be nice to get them out of the way and be able to skip over them next year.

Hopefully the next time we make an entry in this journal it will be from on the trail and not another one of these “change in plans” entries.

~Further",,View Entry,"Jun 07, Sun",0
Further & Yonder,https://www.trailjournals.com//journal/entry/628561,"Finally! We are back on trail. Off to a late start after a long drive so we had to settle for a short night hike for our first day. First time updating this journal from the trail, hopefully it works and I can figure out how to upload pictures. 
~Further","Pen Mar Park
",Falls Creek Campsite ,"Jun 13, Sat",0.90
Further & Yonder,https://www.trailjournals.com//journal/entry/628565,"Had an easy day planned for today so slept in a bit and being a little out of practice didn’t hit the trail until 11am.  Hiked through some light rain and walked into some trail magic!  Nice surprise for the first real day!  Day got even better as we walked over some nice bridges and into Old Forge Park where there was a water spigot for hikers.  Filled all our bottles, got rid of trash, used the restrooms  What more could a hiker want! Ended the day at Tumbling Run Shelters.
~Yonder","Falls Creek Campsite 
",Tumbling Run Shelters,"Jun 14, Sun",7.70
Further & Yonder,https://www.trailjournals.com//journal/entry/628581,Another easy day and good thing too since we got started even later than yesterday. We definitely need to work on that. Ended the day at a state campground where we were able to take showers and recharge our phones. Off to a great start so far!~Further,"Tumbling Run Shelters
",Caledonia SP Campground ,"Jun 15, Mon",10
Further & Yonder,https://www.trailjournals.com//journal/entry/628613,"Did some uphill cruising from Caledonia campground to Quarry Run shelter for a delightful stop.  Met Topo, a section hiker, finishing her final AT section with two friends.   Shelter was extraordinary with a chair swing, potted flowers and lovely building surrounded by a rhododendron forest. We walked on through miles of mountain laurel and mostly smooth trail to Birch Run shelter and met up with our son Jeremy and his friend Tim - which was a lot of fun!~Yonder","Caledonia SP Campground 
",Birch Run Shelter,"Jun 16, Tue",9.50
Further & Yonder,https://www.trailjournals.com//journal/entry/628636,"Another great day but we ran into our first glitch. One of our sleeping pads is malfunctioning and will no longer hold air. Luckily we reached Pine Grove Furnace where Jeremy had his car parked so we were able to drive to the closest Walmart and buy a new pad. So instead of the super lightweight comfortable pad that rolled up to the size of a Poland Spring bottle I now have this giant roll up foam pad hanging off the outside of my pack driving me crazy and it’s not even that comfortable. Hopefully we can find a better solution later on down the trail. The good thing about this though was that the Walmart was back by the campground where Jeremy and Tim were now at so we decided to stay there for the night and take advantage of the free showers before heading back to Pine Grove Furnace to resume our hike.
~Further
“Cold ground was my bed last night and rock was my pillow too...”. B. Marley","Birch Run Shelter
",Pine Grove Furnace SP,"Jun 17, Wed",9.80
Further & Yonder,https://www.trailjournals.com//journal/entry/628637,"Drove back to Pine Grove Furnace state park and then enjoyed a mega breaKfast sandwich at the general store.  One of the fun parts of being out here is meeting fellow hikers...we met some thru hikers - string bean, chili and fantastic - they started their hike and got off trail for several weeks for to Covid.  Now back on trail and will go back south later to finish up what they missed.  Also ran into section hikers Nemo and Dory.  Snacked at Green mountain general store and got to James fry shelter with still more energy for more miles.  Kept going to a stealth campsite which worked out just fine for the evening.  
~Yonder","Pine Grove Furnace SP
",Stealth Campsite ,"Jun 18, Thu",11.20
Further & Yonder,https://www.trailjournals.com//journal/entry/628657,"Today we had our first really hard rain of the trip. Prior to this it had only rained at night while we were dry in our tent. We definitely weren’t dry today though and we could have avoided it by staying at a hostel in Boiling Springs but decided to forge ahead and stay at a hotel that was offering a hiker discount so we could get our own room for less money. This also allowed us to take our third shower in 7 days which is probably a lot more often than most AT hikers and a trend that we hope to continue if possible. 
Today’s picture is from a trail magic break provided by Jeff from Ohio. Zoom and Garlic joined us.
I had become very aggravated with the giant blue sleep pad hanging on the outside of my pack so was very happy to discover an outfitter in Boiling Springs where we were able to get a better quality pad that actually fit in my pack. This proved very timely since my pack cover was not large enough to keep everything dry when the Walmart pad was strapped on and things would have gotten very wet if I had to keep carrying it. Instead, once I got the new pad the $9 Walmart pad was left in the hiker box at the ATC center for the next hiker desperate enough to need it. 
We also enjoyed a great lunch at the 101 Cafe before heading out for what turned out to be a very wet last few hours of hiking.
~Further","Stealth Campsite 
","Carlisle, PA","Jun 19, Fri",16
Further & Yonder,https://www.trailjournals.com//journal/entry/628694,"Today we tested out our top hiking speed in order to participate in our running club’s virtual 5k trail race. Luckily for us this coincided with some of the flattest section of trail we have seen so far. Without actually running we were able to average about a 19 minute mile or about 3 miles an hour. Typically we have been averaging closer to 2 miles an hour including all of our stops of which there are usually many.
Later in the day we had to cross some fields that had clearly not been maintained in quite some time which was a bit challenging as we got lost in a sea of tall grass. As far as we can tell we managed to make it through tick free though.~Further","Carlisle, PA
",Cove Mountain Shelter ,"Jun 20, Sat",15
Further & Yonder,https://www.trailjournals.com//journal/entry/628719,"After a night at Cove Mountain shelter where we met Mulligan who is doing his second full Section hike of the AT, we hiked down to trail town of Duncannon. Got our mail drop and some new socks at Kind of Outdoorsy.  Then to the famous Doyle hotel for delicious iced tea (and a traditional Yuengling beer for Steve - he says he may have liked the iced tea more).   Figured we’d head to Peters mountain shelter about 11 miles away - ha ha- that was before we climbed up Peters mountain in the afternoon sun!  Some major uphill with giant rocks thrown in.  We ended up at Clark’s ferry shelter about 4 or 5 miles out.  
By the way, it might be noted that we usually hike more than the miles listed.  Those miles are just the actual AT trail miles, not the around town miles!~Yonder","Cove Mountain Shelter 
",Clark’s Ferry Shelter,"Jun 21, Sun",8.30
Further & Yonder,https://www.trailjournals.com//journal/entry/628757,"left at 8:45 am from Clark’s ferry shelter campsite walking along the long and undulating Peters mountain ridgeline.  We were pleased to see three turtles all hanging out at different spots in the trail.   It was warm and sunny but mostly shaded as we stopped at a few viewpoints along the way. Met a day trip section hiker enjoying Kinters view - we heard many snakes live in the rocks there but were fortunate not to see them.  (Thru hiker Heebee Jeebee saw a cotton mouth there the later that day.)  Visited the spacious Peters Mountain shelter for late lunch.  Heebee arrived, also Zoom and Garlic.  We kept on going to cover more miles before the predicted afternoon rain.  We had just arrived and set up tent when the skies opened!~Yonder","Clark’s Ferry Shelter
",Stealth campsite ,"Jun 22, Mon",15.20
Further & Yonder,https://www.trailjournals.com//journal/entry/628758,Woke up to a very wet and dirt soaked tent along with zoom and garlic who both arrived minutes after we did last night but unfortunately for them the downpour started before they had fully setup their tents. We wished them well on their way to Maine as we doubted we will ever see them again. They are hearty thru hikers after all while we are mere section hikers so they will soon be much further up the trail than us.After drying out our gear at one of the shelters and eating a late lunch/ early dinner of our special ramen recipe we moved on for some more late day miles only to have a repeat of the night before where we just barely got into the tent before the skies opened up.~Further,"Stealth campsite 
",Stealth campsite ,"Jun 23, Tue",14.20
Further & Yonder,https://www.trailjournals.com//journal/entry/628776,"Woke late after rainy and thundery night so skipped breakfast to get going.  Not too far along, after some rough trail last night, emerged to a beautiful meadow, crossed a road and found trail magic from Karma...cold water and gatorade. Thank u Karma!
We entered Swatara state park and enjoyed breakfast at a camp spot, hiked over another bump and found the Swatara Union Canal Trail.  This trail brought us to Days inn where we dried out and cleaned up from our two afternoons of thunderstorms. ~Yonder","Stealth campsite 
","Lickdale, PA","Jun 24, Wed",6
Further & Yonder,https://www.trailjournals.com//journal/entry/628786,"Today was all about trail magic. We started off by getting shuttled around town to the post office to send back some stuff we didn’t really need and were tired of carrying then through the drive thru for coffee and breakfast sandwiches that they wouldn’t sell us when we tried walking through the drive through and then dropped off at the AT trailhead allowing us to skip the 2.5 walk from the Days Inn where we stayed last night. We were greeted at the trailhead by Boo-Ray who was handing out cold drinks to all the hikers. Later in the day we were treated along with fellow hikers Chili, Stringbean, Blueberry, and Fantastic by former thru hiker Slick who had a full supply of Gatorade, sodas and honeybuns. At the end the day while sitting in our tent waiting out a short rain shower Jet came by with a bag full of cheeseburgers that he was handing out to all the hikers- we didn’t even need to get out of the tent!
On the shower scorecard we got to each take one at the hotel last night and again this morning for a total of 5 over the 13 days so far. We are not exactly roughing it out here so far.One last luxury of our not so tough day was an epsom salt foot soak provided by Borderline, the caretaker of the 501 shelter.~Further","Lickdale, PA
",501 Shelter ,"Jun 25, Thu",11.40
Further & Yonder,https://www.trailjournals.com//journal/entry/628788,"As a result of this whole COVID situation parts of the trail have gotten really overgrown. Today we walked a few miles through grassy trails where we often could not see the ground. This freaked us out a bit because this section came right after we saw the first rattlesnake of the trip. The good news is that we made it through with no rattlesnake bites but the bad news is that I found a tick embedded in my leg which was hard to pull out. We are assuming that the tick jumped onto my leg not too long before we found it but will be on the alert for any telltale Lyme disease symptoms just in case. 
~Further","501 Shelter 
",Eagles Nest Shelter ,"Jun 26, Fri",15.50
Further & Yonder,https://www.trailjournals.com//journal/entry/628820,"We woke to rain today, waited it out and then hiked through a very green world.  We still encountered many rocks on the trail which made our feet tender.  We finished the day by following the Schuylkill River Rail trail (2.4 miles included in today’s mileage).  The surprise at the end was a downpour all the way to the hotel leaving us drenched and ready for a safe haven. ~Yonder","Eagles Nest Shelter 
","Port Clinton, PA","Jun 27, Sat",13.50
Further & Yonder,https://www.trailjournals.com//journal/entry/628835,"Despite getting rained on for the fourth time in as many days today was our best day so far this trip. The trail in PA is getting more interesting and the people we are meeting continue to be interesting as well. We met Papa Smurf and Tic Tac who never got off trail this year and stuck with it throughout all the COVID related closures.They had a ton of stories about their experiences to share with us. Tonight we found a great spot for the tent at the edge of a mountain with a view of a ridge in the distance. The rain has cooled things down to more comfortable temperatures so it should be a nice night for sleeping.
~Further","Port Clinton, PA
",Stealth campsite ,"Jun 28, Sun",12.50
Further & Yonder,https://www.trailjournals.com//journal/entry/628854,"Hardest day of the trip! The rocks on this part suck! And I almost got bit by a rattlesnake! It’s a good thing rattlesnakes have rattles or I would have been a goner. My feet hurt!
~Further Yep, the rocks came in a full range of sizes, small, medium, large, and gigantic and they weren’t just beside the trail, they were the trail!  Fortunately the rattlesnake hiding in one rock pile was willing to give Further a warning.  Pretty scary!~Yonder","Stealth campsite 
",Allentown Shelter ,"Jun 29, Mon",9.80
Further & Yonder,https://www.trailjournals.com//journal/entry/628881,"Much better day today despite more rocks. But these were bigger, more fun rocks that you could hop from one to another over interesting sections like Knives Edge and Bake Oven Knob.  Last night we stayed at a very crowded shelter but tonight we found our own private campsite with a view.~Further","Allentown Shelter 
",Stealth campsite ,"Jun 30, Tue",14.50
