Hiker trail name,Hiker Journal Link,Journal Story,Start location,Destination,date,Today Miles
SoloGrampa,https://www.trailjournals.com//journal/entry/660460,"Starting the trail Sat. Thanks so much to all the generous people who've made pledges ""tunnel to towers"" for my campaign. Let's keep it going! God Bless you all!",,View Entry,"Mar 06, Mon",0
SoloGrampa,https://www.trailjournals.com//journal/entry/660998,,,View Entry,"Mar 18, Sat",0
SoloGrampa,https://www.trailjournals.com//journal/entry/661073,"about to start day 11. It's been real tough up to now.N.H. doesn't have anything on N.C. These mountains are horrendous!! I've had major Big Toe problems since ce day one. Gonna lose my nails for sure. Trying to get a new pair of shoes today. I'm at mile 137 now. I'm behind my schedule, but I can't do much better than I'm doing. Sorry I didn't log in sooner,but I'm not to good at this tech. stuff, and also you need good service. ","
",View Entry,"Mar 21, Tue",0
SoloGrampa,https://www.trailjournals.com//journal/entry/661147,"well, it's night 13. Already had 5 days of rain. Had some severely cold weather. One morning was around zero! I'm usually alone during the day, but generally see people when it's time to quit. Usually at shelters or campsites.  Met alot of nice people on the trail. Even with the cold weather the wild flowers are starting to bloom. I head into the Smokey Mountains tomorrow. Don't know if I'll have any service at all. You can follow me on. Share.garmin.com/DavidManca",,View Entry,"Mar 23, Thu",0
SoloGrampa,https://www.trailjournals.com//journal/entry/661262,"Hi everyone. Last couple days have been good. Miserable weather 2 nights ago, and it rained this morning just before I left camp. Makes the trail real sloppy. Your hike could end in a second if your not careful. Lots of roots,and loose rocks to trip on. Was on Clingmans dome this morning (6,643'). Nice day for hiking, but the views were limited from the Dome",,View Entry,"Mar 26, Sun",0
SoloGrampa,https://www.trailjournals.com//journal/entry/661264,"I'd like to thank everyone from the bottom of my heart that have made pledges! I'm humbled by your generosity. Let's keep this thing going. Keep a copy of my QRcode on your phones, and spread the word. You guys are the true heroes in this campaign, I'm just the driving force!",,View Entry,"Mar 26, Sun",0
SoloGrampa,https://www.trailjournals.com//journal/entry/661411,"feeli g a little guilty today.Im in Hot Springs NC. Taking it easy.I got off trail this morning to pick-up a few things, and stay in a hostel. Feels good to get some of this grime off me. My toe is looking a little better. It still throbs at night. Just did a 20,21,and a 20 (miles) in a row. Been meeting up with a lot of folks I've met on the trail. Me and ""Joker"" are probably gonna part ways tomorrow. He's slack packing today. I caught up to my adopted grand daughters from. New Zealand, but now they're gone again.  Just ran into ""Easy Ryder""and Jewles in town. I'll be leaving 13 lbs. heavier in the morning. Had a nice meal at the diner today. I sat with a couple that invited me to their table. I told them about my mission for tunnel 2towers, and they were intrigued by my goals.Turns out they paid for my meal on the sly, and she's gonna put me on her FB page to try to help out",,View Entry,"Mar 30, Thu",0
SoloGrampa,https://www.trailjournals.com//journal/entry/661436,"well it's 1:15 in the morning, I'm in the most comfortable bed I've been in for 3 weeks, and I can't sleep!🤭 Bad choice of diner food, and my toe is throbbing like hell.( fluid build up under nail) Now I gotta go like hell when I hit the trail tomorrow to try to catch up with the people I'm used to being around. I saw ""Easy Ryder""and ""Jewels"" in town today, but they didn't stay, ""prof. Sprout"" and my adoptive Granddaughters from New Zealand are ahead of me again. Me and ""Joker"" have traveled the same speed since Fontana Dam, but he slack packed about 10 or 12 miles today, so he'll start there tomorrow. We got some rain coming in, and by next week end it's showing 3 days in a row!! Hopefully that changes. I guess ""ol' solo grampas"" gotta get his act together in the next couple of days or make new friends! These kids are about a 1/3 my age, if that, but I'll catch um! Except ""Joker"".He's a year and a half younger than me, and a bit faster. I'll miss them all, so I hope I catch up 🤞",,View Entry,"Mar 31, Fri",0
SoloGrampa,https://www.trailjournals.com//journal/entry/661499,"well it's been a few days. Service has been poor up in the mountains. After  my day off in Hot Springs, I was feeling a little guilty. I never got back on trail till 10:20 the next morning because brkfst. Isn't till 9. It was a rough day. I don't think my body likes to rest. I'm gonna strive to not stop that long again! Back to making good progress again. Yesterday was only about 17.5, cause the trail was really hard. I was up in the cliffs, me and some other hikers even lost the trail in 2 places. I was gonna tent out, so I could get some extra miles in,but about 3 miles past the shelter I saw a sign for a hostel 100 yds. down the road. It was so windy that trees were snapping in the woods! I figured I didn't want to wake up dead, with a tree through my tent, so I went to the hostel! Best 25 bucks I ever spent!",,View Entry,"Apr 02, Sun",0
SoloGrampa,https://www.trailjournals.com//journal/entry/661619,"Just a quick update. Still in Tennessee, but getting close to Virginia. There are no easy days! I  rarely stop during the day, just to fill my water bottle in a brook, or a run off from the side of a mountain. Tomorrow is gonna be a tough day. Some big mountains coming up. It's  supposed to rain also. I'm hiking alone every day pretty much. I need to get to a hostel soon and get cleaned up!  Till next time ""Solo Grampa""",,View Entry,"Apr 05, Wed",0
SoloGrampa,https://www.trailjournals.com//journal/entry/661661,"I'm taking a much-needed break this afternoon. I did 11 miles today, and checked I to a hostel. Having a few beers, getting  myself steamcleaned, and having g a good meal. Brkfst. at 8 tomorrow morning, then hit the trail. Yesterday was a tough day! I know I say that about every day, but this one was worst. The trail took me up to 6,200 ft., then down to 5500 in Carvers gap, then back up to 5800 and some change. Supposed to rain tomorrow.  I hope they're wrong. I'd like to give a shout out to, Karl, Kevin, and Dave who I met on the trail for making a donation to my campaign. Should be in VA. in about 4 days I hope.",,View Entry,"Apr 06, Thu",0
SoloGrampa,https://www.trailjournals.com//journal/entry/661775,"it's been raining for 2 days. Miserable hiking. It turned cold again. I'm putting up in a hostel tonight, to get dried out. Some real nice spots today.  Went along a river, huge water falls. Then we had a 2,000 ft. elevation gain up out of the gorge! It was a killer! I'm about 46 miles south of Damascus now.",,View Entry,"Apr 08, Sat",0
SoloGrampa,https://www.trailjournals.com//journal/entry/661865,"2 nice days in a row!Racked up so.e good miles. Got to the Virginia border about 4:00pm today. Gonna loose some time tomorrow. Not happy about it, but I need to go to Urgent care, and get checked out. Gotta pick up my mail drop also. That means a heavy pack again. 😔I hope I can get outta town by noonish",,View Entry,"Apr 10, Mon",0
SoloGrampa,https://www.trailjournals.com//journal/entry/661946,"just got a couple bars on my phone, so I thought I'd update. Spent yesterday morning in Damascus. Camped on a hill overlooking the town the night before. Had some deer snorting at me as soon as I got to sleep. They didn't like me camping on their turf. Kept me awake for an hour running around snorting. The diner was closed in town, so I ended up eating at a gas station/store/restaurant. Picked up my food drop at the p.o., and was out of town by 10:30 or so. Rude awakening putting that pack on with an Xtra 12lbs. Now I gotta eat the weight off. Saw my 1st.snake yesterday! Not happy about that. Only managed about 14 to 15 miles yesterday with the late start. Couldn't make it to a shelter, so I stealth camped..",,View Entry,"Apr 12, Wed",0
SoloGrampa,https://www.trailjournals.com//journal/entry/661947,"just got a couple bars on my phone, so I thought I'd update. Spent yesterday morning in Damascus. Camped on a hill overlooking the town the night before. Had some deer snorting at me as soon as I got to sleep. They didn't like me camping on their turf. Kept me awake for an hour running around snorting. The diner was closed in town, so I ended up eating at a gas station/store/restaurant. Picked up my food drop at the p.o., and was out of town by 10:30 or so. Rude awakening putting that pack on with an Xtra 12lbs. Now I gotta eat the weight off. Saw my 1st.snake yesterday! Not happy about that. Only managed about 14 to 15 miles yesterday with the late start. Couldn't make it to a shelter, so I stealth camped..",,View Entry,"Apr 12, Wed",0
SoloGrampa,https://www.trailjournals.com//journal/entry/661948,"just got a couple bars on my phone, so I thought I'd update. Spent yesterday morning in Damascus. Camped on a hill overlooking the town the night before. Had some deer snorting at me as soon as I got to sleep. They didn't like me camping on their turf. Kept me awake for an hour running around snorting. The diner was closed in town, so I ended up eating at a gas station/store/restaurant. Picked up my food drop at the p.o., and was out of town by 10:30 or so. Rude awakening putting that pack on with an Xtra 12lbs. Now I gotta eat the weight off. Saw my 1st.snake yesterday! Not happy about that. Only managed about 14 to 15 miles yesterday with the late start. Couldn't make it to a shelter, so I stealth camped..",,View Entry,"Apr 12, Wed",0
SoloGrampa,https://www.trailjournals.com//journal/entry/661949,"just got a couple bars on my phone, so I thought I'd update. Spent yesterday morning in Damascus. Camped on a hill overlooking the town the night before. Had some deer snorting at me as soon as I got to sleep. They didn't like me camping on their turf. Kept me awake for an hour running around snorting. The diner was closed in town, so I ended up eating at a gas station/store/restaurant. Picked up my food drop at the p.o., and was out of town by 10:30 or so. Rude awakening putting that pack on with an Xtra 12lbs. Now I gotta eat the weight off. Saw my 1st.snake yesterday! Not happy about that. Only managed about 14 to 15 miles yesterday with the late start. Couldn't make it to a shelter, so I stealth camped..",,View Entry,"Apr 12, Wed",0
SoloGrampa,https://www.trailjournals.com//journal/entry/661950,"just got a couple bars on my phone, so I thought I'd update. Spent yesterday morning in Damascus. Camped on a hill overlooking the town the night before. Had some deer snorting at me as soon as I got to sleep. They didn't like me camping on their turf. Kept me awake for an hour running around snorting. The diner was closed in town, so I ended up eating at a gas station/store/restaurant. Picked up my food drop at the p.o., and was out of town by 10:30 or so. Rude awakening putting that pack on with an Xtra 12lbs. Now I gotta eat the weight off. Saw my 1st.snake yesterday! Not happy about that. Only managed about 14 to 15 miles yesterday with the late start. Couldn't make it to a shelter, so I stealth camped..",,View Entry,"Apr 12, Wed",0
SoloGrampa,https://www.trailjournals.com//journal/entry/661951,"just got a couple bars on my phone, so I thought I'd update. Spent yesterday morning in Damascus. Camped on a hill overlooking the town the night before. Had some deer snorting at me as soon as I got to sleep. They didn't like me camping on their turf. Kept me awake for an hour running around snorting. The diner was closed in town, so I ended up eating at a gas station/store/restaurant. Picked up my food drop at the p.o., and was out of town by 10:30 or so. Rude awakening putting that pack on with an Xtra 12lbs. Now I gotta eat the weight off. Saw my 1st.snake yesterday! Not happy about that. Only managed about 14 to 15 miles yesterday with the late start. Couldn't make it to a shelter, so I stealth camped..",,View Entry,"Apr 12, Wed",0
SoloGrampa,https://www.trailjournals.com//journal/entry/662071,"it's been a few days. Very poor service in the mountains. I was in and out of Damascas by 10:30. Saw my first snake on the trail. I've put in 4 good days since. The ponies on Mount Roger's and Grayson Highlands were the highlight of my hike so far. I saw about 30. One came right down the trail, and I scratched his head. I'm in Marion VA. right now at a hospital trying to get some tests done. I've lost way too much weight, and I'm trying to find out why. I'm doing good on mileage. I broke 500 two days ago. I was hoping for 550 by the 11th., oh well, I did 500 by the 12th. Hopefully be back on the trail tomorrow. ",,View Entry,"Apr 14, Fri",0
SoloGrampa,https://www.trailjournals.com//journal/entry/662160,"I got service. So a quick update. Went to the ER at Marion VA. Hospital. I hated to get off trail, but I needed to get tests done. Never got back on trail, till 10:30 the next day,  and still got 18.5 miles in! My highlight of the day was stopping by an old one room schoolhouse where some old folks were jamming. There was 7 or8 of them playing that Tennessee mtn. music. They had all string instruments. They sounded great, they fed me, and just before I left, I couldn't resist kicking up my ""heels"" a bit! They loved it. They wanted me to stay, but I'd already lose a half hour, and had to hit the trail. We're supposed to get Thunder storms today. It's about noon now, and I got to get back to hiking",,View Entry,"Apr 16, Sun",0
SoloGrampa,https://www.trailjournals.com//journal/entry/662271,"Had a good day yesterday. I got to a shelter about an hour  before all hell broke loose. Wicked winds,and rain that was sideways! Glad I wasn't in my tent. The wind has been bad all day, and still is now. I'm stealth camping tonight.  I pushed it to the limits today, and got stuck with no place to camp. The last .9 of a mile was a 741ft. elevation change! It just about finished me. But I made it, and I'm turning in for the day. It was a 23 mile day.",,View Entry,"Apr 17, Mon",0
SoloGrampa,https://www.trailjournals.com//journal/entry/662392,"another long day today. Had to get to Pearisburg VA. tonight. Staying in a hostel here. Gonna get resupply in the morning, do a couple things to my pack,and hopefully be back on the trail by noon. Saw a couple really big snakes right on the trail yesterday! They were about 30"" long, and when you agitate them,they strike at you, and they make there tail twicht like a rattle snake. It's been hot during the day, but still cold at night. I here there's a lady from Orange MA. on the trail. I think she's a day or two behind me??.",,View Entry,"Apr 19, Wed",0
SoloGrampa,https://www.trailjournals.com//journal/entry/662659,"After staying at a hostel in Pearisburg, I started on the trail again about 11:00 the next morning. I repaired my sleeping pad, but I got some new leaks! It goes flat in about a half hr. I haven't got a good night's sleep in 5 days! The second morning out of Pearisburg, I encountered 6 feral Billy goats on the trail! They pretty much mauled me. They try to lick every exposed skin area for the salt. They were professionals! 4 infront of me occupying me, and 2 inback picking my pockets. One of them yanked one of my $45.00 gloves out,and took off with it. I ran after him, but couldn't keep up with my pack on,so I dropped my pack, and grabbed my trekking pole and chased him down. If he didn't drop it, we were having Goat loin for supper over a spirit!  The last 4 days have been pretty tuff. I know I say that a lot, but they really are. Lots of steep rugged climbs. The last 2 days boarders on ""class 3"" mountain climbing. Some fabulous views. Everything's in bloom down here in VA. The woods actually have a perfume smell to them. Saw another huge snake yesterday,  about 4'. I'd like to again thank the people on the trail that said they'd donate to my campaign, and did. Like ""ginger goat"", and  ""bat 6"", .I haven't checked my web page lately, but I'm sure there is more. They need to leave a comment, so I know who it is. I've got a third of the trail done as of tonight. That's hard to believe. Time Flys! These mountains I've been climbing this week are amazing. There's boulders on top as big as a bus! Stacked on top of each other. To think that all this was thrashed up out of the ocean millions of years ago is hard to imagine. My photos don't do justice to what I've seen.",,View Entry,"Apr 24, Mon",0
SoloGrampa,https://www.trailjournals.com//journal/entry/662865,"It's been a few days.  Poor service, not stopping long enough to upload messages. Anyway, in my last entry, I meant to tell you about the whip-o-wills. My air mattress was leaking, and would deflate in a half hour,  so I wasn't getting much sleep. One morning I was awake at 3am,so I decided to break camp. I was hiking by 4am. It's quite different hiking with a headlamp. Anyway I saw a Brite almost fluorescent dot up ahead of me, then it was gone! I just brushed it off as my eyes playing tricks on me! Soon after I heard a whip-o-will call out. I haven't heard one since I was a kid! There used to be a few in the swamp behind Link Perviers house. Then I saw one hop up on a log with my headlamp, and it's eyes were bright orange, just glowing! Being a bird that's active at night, that makes sense. Just like a deer, they have eye shine. Anyway it was good to  here them again. This gs have been going good until last night, when a big storm moved in. I was stuck, and had to stealth camp on a ridge. We got about 2-3 inches of rain. Everything got soaked, and all the brooks and streams flash flooded! I had to Ford a stream at 7 this morning that had turned into a raging river! It was well above my knees, and if I would have slipped, it would have been curtains for me! So I'm at a hostel now, regrouping, and drying things out. I spent a night in Daleville VA. about 3 days ago,and got a new air mattress.  Still putting in some big mileage days. Gotta make up for these short days. But you gotta have um every now and then. I pass 800 miles tomorrow. The halfway point is coming fast.",,View Entry,"Apr 28, Fri",0
SoloGrampa,https://www.trailjournals.com//journal/entry/663033,"The weather hasn't been that good the last few days. Had to hole up in a hostel for a day. Passed the 800 mile mark 2 days ago. That was another milestone for me. I'll be a happy guy when I pass 1100! It was freezing cold last night, and I got rained on again about 4 pm. so I was quite wet when I reached a shelter. It was spitting snow in the morning. I hope we have some better weather soon, as it lifts your morale. Craig Twohey is a couple weeks ahead of me trying to finish his hike from last year. He told me that I was going to love VA. I'm not feeling it yet😒! Waynesboro  VA. is just a day out, but I think I'm gonna push through. My brother is driving home from Florida, and we're going to try to get together one night. ",,View Entry,"May 01, Mon",0
SoloGrampa,https://www.trailjournals.com//journal/entry/663592,"I know! It's been awhile. Same excuse, low,battery, no service, no time, etc. Anyway, about a week ago my brother Mike was driving up from Florida. We had to figure out how,and where to meet. Elkton VA. was are only chance. I needed to hike 67 miles in 3 days to make it happen, and still get out of the woods in time to have a good visit. I booked a motel room, and was out on the edge of highway 33 by 2:05 the 3rd day. We had a great visit. Went out for a good meal, then went out for breakfast. I was back on the trail by 11:30 the next day. I had a food drop waiting for me in Luray VA. so that was my next stop. I was gonna take 3 days to get there and give myself a little break, but then I got a good pace going,and decided to power through, and do it in 2. The hiking has been moderate in some stretches, and really tuff in others, but I'm still making good time. I passed the 1,000 mile marker yesterday! That was a milestone. Yesterday I left a nice dry shelter, and went out into the pouring rain! Hiked 19.9 miles.I was completely soaked when I got to the next shelter. Got up this morning, put all my wet clothes, socks, hiking shoes, and hit the trail. The morning was horrible. I was in the section they call the roller-coaster. The rocks are horrible climbing up the mountains. The afternoon wasn't as bad, and my feet finally dried, but I had it in my head that I wanted to make it to""Harpers Ferry"" West Virginia, which was a 23+ mile day. I'm gonna chill out a little bit in the morning. Go to the ATC center and register, and get a pic. This is the unofficial 1/2way pt. (We're actually 75 miles away). I'll hopefully be back on trail by noon. I'm out in front of most of the friends I've made right now. Maybe if I goof off for awhile tomorrow they'll catch up. Hopefully the weather stays nice for a few days. I had two Rainey days in the past 4. It really sucks out here on the trail when it rains. I know I've missed telling you some stuff. I have to report more often. ",,View Entry,"May 10, Wed",0
SoloGrampa,https://www.trailjournals.com//journal/entry/663628,"I went to the Appalachian trail Conservancy this morning to get my pic. in there log book, and give them information. I was back on the trail at 10:10 this morning. In the last 3 days, I've taken fall #13and 14. I gotta start picking my feet up! I smashed my head pretty hard this morning! My balance was off for the rest of the day,  and I had a headache. When I was picking myself back up, I noticed my lifestyle water bottle was missing. I thought it ripped off my shoulder strap when I fell. Come to find out, I left it back at the shelter where I got spring water, which I had to go .25 of a mile down hill to get. The shelter was about a mile back, but I had to go get it. Bummer!! That cost me 2 miles today. I forgot to tell you yesterday I almost got shot while walking the trail. Turns out there's a target range over the hill, and some nimrod must have shot over the birm! When I heard it pass through left to right, I saw a piece of branch with leaves fall, and heard it hit two more branches on my right. I yelled some obscenities as loud as I could, and boogies down the trail! The bullet passed about 6 to 8 yds. In front of me! ",,View Entry,"May 11, Thu",0
SoloGrampa,https://www.trailjournals.com//journal/entry/663736,,,View Entry,"May 14, Sun",0
SoloGrampa,https://www.trailjournals.com//journal/entry/663783,,,View Entry,"May 14, Sun",0
SoloGrampa,https://www.trailjournals.com//journal/entry/663878,,,View Entry,"May 16, Tue",0
SoloGrampa,https://www.trailjournals.com//journal/entry/663879,"RUDE AWAKENING!! After putting in a long 24 mile day,  so I could have a 19 mile day the  next, I came to Pen Mar Park. It's a huge facility on the PA. Maryland line. I asked the old-timer that works there if I could camp, and he said no. I had my supper on the picnic table, and went back to the trail, where I'd spotted a place to put my tent. I figured I was still on park property, but no one could see me. Long after dark, I'd fallen asleep when I heard footsteps coming my way! Then my tent was lit up with flash lights,and an announcement that the Maryland dcr police were there,and I was asked to get out of my tent. I put some clothes on and obliged. When I got past the blinding lights, I was shocked to see 3 officers in swat type gear! They informed me that I wasn't supposed to be camped there,and I was just about to say...... aren't you guys going a bit overboard !....when the said they weren't going to make me move. What a relief.   Then they showed me pictures of a couple of dudes and asked if I'd seen them on the trail.  I hadn't,  and they told me to keep my eyes open, cause they're very bad people!! 2 of the officers had AR'S slung in front of their chests, and the had flak vest on. I'm sure they were pointed at me as I crawled out my tent! It was a little hard to get to sleep after that",,View Entry,"May 16, Tue",0
SoloGrampa,https://www.trailjournals.com//journal/entry/663880,"The next day I awoke early and went back to the pavilion to cook my breakfast. It started raining,  and I waited for the automatic locks on the restrooms to  open at 7. I hiked in the rain all day, and met my friend from Chambersburg PA. at the road,at 2:40. I had planned to stay overnight and go back to the trail by noon, but decided to take a zero on Sunday instead.  I felt a little guilty, but I deserved it. I hadn't felt good for about 4 days. I think the polin is getting to me. My chest was loaded with flem, and felt like it was on fire when I coughed. Anyway, I've been back on the trail for 2 days. I've got some long days to put in, cause I booked a room for Fri night, and have to pickup a food package. There's a 15 mile stretch ahead with absolutely no camping, that I didn't figure on. That kinda threw a monkey wrench into my schedule. Looks like 3 huge mileage days coming up ",,View Entry,"May 16, Tue",0
