Hiker trail name,Hiker Journal Link,Journal Story,Start location,Destination,date,Today Miles
Lead dog,https://www.trailjournals.com//journal/entry/608389,"How many is too many? There is no number.  Ten seems to fit the bill and to fill the cars. Larry’s van turned to shuttle wagon starting with a quick trip to the Dublin Airport to retrieve Harry. He has flown in from Bluefield airfield catching the best bird’s eye view in quite some time. Blue skies!!!!

The Leprechaun Limousine filled to almost max capacity at the Christiansburg park-n-ride. All aboard!!! Chicago passengers please take your seats and put all luggage to the back.  Watch your step retired person. Please take this complementary tiara so everyone knows you are OFFICIALLY RETIRED! All aboard…Side car passengers take your green tokens and proceed as we leave this station.

Arriving at the McAfee parking the L-Train fits in one of the few spots left for prime parking. I’m sure the middle ground will clog soon and turn late arrivals away to the overflow down the road. 

Some introductions must be made as we have some new hikers to the mix. Alexis, another coworker of Anna’s, and we have the Chicago Brew Crew, Nancy and Carl, all are excited to hike this local favorite.

It’s GREEN out. If you failed to wear green here’s your green beads. Have No fear Lead dog’s here, no one’s getting pinched in this group. Next year we’ll have to get Alexis’s homemade shirts….”I’m not Irish but kiss me anyway”!

Crossing the road we hit the trail for the knob. Groups quickly forms and by the time we reach the kiosk and option to cut off on the fire road Larry has his sights set on taking the ‘easy’ route to the top. “Who’s with me?” Carl and Harry peel out of ranks for the old man route. Jared and TJ have already hiked clean out of sight down the AT shouting back they’ll see us at the ‘sign’.  Ok ladies you’re with me.

Taking the actual trail up is the preferred route of this bunch. Nancy came to hike the AT and that she intends to do. She can tell Carl all about it, while I’m sure Larry is giving his own guided tour.  

Bonnie and I have Nancy pinned between us telling her all about the trail and our love for it and how many times we’ve walked this path.  Anna gives Alexis her perspective too.  Already there is talk of where can we hike next. 

It's a cool morning but the sun  has us smiling and happy to be out.  I am surprised at the early birds that are already coming back from their summit trip.  Each eager to tell us what a grand view they had.  We even met a few couples who stayed at the shelter last night. Burr 20 degrees I bet. They are still bundled. 

Stopping at both shelters we show our newbies what is provided protection on the trail. Privy and a place to bunk. The Catawba Mountain shelter has a bear box to help hiker keep their food safe.  Please pack it out folks this is not a garbage disposal. 

TJ and Jared are waiting here for us.  I point to the ridge above and bet the old guys are somewhere up there.  Nancy says glad Carl's there than here, he might not have made it so good over these rocks and uneven ground.  He's a flatlander.

Working up a sweat we all drop a shirt with some down to shorts.  I was determined to wear mine.  Sun's out legs out. 

Reaching the junction with the fire road we all regroup.  Its official trail time to the top.  Let the climbing begin.  Graded trail with switchbacks help with the accent.  The young bucks are probably at the top by now with the young girls close behind.  Come on ladies let's march past these last big rocks and beat the men. 

Bonnie keeps Nancy posted on just how close we are. The stunted underbrush is a good sign you’re at the top.  See there's the sign.  Hootie Hoot.

Wide open, wow, this is wonderful.  Wew, now let's set down. She has worked hard to get here.  This is Catawba valley, and that ridge there is where the AT continues north.  Farther out you can see Tinker Cliffs, the white rock ledges can be seen from way over here and if you look way off to the distance that's Peaks of Otter.  The trail passes close by there.  

Come you guys get on up here we have much to share.  Carl is not liking these heights. This is as far as I go he says finding a place to rest away from the knob’s edge.  

McAfee is ours today.  Come all let’s gather for a group photo.  Happy St.Patty's Day and Hurray to Bonnie!!!Officially retired.  I hope our green be seen for miles. Speaking of miles how far have we hiked Jared?  He has the mileage tracker on his phone.  I had posted this trek was 7 miles but checked my memory last night with Awols trail guide which calculates this at 7.4 miles.  Oh no! Harry says the sign he read at the bottom saying 3.9 to McAfee.  Are we getting more of these shady Martha Miles?  Jared clocked 4 miles by way of actual blazes.  Uh...7? 7.4 that's close.....right? Wrong!!!!  You can't trust those signs, gadgets, just keep following me.

Taking our turn, its time to let the new arrivals have theirs.  So how shall we all return, fire road? Just how far is this road exactly?  We will never know as our tracking device is headed for the parking lot via the AT.  

Our gaggle in green begins back down.  More and more hikers come up. Say are you guys thru hiking? I have the eye for most that are, they have that look.  Wait I have something for you.  Fruit and fun.  Here have some grapes, this orange and Happy St Patty's Day.  These green beads will bring you magic.  Chief is happy to get is set I place around his neck.  His hiking friend from Germany, well was a bit leery of my approach and of my English.  County twang and German thang probably don't mix.  Abracadabra and ya ba dab a do.  Good luck trail friends.

More green magic was spread when I spot a little tike leading her family our way.  Here my dear you need some beads and your sissy too. Enjoy your hike.

Down the trail we are back to our decision point. Anna and Alexis waiting on the old folks at the fire road.  TJ and Jared have hiked on.  Road is the vote, it's all down no matter how you stack it.  

The steady pounding of long strides has the old knee talking to me.  Remnants of many past miles still paining.  Come on old woman, Larry says, I'm gonna beat you off this mountain.  

I have to say I was ready to see that fire gate at the bottom but it was along side the L-train not way behind. Haha.  But please don't make me run across this road. 

One by one our train of green arrives.  So conductor just how many miles was this hike? Lord who knows, the miles grew grew, way up to 9.5. I'd say ask Pinocchio but it's a leprechaun kinda day.","Rt. 311
",McAfee Knob,"Mar 17, Sun",8
Lead dog,https://www.trailjournals.com//journal/entry/609308,"When the trail calls you must answer. Not only to hike but to help maintain. Our very own Slim Jim has asked for assistance with his section over near Gloseclose/Marion.  He has camped out last night after working one side of Glade Mountain. We shall meet him on the other side for instructions.


Cold wind parts the field by the Settlers Museum parking area. Quick get a wool hat on before it blows out of your hands. Wears my gloves, wears my phone, Bonnie has retired and lost her mind. This work crew is ready Jim, what’s the detail?

Safety first! Sign in please. As a volunteer we must heed to the ATC regulations and release them of any harm we might do to ourselves. Don’t run with scissors! Where’s the chainsaw I love to run a chainsaw! NOT…only certified sawyers allowed. Jim got his certificate last week but will save that heavy work for another time.  Handing out pruning nippers and loppers he will take care of the hand saw.  

Walking up the settler’s road we will connect to the AT blazes just past the old home place. Jim has visions of moving a small section of the trail from a powerline area to this location to provide a nicer walk for hikers and visitors. 

Reaching the AT Jim gives instruction to prune anything which impedes the path. Rhododendrons watch out cause here we come. Briars better beware. Limbs lay down the saws a comin to cut. 

Snip snip, the trail becomes littered with branches. Don’t cut those buds Sandra warns. Those will become wonderful flowers come summer. TJ and Jared clear the bigger blow downs.  Anna and Jim lop off wildly branches. Bonnie, Sandra and I sweep the trail clear of clipped debris.  This green tunnel will be the best section around. 

Working our way up the mountain we hardly notice we have been climbing. This is the way to do it Sandra says. You don’t get winded and I’m not even breaking a sweat. Larry should have come on this one Jared says. 

Chatfield Shelter will be our break spot. We’ll remain protected from the wind and have a dry place to set down for lunch. Jim, Ann and TJ painted the inside of this shelter last year and see some of their board work will need some more repairs on the next trip. The privy had some blow downs on top so the fellas cleared them off. One less task for when the shitter will be pumped come July.  Uhhh I don’t thing I wanna be around for that work detail.

We met a few hikers making their way to Maine and they thanked Jim for some Coca-Cola magic from yesterday. Be sure to eat at The Barn once you hit town. Buffet and home cooking!

Time to climb the Mighty Glade…the Mountain makes its own weather. Wind picks up with falling snow pellets. March Madness on the Mountain. Layers go on as we pick up the pace. Nothing really to maintain but our warmth. Open woods with switchbacks before we tuck back in to more rhodies. Snip Snip Snip. Look at that view. We catch the clouds part with rays of sun casting shadows along Big Walker Mountain. Jim has the vantage point in prime shape after he cut all the big growth down to really see out. A very nice etched wooden sign marks the spot. 

Shall we go on up to the summit? Hell yeah we gotta get in the full mileage. Jared what’s the count? 3.3 from this very spot. What? How far to the summit Jim? Half a mile one way. This trip supposed to be 6.6. The Glade, it makes its own miles too apparently. 

One last briar section to nip back and our major work will be complete. See there the top is marked with a location sign handmade by Jim. Big red lettering, Glade Mountain, Elev 4093 ft. You have to have a sign to mark the top!  

Our return was quick and self-rewarded. Just look at how nice this section is. Free and clear of debris. A volunteer trail crew must have just come through here.  Maintenance of the Mighty Glade is complete.","Settlers Muesem, Rt. 615
",Glade Mountain,"Apr 01, Mon",7.60
Lead dog,https://www.trailjournals.com//journal/entry/609927,"Ah spring is in the air. Let’s stretch our legs out a bit more this time and pull off close to a ten mile hike. Its easy walking folks…trust me… wink wink!


Bonnie pulls in right on time 8:10 sharp and we’re off to meet Anna and TJ over at the dismal falls parking area, Kimberling Creek.  I love the drive down Rt. 42 toward Bland. Farm land glistens green between Walker Mountain and another.  White rail fence lines the correctional facility. If I ever had to go to prison this would be the place I’d hope to attend. Haha If you can’t get your mind right in this location your missin out. 


The kids are here waiting on us. We load up with them leaving my car here for us to hike back to. It’s only a 15 minute drive to our trail head.  See that ridge we’ll be along it most of the day. Rolling hills!

Anna has researched my journals to double check that this will be new trail for them. Bonnie is unsure not positive she has or hasn’t hike some or all of this. I think she has at some point but either way this will knock it out just the same. 

Stepping on the trail just a few yards in our first sign says 4 ¼ to Rt. 608. That’s accurate. And if you look to your left I’ve had a birthday party here before. What? Yep. Long ago the Dotson 2 provided me with cake and candle oh and a toast.  It was a cold February day. We hike from the 608 road to the point and back. Snow was falling and we were celebrating. 

Trotting down the trail we chatter on about other sections the kids need to hike to connect their dots. South to Damascus sounds like will be next. But first we must continue north today to Kimberling.

The trail winds in and out and around the edge of the mountain. Bonnie says it reminds her of Rock Castle Gorge but without the gorge. Lol. You guys going back there for a back to back again this year she asks? Oh I don’t know if I need to do all that again for a while I say.  TJ ‘s ready to head back for some fishin!

Before long we’ve come to Jenny Knob Shelter. It’s off the trail some so we don’t go down to check it out. Smoke from a camp fire looms, must be from a spot down close to the road. Lickskillet Holler. Sounds like a dinner should be here. A hostel does reside, their mark is panted on the road with an arrow for the direction. 

Let’s climb this next knoll and have lunch at the top, will be closer to the halfway point of the day and we won’t be climbing on a full stomach. I hate that feeling.

How far is the knoll? Rolling hills right Martha?!!  Bonnie tightens up her hat and gets to scratchin. 

Switchbacked and graded nicely this will be our only ‘real’ climb of the day. About half way up I send the kids on to the top to find us a nice place for lunch. Bonnie and I will be right on….if she don’t kick my ass first.

Cresting the top I remember having a lunch stop here on these very logs.  I hear the kids just up the way. Bonnie is a switchback or two behind me. Ah yes the powerlines, I had forgotten about them. Lunch is served.

Powerline!? Sticks in the air Bonnie shouts. Rolling Hills My Ass! My feet hurt. But I’ll make it, I’ll have to. Sandra would have made it too she says, cause she’d had to too. 

Just a few more miles left. It’s all downhill.  Warm humidity has us sweating but loving it. Beats the wind. Clouds come and go with patches of pure sunshine burning on my neck. Look for the fields Anna that will mean we are close to the finish. 

A long stretch of ridge line has us scattered a bit but we regroup periodically and take off again. Bonnie says there needs to be more white blazes. A good path but what if I got confused by another trail. There were some briars back there too, where’s our nippers?

Anna look for the big oak tree that’s a sign for the fields too. We can take a photo by one of the nice trail signs there. They disappear around the next bend. 

Snake Snake, Turkey Turkey. Animals let us know they are out here fluttering in the bushes and slithering across the trail. The big oak greets us at the field’s edge. Under growth is spring green. Blood root and violets. Oh what a nice camp spot. There’s the trail sign. A nice colorful metal AT plate stamped to a post. Smile its Spring!

Creek sounds come in ear shot the end is near. Chainsaws ring to the north. Maintenance is happening down toward Dismal. Cut it boys!  Crossing the suspension bridge Anna and TJ make sure to walk up and connect their blazes. Their section is complete and so is Bonnie’s.","Rt. 611 Crandon
",Kimberling Creek,"Apr 07, Sun",9.50
