Hiker trail name,Hiker Journal Link,Journal Story,Start location,Destination,date,Today Miles
Lead dog,https://www.trailjournals.com//journal/entry/606213,"Sign, sign, everywhere a sign
Blockin out the scenery, breakin my mind 
Don't this, don't do that, can't  ya read the sign?  

Cascade Falls Closed due to US Government Shut down.  Well damn I didn't even think about that.  Here we all stand pondering what to do. Park on the side of the road and disregard the sign and march our Happy New Year selves right on in. Go home. No way.  My mind races for the next closest option. We have such a good turnout for a hike we can't just go bust.  Bonnie's brought her Jeff,  Ole bum knee trucker boy.  Harry's in town too.  L-train is so happy to have some fellas along.  And one of our long lost little Dotson’s is back.  Sandra, Oh how we have missed you.

Wind rock at Mountain Lake. We could hike some of the AT, see this overlook, and get a few miles in.  Follow me.

Our quick reroute has us driving up Salt Pond Mountain.  The lake has gained some water table marks but is far from ever being what it once was. War Spur trail is just ahead....Larry makes an executive decision to pull in and call upon one of his most reliable ally. The Harry/Larry team confers, Wind Rock will have to wait, this shall be our hike.  

So just how far are we hiking now? Jeff asks with great concern.  Shorter than Martha's plan, Larry notes. Jeff is all in.  Lead on L-train this is YOUR route. 

The loop is a very easy hike. Sign reads 1.7. Don't forget the little side shoot to an overlook, that will add about .4 total out and back.  ""No no Larry says it's at least 3 miles, I hiked it on our honeymoon.  It's long"".  Sandra says I tell you what's long, Iron Mountain.  Now that's long, thought we'd never get up that.  The punches are beginning to hurt now....my name keeps coming up as the culprit to miss representing miles.  Martha miles...Jeff stops in his tracks...so just how long is this really?  

Laughter fills the air as our two packs, one of guys and one of gals, reminisce on down the trail. The overlook junction provides a place for another story telling time.  The AT can be accessed from this spot too. 1.6 miles and we can be following those white blazes to Wind Rock! Who's in? 

Kicked to the curb I follow back in line and we head for the overlook.  It's a small rock outcrop with a side view down the mountain.  In the summer rhododendrons bloom thick here.  Snacks and stories more.  

Our two packs rotate with us gals taking the lead back up to the loop.  Yes a little grade does the body good.  A little trail does the body good. Sandra confers and so it does for the mind. Having just lost her husband recently this first day of the New Year is her way of stepping into another stage of her life and I am so glad she did so with us today.  

Our little loop is coming to its end we can see our parked cars through the woods.  Say we could go for another round.....I have your round right here Bonnie says and it comes in a cooler.  That's right it is New Years.  Cheers, Cheers and Happy Year!","Mountain Lake Area
",War Spur Trail,"Jan 01, Tue",2
Lead dog,https://www.trailjournals.com//journal/entry/606304,"There is something to
be said for taking the trail less traveled. 
Mom always said
“don’t get caught up in the crowd. You don’t have to do what everyone else
does.” I totally agree. We had Sawtooth Ridge all to ourselves yesterday.  
 McAfee’s parking lot
was filling fast when we arrived. Trying to guess how many cars would be
already there was the game driving up 311. 30 was the magic number and we all
under guessed. Sunny days will bring them out and yes they all where hiking to
the knob.

Harry invited two new
hikers to join us. Lawrence and Leia, a young couple from Bluefield with some
hiking experience under their belt. Lawrence has a military background and is
quite the outdoorsman with many hobbies both underground and above. Leia is
ready to get back into hiking and loves the outdoors as well.
Our hike today will
be 6 miles folks. One way with a ride coming at the end. Larry had his courier
work putting him in Roanoke this morning so he will come to our side parking
below Dragon’s Tooth and will walk in a piece to meet us. 
Wonder how long
that piece will be? HA

Shortly entering the
trail a sign is posted stating exactly 5.9 miles to Rt. 624. See it is craved
in wood, Martha Miles are correct, even under stated. How ya like that? 
Bonnie confirms it
is so. I’ve hiked his many times she reports and this is right, you can trust
me.

The ridge proves its
name with many ups and downs but most have been lessened with trail reroute
from the tip tops of the humps. We follow sight of the red roofs of the
Homeplace restaurant, a must go if you have not eaten there. We have other
plans for grubbing which will be at Mountain View Italian Kitchen. Yes Larry
planned this hike.

Toby’s Trail is now
official.  We come to its marker post. 
A side trail from
the AT down to an overflow parking area has been in the works since last year. 
Still a work in
progress this trail will also be connected to the Homeplace for foot travel
verses a hiker having to hitch from McAfee parking lot. This also might be a
good option for us some time too. 
Parking where the
foods at and walking in.  

An awesome sunny day
has me gambling that it will warm and be comfortable in shorts. 
I was sorta wishing
I put my long johns on at first but am managing to stay warm moving. The wind
still blows but not a swift as yesterday's gusts.  
If you look close at
that ridge to our right you'll see the tooth sticking up. Yes that is Dragons
Tooth.  We could hike on to it...8.2 miles one
way.  Bonnie tells of us hiking that trip
some time ago with my dad.  A training trip for us to be ready for
a 17 mile hike in the smokies.  We did on out and back, ran out of
water on the return, and were slap worn out at the end. 
What fun!  
We will be off our
ridge soon.  Once we start down we can take a break
in the open field.  Maybe Larry will have walked in about
that far and we can join up.  Harry calls out Larry Oh Larry where
are thou?   Fat chance he walks this far in. 
I point out the
direction we have yet to go. Only about 2 miles. 
He might make it in
a mile. Maybe he will be at the second bridge.
 We soak up some sun
snacking in the open field. Tall grass provides cushion from the possibility of
seating on wet ground.  I bet the tooth is busy today too. 
Awful glad we are
on this stretch. I text Larry to let him know our progress. Let's go find the
L-train.
 The bottom land
stands marshy.  We can see where the creek has gotten
up by the layer over grass from its heavy overflow. 
Glad this bridge is
still in tacked.  Muddy trail cuts throw this next field
section.  Wide open spaces so we can see our
ridge we just hiked from and the view off to see McAfee Knob. 
Catawba Valley, it
is grand.
 Coming up to that
second bridge I am guessing Larry should be close by but he will never hike
down to us.  My money is on his piece will take him
to the top of our last climb. The fellas stop to view the old mill remains. 
Hey I have contact
from Larry. He reports he is checking his altimeter. 
I got him a new
trail watch and he figuring out how to use it. 
Rattling off crazy
elevation numbers he says he has left us a marker. 
Ha bet that
elevation hasn't moved much big guy.
 One last climb. I
promise.  It really isn't that bad. 
A little more than
half way up the marker is seen.  Sticks lay in the trail in the shape of
the AT emblem. He even placed wickets beside the trail. He is wasting time so
not to hike Down too far.  Ha. I look up and his orange shirt
shows nicely in the woods.  Seating at the top. 
Told ya.
 Come on y'all I have
donuts waiting at the Van.  Can't beat a shuttle driver with
donuts.  
 Switchbacks lead us
over the last down grade to route 624. 
We've only seen 3
people today and one of those was just as we finished. 
Our little group
shared Sawtooth and its solitude. 
Now let's share
some Italian at the kitchen.","Rt. 311, McAfee Parking
","Rt. 624, Dragon's tooth parking","Jan 06, Sun",6
Lead dog,https://www.trailjournals.com//journal/entry/606654,"This U.S. Department
of Agriculture site is currently closed, due to the lapse in federal government
funding.  Guess they didn't get the memo the shut
down is over.  We will not be turned away today, let's
roll renegades!
We planned for such
since we hit this barricade a few weeks ago. 
Arriving early we
have a chance to park in the only pullover area on the narrow road. 
My guess others
will come and take their chances just parking on the shoulder. 
One other car is
already here.
Harry and Betty have
joined us along with their new doggie, Saber, on this birthday hike. Its
Bonnie's birthday and she picked this hike just for you Larry (and in case
trailer trucking Jeff could come too). ""Does this extra mile walk from the
car to the gate count against my trip?"" Larry inquires. This ain't no mile
Larry...its barely .2. 
We stop at the kiosk
and a notice states due to heavy rain and water current portions of the lower
trail are washed out and is closed advising hikers to take the upper trail
going and coming from the falls. 
""Wait Wo I
need full confirmation of this change. Harry says. Does this add miles to our
hike?""  You guys just pipe down and get to
hiking.  
Saber pulls her
master.  She is ready for her first hike at 6
months old.  A rescue dog with a great personality
she has fallen in good hands of these two. 
This will be
Betty's first hike to the falls too. 
Hiking up the fire
road isn't my preferred route as we will be missing a lot of the beauty of
walking along the creek but it does afford some nice views down on the waters
and will be warmer.  The sunshine is a game changer. 
It's a cold winter
morning and I'll take all this I can get.  
We have the trail to
ourselves so Saber is let free of her leash to run free. 
She listens well
and stays close between our two parties.  
Dripping water has
formed giant icicles hanging from the 'cave area'. 
The fellas
investigate while us girls make our way between frozen section of the trail.
Careful the leaves are hiding ice. This should be interesting coming down. 
We have our yak
trax but haven't put on our feet as these spots are few and manageable. I'm
betting the spray from the falls will have that whole rock wall area slick as
snot.
Hearing the roar of
rushing water we are close.  Snow dusts the trail and I can see a
few boot prints.  Look there Betty you can see the falls
from here.  A nice opening in the trees allows us
our first sighting.  It is running over about as thick and
wide as I've ever seen. Come on let's go down as take a closer look.
Light snow, rocks and
some iced leaves make for a tactful descent. 
It's ok guys just
take your time.  I come to the newest addition to the
trail. A very large flat rock step, a makeshift bridge over a run off stream
that forms during lots of rain.  
Water gushes from
all around the other rocks placed to funnel this in one direction. 
Slick slick. Damn
this is treacherous.  I test with my sticks. I could put yaks
on but then I could bust my ass too. 
It's just not worth
it.  
Harry turns comedian
and states we could take our shoes off a wade. You first. Oh back in the day
wouldn't have hesitated but an injury can be too great. Besides give a reason
for Betty to come back.  
So we double back to
the junction sign and discuss where all the conservancy trail leads. 
Remember that rock
ledge I pointed out on they way up? well this trail leads to it, Barney's Wall. 
You can also keep
hiking to the crest of Salt Pond Mountain and connect to Mountain Lake area. Oh
no you don't Lead dog. This is a 4 miles scheduled hike and no more. 
Maybe another day
this is a birthday hike and we must get our birthday girl out before dark.
The return brought in
many hikers. The road was packed. 
The Rangers better
get their gate open soon or there will be too many renegades to count. I do
hope each got their view of the falls and enjoyed their hike as much as we did.
 
Now let's eat. 
Happy birthday
Bonnie!","Road side parking
",The Cascade Falls,"Jan 26, Sat",4
Lead dog,https://www.trailjournals.com//journal/entry/607209,"With a day off for Presidents Day holiday why not spend it in the woods. I’ve been anxious to get back out. Rain, Wind more Rain has had me taking shelter too long. It’s lonewolfin time and no better place to hit the trail than the local stop at Pocahontas Road. New gravel has been dropped all the way down to the small parking pull off, nice. Thank you Mountain Valley Pipeline NOT! But hey they take care of their own. Don’t worry about what run off damage they are causing but by all means keep that dirt road up to heavy truck standards. A small sign posted says 10mph speed limit AND it’s right beside an AT marker post. Guess I better slow this foot travel down or I’ll get a ticket. I have parking to myself. I expected nothing else. Come on out sunshine your rays will be needed if this wind picks up more. Snow still remains after some falling weather these past few days. Always colder this way touching on the WVA line. Having notions of hiking on out the ridge to Symms Gap will depend on how I feel once at the top and if the weather holds. Chances of more rain forecasted. Glad I grabbed my rain jacket heading out the door. Sporting my leopard print fleece hat – Baum Proof Gear original- I’m set to climb. It’s all up from here so no need to even put on my extra layer just step out of the truck and hike. Fingers are cold but they’ll warm soon enough. I set a good steady pace. Feels so good to be back out. I’ve missed these white blazes. Breathing in the fresh morning air sets my mind to wondering. I’m back in Maine, grand views and those rocks...oh how much easier this is than those climbs… then with The Captain crossing the bridge into Harper’s Ferry…then I’m hiking over Roan Mountain hoarfrost gathered on every blade of grass…then the old AT that used to reach my same destination today… that 10 mile round trip hike that I’ve hiked more than a dozen times. I’m sure this newest path will be repeated nearly that many times soon enough. Reaching the forest road I notice a new blaze has been placed on a tree for better direction. More branches laid down at the next turn back into the woods so one doesn’t just keep walking the forest road and miss their turn. What sun I had is now gone as clouds draw in. Angels Rest stand tall to my left view and follows me as I draw closer to the ridge line. Since I travel by myself I can take whatever path my heart desires and I choose to take the old route of the AT up behind the shelter. It’s straight the heck up and was a blue blazed path for the water source. With this snow on it will be a good workout.
Stepping over the brush and undergrowth I take my time and make sure of footing. Leaving the trail and getting hurt wouldn’t be a good thing. At least it’s only a short distance. More ice now, all that rain we had yesterday must have froze at this elevation. Shards of ice lay on top of the crusted snow. It’s a trail of glass if only the sun had been shining it would have glistened like crystal. Woo Wee I’m atop. The wind greets me. Dark ominous clouds line the sky over the fields. Hummm no Symms Gap for me but maybe I’ll just walk on out to the radio tower area for a look around. Will give me another mile round trip and some more views. Walking around the front of the shelter I startle a couple of hikers still buried deep in their sleeping bags. It’s 10:30! One raises up as I say hey fellas. I don’t stop to chat. Too cold for me to hangout for long anyways as I’ve worked up a sweat and will chill quickly in this wind. A quick walk over the fields and views of Angels Rest and WVa are always grand. The walk to the tower was fun with the crunchy snow. I dare not tarry that front will catch me if I do. A quick about face and the race is on for the protection of the south side of the mountain. Those hikers never did rise as I returned by. Hope they are ok.  Voice are heard soon after I head off the ridge. Four fellas are on their way up and have stopped to access their options. They ask if I had views out and I reply just as you see here but a front is coming and you may be caught in it soon. Frozen flakes fall now. They liked my car tag HIKUPIT and notice my many patches on my pack. I do love patches. Happy trails fellas. Clipping on along my knees are feeling it going down. Surgery knee wants to tighten and cause hamstring cramps so I have to stop every so often for a quick stretch. They told me getting old sucks guess this is what they were talking about. But it ain’t stoppin this ol gal. Before long I’m back to the forest road. The front is upon me now. Pellets of frozen snow bounce off me and the trail. I bet those fellas are in the shelter taking cover up there. Wake up sleepy heads.
My hike is nearing its end only 10 minutes and I will reach the road. In fact I can see it once I rounded this last switch back. Another memory has been made.","Poco Rd 
",Rice fields,"Feb 18, Mon",6
Lead dog,https://www.trailjournals.com//journal/entry/607577,"When the sun shines you better take advantage. A window of warmth between two rain days, let’s go. And that we did. I planned a short little hike to stretch my legs and to gather any that might need a trail fix such as me. I picked Sandra up for a shuttle over to Bland and we hope others might join in at the trail head. Harry has confirmed he shall be coming in from Bluefield. 

Blue skies have me in shorts today with back up in my pack. Pushing spring I am. “I see I have overdressed” Sandra thinks but I assure her it is always colder on the other side of the mountain and I may have jumped the gun. And sure enough the skies cover quickly as we pass along the white fence rows of White Gate prison. High 40s become low 40s and 37 degrees when I park. 

A black VW bug pulls in, It’s Harry AND SABER! His little doggie is back for some more hiking fun. We have the area all to ourselves. And nice that the state has poured a fresh layer of gravel in the entry of the parking. That’s two for two on maintenance. 
 
Saber is quick to introduce herself to Sandra while I quickly get some long johns on before we start. When I turn around Sandra is bundled like Ralphie’s little brother on the Xmas Story. Ha and she even has the red gloves. It wasn’t quite that cold. Wasn’t even frost on the ground. 
 
Stepping into the woods I announce today is my 1 year anniversary of my knee surgery. Ha, How about that? And dismal was my second walkabout to test things out. Come on folks let keeping testing.
 
Water fills the trail. Foot prints sunk in the muck from the last hiker that passed this way. Checking the trail log some NOBOs have been by. Ugg I sure wouldn’t want to be lugging along over the last few weeks or months even. Rain Rain Rain. Wind Wind Wind.  
 
Which brings us to one of several blow downs. They are new as no distinct route has been made yet. We each pick our own best route. Saber leads Harry right into the thick. Easy girl.
  Up and around the bend Trent’s store spotted. Harry stopped in on his way in for some trail snacks.  Says the local fellas were in for a visit over their morning coffee.  They liked his vintage bug as well. Harry also has checked out the other area ‘hiker’stops. One in Crandon and another off 52 in Bland. 
 
Heading down toward the falls the small water runs offs are all full so rock hopping is necessary. The rhododendron tunnels make for very wet trail. Harry has to take a high route through the woods to keep his shoes from sucking off his feet. Have a dog on a leash makes this quite the task. 
 
Roaring waters, I wonder how full the falls will be? The cut off brings us all back together. Sandra is several layers down now after warming up. Sunlight begins to filter thru to find us. Lead me on….
 
Louder and Louder, water rushes by, our voices going up to be heard between us all. Saber runs free to get the first drink. Debris lies upon the rock ledges from previous water height. Still up our walking area is less but quite enjoyable. Look fisherman! When did they come in? Casting their lines toward the tumbling current we hope they pull one out for show. 
 
We gather on the rock ledge for a team photo from the top. I had pondered going around to the bottom section but so much debris I defer for another time. A quick snack over trail talk. We are cooling quick standing here so we better head on back. 
  Light skies lend to a lovely hike out. Trail stories and funny times from here and there.  Hard to believe this place has the name of Dismal. It’s quite the opposite as it was a dandy day. Just Dandy.","Rt. 606 Kimberling Creek
",Dismal Falls,"Mar 02, Sat",4.50
Lead dog,https://www.trailjournals.com//journal/entry/607931,"Every step on the trail is a good step, a step in the Right direction, no matter how many times you rewalk it. The Rice Fields seems to have a draw. 
Sandra suggested it last week. Quote: it's not that hard and has a wonderful view. I'm read for the climb. Now she speaks quick without knowledge of its re-route due to the Mountain Valley Pipeline. Trail moved to the other side of the mountain lessens the mileage by half and provides a much easier trek with graded switchbacks. Bonnie was like you don't remember that old trail of 10 miles? We aren't doing 10 are we? Nope. Short and sweet. Just like you two!
We have two newbies joining today, a coworker of Anna's named Christy and her daughter Sarah. They are from Fort Chiswell and excited about hiking the AT. Jared is back too, ready to see a new section. Come on Larry we gonna be late. 
On the drive over we can see white ridge lines. Snow! still hanging on from last weeks flurry of weather. We shall take advantage of this forecasted 50-60 degree day with no rain and lots of sun. I can't wait.
Just 3 weeks ago I was hiking this by myself. Snow at the top and me racing the wind and rain. And now look I have a healthy number looking to see this section for the first time....so I better take it nice and slow so they will come back. Ha. 
Christy and Sarah jump in behind me while the boys gather up the middle and the girls sweep the rear. Sandra's little bell jingles to sound hear location and who knows maybe scare a bear. Head down she is always wanting to follow someone's boots and Bonnie is her lead today.
Chugging along our train winds up this sunny side of the mountain. Giving some trail history I inform them how the old trail used run and how volunteers helped move it to this location. And here is some of the trail I helped with. Sarah asks all the questions I remember asking when I was first introduced to the trail. Where does it start? How long is it? How do you know where to go? You can follow me today but see those white blazes? that's the way!
How far are we from the top? Not far. Come on fellas help me move this downed limb. I've been kicking lots of small limbs from the path. Some other blow downs will need sawing but this one might be able to moved. Step aside Lead dog this is mans work. Jared and Larry put their muscle and ingenuity to the test. Heave Ho, Twist, Timber. Minor maintenance complete. Be sure and tell Jim.
Here's the snow and oh by the way we could walk up this old cut, it comes in right behind the shelter. It's the old water source route. To the trail we stick and wind out to the edge of the woods. This entry to the field is more dramatic anyway. 
Blazed fence posts, wide open space, ridge meets sky, and we step in to it. High clouds rest scattered in the blue background. We stand one foot in West Va and one in Virginia. We are on the state line. It's beautiful every time. 
Winds are stirring but not enough to have us retreat to the shelter. Thank you sunshine, we seat for a bit and have some snacks. Say there's the cat bag. It's back with Sandra holding her array of lunch treats. Sharing what's in our food bags like grade schoolers trading up for that better item, we also devour our views. 
Y'all like it? Bonnie asks. You like hiking? Newbies vote yes. That's good cause we gotta hike out. 
Jared has calculated we have walked 2.6 miles. Perfect I will keep my reputation going for 'adding' more miles. What's a few more steps.
The fellas lead us out while I switch places for sweeper to visit with the short girls. Several others are hiking in too. This new path has now become the regular path. So glad I am sharing it with these friends now.","Pocohantas Road
",Rice Fields,"Mar 10, Sun",5.20
