Hiker trail name,Hiker Journal Link,Journal Story,Start location,Destination,date,Today Miles
Legacy,https://www.trailjournals.com//journal/entry/612061,"The weather is turning decidedly warmer, but before doing so, it threw another cold, gusty, wet day at me. I packed up one morning in the rain and was wet and cold six miles later before I reached Chestnut Knob Shelter at the top of a mountain. A former fire warden cabin, it was unusual as a shelter because it was made of stone and enclosed on all four sides with a door entrance. I burst in and slammed the door against the wind and rain to find a half dozen hikers from the night before. It felt like a movie where people are trying to survive a winter storm at the top of a mountain, and don't know whether to brave the elements or slowly starve to death. I chose to head out again, at one point falling on a wet, slanted rock, and reached the next shelter by 430. So cold and wet that my fingers would not work, I put up my wet tent and immediately got into my dry sleeping bag for the night,  for the first time eating a few bars instead of cooking dinner. Nonetheless, the AT again favored me when the next day proved to be cool but dry.
I know I don't get enough calories on the trail, although I don't feel ravenous. However, given the opportunity, I can eat prodigious amounts of food. A recent exemplar was at an outpost that featured the ""Brushy Mountain burger"", a large enough hamburger by itself, but which then surpassed all expectations by adding a 3/4 inch thick slab of grilled bologna, and served with a knife and fork because it was too big to bite into. I completed the meal with fries, soda and a milkshake. My other notable gastronomic achievement was at a deli. I was hoping for a 12 inch sub, but they only served sandwiches, so I had one...accompanied by a half gallon of chocolate milk, which I finished in one sitting.
I need to be more careful in my planning on Guthooks. On three different days recently, I did not pay enough attention to ""off trail mileage"", adding an extra mile round trip in order to reach water, the deli/campsite, and a hostel. Some are necessary, some can be avoided, and others might not be worth the effort.
One night I set up my tent at a campsite along a ridge line, and realized it was the first time I had camped alone on the AT. I camped alone more often when I was on the Northville Placid Trail for two weeks last August, and here I've been on the AT for over 50 days!
At the deli, I paid for a campsite and shower. When I asked for a towel, the owner gave me one while looking me in the eye and saying ""make sure you return it"", dispelling any thought I may have about packing out a wet towel and giving the thoroughly worn out, seedy towel, complete with holes and rips in it, to my wife for her birthday. (Great! Now what I do I get her?!) On the plus side, the shower was wonderfully hot, but the mirror over the sink was only functional if you were six and a half feet tall. From my vantage point, the mirror only showed the paint peeling off the ceiling, though some may say that's a damn sight better than looking at my face!
In talking on the phone with a sister, I mentioned that with all the time I had to think, I should be a genius by now, but that I hadn't reached that mark. She said I must not be thinking about the right things. Apparently ""I'm tired...my feet are sore...are we there yet?..."" are not stepping stones to higher critical thinking skills. Guess I won't be a genius anytime soon!
Sometimes the southern dialect gives me pause. Growing up, a hocker was what someone spit out of their mouths. Occasionally, in one of these small towns, I will be asked ""are you a hocker?"" I have to remind myself not to cringe and say ""No! I am NOT a hocker!"", and instead put a smile on my face and respond ""Why, yes, I am a HIKER!"" The truth is, southerners have been notoriously polite and kind to the hikers passing through or visiting their town.
It is interesting how random connections can be made with other hikers. Three brothers, all in their 20's, are hiking and invited their retired father to join them (""because I have a higher limit on my credit cards"", he quipped), an altogether wholesome group of guys. They were raised in Franklin, PA, the very same small town that my father grew up in. When asked how they all arranged to hike the AT, they responded ""we all quit our jobs!"" In addition, I recently met First Grader, a retired first grade teacher my age from Grayling, MI, which is just miles from Heart Lake, where my father took the family for two weeks every August for what were the best vacations ever. Other hikers I have met include Ranger (Albany, NY) and Robocop.
Milestones reached include an 18 mile day (15 is more my style), and 1, 2 and 4 hour speed records to get to the outpost for the burger before they closed. I have crossed both the quarter way mark for the AT as well as the 600 mile mark.
Today is a zero day for me. Tomorrow I am renting a car to drive home for my daughter's graduation this weekend when she receives her D.P.T. degree, and I will not return to the trail for a week to allow sufficient time for my family to (1) recognize me, (2) recall my name, and (3) tire of my presence and beg me to return to the trail. I will not be including those days at home as part of my log. Today is day 57; my first day back on the trail will be counted as day 58. Maybe before I leave home to return to the trail, I should remind my family that, like Arnold Schwarzenegger, ""I'll be back!""","
","Pearisburg, VA","May 01, Wed",90.20
Legacy,https://www.trailjournals.com//journal/entry/613629,"Going home for my daughter's graduation was wonderful. The events and ceremony surrounding her receiving her D.P.T degree were outstanding, befitting the effort she has put in. I was at home for five days, spending time with my wife, three daughters and son-in-law, and enjoying the comforts of home that we all take for granted - such as water, showers, laundry, shelter, plentiful and varied food, privies (that flush!) - unless we are on the trail.
Which makes returning to the trail all the more difficult, where we choose hardship over comfort. Upon my return, however, I met an unexpected sight: Pilgrim, who started the same day I did and had been hiking with Conductor until Conductor, a two time thru-hiker, decided in late April that twice was enough. We decided to hike together.
After my first day back, I was sore from the waist down. My second day was an 18 miler on a hot and hilly day. I texted my wife, for the first time putting into words the thoughts in my head, that I was ""thinking about quitting."" She reminded me that there were still options I had not explored: decreasing or varying my mileage, and adding calories. (I'm still not sure if she was trying to help me, or if my returning would interfere with the gala parties she is planning in my absence.)
Sure enough, the next few days were different! It rained like hell the next two mornings, thoroughly drenching us! Still, it was more fun being with Pilgrim, proving that misery likes company. However, our anxiety increased when our feet got roughed up from three days of hiking in wet shoes and socks. Up to that point, my feet had been as ""soft and smooth as a baby's butt"" although the odor was somewhat different (but not necessarily better). Fortunately, I was still without any blisters, so I taped my heels and some toes with Leukotape P - better than moleskin!, better than duct tape! - and I've avoided any problems since.
Hikers talk of the ""Virginia Blues"", but on consecutive days we passed noteworthy sites. First there was the Audie Murphy Monument, honoring the most decorated soldier from WWII, which I found both moving and humbling. Next was Dragon's Tooth, a craggy, rocky monolith that underscored the importance of good dental care. This was immediately followed by a treacherous steep and rocky descent, probably the most dangerous section of the AT we have faced so far. McAfee Knob, the most photograhed spot on the AT, welcomed us on a cool, windy, but clear day.
There are times on the trail where you are faced with conditions made more difficult than they need be. Frustrated by days of rain and some trail conditions, Pilgrim coined a phrase that we started parroting to find humor in otherwise humorless situations: ""A little trail maintenance wouldn't hurt here!""
We have benefited from all kinds of trail magic over the weeks, but my favorite occurred a half mile from Daleville, where I am currently taking a zero. Five mothers, corralling ten toddlers, were doing trail magic there with homemade chocolate chip cookies and boxes of apple juice. (The mothers have been certified as ""good suburban moms"" because the apple juice they served was organic, meeting the very high standards thru-hikers require for their food: it must have calories and be at least as healthy as Little Debbie honey buns!) The kids all had smiles on their faces and trail dirt and mud everywhere else. You rock, Daleville moms!
Unfortunately, Daleville represents the end of my current hike with Pilgrim. He is 11 years younger and 11 years faster than I am, and so is now hiking ahead of me. Happy trails, Pilgrim. Somewhere, there is a hiking partner for me, at least according to something I saw: I wish a fish could hike, then I'd be faster than something. I am now looking for a fish on the AT.
Many hikers have recommended Little Debbie honey buns as a viable method to quickly increase calorie intake, and just recently I have begun to explore that route. I told Pilgrim that this presented a conundrum for me, however. A day after our 34th anniversary, I didn't know if I should tell my wife that I would be waking up with Little Debbie the next morning!
Mount Katahdin, the northern terminus of the AT, is located in Baxter State Park, Maine. One of the first articles of clothing I ever purchased from LL Bean was their down coat, their Baxter State parka. I am not sure if the name was an omen pre-ordaining good news for me: did the Baxter State parka signify that I would truly get to Baxter State Park and summit Katahdin?... Or that it would be a cold day in hell before that would ever happen, and I would need my parka?
In the last couple days I have seen a hiking couple, maybe in their 50's, the man wearing a kilt and the woman wearing leggings. I guess we all know who wears the pants in that family!
Milestones reached include passing the 700 mile mark and completing 1/3 of the AT.
Hikers I've met this week include a group of 6 twenty-somethings (with Spacejam (CT), Whitebread (CT), Grocer (NY), Orange (MN), Pippin (CO)), and Never Better, Cool Pops (GA) and Karma (PA).","
","Daleville, VA","May 16, Thu",93.90
Legacy,https://www.trailjournals.com//journal/entry/614693,"The first few days out of Daleville were quieter than usual. Trail Days, the annual bash celebrating the AT, was taking place that weekend in Damascus, and many hikers left the trail to attend.
Fortunately, I moderated my mileage through this section, to 15 miles or less, because there were long uphills, hot days and fewer reliable water sources. One day I carried an extra 2.5 liters of water into a waterless shelter. That was the same day I had my third fall of the hike, as my left ankle buckled on the uneven surface. I felt my right knee start to twist, and fell rather than injure it.
Brushing my teeth one morning, I saw a deer picking its way through the foliage. A couple mornings later, I was again brushing my teeth when a sparrow landed on a branch 5 feet from me, softly mewing like a kitten as it jumped from branch to branch. This is convincing evidence that wildlife is attracted by minty, fresh breath. I've also seen snakes on the trail. The problem, then, is to have minty, fresh breath to attract deer and birds while having horrid breath at other times to repel snakes and bears.
I stopped overnight at a hostel in Glasgow for the essentials (shower, laundry, maildrop), and again experienced the kindness of trail towns, as the Episcopal church served a dinner to hikers that night. I usually don't find hikers watching TV at hostels, but later, they were searching for some deep intellectual fare, and found it in an Austin Powers movie.
There were a couple days that I found fun because occasional F15's flew just overhead from nearby Langley Air Force Base, emitting ear-splitting sounds as they burst past. It was comforting knowing that, for those two days at least, that the AT was safe from terrorists.
Notable sites I passed included the ""Guillotine"", two walls of rock with a boulder suspended overhead. Flowers have been bursting out everywhere, adding color to the trail. At one shelter, I found Max at work, a stone mason who during his hike has been artistically ""stonescaping"" some of the fire pits.
Arriving early Sunday morning in Waynesboro, I attended a service at the Presbyterian church. It was a beautiful large church with a magnificent organ up front, and it felt good to be there. Today I took a zero, and had lunch with Bruce, Cynthia's cousin. Bruce has completed the AT twice, the second time as a thru-hike in 1991.
Milestones included passing the 800 mile mark.
New hikers met included Granite (NH) and Chai (CAN). I camped with Wicked (MA), One Way (MS) and Fruitbasket one night, and a 50+ set (Red, Colonel, Sky Pilot and Sweetwater) another. I met Iris and Tracy numerous times. Iris (NC) assisted Dori from Rochester, NY, on her SOBO thru-hike.","
","Waynesboro, VA","May 27, Mon",134
Legacy,https://www.trailjournals.com//journal/entry/615529,"Immediately after leaving Waynesboro, I entered Shenandoah National Park (SNP), which includes over 100 miles of the AT. Initially concerned about constraints within SNP, it instead became some of my favorite trail so far: the elevation changes were more moderate, two park campgrounds I stayed at had showers, laundry facilities and resupply, and it had waysides (restaurants) near the trail. Although allowed, there are not many campsites for stealth camping. Nonetheless, the first night I did so, carrying an extra 3 liters of water for 6 miles, because that allowed me to use shelters throughout the rest of the park at 13-15 mile intervals. My stealth camp wasn't stealthy enough, however, because a big black snake crossed the trail and infiltrated my camp. I defended my camp with honor and valor, and the snake eventually moved into the underbrush.
I caught a few evenings of rain after my tent was put up. There was also a shower while hiking one afternoon with Gator, the same day we passed the 900 mile mark. Finding those marks every hundred miles, made of sticks and stones by other hikers, has been fun and a cause for celebration along the trail, and something I look forward to.
Shenandoah is known for their dense bear population (meaning they have a lot of bears, not that the bears are stupid!) Leaving a campground one morning, I hadn't gone far on the trail when I saw my first bear, a cub. Maybe it was older, because I didn't see momma bear...or maybe she was in the bushes and too busy texting her BBF (Best Bear Friend) about how her cub is driving her crazy. I snapped a picture before the cub disappeared.
I caught a nice breakfast at the famed Skyland Restaurant, and the next day caught a hamburger and famed blackberry milkshake at Elkwallow Wayside. Unfortunately, both came with consequences, what I now refer to as town food, something that affects other hikers as well but ravages me. Trail food doesn't give me enough calories but keeps my system regular. Town food gives me a lot more calories - calories I need - but puts my system into overdrive. Each town food meal now seems to be associated with one or more trips to the bathroom, and it is particularly inconvenient if you are leaving town. At times you want to say in exasperation: ""that will be enough out of you!"" Leaving town now generally means that I am leaving with one sore arse. (You learn the most interesting things in trail journals, don't you?)
Small World Department: While hiking one day, a young man approached from the other direction wearing a Rochester Red Wings cap, the minor league baseball team back home. I stopped him and we chatted, finding out that he lives about four miles from my home, and that one of his neighbors, Kyle, is a favorite colleague of mine from my teaching days. Hundreds of miles from home, and we found this connection.
Time on the trail this week was spent reflecting on comments offered from Bruce about the commitment required to thru-hike, as well as words of encouragement from Wendy, my younger sister. My confidence seems to wax and wane rather than grow. I am reminded of words my father once told me: ""It is not enough to just know something. You must know you know it."" In other words, be confident in your knowledge. I am seeking that confidence.
Shenandoah has a unique feature: rather than signs telling you trail info, it has concrete posts with 1 inch metal bands with info stamped on them. It probably sounded like a good idea to the armchair bureaucrat who approved them, but if you forgot to bring your reading glasses to SNP, you're SOL ( s**t out of luck)!
Milestones included passing 900 miles, hiking the length of SNP, and seeing my first bear cub (along with numerous snakes).
New hikers met include Gator (FL), Supergirl (TX), a trio (Matt in a Hat, Onward, and Captain Insano) sponsored by Warrior Expeditions, spouses 5 o'clock and Fireball, Monk and Walden.
My thanks to those who have signed my guestbook. I find your comments encouraging.","
","Front Royal, VA","Jun 05, Wed",107.80
Legacy,https://www.trailjournals.com//journal/entry/616005,"Although only a few days have gone by, many noteworthy events have taken place since my last journal. While hiking a few days with Death March Dan (TN) and Show Me (MO), we went through the Roller Coasters. Given its name, you might have expected me to strap on my seat belt, throw my hands in the air and yell ""Whee!"" But, no, the Roller Coasters are 14 miles of tightly packed, steep climbs and descents. So my pace slowed, and the only sound from my mouth was ""Wheeze!""
Still, we stopped in the middle of the Rollers Coasters to celebrate another event, hitting the 1,000 mile mark. 1,000 miles!, representing three months of hard work on the AT. Woo hoo!
The next day presented another celebration, when after ""only"" 544 miles in Virginia, we exited that state and entered West Virginia, which means I have completed 4 (GA, NC, TN, VA) of the 14 states that comprise the AT. It's like they're falling like dominoes!
Today I am in Harpers Ferry, WV, what is traditionally thought of as the halfway point of the AT. However, because those merry makers at ATC have added miles to the AT over the years, the halfway point is actually two states away, in PA. Thank you, you fun-loving ATC folks!
The last two nights I tented at the Sam Moore and David Lesser shelters, which were correctly named in my opinion, as the first was ""Moore nice"" and the second was the ""Lesser"" of the two in terms of amenity placement.
I would think that the organizations most closely associated with the AT would be more aware of promoting it and catering to their target audience. So I scratch my head in wonder when I visit the ATC (Appalachian Trail Conservancy) headquarters in Harpers Ferry, and they have AT shirts, and AT hats, and AT mugs, and AT stickers...but no AT postcards, only postcards for Harpers Ferry. (Sad face.) Then there is the Bear's Den Hostel, run by PATC (Potomac AT Club), which is close to the AT and has a store with hiker snacks...but is closed from 9am-5pm, you know, during those hours when hikers would most likely stop in for a snack to fuel their hike.
I now have an entertainment option at the end of a long day of hiking. In Front Royal, I called my local library back home, and they helped me download an e-reader app onto my phone and a book. Now on any given night I can be joined by Jack Reacher, the good guy protagonist in Lee Child's books. So during the day I see the beauty of nature along the AT, while at night I read about the vigor with which Jack Reacher knocks heads together. I knew something was missing in my hike - now I have that elusive balance in my life!
Hiking into Harpers Ferry, the halfway point, made me reflect on the sequence of events that led me here: day hikes in the Adirondacks with my daughter Kelsey, hiking the Camino de Santiago with my amigo Rick, solo backpacking trips on the Great Allegheny Passage and C&O canal towpath, and thru-hiking the Northville Placid Trail in the Adirondacks where I met one of my AT mentors, Pokey. They were the building blocks that put me on the AT.","
","Harpers Ferry, VA","Jun 10, Mon",53.10
Legacy,https://www.trailjournals.com//journal/entry/616720,"My neighbor Jim commented that my last journal entry was free of concerns about injury and fatigue. If so, that was purely an oversight and I apologize to my readers. My fans - yes, both of them! - demand tales of woe. Let's not disappoint them!
Death March Dan and I have endured periods of rain over the last four days, and apparently this pattern will continue for the next millenium. It made for slippery mud today, where I slid on my feet on a steep downhill, turning 180 degrees and facing backwards. Who said hiking wasn't an art form?
We are now in Pennsylvania, our seventh state, having left West Virginia and Maryland behind. En route we saw the Jefferson Rock and the original Washington Monument. We crossed the Mason Dixon line between Maryland and Pennsylvania.
We passed the true halfway point near Pine Grove Furnace State Park, where many hikers undertake the half gallon challenge, eating a half gallon of ice cream. Instead, I had a cheeseburger, soda and what I call the half quart challenge by eating a pint of ice cream. I wouldn't want anyone to think I was gluttonous, mind you!
""For no particular reason"", as Forrest Gump would say, a rear molar chipped one day. A bridge that attaches to it still does so, but I now need to find a dentist on those rare days when we may be in a trail town.
At those times when we need to find a motel to shower, wash clothes or dry out, selection can be limited. Our last motel provided an example. You know you're in an old motel when: (1) the major selling point on their sign advertises ""TV"" or (2) the bathroom has the original pink tile, pink tub, pink sink and pink toilet with matching seat!
Blue mentioned that he operates according to the Pirate Rule, which I found funny: you fall behind, you're left behind! Life can be tough on the AT.
Death March Dan told me of this quote from the movie ""Lawrence of Arabia"" which I find to be much more representative about life on the AT.: ""The trick, William Potter, is not minding that it hurts"". To be sure, there can be many discomforts, and you have to find a way to get beyond them.
Thanks to my high school friend John, who sent a funny and encouraging letter, and others who have been so supportive.
New hikers met include a retired trio, Nobro 1 and 2 (AL) and Moonwalk, and Stormchaser (WI).","
","Carlisle, PA","Jun 18, Tue",106.70
