Hiker trail name,Hiker Journal Link,Journal Story,Start location,Destination,date,Today Miles
Legacy,https://www.trailjournals.com//journal/entry/608129,"I'm not a deep thinker. Some might say I'm not much of a thinker. But I am aware of the enormity of the task of hiking the Appalachian Trail, and I knew that I needed some deeper understanding of its transformative power to keep in mind while hiking it to keep myself centered.My trail name, therefore, will be Legacy. A legacy is a gift, action or guidance handed down, inherited or received from a predecessor. The trail name is in memory of my father, and is also in honor of my wife and three daughters. My father, hardworking and intelligent, emphasized the importance of living a life full of quality, of ""marching to a different drummer"", as exemplified by running 43 marathons beginning at age 59. For my wife, Cynthia, and children, Kelsey, Bonnie and Audrey, I hope to have modeled for them a life well-lived, a life full of work and of worth. My life actions and love for them is my legacy to them.The starting date for my thru-hike, March 6, has special significance in this regard as well, in three ways. It is the date of my daughter Bonnie's birthday. It is also the date of the second anniversary of my father's death at age 97. And it is Ash Wednesday. I will be keeping these thoughts in my head and in my heart to help keep me on the trail.",,View Entry,"Mar 15, Fri",0
Legacy,https://www.trailjournals.com//journal/entry/608132,"There are certain people I need to thank for their guidance and support for helping get me on the AT.

My A-Team includes my wife, Cynthia, who will be at Command Central and holding down the fort while I am away,  handling communications, questions and especially maildrops. She has been incredibly supportive of my efforts. They say the AT changes a person. (She can only hope so!) My daughters, knowing the eccentricities of their father, and who also are a source of inspiration for him, support him as well. My neighbors, Jim and Marcia, have helped - Jim with his interest in my well-being and with his technological skills for downloading Guthook and pdfs, and Marcia with her encouragement (""you're crazy!"")

I would be like a babe lost in the woods (literally) if it were not for what I call my A.T. Team, AT hikers, three from Rochester, NY, who have generously shared their time and knowledge with me. Brightside (NOBO, 2017) inspired me with her blog, answered my questions, and provided the blueprint for much of my gear by posting her own gear list. I attended two of Dori's presentations to learn about her SOBO thru-hike. Opa wrote a daily blog of his 2018 hike to give me a better sense of the day-to-day existence on the AT, and had lunch with me to answer my questions. I met Pokey, from CT, on my Northville Placid Trail thru-hike in the Adirondacks last August, a chance encounter that has been incredibly important to me. Pokey has been very patient with me, providing detailed answers and pictures to my many questions over months. The Genesee chapter of the Adirondack Mountain Club (ADK) has had monthly speakers who have expanded my knowledge of hiking in general and the AT in particular.

One does not hike the AT alone. I would not be hiking at all without my A-Team and my A.T. Team.",,View Entry,"Mar 15, Fri",0
Legacy,https://www.trailjournals.com//journal/entry/608135,"After a 25 hour Amtrak train ride from Rochester, NY to Gainesville, GA, and a shuttle ride, I arrived ""fresh"" at Amicolola State Park on March 6 for the 8.8 mile approach trail just to get to Springer Mountain. I registered as a thru-hiker, AT 601. Some school kids were on the trail, one with a shirt that said ""All Legacy"", which I took as a good omen. At the summit, I paused for pictures at the famous ""AT plaque"", where I met Popps, and we headed to Springer Mountain Shelter for the night, at AT mile marker 0.2. The temperature dipped to 22 degrees that night, the coldest I have experienced on the trail so far, but except for some cold feet, I was warm that night.
The following morning, Popps and I set out, with Jerry later joining us, as we made our way to Hawk Mtn campsite, where we made our dinners on top of a bear box.
The next night, Sped, a thru-hiker I met on the train ride down, tented next to me, which was reassuring as we had an all-night drenching and let me know of the type of weather adversity to be faced on the trail. Sped is a good hiker with a positive attitude, which kept me centered early on.
A couple nights later Westy and Tabasco joined us at a campste. Westy in particular is a character, at 71 doing his second AT after thru-hiking three years earlier. (Westy: ""Tabasco thinks he's hot stuff!"") We went to do a group bear hang, Westy choosing a tree. Tabasco threw the line over a branch, then gave a tug to test the limb. The branch came crashing down, narrowly missing Tabasco. ""Well"", said Westy nonchalantly, ""let's try this tree over here.""
Sped and Highlander hike faster and further than me, so I let them go, but Westy, Tabasco and I ended up at Top of Georgia, a great hostel at Dick's Creek Gap. When I asked Westy how large his ultralight pack was, he said 80 liters, and we laughed, thinking that 80 liters of anything is no longer ultralight. Still, his base weight of 18 pounds is two pounds lighter than mine.
Westy is a memorable guy, and one of the most gracious things he did was let me copy his itinerary. This has been a real blessing to me, because it put each day's trek in ""Doug-miles"" rather than in ""superhiker miles"" that would do me more harm than good, as well as suggesting hostel stops and maildrops.
Self-assessment: my feet are definitely tired by the end of the day. Still, I have gone through some drenching rain and cold nights. The trail is beautiful, surrounded by trees, streams, mountains and sweeping vistas. The trail is work, but easier than the High Peaks in the Adirondacks: less rigor than the peaks, fewer muddy trails, and switchbacks that make the climbs more gradual. With weather that overall has been favorable, I am doing better than expected. ","Amicolola State Park
",Dick's Creek Gap,"Mar 15, Fri",69.20
Legacy,https://www.trailjournals.com//journal/entry/608794,"Enquiring minds want to know: ""Legacy, what is the stinkiest article of clothing after a week on the trail?"" Now, I don't want to air my dirty laundry, mind you. We have had variable weather (cold, rain, sun), but we have not had those summertime temperatures that create the potent stench that hiker trash is known for. Nonetheless, one piece of clothing elicits more ""pews"" than you see in church on Easter Sunday. My underwear, which at home smells like a bed of roses - even after being worn - stinks, both the day hiking pair and the gently used nighttime pair. If my underwear had legs, it would run away. What is it about hiking that would create such a stench? It's not like I ran out of toilet paper halfway through at the privy! Apparently, my exhaust is worse than a '53 Chevy that needs a tune-up. On the positive side, it has proven to be an effective bear repellent, since I haven't encountered any bears so far. Sped, a biologist, is a proponent of Lysol spray (""kills norovirus, which hand sanitizer will not""). What am I to do? Spray Lysol on my butt (or butt-ocks, as Forrest Gump would say)? Stick some Glade air freshener in my underwear?
That reminds me that the Petrasky's, the polite side of the family, would refer to having gas as ""breaking wind"". Hell, growing up, us Brown's did not break wind, we farted, oftentimes loudly, and with five other brothers and sisters, sometimes in competition. My mother wasn't known as The Bomber for nothing!
Hiker stench has stymied climate scientists for generations, trying to find a solution to its bad odor. I don't have a solution, just a word of warning: don't stand downwind of me!","
",Dick's Creek Gap,"Mar 25, Mon",0
Legacy,https://www.trailjournals.com//journal/entry/608808,"On the first day after a zero at Top of Georgia hostel, I crossed the GA/NC state line, the first noteworthy sign of progress on the AT. That same day I passed the most photographed tree along the AT, at Bly Gap.  Two days later, I passed the 100 mile mark at Albert Mtn, which had sweeping vistas, and concluded the day by hiking with Conductor (two-time thru-hiker, MI) and Pilgrim (fellow Camino hiker, FL).
I met up with Westy again at a hostel in Franklin,  NC. With pain in both hips, Westy has reluctantly decided to leave the trail. He has been both an excellent mentor and friend to me on the trail, so I was especially sorry to hear his news. In his honor, I relate one final Westy story. On his initial thru-hike, Westy fell and broke his tailbone. In pain, he called his doctor for advice. The counsel from his caring physician: ""suck it up "". Westy did, and successfully completed his thru-hike. 
Franklin, NC, tries to be an exemplary trail town, as represented by the First Baptist Church providing hikers with a pancake breakfast. The associate pastor noted a Bible passage about Jesus assisting hikers in particular - those that are ""heavy laden"", which certainly describes us. 
Franklin, NC, also was a chance for me to reflect, because my father was born and raised in Franklin, but in Franklin, PA, not NC. This trip, like all my hikes, is a pilgrimage, and I try to keep things in perspective. 
They say it takes 5 million steps to hike the AT. (For me, with my smaller stride, especially going downhill, it may be closer to 7.5 million). Because I am slower than most, during the day I often hike alone, joining others when I get to that day's shelter. During the day, I will watch my path, look at the mountainous surroundings and think freely. Although I do not pray much at home, on the trail I find myself numerous times each day repeating the Lord's prayer or singing the first verses to a half dozen hymns I memorized before leaving for the trail. 
Many hikers, like me, wear Dirty Girl gaiters, which add a ""pop"" of color above your shoes. One guy said that we all carry the same gear, but we all have different gaiters. It reminded me of a quote from a movie: ""the only thing that separates us from the primates is our ability to accessorize!""
Trail magic has included burgers twice, beer and veggies, all welcome! I am trying some Superfeet insoles to address soreness in my right foot with limited success. I am spending three nights at the excellent Cabin in the Woods, with one slackpack day and one zero. 
Interesting but faster hikers that have passed me include Too Late, Denali (MI), Hiex (NM), the band Mailboxes (aka the Purples), Scoutmaster (PA) and Beth and Doug, baker and brewer from Vermont whose common bond must be yeast. 
Self-assessment: I am going at the right pace for me, graduating from 8 mi/day to a current 11-12mi/day. I am pleased with how I am handling the adversity that is inherent in a hike of this nature, including ice on my tent one morning. Besides the hours of hiking and tired feet, there is the daily setup (tent, sleeping pad, filter water, cook dinner, hang bear bag, etc) and packing up (tent and sleeping bag, eat, water, privy, etc). There are mental letdowns with chores to be done, and periods of loneliness because the set of hikers at each shelter is so fluid at this point. Calls home to my wife have been uplifting and supportive. 
Still, there are the stunning views each day: the layers of mountains in the distance, each layer dimmer and more indistinct, stretching out into the horizon as if it goes on indefinitely, a world that pictures cannot capture. That must be one reason to hike the AT. ","
",Fontana Dam,"Mar 25, Mon",97.10
Legacy,https://www.trailjournals.com//journal/entry/609445,"The AT has a lot of ups and downs. (""Pretty funny there, Legacy."") There are the usual ones involving life, there are the ones due to carrying everything you need on your back, and there are the mountains on the AT, and you get to navigate them all. After I left Fontana Dam, I entered the Great Smokey Mountains National Park, and my mileage varied as I moved through some difficult terrain.
One day was particularly difficult. In 2011, I had surgery due to prostate cancer. Usually that presents no problems...except...when...I backpack. The pack's hipbelt presses where I normally don't have pressure, and when I tire, it causes leakage, and can hit suddenly and frequently. Not every day, but some days. It's not like I'm a dog marking every tree, but when it hits suddenly and I have the choice between marking a tree or my pants, I will choose the tree every time.
Anyway, it struck during one day that had many climbs as I tired. To ""stem the tide"", so to speak, I reduced my water intake on a warm day, which caused a headache, a painful one. By the end of the day, I was exhausted, dehydrated, had a painful headache, was too tired to socialize during dinner, and did not sleep much that night due to the headache. In the morning, I felt low, and went behind the shelter to cry several minutes (not my normal way of dealing with stress), big tears of self-pity. Well, later, when the Excedrin eased my headache and I was on the trail, things improved. That was probably the lowest point on the AT for me so far.
The hardships are balanced by glories. My mileage varies but has grown lately, and I am handling it better, even in the arduous terrain of the Smokies. The trails and mountains are beautiful in the mornings (hmmm...I don't appreciate them as much in the late afternoons), and there are numerous, fun stream crossings with gurgling water. My favorite day so far was hiking out of the Smokies in falling snow that seemed magical. On cold mornings, there can be shards of frost poking out of the ground which look like blades of grass chiseled from ice.
There are a steady stream of characters I have met on the trail: Zach and TBone, Snow Cream, Barefoot, Strikeout, Free, Firefly, Further and General Lee, and as my mileage increases, I see them more often. Occasionally, there is something that puzzles me that provides fodder for thought as I hike. One example was a weekend hiker in his 50-60's that said the year before he met a young woman on the AT and hiked for 5 months ""at their own pace"" (no word was said about what his wife thought about that), but then later complained about ""you f*ing thru-hikers"", a group he apparently was a member of just the previous year. Knowing that I live my life differently, and spend my money differently, than other people - which has allowed me the opportunity to hike the AT - I have always tried to be tolerant of other people, but the AT is making me see that I can do better.
After 3 1/2 weeks on the AT, I fell for the first time. This by itself is noteworthy, because as my daughter Kelsey can attest, I probably average one fall per High Peak in the Adirondacks when we hike. So what caused it? Was it the terrain on the trail, what sometimes is called ""rocks and roots"", or maybe the slippery...""whoops""...mud the last few days where a foot skis underneath you? No, it was at a rare section where the AT was next to a road. Some debris, a circular piece of wire, ensnared both my feet and I immediately tumbled. The danger lies not in the forests but in modern society's debris!
Some good news lies just ahead! They say that you get your trail legs at 300 miles on the AT. 300, mind you, not 301 or more. Well, I am in Hot Springs taking a zero today, and I am starting to feel like Joe Namath (""I can't wait until tomorrow, 'cause I get better lookin' every day."") I am at mile mark 275, and that means that in the next couple of days, a miracle is going to occur, and suddenly, very suddenly, I am going to get what you can't buy at REI: TRAIL LEGS! I sure hope they don't run out of them when they're handing them out and I'm next in line, because I need them a lot more than these young bucks!
Hot Springs also represents a milestone of a different sort. They say that 50% of thru-hikers never make it the 275 miles to Hot Springs, so that makes me feel good: I like being in the top half of the class. Of course, to be a true thru-hiker, you have to be in the top 20%, the percentage who actually make it to Katahdin. That tells me that 60% of the thru-hikers that make it to Hot Springs fail to finish - and there are a lot more than 275 miles to go. Still, we are to savor every day, because of the 5 million steps to complete the AT, any single misstep could knock you off the trail.
The AT is difficult, but continues to evolve, and each day is different. I continue to be blessed with good weather - I consider the weather to be good as long as it's not raining. My wife, at Command Central, continues to be a positive contributing factor as I make my way north on the AT. My thanks to all who have shared their thoughts in the guest book.","
",View Entry,"Apr 03, Wed",108.60
Legacy,https://www.trailjournals.com//journal/entry/609982,"I'm taking a zero today in Erwin, a bit sooner than my others. To date, I think I've taken one nero and four zeros.
Lately, trail magic has taken on more exotic fare. One evening, at a shelter no less, trail angel Bloodhound showed up with beer and ice cream on dry ice. My favorite, however, was one Sunday morning when I needed more energy and Quiet Paul was serving up freshly cooked scrambled eggs with fried potatoes that were outstanding.
My trail legs did no show up on schedule as hoped. I am generally a morning person, so I was concerned when I had low energy one morning...since I had already noticed low energy during afternoons that made for lethargic progress, and I had dark thoughts about my continued existence on the AT. A couple days of more moderate terrain gave me hope, as well as talking to Up And Over, someone closer to my age who seemed to be dealing - maybe more positively - with the same issues. With our slower pace, it takes us longer to reach the shelter, giving us less recovery time to prepare for the next day. I've noticed a reduction in the number of hikers from the ""retirement set"" the further north we progress.
My thought is that three things may increase my energy/enjoyment/hiking mileage in due course: (1) my legs and body will become better adjusted to the workload, (2) I am trying to increase my caloric intake (easier to do in trail towns than on the trail), and (3) the terrain is supposed to moderate in Virginia. I need all three at this point. (Slowing down is a possibility, but then has the consequence of me carrying more food, hence weight, as it takes more days to get to your next resupply location.)
Evenings, though short, have been better as the last week I have progressed to the same shelters as General Lee and his troops, and other hikers I have gotten to know. (I have wondered if General Lee will change his name to General Grant north of Virginia.)
The topics most discussed among thru-hikers are: food (what you ate, what you are eating and what you plan to eat in town), calories (as everyone is losing weight), and protein (peanut butter at the top of the list). Jazzhands found a packaged honey bun that packs 710 calories and that she believes saved her. As she told one hiker, ""Dude, if you're still buying Little Debbie's honey buns, you're doing it all wrong!"" General Lee is a strong hiker and relies on multiple meals frequently throughout the day and probably does it the best of anyone I've seen.
I have anxious concerns about outbreaks of norovirus on the AT near me, and am trying to take more vigilant action to avoid contact with it or individuals, short of wearing one of those sumo wrestler blow-up costumes on the trail.
The fluidity of hikers is becoming more natural as I meet more and more hikers, people such as Happy Dance, Raven, Swiss Miss (WI), Upstate (NY), Up And Over (CT) and Highland (CAN). I am continuing to move north.","
","Erwin, TN","Apr 09, Tue",69.30
Legacy,https://www.trailjournals.com//journal/entry/610881,"With the significant effort it takes to hike the AT, it is natural for there to be times when a nadir fills your hiking head. Leaving Erwin, I had three heavy days of 17, 17 and 16 miles, much of it uphill, and it wore on me physically and mentally. And that's when the trail magic occurred, not in the form of food, but in the form of fellow hikers and friends back home. Swiss Miss accompanied me for much of those three days, providing the boost I needed. Later, I hiked with Up & Over while he dealt with a swollen shin, sharing conversation at shelters in the evenings. Back home, Wendy and Larry, both of whom are friends, fellow parishioners and health care professionals that I have visited in the past, graciously replied to my emails about issues I was having on the trail. This support was crucial to improving my mindset, and I have done better since then.
Certain images are etched in my mind. Though I was dark in spirit, I enjoyed the climb down from Roan Mtn in driving winds and rain. I liked the memorial of seeing a tree in the woods dressed up in Christmas ornaments. Jones Falls and Laurel Forks Falls were both spectacular in their natural beauty. And I loved the wonderful sense of comunity when attending a Maundy Thursday service at a small church last night.
The weather, though drastically variable, is warming more consistently, and with it are sights of buds on the trees and bugs on the ground, and bright orange newts, insects and a black snake. At a hostel / tavern, we enjoyed a country western couple playing a banjo and fiddle. And you know you are in the South when you see a sign that says ""I love you like biscuits and gravy.""
Milestones reached include leaving North Carolina and Tennessee behind and entering Virginia. Since 25% of the AT is in VA, I'll be here awhile. I have hiked 470 miles to date. I set a new PR by hiking more days on this trip than I did when I hiked the Camino de Santiago three years ago with my amigo Rick.
New hikers I have met include McFly, Zig (PA), British chap Cocoa, Blacksmith with his dog Hank (ME), Eagle Eyes and Milky Way with their dog Baxter (FL), and Xavier (NH).","
","Damascus, VA","Apr 19, Fri",126.60
Legacy,https://www.trailjournals.com//journal/entry/611327,"""Don't send any winter gear home until you get to Virginia"", they told us at Amicalola State Park for the start of the AT. Maybe they need to amend it to ""until after Damascus, VA."" On Friday, I sent home my fleece and some merino wool gear. Then Saturday, I left Damascus, and had an all-afternoon drenching that soaked my rain gear and left me cold and wet. (I was warm and dry in my sleeping bag that night.) Then on Easter Sunday, I was greeted with...what? snow in the mountains?...that rained on me as temperatures warmed slightly. Concerns about hypothermia danced like sugarplums in my head...oops, wrong holiday image! That was on a 17 mile day with lots of rocky, uphill work where we were supposed to see the wild ponies from Grayson Highlands. Huh. I saw none. Apparently the neon sign announcing ""WILD PONIES! THIS WAY, LEGACY!"" was in the shop for repairs. However, on Monday I saw five ponies which were conveniently grazing near the AT. Thank you, you nice conveniently located wild ponies!
On Tuesday morning, I hiked for a while with Kevin, a strong young hiker from Syracuse - together, we were a couple of good ol' boys proudly representing Upstate New York on the AT, we were - when we met Mr. Appalachia! I knew it was him because he asked us ""who gave you permission to hike my trail?"" We answered real respectfully (1) because he was an older man and (2) he was packing a pistol on his hip. He was a nice guy, Mr. Appalachia, and we went happily on our way (1) because he told us of his trail magic by the road and (2) because he did not shoot us - I told you he was a nice guy.
I stayed Tuesday night at the Partnership Shelter, which is distinguished because (1) it has a shower and (2) you can order pizza to be delivered to the shelter. Wouldn't you know it? - the shower was turned off! Other bad news seemed imminent after some young hikers, fully informed of my desire to order pizza, showed un-AT-like behavior by ordering without me, but then another hiker from the retired set showed up and we ordered and ate together.
Today was a short but beautiful day so I could shower, do laundry, resupply and eat real food before heading out again tomorrow. Toward the end of the hike today, a train passed on nearby tracks, and it reminded me of my hike and bike trips on the Great Allegheny Passage with trains frequently going by - I love the sound of trains, especially at night.
My mileage has moderated with the terrain after a short talk with Lady Di one morning about having fun.
Milestones include going over 500 miles so far, making this my longest multi-day hike by exceeding the miles I hiked on the Camino de Santiago three years ago.","
","Atkins, VA","Apr 24, Wed",74.80
