Hiker trail name,Hiker Journal Link,Journal Story,Start location,Destination,date,Today Miles
Legacy,https://www.trailjournals.com//journal/entry/617557,"If it's been awhile since I've written, it's because my life has been rocky lately. It all began with this phone call: ""Hello, this is Pennsylvania. For your hiking adventure, we have this deluxe package for you: rocks, rocks and rain, and rocks, rain and mud puddles. Enjoy your stay!"" Boy, they weren't kidding. My wife may disagree, but I've seen evidence that PA has more rocks on the trail than I have in my head! One hiker said that the terrain changes from ""more dirt than rock"" to ""more rock than dirt"".
This has presented some difficulties in various ways: (1) the rocks make footing treacherous, and we slow our pace as we carefully and painfully traverse them, (2) the rain kept the trail and our shoes wet, resulting in some blisters, and (3) the shelter spacing did not adjust for the terrain, resulting in some 12 hour days, about 3-4 more hours than I would prefer. So, I'm a bit tired currently.
We have had good moments. We have tasted Pennsylvania fare, birch beer for me (similar to root beer) and scrapple for Dan. Three trail magic opportunities were appreciated. When taking a nero in Pine Grove, I attended a welcoming Lutheran church service and Pastor Barry offered to shuttle us to the trailhead the following morning.
Yesterday we hiked over the Knife Edge, an aptly named section which rivaled VA's Dragon Tooth in terms of danger.
Death March Dan and I have been hiking together for three weeks now. He has ""Father of the Year"" written all over him. As an example, when his now-grown children were young, he would take them on family hikes which turned out to be too long and difficult, where they would scream ""this isn't a hike, this is a death march!"" Hence, the name.
Our compatibility as a team is enhanced because both our pace and IQ are similar. My cynical readers would guess that it took 1,000 miles to find someone with a negative IQ (like mine). But, au contraire!, Dan has a PhD, and is a former university professor and retired electrical engineer. So, to those cynics, I say ""Nyaah!"" (in a mature fashion, of course). Dan is a serious but positive guy. I try to be lighthearted but get worn out. I told him at the end of the day, Elton John's ""I'm Still Standing"" plays in my head, and sang one line from it. He claimed not to recognize it, even though I sounded exactly like Elton John. Maybe if I added sequins and rhinestones to my hiking attire it would help jog his memory.
Dan says he hopes to learn patience while on the trail. He certainly needs it - he waited a leisurely 10 days after retiring before beginning the AT. I am helping him learn patience. One day at a muddy location, I hopped on a log to chat with another hiker. Dan, who was behind me, shouted ""Get off the log! I'm standing in mud!"" Ah, me! As you can see, a lot of work remains to teach him patience! Fortunately for him, I unwittingly create such situations every day, so we will have daily assessments to guage his progress!
Milestones reached include passing 1,200 miles. New hikers met include Scout, Sharkchow, and Rope (who lived in Rochester for 3 years).","
","Palmerton, PA","Jun 28, Fri",128.40
