Hiker trail name,Hiker Journal Link,Journal Story,Start location,Destination,date,Today Miles
Papa Smurf 2019,https://www.trailjournals.com//journal/entry/606405,"I know exactly when and where I was when I made the decision to attempt a thru hike.  It was July 2015 at the outfitter in Damascus VA with my father and my sister in-laws husband Johnny (trail name ""Chief"").  We had been riding the mountain road in NC and VA for most of the day and decided to stop in and visit the outfitter.  Chief has hiked the entire length of the AT, the MST and hiked several other trails.  I reminded my father that Chief had hiked the AT.  He had forgotten, as he was caught up examining all the items in the outfitter.   At that point, my father struck up a conversation with Chief about hiking.  He was making statements to him such as ""If I were younger, I sure would love to hike with you"",  ""If my legs could take it, I would hike"", ""I'm way too old to even think about hiking now"", and other statement like that.  At that point I made my decision to attempt an AT thru hike.  I told myself that I did not want to be at my fathers age making similar statements that I wished that had done something such as a thru hike attempt.  I had gotten caught up following Chief and others on their thru hike attempts back in 2001.  I thought to myself about the potential experience, but I was never too serious about those thoughts.  That is until I heard my fathers discussion with Chief.  So here I am, three years later, retired after 35 years in the corporate world, and ready to begin late February.  Wish me luck.",,View Entry,"Jan 14, Mon",0
Papa Smurf 2019,https://www.trailjournals.com//journal/entry/606407,"Where did the trail name Papa Smurf come from?  That name was given to me by two separate individuals during two separate, unrelated events.   The first was back in October 2012 when I was taking a 4-day motorcycle safety class.  On the third day, one of the guys in the class called me Papa Smurf.  He said that it was because I was the oldest person in the class, I had graying hair, a full beard (at that time) and always wore a blue shirt to the classes.  We were required to wear long sleeve shirts to the classes.  For those that know me, I don't like to wear long sleeves unless I have to.  I sacrificed one of my older dress shirts for the class and wore it every day.  My camo long sleeve shirts are for hunting.
The second event occurred when one of my coworkers called me Papa Smurf at work.  She said that it was because of my graying hair/beard and because of my long time experience in the department that we worked.
I am adding 2019 to the name because I have heard of a Papa Smurf that hiked the AT in 2018.  I wanted to eliminate possible confusion.
To my family members that thought that I would take the trail name ""Frogman"", I am not taking that name because I gave that name to myself.  At least Papa Smurf was given to me by others.  Maybe not on the trail, but by two separate people.",,View Entry,"Jan 14, Mon",0
Papa Smurf 2019,https://www.trailjournals.com//journal/entry/606409,For my third entry I am testing from my smartphone to assure there are no issues.,,View Entry,"Jan 14, Mon",0
Papa Smurf 2019,https://www.trailjournals.com//journal/entry/607465,"I made it to the Springer Mountain Southern Terminus today. The adventure has begun. I am staying at the Springer Mountain Shelter tonight. That means that I have hiked a whole 0.2 miles of the AT today. I hiked the Approach Trail as well. That is 8.8 miles. But that doesn’t count because it is not considered part of the AT.
Johnny (Chief) and Ed (Hot Sauce) hiked 0.9 miles from the parking lot to the Springer Mountain Shelter, set up to stay in the shelter, then packed it in and headed back to the truck. I want to thank them for picking me up at home and and driving me to Georgia. They picked me up on a 6/23/2019, we drove straight to Neels Gap to drop off my food supply so that it is available when I hike into Neels Gap 4-5 days from now. We stayed in a Motel that evening and they drove me to the visitors center so that I could register and start the Approach Trail. I was registered as NOBO hiker #283 with a pack weight of 32 lbs.
After a 9 mile hike today I am tired and ready for bed.
THANKS Chief and Hot Sauce. Your help over the past couple of days is greatly appreciated.",,Springer Mountain Shelter,"Feb 24, Sun",8.90
Papa Smurf 2019,https://www.trailjournals.com//journal/entry/607947,"HOW TO SEE ALL PAPA SMURF'S PHOTOS, JOURNAL ENTRIES AND SIGN HIS GUEST BOOK.
This is ""Mama Smurf"". I just wanted to give viewers some navigational details to make sure you see all Papa Smurf's journal entries, mileage, photos and guest book.  The entire trail from Georgia to Maine is 2,192.0 miles, through 14 states, and takes the average ""thru hiker"" about 6 months to complete.
*NEW* 3/20/19 - Some journal entries will have links to more pictures--just click on the blue text to see them.
Journal entries are displayed by day, and have navigation options beneath the title: first, previous, next, last.  Each entry will show his location, how many miles he hiked that day, and below it is the total miles he's hiked so far. Click on the blue ""Entries"" button on the left-hand side of the journal, and select the entry you want to see.  
To view more photos, click on the blue ""Photos"" button on the left-hand side of the journal.  Click on a photo to enlarge it for better viewing.  
To Leave Papa Smurf a message in his guest book, click the blue ""Sign"" button on the left-hand side of the journal.  (To view his guest book entries, click the blue ""View"" button.)
All fields are not required, but at least enter your name so he'll know who left him the message.
The date will automatically be added.
Type your message in the ""comments"" box.
Click the ""I am not a robot"" box/image.  (This is only a security feature to verify you are a person interacting with the computer, and not an automated program.) 
A green checkmark should appear after a few seconds. If not, you may be prompted to select items from an image before the checkmark appears. Just follow the instructions indicated (usually it will have you click on each image that contains a specific object), then click ""verify"".Once the ""Robot"" verification is received (green checkmark), click the blue ""Sign Guest Book"" button on the lower right to post your message.",,How to Navigate Papa Smurf's Journal,"Feb 24, Sun",0
Papa Smurf 2019,https://www.trailjournals.com//journal/entry/607466,"The day got off to a cold start. We heard that the temperature got down to 20 degrees last night. The wind had been blowing and gusting hard all throughout the night. Some spots were iced over on the trail. The trail was mainly flat or down hill the first half of the day. Most of the second half of the day, after Three Forks River, were uphill. I am with most of the same people tonight at Hawk Mountain Shelter.
Special note: my journal entries are having to wait till I get to a location with cell service. My cell phone is not connecting to any service in the areas I am traveling now.","Springer Mountain Shelter
",Hawk Mountain Shelter,"Feb 25, Mon",8.10
Papa Smurf 2019,https://www.trailjournals.com//journal/entry/607467,"Today started off great. The temperature was chilly, not cold. I hiked without a jacket, it was that mild. I was tired by my the time I made it to Gooch Mountain Shelter. I was greeted by two trail ambassadors named Mother Nature and Smoke Stack. After a couple of hours of conversation, I learned that they both know Chief and his friends Stumpknocker and Christmas. They shared many stories. It’s a small world, isn’t it? We also had our first trail magic. A couple that runs a local B&B stopped by the shelter and gave all of us hikers some baked scones. They were good.


I tried to give one of the guys in the group his trail name. His name is Tim. I wanted to call him “Leaf Blower”. Because he huffs and puffs so hard on the uphills that he blows all the leaves off the path. I don’t know if he will accept the name.
Getting dark now, time for bed.","Hawk Mountain Shelter
",Gooch Mountain Shelter,"Feb 26, Tue",7.60
Papa Smurf 2019,https://www.trailjournals.com//journal/entry/607468,"It started raining around midnight and didn’t stop until we had been on the trail over an hour. There were approximately 16 tents at the shelter with 4-5 people inside the shelter. I counted 6 separate tents that had “snorers” in them. It would have been 7 if I had been asleep. The loudest tent snorer was right next to my tent. Why not? The trail today wore me out. It was a 12 mile hike with some decent climbs throughout the day. Most, but not all views were obstructed by the clouds and fog.
By the way, we had our second trail magic. It was Odie. He is known for publishing the yearly hikers yearbook. He was in a modified short school bus located at Woody Gap. He handed out some fruit, candy bars, pop tarts and fruit paste. It hit the spot.
They are calling for rain tomorrow, but it should be a short hike over to Neels Gap.Time for bed.","Gooch Mountain Shelter
",Woods Hole Shelter,"Feb 27, Wed",12
Papa Smurf 2019,https://www.trailjournals.com//journal/entry/607470,"It started to rain around 6:00 AM. That meant that we all had to break camp in the rain. It was a relatively short hike today. However it was a steep climb up to the top of Blood Mountain. It is the highest mountain in Georgia on the AT and has the oldest shelter on the trail. The decent down from the top of Blood Mountain was very steep and had many, many solid rock sections that had to be managed very carefully due to the wet surfaces. No views available due to the clouds. 
Well, I got off trail on the wrong trail for the first time during my hike. I was trying to hike along the sides of the rock surfaces to avoid a slip/fall. As a result I missed a white blaze in the middle of the rock (trail). I went down hill approximately 200 yards.  I came across a sign that read “This is not the AT. Turn around and look for a blaze to your right”. It took me approximately 20-30 minutes to climb back up to the correct trail, it was that steep. I had a few choice words for that mistake.
I made it down to Neels Gap. I teamed up with Frank and Shane (two section hikers) and Dave (thru hiking) and we all split the cost of a cabin at Blood Mountain Cabins. The cost of the stay included laundry. Great deal and cheaper than staying at the nearby hostel. Laundry was not available at the hostel. We had soft drinks, chili and salad for supper at the cabin office. It was GREAT.
Time to rest. Time for bed.","Woods Hole Shelter
",Neels Gap,"Feb 28, Thu",3.60
Papa Smurf 2019,https://www.trailjournals.com//journal/entry/607505,"We were planning to leave the cabin this morning at 9:00 so that we could eat a nice hot breakfast before we hit the trail. However, there was a handwritten sign on door stating that they could not open for breakfast until 11:00. We couldn’t wait that late to start so we fixed something in our cabin, stopped for some supplies at the outfitter and were on the trail 10:15. It rained the entire time we were hiking.Have you ever seen the Seinfeld episode about the Soup Nazi where he says “No soup for you”? I felt like Mother Nature was like the View Nazi. Saying “No view for you”. Due to the clouds and the rain, there were no views at all today. Oh well, we can try again tomorrow.We decided not to go to Whitley Gap Shelter because it was 1.2 miles off the trail. We didn’t want to add an additional unnecessary 2.4 miles miles to our hike. We decided to stealth camp just off the trail 0.4 miles north of the trail exit for Whitley Gap Shelter. Getting to bed early to try and dry me and everything off.Time for bed just before sunset.","Neels Gap
",Whitley Gap Shelter,"Mar 01, Fri",7.10
Papa Smurf 2019,https://www.trailjournals.com//journal/entry/607527,"Today is Mama Smurf’s Birthday. I hate that I am not there for her birthday this year, but if I waited until after her birthday to start the trail, the trail would be overly crowded. These crowds are sometimes referred to as “The Bubble”.
Happy Birthday Mama Smurf. I love you.
Frank (Tank), Shane (Physical) and I started to break down camp starting around 6:00 AM. We were leaving our stealth site around 7:45 AM. It was very windy and foggy. The fog cleared after approximately 2 hours of daylight. After 2 hours of hiking I ran into Dave (Helluva) heading south bound. After I said good morning to him he realized that he had been hiking in the wrong direction, for the last 1.5 miles. He turned around and headed back in the correct direction. He had accidentally added 3 miles to his day. Needless to say, he cursed himself a few times.
I reached the Blue Mountain Shelter by mid afternoon. It was a good hike, but it took absolutely everything out of me. I forced down my supper and prepared for bedtime.
Good night Birthday girl.","Mile 38.4 Near Whitley Gap Shelter
",Blue Mountain Shelter,"Mar 02, Sat",11.70
Papa Smurf 2019,https://www.trailjournals.com//journal/entry/607555,"Plans for today include getting into town to wait out the rains expected throughout the day.  Return to the trail tomorrow morning and hike for two days. The temperature lows for Tuesday night is expected to be in the  single digits. We wanted to assure our gear was dry as we approached these upcoming low temperatures.
We got a shuttle into Hiawassee, got cleaned up and ate ""real"" food.
The motel offers free shuttle service back to the trail.","Blue Mountain Shelter
","Hiawassee, GA","Mar 03, Sun",2.40
Papa Smurf 2019,https://www.trailjournals.com//journal/entry/607590,"(See more pictures of the ""elevation frost"" - click on the ""photos"" button in the left-hand menu.)
The shuttle picked us up at 9:00 and we were back hiking again around 9:30 at Unicoi Gap. The day was cold with the wind blowing constantly. At a certain elevations the trees turned white due to frozen cloud moisture on all limbs and surfaces. It made for some unusual and beautiful views. No pictures could do justice to the scenery. We got to Tray Mountain Shelter by early afternoon. It was only a 6 mile hike today. Everyone at the shelter fixed something warm to eat and drink. Most were in their tents by 5:00 to keep warm. I am wearing just about every stitch of clothing I have to layer and stay warm.
Everyone will be sleeping with their electronics and water filters to keep those from freezing.
Early bedtime tonight. I dread getting up in sub-freezing temperatures in the morning. Looking forward to starting the hike so that I can keep warm.
Good night John Boy.","Unicoi Gap
",Tray Mountain Shelter,"Mar 04, Mon",5.70
Papa Smurf 2019,https://www.trailjournals.com//journal/entry/607637,"One of the hikers has a portable weather station kit with him. The temperature atop Tray Mountain was 16 degrees. With the wind chill factor it was 6 degrees. When you get out from under your quilt or sleeping bag it is colder than a well digger's buttocks. 


I was up at 5:00am and hiking in the dark by 5:30am. Walking helped with the cold. I slept with my electronics, water filter and partially filled water bottle. My water bottle contents froze as I walked.
I hiked to Dicks Creek Gap then hiked down to ""Top of Georgia"" hostel. The staff helped me print my permit for the Smokies. 
Lots of people at the hostel. I hope for a good nights sleep in a warm setting.","Tray Mountain Shelter
",Dicks Creek Gap,"Mar 05, Tue",11
Papa Smurf 2019,https://www.trailjournals.com//journal/entry/607675,"For those that don’t know what a zero day is, it is basically taking a day off to rest and advance zero miles along your AT journey. After 10 days and 69.2 miles of hiking my body needed a full day of rest. We were also avoiding night time lows in the single digits. We shuttled from Top of Georgia Hostel into Hiawassee where we went to the Holiday Inn Express. I split a room with Tank and Physical.I went to the Ingles and bought my food for the next section. I also bought enough food for my first section of the Smokies. I mailed my food supply for the Smokies forward to the Fontana Village Lodge in Fontana.Time to eat and rest now. Good night Carl.","Top of Georgia Hostel
",Hiawassee,"Mar 06, Wed",0
Papa Smurf 2019,https://www.trailjournals.com//journal/entry/607747,"We caught a shuttle from the hotel after eating a nice hot, all-you-can-eat breakfast. The temperature was chilly, but not too hot or too cold. I had an extra spring in my step after the great rest from the zero day and the large breakfast. We made it to the Georgia/North Carolina state line. One state is now complete. Georgia was no joke.
A few yards after the state line, we rounded a corner and up a small hill and we were at the famous Bly Gap tree. We took several pictures and then set up camp at Bly Gap. There are approximately 12 tents at this site tonight.
Getting dark. Time for bed.","Dicks Creek Gap
",North Carolina,"Mar 07, Thu",9
Papa Smurf 2019,https://www.trailjournals.com//journal/entry/607842,"Well, Tank and Physical are headed back to Dicks Creek Gap today, after finishing their section hike today. They are going back to their homes in New Jersey and Pennsylvania, respectively.  Sad to see them go. The three of us had maintained the same daily sheltering distance since the first day on trail.
The strenuous climb out of Bly Gap is well known and did not disappoint. All this in the rain and sleet. It rained all day. I stopped at Muskrat Shelter to use the privy and have some warm breakfast (oatmeal). I continued in the rain to the next shelter (Standing Indian Shelter). I am one of seven in the shelter tonight. We are packed inside like sardines due to the heavy rain.
More rain expected tomorrow, but slightly warmer. Hopefully we sleep well tonight.","Bly Gap
",Standing Indian Shelter,"Mar 08, Fri",7.70
Papa Smurf 2019,https://www.trailjournals.com//journal/entry/607844,"Serious fog all day.
No one slept good in packed shelter last night. Too tight to move. It rained all night and most of the day. The fog was as thick as pea soup. Water was running down the middle of the trail. There was lots of slippery mud and miles of exposed tree roots in the trail. I made it to Carter Gap Shelter, set up my tent and had lunch.
We are expecting more rain tonight and tomorrow morning.","Standing Indian Shelter
",Carter Gap Shelter,"Mar 09, Sat",7.60
Papa Smurf 2019,https://www.trailjournals.com//journal/entry/607924,"Started out late today to wait for the rain to stop. Left around 9:15. The clouds cleared and we had great weather for hiking. We finally had views today.
Albert Mountain has to be the steepest, most memorable climb so far. I had to set aside my trekking poles and use my hands to pull myself up the mountain. Thank goodness it was not an extremely long climb. I met one of my major milestones today. I have now hiked over 100 miles. I took a picture at the base of the Albert Mountain Fire Tower to mark the occasion.
Atop Albert Mountain Fire Tower
Finished my hike today at the Long Branch Shelter. Lots of new faces at the shelters each night.
Time for bed. Good night.","Carter Gap Shelter
",Long Branch Shelter,"Mar 10, Sun",8.70
Papa Smurf 2019,https://www.trailjournals.com//journal/entry/607925,"Woke up at 6:00 AM to overcast skies. Luckily no rain. The hike today only had two moderate climbs. All in all, not a bad day.
What made things even better was a trip into Franklin, NC at the Gooder Grove Hiker Hostel. I had my first shower in 5 days. To feel clean again is truly amazing. Getting clothes cleaned helps you feel better as well.Time to resupply for the next section and take advantage of the rest.","Long Branch Shelter
",Winding Stair Gap,"Mar 11, Mon",7.20
Papa Smurf 2019,https://www.trailjournals.com//journal/entry/607979,"Today was a day of rest, resupply and eating food. I hated to zero on a beautiful weather day but I cannot always predict the weather when I have access to a town.
I met a Hiker today trying to complete the entire AT in 100 days or less. He wants to average over 25 miles a day. Trail name is “Posi”, which stands for a Positive Attitude. He definitely has one. I wish him lots of luck.
Time to take advantage of the rest.","Franklin, NC
","Rest, Resupply, and Eat","Mar 12, Tue",0
Papa Smurf 2019,https://www.trailjournals.com//journal/entry/608049,"A group of us caught a bus at the hostel and we were transported back to Winding Stair Gap where we resumed our hike. With the rest from the previous day, the hiking was not too bad. Even though most of the hike was a long, gradual uphill.
We first walked out in the open at Siler Bald. It was slightly overcast but not too bad for views. Further in the hike we came out into another clearing with a stone tower on top. This was Wayah Bald. Hazy, but good views all around. The camp site was a little over a mile away at Wayah Bald Shelter. The shelter and tenting sites should be full tonight.
Time to eat and get ready for sleep.","Winding Stair Gap
",Wayah Bald Shelter,"Mar 13, Wed",11
Papa Smurf 2019,https://www.trailjournals.com//journal/entry/608147,"Woke up to rain this morning. Broke down camp in the rain and started north bound. A few miles into the hike I heard multiple voices through the fog at the Burning Town Gap road crossing. To my surprise it was trail magic. It turned out to be Fresh Ground in his Leap Frog Cafe van. He has been offering trail magic to hikers for the past 5 years. He had teamed with the Crawford Family to set up for trail magic. If you are not familiar with the Crawford’s, they thru hiked the AT last year as a family of eight (8), and I followed their adventure on YouTube. The trail magic was great! Blueberry pancakes, mixed fruit, eggs, sausage, yogurt, coffee and juice. We were forced to eat all we could eat and then some. While we were eating, Fresh Ground got a call from another 2018 thru hiker.  Her name was Amanda Bess (Trail Name: Pee Wee). I followed her on YouTube last year as well. She was inviting Fresh Ground and The Crawford’s to her wedding later this year. Nice surprise this morning.
Because of the rain today and tomorrow, we arranged for pickup at Tellico Gap to stay at Nantahala Mountain Lodge. Most of us will likely slack pack in the rain tomorrow and return to the trail the day after, in colder weather with dry gear. 
Very nice accommodations at the lodge and the owners are great.","Wayah Bald Shelter
",Tellico Gap,"Mar 14, Thu",8.40
Papa Smurf 2019,https://www.trailjournals.com//journal/entry/608152,"For those that don’t know what ""slack packing"" is, it involves being dropped off with minimal supplies for the day's hike. Items such as water, snacks, lunch, and clothing for the weather. You hike to the next designated pickup point for that day. This assures minimal pack weight for the day and you still get your trail miles done.
We were dropped off in the rain back at Tellico Gap and hiked down to Nantahala Outdoors Center (NOC). We had thunder and lightning during this hike. The rain stopped prior to reaching the NOC and the sun came out. 
NOC Photos: Footbridge, Nantahala River
We stopped in the restaurant and had a great lunch.  Some hikers resupplied and others got their permits for the upcoming Smokies. Our shuttle arrived and returned us back to the Nantahala Mountain Lodge.Our host Steve (Wiggy) and hostess Maggie have been great!  Getting laundry done this evening and having a late supper.  
Getting late and time for bed.","Tellico Gap
",Nantahala Outdoors Center,"Mar 15, Fri",8.10
Papa Smurf 2019,https://www.trailjournals.com//journal/entry/608233,"Everyone at the lodge was shuttled back to the NOC to begin the long climb to the next shelter. Sassafras Mountain has a reputation as a difficult climb out of the NOC. All uphill. It was basically true. I think most everyone got themselves mentally prepared for the effort, and it turned out to be not as bad as I had envisioned.
It is cold at this elevation. We are expecting temperatures to be in the low to mid 20’s tonight.
I estimate that over 30 different hikers passed our shelter and kept hiking. The trail is getting crowded.
Time to eat, hunker down and get ready for bed.","Nantahala Outdoors Center
",Sassafras Gap Shelter,"Mar 16, Sat",6.90
Papa Smurf 2019,https://www.trailjournals.com//journal/entry/608354,"We had Amos the dog and owner Laura (aka “GPS”) at the shelter last night. Amos was a well behaved dog around all the hikers at the shelter. Added entertainment.
""Wednesday"" got off the trail due to a cold night with existing equipment. She said she was miserable all night. She has been following the same shelter-to-shelter pace as myself since Blue Mountain Shelter. I hope she gets her gear squared away.
We came upon Trail Magic from the United Methodist Church at NC Hwy 143 picnic table. Ziplock baggies with miscellaneous snacks were left with an inspiring message from the church.
The hike today took a lot out of me due to the Jacob’s Ladder section. It was long and straight up, with switchbacks showing up eventually near the top of the mountain. It was a tough hill climb at the end of the day.
Good night John Boy.","Sassafras Gap Shelter
",Brown Fork Gap Shelter,"Mar 17, Sun",9.10
