Hiker trail name,Hiker Journal Link,Journal Story,Start location,Destination,date,Today Miles
Papa Smurf 2019,https://www.trailjournals.com//journal/entry/618762,"I got off to my usual early start around 5:35 am. With the early start and the reduction in humidity I was expecting a good hiking day. For the most part, that was true. However, about four miles before reaching my final destination, I began to feel exhausted. By the time I reached Kid Gore Shelter, I felt totally spent. No energy left. The mileage planned for tomorrow is less than the last couple of hiking days. Let’s see how things feel at the end of the day tomorrow.
The highlight of the day was reaching Glastenbury Mountain lookout tower. The skies were relatively clear and views from the top of the tower were good.
Happy Birthday to my son, Carl.
I will try and get a good nights sleep tonight and see how I feel tomorrow. Good night all.","Congdon Shelter, VT
",Kid Gore Shelter,"Jul 13, Sat",18.70
Papa Smurf 2019,https://www.trailjournals.com//journal/entry/618815,"The trail took a long uphill to the top of Stratton Mountain. There was a care taker cabin and a tower at the top of this mountain. The skies were overcast, but the views from the top of the tower were not too bad. The trail for the rest of the afternoon was downhill to the Stratton Pond Shelter. It was a nice afternoon with several people out on both the Appalachian Trail as well as the Long Trail. Both trails share the same path along this section of Vermont.
With this being a relatively short hike today, I felt pretty good all day.
Time to settle in for the evening. Good night all.","Kid Gore Shelter
",Stratton Pond Shelter,"Jul 14, Sun",15
Papa Smurf 2019,https://www.trailjournals.com//journal/entry/619097,"It was approximately a 10 mile hike to get to the VT Route 11/30 road crossing. We needed to hitchhike to get into town. This was my first hitch. It took only a few minutes and someone pulled off and took ""Lucked In"" and myself into Manchester Center, VT. We couldn’t get into the hostel before 1:00 pm, so we went to the the grocery store and picked up our resupply for the next few days of hiking. Afterwards, we walked to McDonalds and got something to eat. 
While waiting for the shuttle pick up, I needed to go to the nearby outfitter to see if I could get better hiking shoes. The shoes that I was currently wearing were causing blisters on my heels and I was getting trench foot on my toes and the balls of my feet. These shoes did not wick away moisture. The sweat from my feet was pooling in the tie box resulting in constant moisture on my toes. It was so bad that my toes were bleeding and it was painful to pull off my socks. I had to replace these shoes immediately. The outfitter did not have a huge selection in my size. I wound up getting a brand that I was not familiar with. However, this brand was more comfortable than what I had been wearing. My next challenge was to mail the other shoes home. I spoke with a police officer in town and he recommended a small business near the outfitter that could help me coordinate the shipment to my home address. After that was complete, we called for the shuttle pickup to Green Mountain House Hostel. There were five of us waiting for the pick up. It was a very clean and well managed hostel. The owner was out of town, but it was being well taken care of. It was a great opportunity to get myself and my clothes cleaned up. Some in the group got their hair cut by fellow hikers.
Looking forward to the breakfast in the morning. Time to rest for the evening. Good night all.","Stratton Pond Shelter
",VT Route 11/30,"Jul 15, Mon",10.70
Papa Smurf 2019,https://www.trailjournals.com//journal/entry/619098,"We woke up, ate breakfast and caught the shuttle at 8:00 am, heading for the trail head. It was a relatively easy hike today. The new shoes were feeling much better and making a huge comfort difference. I could almost walk like a normal human being again. We hiked up to the top of a local ski lift. Decent views from the top. Again, it was a nice hike to get to the Big Branch Shelter. Four in the shelter and two tents set up outside. The Big Branch water source was directly in front of the shelter. It was a welcoming sound of water over rocks for the evening.
As usual, it is time for the daily camp chores before getting into the tent for the evening.
Good night all.","VT Route 11/30
",Big Branch Shelter,"Jul 16, Tue",16.50
Papa Smurf 2019,https://www.trailjournals.com//journal/entry/619099,"As soon as I started to take down my tent, it started raining. It rained most of the day. We hiked past two different locations where people over the years have stacked pillars of rocks called ""Cairn"". Some of the rocks were stacked in the trees.
There were two decent sized uphill climbs. One of those climbs was over another Bear Mountain. Again, another state with another mountain named Bear Mountain. The humidity was high resulting in lots of sweat. We also crossed a deep gorge crossed on a suspension bridge. The bridge was very shaky, especially when two people were on it at the same time. 
We made it to Clarendon Shelter by early afternoon. It is full because of the rain. Several hikers came by and hiked on because the shelter was full.
Settling in for the evening. Good night all.","Big Branch Shelter
",Clarendon Shelter,"Jul 17, Wed",16.90
Papa Smurf 2019,https://www.trailjournals.com//journal/entry/619100,"We met two significant milestones today. The first was reaching the 500 mile point. It is now less than 500 miles to Katahdin! The second milestone was reaching the 1,700 mile point. Again, less than 500 miles remain.
As the hike began this morning, I spooked over a dozen wild turkey as I approached the edge of a farmers field. Mixed in with the turkey were at least a dozen grouse. They let me get close before they were spooked and flew off.
Most of the hiking today was consumed with climbing Mt. Killington. I summited Mt. Killington around lunchtime and ate my lunch atop the mountain. The remainder of the day was hiking down to the Churchill Scott Shelter. I am not expecting many at the shelter tonight because we are so close to town. That is my destination first thing tomorrow morning.
I am doing doing camp chores and will be getting ready to climb inside my tent. The mosquitoes have been bad for the past week or so. Especially around sunset.
Good night all.","Clarendon Shelter
",Churchill Scott Shelter,"Jul 18, Thu",14.80
Papa Smurf 2019,https://www.trailjournals.com//journal/entry/619222,"It was a short hike to US Route 4 this morning. ""Nagel"" and I got a quick hitch into the town of Rutland. We are staying at the Yellow Deli Hostel. We got there early enough to enjoy a free breakfast. I had an excellent lunch at the deli, later in the day.
They blocked off the street in front of the deli for an outdoor concert this evening. Performing tonight are ""O-Town"" and ""Aaron Carter"". A group of us walked the street event until 10:00 pm, which is the time the hostel locks their doors.
We are currently planning a zero tomorrow with plans to return to the trail on Sunday.","Churchill Scott Shelter
","Rutland, VT","Jul 19, Fri",1.90
Papa Smurf 2019,https://www.trailjournals.com//journal/entry/619287,"We were called to breakfast at 7:30 this morning. By the way, the Yellow Deli has had great food.
We had tentative plans to do a short 5-6 mile hike this morning. Those plans were canceled when the logistics of getting transportation to and from the different points on the trail were questionable.  We will zero here today and rest.","Rutland, VT
","Rutland, VT","Jul 20, Sat",0
Papa Smurf 2019,https://www.trailjournals.com//journal/entry/619542,"We planned for a long day with big miles. We had arranged to slack pack today. We could do bigger mileage with lighter packs and plenty of rest.
We ate breakfast at the Yellow Deli. After breakfast, Tom came at 8:30 to pick up our gear and take us to the trail head. After dropping us off, Tom took our excess gear to our final destination for the day. It is a barn, next to the trail at VT 12. This makes for a 20+ mile day. We all felt up to it. Slack packing today are ""Lucked In"", ""Detour"", ""Fire Plug"" and myself.
The hike had many ups and downs throughout the day. The temperature was hot, yet not as hot as the day before. We hiked past a couple of water falls and a large pond today. All were beautiful sights. There was one point on the trail where an actual ladder is installed to aid hikers going up or down the long rock face.

By the end of the day, we came out to VT 12. About 0.1 miles west was an old barn that the owner Dan allows hikers to use as shelter. He also had an outdoor shower. Most of us set up our tents in the field. A few stayed in the barn loft.
We ate supper and had our tents up just before dark. Settling in for the evening. Good night all.","Rutland, VT
",Barnard Gulf Rd,"Jul 21, Sun",23.70
Papa Smurf 2019,https://www.trailjournals.com//journal/entry/619543,"Some of the group began piling out of the barn loft this morning while the rest of us began breaking down our tents. ""Lucked In"" and I left camp around 6:30, which is later than normal. However, ""Lucked In"" is out of water treatment drops so we are both using my filter until he can get more drops.
We had an immediate climb coming out of camp. Now that will get your heart pumping first thing in the morning! All the climbs today were straight up or straight down. No switchbacks. It is like the state of Vermont is getting us ready for what is coming in the states of NH and ME.
It started raining at approximately 10:00 and did not stop for the remainder of the day. By mid afternoon we had made it to Happy Hill Shelter. Because of the rain, everyone wanted to be under the shelter tonight. It has an upper loft. The bottom was full, so three of us stayed in the loft. It has a low roofline and is a tight fit for three adults, but we'll make it work.
Time to settle in for the evening, good night all.","Barnard Gulf Rd
",Happy Hill Shelter,"Jul 22, Mon",17.30
Papa Smurf 2019,https://www.trailjournals.com//journal/entry/619704,"It rained all through the night. No one wanted to get out of the shelter and start hiking due to the rain. We eventually got a 6:30 start.
The hike came out of the woods and became a long road walk. We hiked through Norwich VT and came to the Connecticut River. The Vermont/New Hampshire state line was marked in the pillars of the bridge over the River. Vermont is complete, and only two more states remain. 
We continued our trail road walk into the town of Hanover, New Hampshire. There we took a city bus into the town of West Lebanon. There ""Lucked In"" and I got the tips of our broken trekking poles fixed at an outfitter. We ate lunch and went to Walmart for our resupply. ""Lucked In"" was able pick up a water filter there as well. We took the bus back to Hanover where we got back on the trail walk. By late afternoon we came to Etna-Hanover Center Rd. We hiked 0.8 miles west to a general store where we were able phone a nearby hostel (Tigger's). We got cleaned up and were set up to stay in a camper located beside the house. The couple that runs the hostel provide old campers as sleeping quarters for the hikers.
We ate, cleaned up and settled in for the evening. Good night all.","Happy Hill Shelter
","Etna-Hanover Center Rd, Etna, NH","Jul 23, Tue",11.70
Papa Smurf 2019,https://www.trailjournals.com//journal/entry/619706,"We were shuttled back to the trail head around 8:00 am. The hike had two decent uphills and there were no switchbacks. They were basically straight up.  The views from these elevations appear more majestic in this area. The mountains appear higher and the valleys appear deeper.
By early afternoon we made it to Trapper John Shelter. We might have a few people here with us at the shelter tonight. I have set up my tent for the evening. 
Before it got too late I heard another hiker mention a hiker named “Timber”. It turns out that he was here at Trapper John Shelter as well. He stopped by and I did not recognize him. I have not seen him since Neels Gap. We both lost weight and we both have more facial hair. We briefly caught up. It is good to see him again. I have been trying to cross paths with him since Duncannon, PA. I passed him on the ridges out of Duncannon and found out from other hikers that I passed his tent that morning. Again, it sure was good to see him again.","Etna-Hanover Center Rd, Etna, NH
",Trapper John Shelter,"Jul 24, Wed",10.80
Papa Smurf 2019,https://www.trailjournals.com//journal/entry/619707,"The trail today had two relatively nice uphill climbs. The first climb was over Smarts Mountain. At the top of Smarts Mountain is a fire lookout tower and a fire warden cabin. Nice views from the tower. The second climb was Mt Cube.  
By the end of the hike we came to Hexacuba Shelter, a large hexagon-shaped shelter. There were very few tenting sites, but I did get there early enough to claim one of them.","Trapper John Shelter
",Hexacuba Shelter,"Jul 25, Thu",12
Papa Smurf 2019,https://www.trailjournals.com//journal/entry/619857,"We were up and climbing first thing. The climb took us to the summit of Mt Cube. The wind was calm, which allowed the low-lying clouds to settle into the valleys. It looked like an ocean of clouds from the summit. It was a nice clear morning. 
We hiked a approximately six miles to NH Route 25A. At 9:30 a man with the trail name ""Bag of Tricks"" brought ""Lucked In"", ""Waldo"" and I some soft drinks, fresh water and picked up our excess gear so that we could slack pack the remaining 10 miles to NH Route 25. At that crossing we hiked east to the Hikers Welcome Hostel. There are 20+ hikers here at the hostel. We cleaned up, ate and made plans for a slack pack for tomorrow.
""Bag of Tricks"" drove us to a nearby restaurant and we enjoyed burgers and pizza.
We are trying to rest now. We have a huge climb scheduled for tomorrow. Good night all","Hexacuba Shelter
",NH Route 25,"Jul 26, Fri",14.80
Papa Smurf 2019,https://www.trailjournals.com//journal/entry/619858,"There were over 30 people at the hostel last night. I was up at 4:30 am and walked to the trail head for a 5:30 am start. Today is a big uphill and a steep down hike up and over Mt Moosilauke. We were being slack packed today. It made the hike more manageable. I was able to summit Mt Moosilauke at 8:00 am. I stayed at the summit and enjoyed the views and a breakfast. The downhill was very steep heading north. There was a section that was next to a waterfall. There were better views of the falls than expected.
By the time we made it to the Kinsman Notch Parking Lot, we hitched a ride back to the hostel. 
When I was back in Duncannon, PA I talked about eating breakfast with one of the locals. That same local is working here are the Hikers Welcome Hostel. He remembered our prior meeting. He is not currently thru hiking, but did so many years ago. His trail name is ""Bag of Tricks"". He has been entertaining everyone with his stories. He has helped us tremendously with our slack packing efforts as well. Good people and good discussions.","NH Route 25
",Mt Moosilauke,"Jul 27, Sat",9.30
Papa Smurf 2019,https://www.trailjournals.com//journal/entry/619926,"The shuttle left the hostel at 7:30 am. We were at the trail head by 8:00 am. Today we were hiking up and over Kinsman Mountain. The trail was a mixture of mud, rocks of all sizes and plenty of tree roots. It was a long climb to the summit of South Kinsman Mountain and a little further to North Kinsman Mountain summit. I stopped at the north summit and enjoyed lunch with a view. It was a bit hazy, but the views were still decent.
It was a long downhill with plenty of rocks, roots and mud again. The end of the day was at US 3, I-93. We walked on a bike trail to the Flume Visitors Center where we called the Inn 32 Hotel to pick us up. Our excess pack items had already been delivered to the hotel earlier in the day by the previous hostel drivers.
We cleaned up and had supper. ""Lucked In"" and I both agreed that the Kinsman Mountain section hiked today was more difficult than the prior day over Moosilauke.
We will resupply and return to the trail tomorrow. Good night all.","Kinsman Notch
",Over Mt Kinsman,"Jul 28, Sun",16.10
Papa Smurf 2019,https://www.trailjournals.com//journal/entry/620005,"The order of business first thing was to get to an outfitter and get my trekking pole repaired. The lower section of one pole was bent. ""Lucked In"" also needed repairs to one of his poles. It had broken clean into two pieces. We ate breakfast and walked to the outfitter to be there when they opened at 9:30 am. We both got pole replacements. We walked back to the hotel and checked out. The hotel owner shuttled us back to the trail.
We hiked Franconia Ridge today. I have been looking forward to this section of the White Mountains. We walked for miles above tree line. 360 degree views and nearly clear skies. It was beautiful up there. We first crossed over Mt Lincoln, followed by Mt Lafayette and the day ended back in tree line crossing Mt Garfield. It was a relatively short hike today, but the terrain was steep and rocky. It took an additional three hours to hike similar distances in other areas.
I set up my tent on one of the wooden tent plate forms at Garfield Ridge Shelter/Campsite. Chief had contacted me today about using additional hardware to stake down my guy lines on these wooden platforms. I picked up the necessary equipment a a hardware store next to the outfitter this morning and it worked fine.
I came across a young lady that had taken the wrong trail from Franconia Ridge today. She was a day-hiker and could not make it back to her car by nightfall. Another hiker escorted her to the shelter where the caretaker provided her a hammock and sleeping bag. Us hikers helped her with food and another helped with a jacket and long sleeve shirt and pants. She was originally wearing shorts, a sports bra and a hydration bladder. She had contacted her family to let them know her situation so they would not worry. She'll have help getting to her car tomorrow.
Time to settle in for the evening. Good night all.","Over Mt Kinsman
",Garfield Ridge Shelter/Campsite,"Jul 29, Mon",10.50
Papa Smurf 2019,https://www.trailjournals.com//journal/entry/620096,"I had multiple ups and downs throughout the day with multiple points along the trail for outlooks. The last five miles were very nice because it was in a valley, very flat and fewer rocks. There was almost two miles of walking on boards over muddy sections.
Just before it got dark we got word that a moose was on the opposite side of the pond. Everyone ran down to the pond to take pictures. It was so far away that it was difficult to see detail. My first moose sighting. 
The shelter is full because of expected rain tonight and tomorrow. I set up in the shelter to keep my gear as dry as possible, for as long as possible.
Time to call it an evening. Good night all.
Special Note: Happy Anniversary to Mama Smurf.","Garfield Ridge Shelter/Campsite
",Ethan Pond Shelter,"Jul 30, Tue",14.50
Papa Smurf 2019,https://www.trailjournals.com//journal/entry/620223,"It rained all night long and came down hard at times.  It was nice to have the shelter to keep things dry. It had stopped raining by the time we all began hiking.
The early part of the hike was great because the terrain was still relatively flat. The climbs began at the base of Mt Webster. Very near the summit of this first mountain it was hand and foot climbs along a huge rock face. About half way up this rockface, I placed my hand in an open crack for better grip when a snake came out of the crack and slithered over my hand and went down by my feet. I am glad that I didn’t overreact, because it was a long ways down by that point. I gathered my wits and continued on with my climb. 
The downhill slammed my knees as I prepared to climb Mt Jackson and later Mt Pierce. After eating lunch at one of the huts a group of us decided to push on to the next hut. Bad weather was expected, so we teamed up in pairs to hike together for safety reasons. It was approximately five miles to the next hut and the weather held back during our hike. We made it to Lakes of the Clouds Hut and checked in. They are allowing us hikers to sleep on the hut floor after the regular guests settle in for the evening at 9:30. This place is packed, with over 60 people here this evening. Clouds eventually rolled in and it began to rain hard around 5:00pm. We will wait for the crowds to go to bed and us hikers will start to settle in on the floor.
Hopefully we can get a good nights sleep. Good night all.","Ethan Pond Shelter
",Lakes of the Clouds Hut,"Jul 31, Wed",13.90
Papa Smurf 2019,https://www.trailjournals.com//journal/entry/620329,"All the hikers camped out on the floor of the hut had to be packed out before the hut guests began to stir for breakfast. I began hiking around 6:00 am towards the summit of Mt Washington. The clouds were blowing all around the mountain tops. It was cold enough that I wore long sleeves and gloves. I was the first to summit Mt Washington and took my picture in front of the sign. Along with other hikers, we explored the buildings at the summit. Even with all the clouds, there were beautiful views. 
We hiked on towards the Madison Spring Hut. When we entered the hut, there was a sign saying that you could have all the leftover breakfast you wanted as long as you told a joke and made the staff laugh. I told my joke and began chowing down on scrambled eggs and oatmeal. I capped it off with a bowl of potato soup. It was nice to feel full. Even if it is leftovers.
The remainder of the day was brutal. We hiked up Mt Madison and down the other side. There were so many rocks and boulders that we could not hike faster than one mile per hour. The rocks went on for ever today. It was so intense and slow going today that we had to change our plans to head into town and stop short at the Osgood Tent Site. We were not the only ones to cut our plans short, several other hikers did the same. All saying that the hike today was intense.

I set up my tent on the wooden platform and ""Lucked In"" cowboy-camped on the platform as well. There are approximately 15-20 hikers tenting in this site tonight.
We hope hike tomorrow to the road crossing and get a ride into town.
Time to settle in for the evening. Good night all.","Lakes of the Clouds Hut
",Osgood Tent Site,"Aug 01, Thu",10.30
Papa Smurf 2019,https://www.trailjournals.com//journal/entry/620331,"Today is what we call a ""Nero""--a near zero day or very low mileage on the trail. It is usually done to get yourself into a town so that you have enough time to get all your chores done. We slept in a little later than usual and were on the trail shortly after 6:00 am. It felt like it took forever to go just under five miles.
When we arrived at the Pinkham Notch Visitors Center, I went inside to get a drink and snack before we began our hitchhike attempt. When I came out of the center, ""Lucked In"" was talking to a gentleman about IT work. When I was introduced to the gentleman named Gary, he said that he was looking for a ""Papa Smurf"". It turns out that I was planning to contact him when I got into town where there was better phone service. Jimmy and his wife ""I Believe"" had contacted Gary to get in touch with me. It was another trail miracle that we come across unexpected people here on the trail. I will be speaking with Gary while I am in the town of Gorham. I am staying at The Libby House B&B and Hostel. This was a good recommendation from Gary and his wife Cathy. He also drove us to the hostel.
We plan to take an additional day and do a zero tomorrow.
Time to rest. Good night all.","Osgood Tent Site
",Pinkham Notch,"Aug 02, Fri",4.70
Papa Smurf 2019,https://www.trailjournals.com//journal/entry/620396,"I slept in until 7:00 am. That is a first for me since starting the trail. This rest day is greatly needed.
We happen to be in the town of Gorham during the time of an annual ATV Festival. The town, the streets and parking lots are packed with ATV’s of all shapes and sizes. I am amazed at the large number of ATV’s. It is also lawful to drive your ATV on the streets. No helmets required either. No helmet required for regular two wheel motor cycles as well. The locals say the streets will calm down after the festival ends this weekend.
Other than walking to local restaurants from the hostel, we are resting today. Enjoying this Zero day.","Zero in Gorham, NH
","Zero in Gorham, NH","Aug 03, Sat",0
Papa Smurf 2019,https://www.trailjournals.com//journal/entry/620434,"We were shuttled back to the Pinkham Notch Visitors Center where we returned to the trailhead. It initially was a relatively flat trail and then it quickly became a steep uphill to the Wildcat peaks. These climbs were difficult, but not as aggressive as was being passed along to us northbound hikers. The wind picked up in the early morning and helped keep the temperature cooler. By midday I was at the Carter Notch Hut where I stopped and ate lunch. The remainder of the day was hiking to the Imp Shelter. The downhills to this shelter were the most demanding part of the hike for today. Multiple times I was using trees and roots to help lower myself down a rock embankment. This can wear down the knees over the day. I arrived at the shelter, saw the caretaker, set up my tent, ate supper and prepared for the evening. It is cooler than usual and it feels good to curl up in a sleeping bag.","Pinkham Notch
",Imp Shelter,"Aug 04, Sun",13.10
