Hiker trail name,Hiker Journal Link,Journal Story,Start location,Destination,date,Today Miles
Papa Smurf 2019,https://www.trailjournals.com//journal/entry/615345,"Today was a long day, but a good day. I left the hostel early and walked to the trail head starting at 6:00 am. The first notable thing I saw today was the other shelter in competition for the neatest, cleanest and best looking. There were lots of potted plants, a sun dial, welcoming signage and the cleanest privy that I have seen so far. The toilet seat actually “shined”.
Later I was looking for sticks in the middle of the trail and that mark the 2019 halfway point at mile 1,096.0. I did not see the markings in the trail. I took a Guthook GPS screenshot and I was 0.2 miles past that point. I did come across two other official halfway markers from previous years.
Next came the ""Half Gallon Challenge"". After crossing the trail’s halfway point, you are challenged to eat a half gallon of ice cream in one sitting. Me and two other hikers did our part. It was no problem. I even ordered a cheeseburger to go. That would be my supper for the evening.
Lastly I started the seven-mile hike to my final destination. However, before I got there I had to walk through two hours of heavy rain and marble/pea-sized hail. The hail was large enough for me to attempt to get next to a tree to minimize the hard impact. It covered the ground in some areas and looked a little like snow. The ground was green when it stopped, because the hail knocked off thousands of leaves from the trees. I did eventually make it to James Fry Shelter. It was my longest hiking day so far. Well over 20 miles today. The cooler temperatures helped make the longer day easier.
I ate my cheeseburger for supper, did my chores, and set up in the shelter (due to the rain) and got ready for bed. Good night all.","Trail of Hope Hostel, Fayetteville, PA
",James Fry Shelter,"Jun 02, Sun",27.10
Papa Smurf 2019,https://www.trailjournals.com//journal/entry/615532,"Around 11:00 during the night last night, we had a hiker show up at the shelter. He shined his light in everyone's eyes looking to see if there was space available. He wound up in the front corner of the shelter. He shivered and moaned all night long. He never spoke up and said that he was in trouble or needed any help. About 3:30 am I got up for a nature call. At that time he whispered to me, asking if I had anything to help, that he was freezing. I reached into my pack and handed him my jacket. He never said anything again during the night. When everyone started stirring, he just sat in one place looking off into space. I asked him if he was doing OK, he indicated that he was fine. Without saying a word to anyone he simply left the shelter. We will likely never see him again. I believe he had an experience last night that he will never forget as long as he lives.
There were times during the hike today that required me to set aside my trekking poles and use my feet as well as my hands to climb up or down rock faces. This is preparation for what is to come. Both here in PA as well as other northern states. We moved down out of the mountains, down into open pasture land. Just prior to entering the town of Hot Springs, I set up my tent in a Backpacker Camp. There is room for many tents and a port-a-potty. I walked into town and took a shower at a nearby swimming pool and ate lunch with another hiker who was from the Netherlands. Several tents are set up in the area tonight. It will be noisy, as the camp site is right beside some railroad tracks. Trains have been coming and going all afternoon. Time to get ready for some sleep tonight. At least between train visits. Good night all.","James Fry Shelter
",Backpacker Camp near Boiling Springs,"Jun 03, Mon",11.60
Papa Smurf 2019,https://www.trailjournals.com//journal/entry/615533,"Today was the flattest day of hiking since I began the trail. There was less change in elevation than any other day. Most of the day was either through open fields and pastures or in narrow bands of trees between them. There were also a high number of road crossings throughout the day. I saw multiple cherry trees and a few mulberry bushes.
I thought the state of Maryland had a lot of chipmunks. Pennsylvania has them all beat. I bet that I saw over two dozen of them and heard hundreds chirping everywhere.
I had enough energy and daylight to do more miles today. However, I think I might have shin splints. I will keep my mileage down and see if the shin discomfort disappears.
I set up my tent at Darlington Shelter and went through my camp rituals. Hopefully I will sleep better tonight, now that I am away from the train tracks.
Before dark, about eight hikers showed up. Everyone one of them were hikers that I had met back in Virginia just before they all left for trail days. This bubble of hikers had caught back up with me. The shelter and tent sights are full tonight.","Backpacker Camp Near Boiling Springs
",Darlington Shelter,"Jun 04, Tue",14.70
Papa Smurf 2019,https://www.trailjournals.com//journal/entry/615701,"Because of my shin discomfort, I will intentionally slow my pace and lower my mileage to see if that strategy reduces or eliminates the discomfort. I had a short hike into town today. Destination, Duncannon PA. My guide book warned of a rocky section heading into town. It did exist, however it was nothing we have not experienced before.
We timed it perfectly, one of the local churches offers a free spaghetti supper to all hikers every Wednesday night. Last night, the spaghetti supper was mentioned by every hiker at the shelter. Guess what day it is? HUMP DAAAY! Yes, we timed it perfectly, for a change. Looking forward to the meal and rest for my shin. 
P.S. The spaghetti supper was great. You can tell that they have done this before. Spaghetti, salad, fruit, tea, milk, Gatorade, bottled water and lots of homemade deserts. They also laid out a mixture of resupply items. The hospitality was very welcoming and greatly appreciated.
Time to sleep on a full stomach. Good night all.","Darlington Shelter
","Duncannon, PA","Jun 05, Wed",11.30
Papa Smurf 2019,https://www.trailjournals.com//journal/entry/615704,"Before heading out on the trail, I stopped and ate breakfast at one of the local diners. One of the town locals sat and ate with me. He had hiked the trail back in the 90’s. He was filled with lots of stories about the trail and local trail facts. It was interesting to hear some of his stories. After breakfast, I was on the trail by 7:15 am.
There was the usual climb out of town after crossing the Susquehanna River. At the top of the climb the ridges were loaded with rocks. I came upon a deer with a red tag in one of her ears, another black snake and my first box tortoise of the trip.
I made it to my final destination, Peters Mountain Shelter, by 12:00 pm. It feels strange to stop so early in the day. I hope the short mileage now, pays off in the long run. At the shelter were three guys resting. It turns out that two of them started their hike the same day that I did back in February. This is the first time that our paths crossed. Apparently another hiker by the trail name, Timber, had stopped and set up his tent earlier this morning. If that is true, then I passed Timber this morning and did not know it. I know Timber from day one. He was the guy that I wanted to name “Leaf Blower”. Apparently he did not like that as his trail name. I hope to cross paths with him soon. I last saw him back at Neels Gap. 
I am taking my time this evening doing my usual camp routine. Good night all.","Duncannon, PA
",Peters Mtn Shelter,"Jun 06, Thu",11
Papa Smurf 2019,https://www.trailjournals.com//journal/entry/615899,"I was up at 4:30 am and on the trail by 5:05 am. I like early starts on days when the temperatures are warmer. My shin did good until the last two hours of my hike. It started to tighten up and felt tender. I made it to Rausch Gap Shelter by 2:00 pm.
I saw a small brown snake early in the morning. About two miles before reaching the shelter, I heard a rattling noise off to my right side. I reacted and jumped forward about five feet. Yes, it was my first rattlesnake sighting. It was less than a foot off the trail, on my right side. I took out my phone and started taking pictures. As I was taking the pictures, I heard voices coming down the trail. Five hikers were approaching, so I warned them about the rattler. They all stopped several yards back. They inched forward and one of the guys started taking pictures as well. Everyone else stayed back several yards. I left everyone there to enjoy their rattlesnake experience. They passed me later and thanked me for the warning. BTW, it was a GOOD SIZE snake.
I set up in the shelter and decided to stay there and rest for the remainder of day.","Peters Mtn Shelter
",Rausch Gap Shelter,"Jun 07, Fri",18
Papa Smurf 2019,https://www.trailjournals.com//journal/entry/615900,"I started my hike at 5:15 this morning. My first obstacle was sloshing through water half-way up my calves for about 150 yards. The water was over the trail as a result of a beaver dam right next to the trail, but it wasn't too bad. 
There were multiple stretches along the ridge line where you have to jump bolder to bolder to move along the trail. A local guy back in Duncannon called these areas with lots of rocks, “Rock Gardens”. They really slow down your walking pace. 
I did another short day and ended up at the 501 Shelter. This shelter is famous for pizza delivery straight to the shelter. What did I do? I ordered a pizza, an Italian Sub and a Mountain Dew. All the other hikers placed their orders as well. It was a great meal.
We are settling in for the evening. Good night all.","Rausch Gap Shelter
",501 Shelter,"Jun 08, Sat",17.50
Papa Smurf 2019,https://www.trailjournals.com//journal/entry/616096,"I had my usual early start this morning. The highlight of day was trail magic from Quiet John. He had water and Kit Kat bars and good conversation. It was a relatively short day to Eagles Nest Shelter. I set up inside the shelter due to the potential for rain tonight. It will likely rain on my way into town tomorrow.
Settling in for the evening. Good night all.","501 Shelter
",Eagles Nest Shelter,"Jun 09, Sun",15.10
Papa Smurf 2019,https://www.trailjournals.com//journal/entry/616097,"I woke up at 4:30 this morning. It started raining at that time. So the entire hike today was in the rain. It was, however, a short hike to Port Clinton, PA. While walking from the trail to the local camp pavilion, Steve, a local shuttle driver stopped and took me to nearby Hamburg, PA where I am staying at the Microtel.
Two section hikers from the shelter last night, Booboo and One Crock, were kind enough to shuttle me around today. First we went to the Cabela’s across the highway. It is the largest Cabela’s in the world. I picked up a pair of hiking shorts while I was there. The shorts that I have been hiking in, have holes worn in them. I am not able to repair the holes due to the missing material and hole size. Next we went for food at Red Robin. We followed that by a trip to the nearby Walmart for resupply. Finally we went to a candy store in Port Clinton.
As I was sorting through my resupply, I began to notice that the top of my right foot was sore and felt tender to the touch. I made the decision to rest my feet and asked for another nights stay at the Microtel. It looks like I will be taking a zero here tomorrow.","Eagles Nest Shelter
","Port Clinton, PA","Jun 10, Mon",9
Papa Smurf 2019,https://www.trailjournals.com//journal/entry/616472,"I spent most of the day in the Microtel lounge chatting with other hikers. I am trying to simply rest and allow my shin and foot to heel. The swelling in my foot has gone down a little. If it does not go down any more, I might have to zero again tomorrow. As usual, I will evaluate the need for that possibility later today. 
Over the past week I have been leap frogging on the trail with ""Stingray"", ""R.G"". and ""Q"".  They have a fourth member in their group named ""Halo"" that has been a few days behind them since he had gotten off trail for a family event. Well today, not only did I finally meet up with Halo, but I got to meet Halo’s wife Rhonda. She had signed my guest book before I even started the trail asking that I be on the lookout to run into her husband. Well I got to meet both of them on the same day. They were also very kind to leave me with some trail magic this evening. Thank you. 
I also got to meet YouTuber’s Jimmy and his wife, ""I Believe"".  ""I Believe"" hiked the entire trail a few years back. They have been providing trail magic to hikers over the years since she was on the trail. It was nice to meet them since I had been following their YouTube interviews over the last couple of years.","Port Clinton, PA
",Zero in Hamburg,"Jun 11, Tue",0
Papa Smurf 2019,https://www.trailjournals.com//journal/entry/616473,"It was difficult this morning watching the other hikers gather and head out to the trail. This is especially true when I feel good and well rested. However, I keep telling myself that the additional day of rest will pay off in the long run. I have a special thanks to RG, Halo and Rhonda for the additional trail magic this morning. Before everyone left this morning, we all posed for a group picture. Again, I felt like I should be loading up to leave as well.
The remainder of the day was filled with rest.","Zero in Hamburg
",Zero in Hamburg,"Jun 12, Wed",0
Papa Smurf 2019,https://www.trailjournals.com//journal/entry/616474,"I made the decision that my foot and shin had rested enough and I would head back to the trail today. It rained most of the night and was raining when I began my hike. It stopped raining midday. However it remained cloudy. The clouds affected my view at the overlook called The Pulpit. No views due to the clouds. I did experience multiple rock gardens near the Pulpit. About an hour before I reached Eckville Shelter, it started raining again. Just enough to get things soaked. The shelter itself was dry. That is good because it is expected to rain throughout the night. 
Trying to stay dry tonight and hopefully have clear skies tomorrow.","Hamburg, PA
",Eckville Shelter,"Jun 13, Thu",14.80
Papa Smurf 2019,https://www.trailjournals.com//journal/entry/616475,"Today Pennsylvania lived up to it’s reputation of rocks on the trail. It is likely the most dense section with rocks. This included a section called the knives edge. The rocks really slow my pace.
I came to a sign at a road crossing that said trail magic. There was an arrow on the sign pointing towards the parking lot. A couple named Joe and Sue were providing drinks, hot dogs, hamburgers, and honeybuns. Several of us stopped and enjoyed the food and conversation.
Near the end of the day I found myself at Bake Oven Knob Shelter. Several other hikers are here tonight. Time to settle in for the evening. Good night all.","Eckville Shelter
",Bake Oven Knob Shelter,"Jun 14, Fri",17.40
Papa Smurf 2019,https://www.trailjournals.com//journal/entry/616476,"This morning I woke up and hiked one mile back to Bake Oven Knob Parking lot. I was picked up by ""Physical"" and ""Tank"". If you remember, the three of us hiked the entire Georgia section of the AT together. They asked me to contact them when I reached their home states. ""Physical"" is from PA and ""Tank"" is from NJ. They were kind enough to buy me breakfast, take me to Walmart for resupply and to Dick’s Sporting Goods to get a stove replacement and compression sleeves for my shins. Great trail magic. It was really good to see them. They have been tracking my hike since they finished their section hike back at Bly Gap. They returned me to the parking lot and I hiked the rocky trail to George W. Outerbridge Shelter. Before I reached the shelter, I came to a dirt road crossing where ""Sunshine"" was set up providing trail magic. She had hot dogs, chips, candy bars, fruit and drinks. Her husband, ""Blue Grass"" hiked up as I was about to finish my meal. Trail magic twice in one day! This helped get through the day with all the rock hopping.","Bake Oven Knob Shelter
",George W. Outerbridge Shelter,"Jun 15, Sat",6.80
Papa Smurf 2019,https://www.trailjournals.com//journal/entry/616539,"We got up and started hiking around 7:00 am. That is late for me. We only planned a 16.7 mile day. The big discussion was the upcoming climb out of Lehigh Gap. It was a steep bolder-hopping climb. But I didn’t think that it was as strenuous as everyone was stressing. The climb takes you through an area that was previously mined for zinc. We had to carry extra water because the water in this area was potentially contaminated due to the mining and pesticides. I arrived at the Leroy A. Smith Shelter by early afternoon.
A special note: It is Father's Day today. I heard from my son Carl this afternoon. It was good to hear from him.","George W. Outerbridge Shelter
",Leroy A. Smith Shelter,"Jun 16, Sun",16.70
Papa Smurf 2019,https://www.trailjournals.com//journal/entry/616616,"A relatively short hike planned for the day. Just over 13 miles to the next shelter. Those miles were consistently rocky the entire journey. You had to carefully position your feet according to the rocks you were in at that time. The rocks, of all sizes, were relentless today. I got to the shelter just after 1:00 pm and set up inside the shelter. It was raining and expected to continue to rain throughout the night.
Tomorrow should be my last day in the state of PA.  Best wishes to my brother, Oliver, whose birthday is today.","Leroy A. Smith Shelter
",Kirkridge Shelter,"Jun 17, Mon",13.70
Papa Smurf 2019,https://www.trailjournals.com//journal/entry/616830,"Today’s hike was a short one. It also completed my section of Pennsylvania. Seven of the 14 trail states now complete!  (By the way, if you have not heard, the rocky section of the trail does not end at the Pennsylvania/New Jersey state line.)  
After crossing the Delaware River and the state line, I entered New Jersey. I immediately pulled off the trail at Kittatinny Visitors Center. Tank had arranged to pick me up at that location. He was kind enough to take me to his place where I could clean up and get resupplied. He also had some great food. As usual, that is at the top of my list. It felt good to have a full stomach and feel clean. It rained all day today. It was nice to be under a roof and be dry. He dropped me off at the post office where I mailed some items home. He took me to a nearby Walmart and store for resupply He also provided barbershop services, as he gave me a buzz cut. I felt like a new human being again. We spent most of the time talking about the trail. He is able to relate to most of my stories as he, Physical and I hiked all of the Georgia section together. His hospitality has been greatly appreciated. He went over the top with his trail magic.
We will get up early enough tomorrow to get me back on the trail, and he can return to work. A special THANK YOU to both Tank and Physical for all the trail magic provided over the last few days.
I am getting ready for the next few days. It is supposed to rain a lot over the next week or so. Good night all. Stay dry.","Kirkridge Shelter
",Kittatinny Visitors Center,"Jun 18, Tue",7.70
Papa Smurf 2019,https://www.trailjournals.com//journal/entry/616907,"After a great breakfast, Tank drove me back to the trail. Again, his hospitality is greatly appreciated. It rained off and on throughout the day. The final destination was the Mohican Outdoor Center. I checked in, had something to eat, took a shower and settled in for the evening.
Here at the center that I know are Cecil, RG, Stingray and Halo.","Kittatinny Visitors Center
",Mohican Outdoor Center,"Jun 19, Wed",11.60
Papa Smurf 2019,https://www.trailjournals.com//journal/entry/616908,"I reviewed the weather radar this morning and waited for the heavier rains to let up before I started hiking. The rain kept everything wet. Including the rocks. I did have a slip and a fall on some rocks that were on a sideways slant. Minor scratches on my right forearm.
No views due to the clouds. I did come upon a fire tower in the fog. Again, no views. I had three wildlife first observations today. The first was a newt that was not the usual red-orange color. I did see dozens of the red-orange variety due to the rain and damp ground. The second observation was a snapping turtle. We passed multiple ponds today. I guess it was traveling between ponds. The third observation was a first in my lifetime. I saw my first porcupine. It was up in a tree on the trail about at head-height. It just sat there while I spent about five minutes taking pictures and talking to it. It looked like a juvenile. I had this sighting on my wish list for this adventure! The other is a moose sighting. Hopefully that might occur in Maine. I hope the stars align and I make it there.
I arrived at Brink Shelter by 1:00. I was done for the day. I rested and did my daily camp chores. It started raining hard again around 5:30 pm. It is expected to continue to rain throughout the night. I am dry inside the shelter tonight.","Mohican Outdoor Center
",Brink Shelter,"Jun 20, Thu",11.90
Papa Smurf 2019,https://www.trailjournals.com//journal/entry/617093,"It rained all night. I delayed my start this morning until the hard rain let up. I got on the trail at 7:30 am and it stopped raining around 11:00 am. After the rain stopped, it turned out to be a decent day. The hike was not too hard and the temperatures relatively cool. All views today were filled with fog and a few partly cloudy sections.
I ran into ""Sunshine"" and ""Blue Grass"" in the afternoon. ""Blue Grass"" waited for all rains to end before ""Sunshine"" shuttled him back to the trail. By 2:30 pm I had reached my final destination, Rutherford Shelter. I set up my tent and went through my usual camp chores for the evening.
It will be nice to have a dry night for a change. Time to call it an evening on this first day of summer. Good night all.","Brink Shelter
",Rutherford Shelter,"Jun 21, Fri",15
Papa Smurf 2019,https://www.trailjournals.com//journal/entry/617094,"No rain expected today, and that is good. The previous rains however, did make the trail very muddy. Being muddy made it slippery in many areas. Other than the mud, the trail had it’s fair share of rocks, pasture land walking and marshy/swampy areas. Some of the marshy areas on trail had wooden boardwalks, which made travel through these areas much easier and enjoyable. 
I came to a wooden deck on trail. Atop this observation deck I could easily see on the nearby mountain. This is the highest point in NJ.  
Around lunchtime, I hiked into Unionville, NY and had my lunch and resupply at the General Store and Deli. (I also bought a sub sandwich for supper later this evening and it was good.) 
Later in the afternoon I made it to Pochuck Mountain Shelter where I set up my tent and went through my routine. All the hikers at the shelter this evening are new to me. Several weekend hikers and a few Flip-Flop Hikers.
Getting late. 
It is after 7:00 pm. Time for bed. We refer to this time of the day as ""hiker midnight"". 
Good night all.","Rutherford Shelter
",Pochuck Mountain Shelter,"Jun 22, Sat",17
Papa Smurf 2019,https://www.trailjournals.com//journal/entry/617172,"I was up and hiking early this morning since it was supposed to be warmer today than in days past. Again, I like to get up early and take advantage of the cooler temperatures. Hiking over swamps was the highlight for today. We had the usual boardwalks over the wetlands. There was one stretch where the boardwalks were elevated approximately four to five feet above the swampy waters, which made for easy walking. However, there was no shade and the sun beat down on you the entire boardwalk experience. There was also a suspension bridge that went over the Pochuck Creek and made for easy hiking in these sections.
While I was at a stream getting water for the remainder of the day, two guys walked up and asked me if they were hiking in the north direction. I told them, no, it was back in the direction they came from. They had been hiking 3.5 miles in the wrong direction. They were out hiking for the week and had taken precious time off of their schedule to start their journey. I saw them later in the afternoon at the Wawayanda Shelter where I was set up for the evening. They said the time lost today should not interrupt their schedule too much. They are from Tennessee and Illinois, and grew up in the New Jersey and New York areas. They were looking for better tools (maps) to help them on their hike, so I showed them the AWOL Guide and Guthook app that I use to aid me during my hike. They are strongly considering getting either one or both of these items. 
My tent is set up and I am going through the chore activities for the afternoon. The camp is almost full. The shelter is full and all the tent sites are taken. Crowded with thru hikers (NOBO, Flip-Floppers, Section Hikers & Week-Long Hikers), it feels unusually crowded.
Time to prepare supper and settle in for the evening. Good night all.","Pochuck Mountain Shelter
",Wawayanda Shelter,"Jun 23, Sun",11.50
