Hiker trail name,Hiker Journal Link,Journal Story,Start location,Destination,date,Today Miles
Pockets,https://www.trailjournals.com//journal/entry/500150,"Day 67 - I wasn't sure how far I'd go today - the humidity was lower, but the temperature seemed higher. I was still sweating profusely on the uphills. In the end, I decided that 15 miles was enough and there wasn't a really good reason to push on the last 5.5 easy miles to Waynesboro. I'll still get there by 10 am tomorrow, time enough to clean up and participate in a hiker feast before my wife arrives around 4 pm. A thunderstorm hit in the afternoon and lasted quite a while while I was hiking.   After getting pleasantly cooled down, but before I was soaked, I happened upon a rock overhang. I was able to keep from getting drenched by taking refuge underneath it. Sometimes you just get lucky. The storm broke the humidity and cooled things off nicely for the evening. The shelter here is spacious and clean so I decided not to tent. It should make getting out of here early easy and maybe I'll even get into town in time for a big breakfast. There will probably be only 5 of us here tonight unless there are some late arrivals. Pickles just spilled a big pot of cooked orzo on the shelter floor. Do bears consider orzo to be food? If so we might have visitors tonight. We are at the northern end of the 'problem bears' section. Zissou is staying here tonight - he has been feeling bad all day and has vomited multiple times. He thinks it's food poisoning from some bad cheese or an overripe avocado he ate. I'm hopeful it isn't a norovirus. That is somewhat common on the trail, is very infectious, and lasts for 1 to 3 day. It causes severe vomiting, severe diarrhea, and in really bad cases hospitalization is called for. This may be my last post for about a week. I may post some pictures from the Outer Banks of NC, but that will be up to my wife, who may want a vacation from Trailjournals. So, until whenever.....","Maupin Field Shelter
",Paul Wolfe Shelter,"Jun 12, Fri",15.80
Pockets,https://www.trailjournals.com//journal/entry/501578,"Day 68 - I was able to get on the trail by 6:30 this morning, my earliest start so far. I was driven by the prospect of a scrambled eggs/bacon/coffee breakfast and shower in Waynesboro before meeting up with my family. The hike took 2 and 1/2 hours and then another hour to catch a ride into town. I was able to get a shower at the YMCA and sat down to eat by 10:00 AM. It was TrailFest Day in Waynesboro; all events sponsored by the YMCA. They provided free camping in town, free showers, an AYCE lunch at a local restaurant, and a free movie at the Zeus 8 cineplex - not a bad way to spend the time waiting to be picked up. Half the hikers watched the new Mad Max movie. Most of the rest, including me, watched Jurassic World, with many of the hikers rooting for the dinosaurs. There were about 40 or 50 hikers in town taking advantage of theTrailFest activities. While eating lunch, I heard that last night Stretch and several others had encountered a bear about 1/4 mile past Paul Wolfe Shelter. They had decided to continue on into Waynesboro for beer and pizza instead of staying at the shelter like me. The bear actually charged Stretch, but she held her ground and it veered off into the woods. My wife and daughter got here by 5:00 pm and by 9:30 pm, we got to Oxford, NC, where my son lives. We intend to complete the drive to the Outer Banks of NC on Sunday. A hot week is forecast in Virginia for next week, so this may be a good time to be off the AT.","Paul Wolfe Shelter
","Rockfish Gap, VA","Jun 13, Sat",5.50
Pockets,https://www.trailjournals.com//journal/entry/501832,"Dear Readers - This entry and the next 5 entries have been entrusted to Mrs. Pockets to compose as both of us did nothing but rest and relax while Pockets took time off the trail and I took time off Trail Journals. Hah! It's not too much of a stretch to imagine that I, Mrs. Pockets, have pretty much turned into a Trail Journals junky since I'm intently following my husband's journey and entering his data on Trail Journals almost daily. I've read lots of entries in hikers' journals about how thrilled they are to come upon unexpected trail magic. I thought it would be lots of fun to be a trail angel, but heck, our house is nowhere near the AT. As I prepped for the road trip from Western NY to Virginia to pick up Pockets, I got the brilliant idea to leave a couple of styrofoam coolers with water bottles, coca-cola, apple juice, and packaged snacks somewhere along the trail. Since Pockets was sure he'd be enjoying TrailFest in Waynesboro, VA by the time I made it there, I decided to leave trail magic off Miller's Gap Road- between Carlisle and Duncannon, PA. I didn't see any thru-hikers when I dropped it off.   I hadn't been following any hikers on Trail Journals who were already in Pennsylvania. I wasn't sure how many hikers would come across my trail magic. My plan is to fill the coolers back up as I head back up north after dropping Pockets back on the trail.","Rockfish Gap, VA
","The Outer Banks, NC","Jun 14, Sun",0
Pockets,https://www.trailjournals.com//journal/entry/501833,"Dear Readers: Mrs. Pockets here - Nearly every summer for over 25 years, Pockets' side of our family has gathered for a week long family reunion. His parents have since passed on and his siblings and their offspring have scattered all over the USA-a nephew and his wife even joined us from Germany this year. Gatherings in those early years tended toward small cabin camping accommodations somewhere in the Eastern USA and especially in the state where he and his 7 siblings grew up. As the size of our extended family grew, we have headed more toward The Outer Banks of North Carolina, where there is an abundance of very large multiple bedroom vacation houses. Not all of the family made it this year and some that were there didn't pose for this photo, but this is a bunch of us. Today was Pockets 62nd birthday! Two cakes, off key singing and liquid refreshment followed the taking of this photograph.","The Outer Banks, NC
","Vacationing in the The Outer Banks, NC","Jun 15, Mon",0
Pockets,https://www.trailjournals.com//journal/entry/501862,"Dear Readers: Mrs. Pockets here - What else could you expect for today's entry? We're at the beach after all! The first full day at the beach is always anticipation, excitement and hurry - get up, lather up, head out, set up, sit a spell, and hit the water. It was over 90 degrees most days we were there. So repeat the lather, the water and sitting several times over again. Try hard not to look like a lobster after the first day and end up being confined to the house until the sun goes down. Throw in some reading under a beach umbrella, interesting conversations, beach games, body boards, and a kayak too. Well, that's how we gear up for happy hour.","Vacationing in the The Outer Banks, NC
","Feet in the sand on The Outer Banks, NC","Jun 16, Tue",0
Pockets,https://www.trailjournals.com//journal/entry/501864,"Dear Readers: Mrs. Pockets here - hmmm...Happy Hour(s)- let's just say they are a family tradition that goes way way back. I'll let the photos do the talking for this entry. What is not apparent from the photos is the decibel level. Um, just a tad high. There are also several family members who fancy themselves as singers, which is always a hilarious treat and often results in sing-alongs.","Feet in the sand on The Outer Banks, NC
","Happy Hour(s) at The Outer Banks, NC","Jun 17, Wed",0
Pockets,https://www.trailjournals.com//journal/entry/501866,"Dear Readers: This is Mrs. Pockets here - I must admit that today's entry was totally NOT MY IDEA. Pockets insisted on it. Something happens to most of the guys in this family when they get together that promotes a bit of manly men behavior. To be fair though, I suppose the gals get a little crazy too, but you won't see us adding any photos on here like the guys did. A special note to Pockets' former co-workers and long time friends: Viewer Discretion is Advised. You may NOT want to click on his photos page right now.","Happy Hour(s) at The Outer Banks, NC
","On the Beach at the Outer Banks, NC","Jun 18, Thu",0
Pockets,https://www.trailjournals.com//journal/entry/501884,"Dear Readers: Mrs. Pockets here - I'd like to think we got up early on our last day at the beach and watched the sun rise over the ocean, but that story ending might be more for movies. It didn't happen like that. We scurried around looking for all our stuff, which, of course, was not organized because we really didn't want to leave. The sunrise photo you see is from a day or two before the last day.   We had just watched several incredible night time lightning storms from the rental house's crow's nest deck though. They looked like mini fireworks. We dropped our son off at his new apartment near Raleigh, NC and then headed for a hotel in Waynesboro, VA. Our daughter drove us back to Rockfish Gap bright and early the next morning so Pockets could get back on the trail. Goodbyes are always hard, but hey, he's hiking north. That's closer to home base and that will make brief visits with him more possible. On the way back to Upstate NY, we again stopped at Miller's Gap Road in Pennsylvania to see what was left of our trail magic and to restock, if necessary. We were rather surprised to find everything had been comsumed- so we reloaded as best we could with water and snacks. Our daughter flew back to California today. Now it's time to get these journal entries up to date. When Pockets reaches the area near Miller's Gap, I plan to return and add more trail magic there. Next up, back to Pockets' TJ entries. Mrs. Pockets is signing off...","On the Beach at the Outer Banks, NC
","Waynesboro, VA","Jun 19, Fri",0
Pockets,https://www.trailjournals.com//journal/entry/501950,"Day 75 - This was a difficult day, both mentally and physically. I forgot to check where the next water source was before I started hiking. I was carrying just 1 quart of water. That, plus a diet coke I had yogi'd had to last about 10 miles on a hot and humid day. 20+ miles is a long distance on any day on the AT.   On the first day back on the trail after 6 days off plus wearing new shoes, my feet were complaining loudly. Mentally, I was having a hard time getting back into the trail routine after all those days on the beach doing absolutely nothing - and now I was working very hard, wishing I was back at the beach. I hope I can make the mental switch back to the trail soon. I saw my first rattlesnake today - it was on the trail looking at a rabbit that was about 2 feet from it, also on the trail. It was way too big for the snake to eat so I don't know what was going on. As I approached, it turned to look at me and rattled, which is when I realized it was a snake and not a 2.5 foot long stick. As I fumbled to get my camera out, it slithered off the path except for it's tail. I guess I'd better start watching carefully where I'm putting my feet. With my eyes on the ground, I almost ran into one of the pretty tame deer that are here in the park. The thunderstorms held off until late in the afternoon. Given the heat, I was glad to get slightly rained on. There's a full shelter here tonight and a campground full of scouts. No one here is planning to hike naked tomorrow for the annual 'Hike Naked Day'. I was going to wear the speedo I wore on the beach, but decided against it - too many bugs!!!Until tomorrow....","Waynesboro, VA
","Blackrock Hut - SNP, VA","Jun 20, Sat",20.20
Pockets,https://www.trailjournals.com//journal/entry/501951,"Day 76 - Today was another challenging day. The long miles on my first day back yesterday gave me a couple of blisters, and at some point along the way, I must have overextended my right knee. The heat and humidity weren't quite as bad as yesterday, but still an issue. I made it a point to keep the miles lower today and will continue to do so until the blisters and knee are better. That means I can sleep in later if I'm in my tent, hike slower, and still get to the day's destination a little earlier. The big event today, aside from ice cream, soda, and sardines at the Loft Mountain camp store, was a rattlesnake that was blocking the trail. It refused to budge despite my prodding it with my trekking pole. All that accomplished was to piss it off and make it curl up in an attack pose with it's tail rattling furiously and still occupying the center of the trail. There was thick brush on both sides of the path. Eventually I decided that I had to end the impasse and eased my way past it. I was much closer to it than I wanted to be - about 2 feet. Someone later told me that they can strike their full body length - in this case that would have been at least 4 feet. I will be more cautious in the future. I've met up with hikers HVAC and Lorax, a married couple from Montana who are my age. They started late March and are also keeping a journal on Trailjournals.com. Everyone but me seems to be seeing bears. I'm ready to start seeing bears and to stop seeing rattlesnakes. At least with bears, I can stop fixating on the ground and don't have to worry about where I put my feet. Today was supposed to be 'Hike Naked Day', but I didn't see any naked hikers in spite of my best efforts. They probably passed me while my eyes were on the ground looking out for snakes. I had considered wearing my beach attire (a speedo), but this was also Father's Day, a weekend day and I'm in a national park. I could just imagine all the section hikers talking about that 'crazy old speedo wearing hiker'. Until tomorrow.......","Blackrock Hut - SNP, VA
","Pinefield Hut - SNP, VA","Jun 21, Sun",13.20
Pockets,https://www.trailjournals.com//journal/entry/501962,"Day 77 - The huts aren't spaced well in Shenandoah and don't easily allow for 15 to 18 mile days. I was going to have a short day today. When the sun rises at 5:30 am and other hikers start getting up at 6 am and make a lot of noise as they tear down and pack up, it is difficult to sleep in late. Once I'm up, there's not much to do except start walking. Since I'm camping by myself tonight though, I can sleep in as late as I want. My knee is feeling better, but my left foot has a blister on the ball underneath a large callus and any pressure on that is painful. That's the main reason I stopped short before reaching Lewis campground. That was my goal for today and which, if I had made it, would have resulted in another 20 mile day. I passed the 900 mile point today, but I missed the marker on the trail, so I have no picture of it. I'll try to get one from someone else. But 900 miles - damn that's a lot of miles! Lorax and HVAC are dealing with the hut spacing a little differently than I. They hitched on the Skyline Drive ahead, I think to a lodge. I considered hitching myself, but the traffic was thin and HVAC wasn't having much luck. So stealth camping totally by myself is a first for me. I think I was stung by a bee while taking a break at a picnic area. It's either that or a brown recluse spider bite. It's on my back at that one spot that's impossible to reach with either hand. I think it's a bee because they were swarming all over my pack for some reason while I was taking the break. One may have become trapped between the pack and my back when I put the pack back on. Most things won't sting you through a shirt, but I think a bee can sting through one. I'm getting back into the hiker mindset - it's taken a while but I think I'm going to be okay. Until tomorrow.....","Pinefield Hut - SNP, VA
",Stealth campsite @ mile 911.5,"Jun 22, Mon",16
Pockets,https://www.trailjournals.com//journal/entry/502090,"Day 78 - The trail these past 3 days has certainly been the easiest so far. If it was not so hot and humid and I had no injuries, I could really cover some ground here. It's a little frustrating to do only a little more than 12 miles today. I know that it's not a race, but I'd like to make up some of the time I lost while at the Outer Banks. Meanwhile, my blistered foot and overextended knee are feeling better so that is returning to normal. My mental attitude is improving as well as I distance myself from time spent with family and have more days on the trail. I remind myself that I have a whole lifetime ahead to do the things I'm missing now, but only one chance to do the AT. The website www.atweather.org warned of violent storms with damaging winds in this area starting around 3:00 pm and lasting until about 11:00 pm as a cold front moves through. I decided that was reason enough to spend the night at Big Meadows Lodge instead of in a tent in the woods. To me, 'damaging winds' in the woods means 'trees and dead branches falling'. So I'm having a very pleasant evening in the lodge. I had a good dinner w/beer and watched the storm come in from the west. According to NBC's nightly news, this same front has wreaked havoc all along the eastern US with reports of tornadoes, softball sized hail, etc. The good news is that the high tomorrow will only be in the upper 70s, so finally a break from the heat. HVAC and Lorax have also stopped here for the night and will be heading out in the morning. One of the benefits of hiking the AT in Shenandoah National Park is that there are camp stores, restaurants, waysides, and lodges scattered along the trail so I don't need to carry much food, which makes for a light pack. So far I've hit the Loft Mountain camp store and wayside, the Lewis Mountain camp store, the Big Meadows Lodge, and tomorrow I'll hit Skyland at some point. A 'wayside' is just a restaurant along Skyline Drive. Last night's stealth camping was pretty interesting - my first night alone in bear country. There's safety in numbers so most hikers like to camp at shelters/huts in the evening. The huts also have bear poles for hanging food out of the reach of bears. I didn't have any of that when stealth camping, but the upside was that I was able to sleep as late as I wanted without being awakened by the noise of all the early risers breaking camp. I am a little disappointed that I have not yet seen any bears here in the park when it seems everyone else has. Until tomorrow....","Stealth campsite @ mile 911.5
",Big Meadows Lodge,"Jun 23, Tue",12.60
Pockets,https://www.trailjournals.com//journal/entry/502232,"Day 79 - Today was just what the doctor ordered to cure my mental malaise - low humidity, sunny skies, and temps in the mid to upper 70s along with a nice breeze. In addition, my feet and knee are almost back to normal. I also got a diagnosis for that thing on my back that I thought was perhaps a bee sting or a brown recluse bite - shingles!!! This is a fairly small and mild case - Traildoc (not his real trail name) looked at it at Skyland and made the diagnosis. What is surprising is that I got the shingles vaccine last October. He said that it was a good thing that I had gotten it or it most likely would be much worse. I have a patch about the size of a quarter and it matches all the shingles symptoms, but mainly it just hurts. It's not so bad. I can ignore it. It should be gone in about 2 weeks, but I may stop in at an urgent care facility in Front Royal to have them look at it when I exit Shenandoah if it doesn't clear up by then. I got a late start today. That was partly because of the breakfast I had at Big Meadows with HVAC, Lorax, and Cricket, and partly because I wanted to resupply at the Big Meadows wayside. Resupplying there would eliminate the need to hitch into Luray to resupply this evening. The problem with that was it was 0.9 miles from the lodge to the wayside and no one stopped to give me a ride. Then when I went to pay I realized that my money and credit card were back at the lodge. So I had to go back to the lodge, get my credit card, then go back to the wayside to pay. Bottom line - I didn't get onto the AT until after 10:00 am. I hope I learned a lesson in there somewhere. I have a problem getting rides when hitch hiking. I think it's because I'm tall and I must look like a hobo. Someone told me that thruhikers are basically hobos with a credit card. HVAC and Lorax treated their clothes with a veterinarian strength (5%) permethrin solution as a tick repellant. It caused a bad rash reaction when they wore the clothes. The Sawyer's brand permethrin solution is 0.5% - this is what I have used and I've had no problem. I ran into HVAC, Lorax, Cricket, and Ambush at Skyland where I stopped for lunch #2 - HVAC and Lorax are staying at the lodge there tonight so I don't know when or if I'll see them again. I enjoyed their company when I was with them. Tomorrow morning I'll cross Thornton Gap where my brother 'Cotton', my sister 'Spyder', and I finished our Shenandoah section hike a few years ago. After that, I will once again be in virgin territory as I go north from there towards Front Royal, the northern terminus of the park. After that comes the 'roller coaster', a series of about 13 PUD's (pointless ups and downs) before coming to Harpers Ferry in West Virginia. Harper's Ferry is the unofficial 1/2 way point between Georgia and Maine. I'd like to get there before I reach the 90 days (3 months) point so that I feel like I'm on track to finish in 6 months. Until tomorrow.....","Big Meadows Lodge
","Byrd's Nest #3 Hut, SNP, VA","Jun 24, Wed",14.40
Pockets,https://www.trailjournals.com//journal/entry/502408,"Day 80 - Way back when I was still in Tennessee, I promised you, dear readers, that I would photograph some bear poop. Everyone has seen photographs of bears, nothing new there. But how many photos have you seen of bear poop? Probably none, until today, that is. And this is fresh, probably less than an hour old. Bear photos - same old thing. Bear crap photos - out of the box thinking!!! Tonight is my last night in Shenandoah National Park. In general, the hiking was the easiest to date, but it was made more difficult by hot, humid weather and my knee and foot problems. Those added at least a day to the time it took me to transit the park. Now mostly healed, I expect to take only 3.5 days to get to Harpers Ferry. I should get there by the 29th of June. From there, it's only a day or so to get through Delaware and into Pennsylvania. I'm ready to be done with Virginia with it's 500+ AT miles. At the same time though, I'm a little more apprehensive about Pennsylvania with it's infamous rocks. After a week back on the trail, I think I have lost most of the weight I gained on the Outer Banks. It's difficult to know for sure without actually weighing myself. Maybe I'll have a chance to do that tomorrow in Front Royal when I go there to resupply. The last time I weighed myself I was at 181.5 pounds, but I have no idea how accurate that scale was. I heard a new description on the AT today: ""The world's longest pub crawl"". It does make sense - lots of the young hikers love their beer, they stop at every bar in a trail town. Then they hike to the next trail town and repeat the process all the way up to Maine. Note to Steve Sturm - the book you gave me was just too heavy to continue to carry; I ended up leaving it at a shelter. Maybe it has found a receptive reader(s) there!!Until tomorrow......","Byrd's Nest #3 Hut, SNP, VA
",Gravel Spring Hut,"Jun 25, Thu",17.50
Pockets,https://www.trailjournals.com//journal/entry/502607,"Day 81 - I finally saw a bear in the park today - it was far more satisfying than finding bear crap so forget all that stuff I wrote yesterday!!! Today was going to be a 12 mile day ending up in Front Royal for resupply. Ambush told me about a hostel he was stopping at (Terrapin Station) and that seemed like a much less expensive option. A stay there included a shuttle into town for resupply so that sealed the deal. The forecast for tomorrow is for a 100% chance of rain. The weather guys are forecasting 1 to 3 inches of rain with flood warnings. If that's true, there is a chance I might stay here tomorrow as well. I visited the urgent care facility when I went into the town today. They weren't convinced that I had shingles. Instead, it might be some other skin infection that is already starting to heal, so that's good news. While there, I weighed myself on their digital scale - 190 pounds. That is good news as well. I have decided that if I drop below 175 lbs., I will need to get off the trail. So 190 lbs. is a change in the right direction. The hostel here is owned by Mike Evans, an AT and PCT thruhiker with lots of stories to share (and beer/pizza to drink and eat). I recommend this place highly as an alternative to overnighting in Front Royal. In fact, I think I'll have some pizza right now. Until tomorrow.....","Gravel Spring Hut
",Terrapin Station Hostel,"Jun 26, Fri",9.60
