Hiker trail name,Hiker Journal Link,Journal Story,Start location,Destination,date,Today Miles
Running Nose,https://www.trailjournals.com//journal/entry/615098,"My old trail blisters have turned into itchy callouses and my gear is still scattered about my screened in back porch waiting to be cleaned and packed away.  I’ve been home for several days and back to commuting an hour plus to/from work. I just finished 10 days climbing up and down rocky mountains carrying a backpack without injury, but yesterday my back went out just sitting in my office chair. Sheesh!  Wish I was still on the trail!
Anyway. Enough whining. It was just a lovely section hike and I was blessed with beautiful weather, pleasant interactions with hikers and others, no lost or broken gear, wonderful views, and peaceful, serene, and rejuvenating hours walking in the woods.  What more could one want? Just more of the same IMHO. 
So here are my conclusions. Everyone is going to have their own preferences and ideas, especially when it comes to gear. I provide this just so you can better understand how I worked things and have the opportunity to incorporate anything you see as useful into your regime. 
THOUGHTS ON ME
Blisters 
I did work at trying to get conditioned for this hike. I’d lost some weight. Did a good amount day hiking most weekends, working up to a 23 mile hike a few weeks before my shakedown. I have a good pair of Altra Timp Trail 1.5 trail runners that fit my feet well and wore Darn Tough boot cushion wool socks.  I did take breaks several times a day, taking off my shoes and socks for 20 minutes or more most times. I guess all of that was necessary, but just not sufficient in my case. Maybe I pushed too hard my first day, racing down the C&O Canal? Not sure. I certainly could stand to lose a solid 20-30 more lbs.  That would definitely help. I’m pretty confident my blisters were not from poor fitting or rubbing footwear but from just the repeated impact and pressure of my steps. Treatment?  (If you are squeamish skip this part) These were deep on the balls of my feet and lower heels under calloused skin. I had to pop them by cutting into them with a nail trimmers I carry that is similar to a handheld wire cutters.  A pin would not do the trick. I found it best not to try and cover them with moleskin.  Instead, I fashioned a pad about the size of the blister from gauze from my first aid kit and secured it with surgical tape. Note - wrapping the tape all the way around the foot so it is secured to itself will keep it in place so you don’t have to redo the whole thing every time you take off your socks.  Even the surgical tape won’t stick for long on your sweating, constantly moving feet. Don’t wrap the tape too tightly or it may restrict circulation in your feet or start cutting into them causing you more problems down the trail. Forget about band aids. They will not stay in place on your feet. This method let the blister drain and breathe while still providing some padding to the area. For me, Ibuprofen was much more effective at controlling this type of pain than Tylenol.My wife sent the rockplate inserts from my old pair of Altra Superior trail runners to my resupply point halfway through my hike.  I put the inserts in to my Altra Timp Trail 1.5 shoes. My theory was that these would help distribute the force of my footfalls. They didn’t seem to hurt, but I’m not certain they significantly helped - it’s possible they did. I wore them for the rest of my hike and I’ll probably continue to use them in the future.The blisters began healing a day or so after I popped them. It could be that for my feet, body mechanics, and gait that some starting blisters are just what I can expect at the start of a backpacking trip. Just the price of admission for a walk through heaven.Tempering my desire to go more miles helped with the healing. By the end of the day I could tell that if I went the extra 3-5 miles my legs could manage that my feet would be worse off for it.  My advice - Listen to the feet. 
Conditioning 
I was definitely in better condition for this section hike than my previous section hike two years ago. I had lost some weight (but still maybe 20-30 lbs overweight), and had done a good amount of weekend day hiking. This definitely gave me more stamina than I had before. I didn’t get winded as often on the uphills and was not completely exhausted when I stopped for the day.  While this definitely makes it easier, the natural human tendency is to push until it starts hurting and then wonder why.  I’ve seen plenty of people I’d say were more overweight or not in as good shape as me on the trail doing just fine. The simple fact is that it’s just walking, and you are in complete control of how far you go and at what pace you get there, as well as how much you carry along the way. 
Gravity Assist
On the downgrades I often find myself breaking into a sort of speed walk or slow trot gait. I’m sure this looks a little silly but I find it easier than wasting energy braking while going downhill. This is probably something you will not be trying if your knees are a problem for you.  I only do this if the trail and conditions permit. You need to stay in control, not get up too much speed, and be able to stop quickly at any point. If the trail is too rocky, steep, or wet this would be foolish. Know your body and your capabilities and act accordingly. 
Lollygagging
My section hike allowed for time to take some of the side trails to see the sights. Most of these were not too far off the AT and IMHO were worth the extra steps. Taking a bit of time to smell the roses along the way (and I quite literally did this several times) is definitely worth it I think. It can provide a quick change of pace and can be motivational as well as enjoyable. I tried to work these in as planned breaks or lunchtime stops when possible. 

THOUGHTS ON MY GEAR
Hennessy Hammock 
I’m very pleased with the comfort, ease of setup and packing, and greater ability to stealth camp VS a tent. I don’t have an underquilt but I do have a reflector, though I didn’t bring it on this trip. On one or two nights I would have been more comfortable if I’d had the reflector because of the wind and low temps.  That’s something I’ll reconsider on my next spring outing. I don’t sleep in the Shelters so with the hammock I don’t need to carry a sleeping mat.  Finding a good pair of trees usually takes a few minutes. The further apart they are, the more bow will naturally want to form in the line of the straps, tieout cord, and hammock proper, so the higher it must be attached to the trees to keep your butt off the ground.  When you first sit in it, it will naturally sag a bit as the lashing cinches itself up to the straps and tightens up. Plan for this by tying it a little tighter, leaving less room for the “knot” of your lashing to slide and cinch itself up to the straps, and position the straps so the hammock hangs a bit higher than where you want it to end up.I use the Hennessy snake skins to stow my hammock. I’ve tied a piece of fluorescent ribbon at the end of one of the snake skins so that I know which side of the hammock has the zipper opening and I can hang it appropriately without unfurling it from the snake skins. I like to set up so the guy lines of the rain fly on the zipper side of my hammock are wrapped around my trekking poles and then staked to the ground.  This raises the fly up a bit and makes the entrance more accessible. I also like to sit sideways using the hammock like a swing to cook and eat my meals.  No shelter picnic table needed! At night I tie my shoes together and hang them over the hammock underneath the rain fly. Socks, pants, and electronics gear bag hang on the ridge line inside.  Let me apologize in advance for this image, but it is possible to open the zipper and balance oneself hanging partially outside on the edge of the hammock and pee without getting out of the hammock. Sorry ladies, the difficulty class of this maneuver will probably be more challenging for you than it was for me. But desperate times often call for desperate measures. 
heavy duty lawn garbage bag 
I throw this on the ground like a tarp on which I put my gear and food when I’m cooking and packing up in the morning. I put my pack inside it at night to keep slugs and other crawly critters out and off of my pack and its contents.
Meals 
For dinners I bought large cans of Mountain House dehydrated meals. I portioned them out into individual freezer baggies. I put the baggie in the little flat-bottomed bowl that’s part of my cook system, then add the hot water. This keeps the bag upright and makes it easier to hold, but I still use my bandana like a hot pad.  I like to roll the top of the bag down to keep it more widely open when it’s ready to eat. I was happy with how this all worked out - a bit cheaper than the prepackaged individual servings, not as bulky, less trash, and maybe a few ounces lighter to boot!
Cooking 
I am pleased with the JetBoil MiniMo system as an upgrade from my old pocket rocket, collapsible pot and mug. Definitely more convenient and efficient and any weight difference is probably negligible IMHO. 
Water filter. 
I use the Platypus gravity water filter along with several collapsible plastic 1 liter bottles. Four bottles (along with my Nalgene) have been sufficient for my needs.  At the end of the day I like to get enough water for dinner, breakfast, and two liters to hike out with the next day all at once rather than going for water again the next morning before leaving.  If you are going for big miles the extra convenience of the Sawyer squeeze filter system might be worth not having to wait while your water filters.  For me, a water stop is a natural time to rest and having to wait while I filter water during the day is actually a good way to enforce something I need to do anyway and might be tempted to skip if I used the Sawyer filter.
Trekking Pole StrapsThis is probably going to be obvious to most people but it took me a while to put it together. When I first started hiking I was bothered by the feel of my trekking pole straps and didn’t use them. “Why do I need these straps?  It’s not like the poles are going to suddenly jump out of my hands, right?!  And they make it a pain to put the poles down.”Eventually I learned that the straps can distribute some of the force so that you don’t have to grip the poles as tightly if you “lean” on the straps with your wrists. Then I realized that with the straps I could let the poles drag behind me as I walk and use my hands to open and drink from my water bottle or eat a snack without having to stop.  Priceless. Caveman-realizes-rock-can-smash-nutshell type moment. Water Bottle 
I switched from a wide mouth Nalgene water bottle to a narrow mouth bottle. Definitely get a small mouth bottle if you don’t have one. You can drink from the bottle without having to stop to avoid spilling water all over yourself when hiking. Priceless.  Having a hard water bottle lets me mix up protein shakes and water add-ins like electrolyte supplements easily. I used to use one of those water bladders that slip into sleeve inside the back of the backpack and have a sipping tube that clips to a pack strap. One day on a trip in the past after getting water I was trying to squeeze the bladder back into my pack without having to completely unpack and repack all my stuff when the damn thing spouted water all over the contents of my pack. I haven’t used one since and don’t miss it in the least.  Your mileage may vary. 
Waterproof Stuff Sacks
All my gear is sorted into various waterproof stuff sacks except for the few things that are impervious to water - ex. stove and fuel canisters. I have a few things in gallon ziplock baggies like my food and meds for the day on trail and my toiletries kit.  These things it is nice to see inside the bag before opening it. My actual food bag is a large waterproof stuff sack intended for kayaking. It’s a bit more durable than the standard backpacking variety and bright yellow, making it easy to find in the morning. If I need to carry extra water in my pack, the bottles go inside a waterproof stuff sack because newly filtered water is generally cold and the bottles will sweat. Also, lids can come off, container seams can fail, and if it could happen it probably will happen to me.  All this gives me extra assurance that all my stuff will remain dry even if I slip and fall in a creek or do something pathetically comical like that. I still use a rain cover for my pack to keep it from soaking up a few extra few pounds of water during a downpour, but this way I don’t need a pack liner. In the past I’ve tried using a garbage bag for this purpose but I found it to be more of a pain is the butt than it was worth. Without a pack liner you can more easily find and/or reposition stuff in your pack.",,View Entry,"May 31, Fri",0
