Hiker trail name,Hiker Journal Link,Journal Story,Start location,Destination,date,Today Miles
Running Nose,https://www.trailjournals.com//journal/entry/614555,"From Rocky Mountain Shelters (AT mile 1081.3) to Birch Run Shelter (AT mile 1094.3)
[I had no cell service at Birch Run Shelter tonight  so I wrote this entry offline and will up load it along with the days pics when I get covertage]
I was roused from my sleep around 5:30am thinking, “What kind of jerk is setting of firecrackers in the woods this early in the morning?!”  There was very loud BOOM as I realized a tree was falling and it hit the ground. I’m glad I checked all the trees surrounding my hammock for large dead limbs and standing dead trees. Word to the wise:  ALWAYS look up around your tent or hammock site and don’t set up near dead wood. There are a lot of standing dead trees in the woods because of past insect and fungal invasive species depredations and a dead tree does not always look dead at the ground level.  Nuf said. 
I had breakfast, packed up, wished Nay Nay well, and was on the trail by 7:30am.  Dodge O has already departed and Pink Socks was still sleeping.  It was a truly glorious day today, temps in the mid 60’s and low 70’s with wonderful breezes and sunny skies. Perfect hiking weather. 
Early in the morning I encountered a section of boulders I had to pick my way through and scrabble over. It was a fun little challenge. 
I soon crossed over PA route 30, waiting for my break in the traffic and jogging across.  This road runs east to my hometown of Lancaster, PA. I am kind of in my home turf now. I’ve done several hiking and backpacking trips in this area before. 
On the other side of 30 the trail enters Caledonia State park - a real treasure. I came across a wonderfully aromatic wild rose bush right there. The trail was detoured east on the Trolley trail, perhaps due to some maintenance project, but rejoined the AT after a short distance. 
After leaving the gravel paths of the park the trail began a big climb from about 900 ft to over 2,000 ft.  The trail passes through towering rhododendrons literally forming a green tunnel. The rhododendrons here have their new light green spring growth leaves but haven’t started to blossom yet. In a month or so this will be filled with purple and white magnificence!
The green tunnel widens to allow space for the Quarry Gap Shelter. This is without a doubt the most lovingly and meticulously maintained AT shelter I have yet seen. There is a picket fence and potted flowers, a porch swing, a sundial and a beautiful deep clear spring runs just feet in front of the shelter. Oh and the wooden duckie cutouts are awesome.  A hanging sign proudly declares that the shelter is maintained by “Innkeeper” Jim Staunch. I have to say, kudos to you sir, and a hearty and heartfelt thank you!
The trail spent a good amount of time meandering through conifers today. Often there was a carpet of pine needles and the heavenly sent of pine in the air. 
I ate my lunch of turkey jerky around 11:30am just after one of the power line crossings on the trail. 
My feet had a good day and I hiked without and pharmacological assistance (I.e. pain relievers).
I took a short afternoon break at the bottom of a steep hill where the trail passes the Milesburn cabin on a conveniently located bench by the stream crossing there. 
The trail passed through a section of forest that had just been logged. They rarely clear cut anymore, instead leaving some trees standing in the harvested area but spaced out. I wouldn't call myself a tree-hugger but having recently listened to the book, “The Hidden Life of Trees”, I was disheartened to see this. Especially right on the AT. Trees are communal lifeforms which depend on their roots connecting to other trees through fungal networks. Sister trees actually help their neighbors who are stressed or wounded by sending them nurishment through these root connections. When a tree has no neighbors that can help it through a bad year it is more susceptible to disease and insects. This is one reason why the trees in our “managed” forests rarely live to be 100.
I arrived at my destination, the Birch Run Shelter, around 3pm. I filtered water and briefly soaked my feet in the ice cold brook that runs in front of the shelter, then I wandered about looking for a suitable spot to hang my hammock. It was soon time for dinner and I fired up the JetBoil stove and had my ziplock freezer baggie of beef stroganoff with a desert of butter flavored waffle cookies and a big mug of cinnamon black tea. 
Dodge O, one of the hikers I met at yesterday’s shelter is also spending the night here. A gaggle of young weekend hikers arrived at the shelter as I was finishing dinner. They’re competing to see who can build the biggest fire. I’m sure they’ll be up late, but hey, I’ve got earplugs baby!
My food bag is hung from one of the steel bear poles here at the shelter and it’s 8pm as I finish writing this.  It was an fantastic day. Heading to pine Grove Furnace tomorrow - home of the half gallon challenge. If you eat an entire half gallon of ice cream in under one hour you get a free wooden spoon!  We’ll see how I’m feeling about this when I get there. Night all.","Rocky Mountain Shelters
",Birch Run Shelter,"May 24, Fri",13
Running Nose,https://www.trailjournals.com//journal/entry/614556,"From Birch Run Shelter (AT mile 1094.3) to stealth campsite ~0.7mi north of Pole Steeple (AT mile 1107.4)
[No cell coverage from my campsite again tonight so I am writing this offline and will upload when the opportunity arises]
Today was a day for snakes. No worrisome encounters but I did see a couple. First, I saw a timber rattlesnake in the woods near the privy this morning. He wasn’t rattling just laying there chilling out. Pretty cool. I got a pic and uploaded it if you want a peek. This afternoon at a high rock overlook someone pointed out a copperhead curled up in the rocks. I got a pic of this fella too. And lastly, while hanging my food bag I found a full length snake skin (without the snake in it).
Before leaving the shelter this morning I warned two guys hiking with a dog about the rattlesnake. Their pooch was the spitting image of my mutt Ivy - coloring, build, size, and temperament but male not female. I saw them several times throughout the day. 
I hit the trail around 8am this morning. It was another picture perfect day with fantastic weather.
Early in the day the trail passed through a more open section for about a half mile where the fragrance of wild roses was wafting around on the cool morning breezes.  Most excellent.
I took a break at Toms Run Shelter around 10am. The trail to and from this shelter was very wet. At some points you are literally hiking in what seems like a stream, moving from rock to rock. 
The trail around Pine Grove Furnace State park is true to the name. You are walking through groves of pines. 
The trail takes a short walk on roadway and passes by the Iron Masters Mansion which is a hostel for hikers.  A few steps further up the road I stopped for lunch at Pine Grove Furnace General store and had a bacon cheeseburger and a large dish of mint moose tracks ice cream. 
This establishment is the host of the Half-Gallon-Challenge. In celebration of reaching the halfway point in the AT, hikers will try to eat an entire half gallon of ice cream. If they finish in under an hour they get a cheap crap wooden ice cream spoon to memorialize the achievement. The record time is under 5 minutes!  There were several hikers attempting the feat when I left. I hope they have plenty of TP just in case!
I had planned to upload yesterday’s journal from the store but I got no cell coverage. Damn.
The Appalachian Trail museum is just a few hundred feet up the street from the store. I stopped in to look around.  There's some cool memorabilia there especially if your into the AT and hiking. I love the photo of Grandma (Gates?  her names not coming to me), one of the early hikers to do the entire AT. The photo shows her with all her gear in the sack she just slung over her shoulder and trudged up and done mountains with for 2,200 miles! Now that’s tough. Her first baby probably came out sideways and she didn’t scream or nothing!
The trail meanders through the park for a bit. There were plenty of picnickers out on this Memorial Day weekend.  A couple of thru hikers I met back at the store took a half hour to soak their sore feet and ankles in the lake here, part of which allows swimming. 
The trail leaves the park and begins climbing up for about 2.5 miles. Along the way up I stopped at a spring to “camel-up” on water because I’m not camping at a shelter with a water source tonight. 
Soon afterward I took the side trail to the Pole Steeple overlook. I left my pack at the bottom of the rocks and headed up and out onto them to take in the view.  It is definitely a very nice view and I got several pictures. I was also able to get a phone signal and was finally able to touch base with the home fort. 
My planned destination was a tent site not far from the Pole Steeple side trail. When I got there I discovered a “widow maker” dead tree standing perfectly straight up and with a line to drop on every viable hammock site I found. I decided that perhaps the trail gods where speaking to me the other morning when I was awoken by a falling tree and decided to press on in hopes of finding a better spot down the trail. And, perhaps a mile or so later, I found a decent spot to stealth camp just off the trail where the odds of not being crushed were considerably more favorable. 
I was settled in and cooking dinner by 5pm under the cover of my rain fly when it began to drizzle for a bit.   It has stopped for the moment but I can occasionally hear a thunder clap in the distance and it “feels” like some rain is likely tonight.","Birch Run Shelter
",Campsite beyond Pole Steeple,"May 25, Sat",13.10
Running Nose,https://www.trailjournals.com//journal/entry/614622,"From stealth camp beyond Pole Steeple (AT mile 1107.4) to Alec Kennedy Shelter (AT mile 1119.5).
I slept like a baby last night, about 11 hours!  This morning I had eaten, packed up and broke camp by 8:30am. 
I stopped at the James Fry Shelter for a break around 10am. I finally had cell coverage and decided to call my lovely wife with a status update and take some time to upload my photos and journal entries from the last several days. 
As I was on the phone, a gaggle of young children appeared at the shelter. One asked in an incredulous tone, “Do you LIVE here?!”  Their parents soon caught up. “It’s best to give them stopping points like this ‘cabin’ and we can catch up rather than running after them the whole way.”
I ate lunch and went to filter some water at the shelter’s spring, and the family had moved on.  I passed them soon after I rejoined the AT at a wooden bridge stream crossing. 
Soon after, the trail crosses Pine Grove road and walks for a stretch on a nice smooth and level path which looks like an old railroad bed. There are fens and bogs on either side of the trail. The trail eventually took a turn and crossed a working railroad track complete with several cars sitting on a side track. 
Around 1pm it was beginning to get warm and I began to hear the rumble of thunder.  When the first drops began to fall I stopped to put on my pack’s rain cover and put my phone in it’s waterproof case. It never seems to feel like it rains as hard in the woods as it does out in the open.  The woods darkened and the temperature began to drop. Eventually it was raining hard with lightning and thunderclaps rolling from my left to right as I walked in the downpour. It was invigorating and cooled me down wonderfully.  It was all over in a half an hour and I began drying out as I walked.
Later, the trail climbed steeply up to a section a mammoth rocks. This was really cool. The trail goes over, around, up, and through them like a bit of an obstacle course. At one point I had to take off my pack and put it and my trekking poles up on a ledge in order to climb up myself!  When I did a section hike on the AT through NJ and NY there was a bit of this sort of thing around the famous “lemon squeezer”, but IMHO this particular section in Pa far exceeds what I encountered in NY. As far as I can tell this little gem is not even named. 
I made it to the shelter around 6:30pm and have good cell coverage to night. I put up my hammock and was joined by two other hikers here tonight. Tomorrow is a short 4 mile hike and I’ll meet my wife in Boiling Springs to wrap up this excellent adventure.","Campsite beyond Pole Steeple
",Alec Kennedy Shelter,"May 26, Sun",12.10
Running Nose,https://www.trailjournals.com//journal/entry/614717,"From Alec Kennedy Shelter (AT mile 1119.5) to ATC regional office in Boiling Springs PA (AT mile 1123.4)
I am writing this from the comfort of my home after showering, napping, and having a Five Guys burger and fries with a pint of Ben and Jerry’s ice cream. 
I woke this morning to yet another glorious day.  Truly the trail gods have smiled on me this entire hike.  By 8am I had eaten, packed up and hit the trail. Today was a short walk to Boiling Springs where I would meet my trail boss and wonderful wife, and end this fantastic section hike. 
Early on there was a climb to the top of Center Knob Point with some nice but partially obscured views through the trees on the way up. At the top there is a AT plaque. I’m not sure, but perhaps at one point in the past this may have been the midpoint of the trail. 
The trail walked down from the peak and exited the woods to walk through pastures and farmland. Some very nice and wide open bucolic views along the way. At one point through the fields there was a very wet area and I could not avoid getting my shoes and socks soaked. I stopped soon after to ring out my socks and continued on. 
The trail soon entered Boiling Springs proper, crossing a bridge and walking by a flowing creek festooned with fisherman of all varieties out on this Memorial Day holiday. I stopped there at a parking lot by the water to wait for my planned rendezvous. With my pack propped against a post marked with a white AT blaze, I sat back and rested while people with fishing gear and dogs passed by. I received only a few sidelong glances at my loitering and somewhat haggard form. 
My wife soon arrived, and our dogs were much more willing to embrace my odoriferous personage than she.  I put my pack in the trunk, changed into a clean shirt, socks and sneakers, and then we walked along the lovely little lake following the path of the AT to the Appalachian Trail Conservancy regional headquarters. 
We stopped by to chat for a bit then walked to the 101 Cafe just down the street and had a delicious Mexican food lunch sitting on their patio with our dogs. Just across the street, some veterans were having a flag raising ceremony to honor the day. 
It was a very nice ending to a simply wonderful ten day adventure.","Alec Kennedy Shelter
","ATC headquarters, Boiling Springs PA","May 27, Mon",3.90
