Hiker trail name,Hiker Journal Link,Journal Story,Start location,Destination,date,Today Miles
Beast,https://www.trailjournals.com//journal/entry/607649,"One year ago today was one of the most challenging days of my life. My loving parents drove me from Pittsburgh, ever closer to the trailhead at Amicolola Falls State Park, GA. I did my best to pretend to be strong for them. The pouring rain camouflaged my tears quite well I think. I had just given up everything that was guaranteed and comfortable in my life; on purpose, to pursue something with no defined reward, and an 80% fail rate. I hiked alone into the unknown on Tuesday, March 6th, 2018. 4 short hours later, at 2:00pm, I would summit Springer Mountain, GA, the southern terminus and official start of the Appalachian Trail.
Somewhere along the 2,190.9 mile hike though 14 states from Georgia to Maine, I learned that the reward I sought could not be defined because it simply is immeasurable. Strength is not measured by how heavy of a bar you can pick up and put back down a few times at the gym. Strength is measured by how much you can endure beyond when your mind and body are screaming at you to quit; all day, every day. It didn’t take me 169 consecutive days of physical and mental perseverance to realize conquering the unknown, never giving up, and pursuing your dreams are the keys to happiness. I just wanted to milk that feeling for as long as I could.
I stood atop the infamous sign on Mount Katahdin, ME, the northern terminus of the Appalachian Trail on Wednesday, August 21st, 2018 at 1:00pm. Don’t get me wrong, it felt amazing. But it was not the climax I had been expecting for the previous 5 and a half months. Getting my picture taken here did not change my life the way I thought it would. Where was the reward?
Only recently have I realized it was the 5 million steps taken between Springer Mountain and Mount Katahdin that was the reward. This is what really changed my life. The weather and terrain that I refused to let destroy me, the random acts of kindness bestowed upon me, the goodness and selflessness of people, and the amazing relationships I formed along the way are what will positively influence my life forever.
When you work this hard for something, nothing can ever take those feelings away from you. It truly is not the destination you should seek, it is every step taken to get there, and the experiences along the way.
I went into the woods expecting nothing, but gained everything. This is what my hike was all about. When you don’t let your fears and challenges dictate your life, only then can you truly live.",,"Jackson, Wyoming","Mar 06, Wed",0
Beast,https://www.trailjournals.com//journal/entry/626879,"Two years ago today at this time, I found myself standing around a warm campfire on a cold night in northern Georgia, sipping on my favorite beer, Dogfish Head 120 minute IPA. There were about 14 of us at the shelter that night, all Appalachian Trail thru-hiker hopefuls. After dark, there were only 4 of us left by the fire. One of them said “you know, statistics say only 1 of the 4 of us will make it to Katahdin, who’s it going to be?” We all thought it would be ourselves, and we were all right. To the best of my knowledge, all 4 of us completed our thru hike in 2018. As for the other 10, they were not enjoying the fire and a great beer, but instead were in bed, preparing for another grueling day of hiking. I can only confirm one of the other 10 finished, and I can definitely confirm several did not. So the overall ratio pretty much checks out.
Everyone was astonished that I would carry a full bottle of beer 12.6 miles up Springer Mountain to the shelter, just to drink it by the fire on my first night. Honestly, the worst part was packing out the empty bottle for a few days until the first trash can at Neel Gap. The hikers at the shelter that first night who went to bed early were hiking it just to say they did it, not to enjoy and embrace the experience. They were even more flabbergasted when I said “It’s going to be more impressive when I carry one through the 100 mile wilderness and up Katahdin. Well, I did. (Even though my friend Evan volunteered to carry it the 100 miles until the Baxter State Park entrance for me). I saw this attitude in New Hampshire and Maine, at the end of their epic hikes far too much. Swarms of miserable people just trying to get it done and not enjoying it. Those people undoubtedly had regrets after they finished.
In the 2 years that have passed since I started my hike, I’ve found it much more relevant to celebrate the start of my hike, rather than the finish. I feel the start my hike took way more courage than it did to finish it. I had to give up all that I had worked for in my career, knowing there was no guarantee of finding a job that was as good as the one I had just willingly left. I gave up my friends, a relationship, and a secure job and housing in New York, and knew I would have to start over when I was done. But once I was on the trail, I loved it so much and I knew there was nothing that would stop me from completing it. Finishing my hike only took stamina and will power, not courage.Now I am celebrating the second anniversary of starting my thru hike, and I did the same thing, but double the distance of the hike. It took me a while to get into a state of reflection this time. I feel like it had been so long ago, and I almost couldn’t relate to what I was doing 2 years ago, or even 1 year ago. I was trying to reflect on my hike, and force myself to wish I was starting the AT again. It was not working. I was just sitting in deep snow on the backside of Snowking Mountain with a great beer and my ski boots on. Only once I started focusing on what I’ve accomplished since my hike did I start to feel anything significant. And there it was... I can honestly say I’m glad I am where I am now, and not starting another thru hike. My long term goal is to get my triple crown, which is hiking the AT, CDT, and PCT. But I’m very happy where I am now. Jackson has been amazing. I am 5 times more active than I was in NY with all the skiing, snowboarding, hiking, volleyball, hockey, backpacking, fly fishing, mountain biking, you name it. The mindset and competitive nature of everyone here is what I need. This area continues to amaze my by how beautiful it is. I work for a private clinic for great people, and with great people. It’s  something I never thought I would find in healthcare.
A lot of people have asked me if I wished I was starting another thru hike again this year. My answer is a simple “Nah, I’m good... I’m really good”. Hopefully someday I’ll be in a place to challenge myself for another 2,000+ mile hike, but I love where I am right now. The trails will always be there, and I’ll be more than ready when the time is right.",,Leeks Canyon,"Mar 06, Fri",7
Beast,https://www.trailjournals.com//journal/entry/636346,"March 6th is a very important day to me. More important than Thanksgiving,  Christmas, and even my own birthday. March 6th, 2018 is the day that I began my thru hike of the Appalachian Trail....
My happy place... It’s 9:00pm on a Saturday, and I have spent the past 1+ hours bootpacking, from the base of Snowking Mountain to the summit with my snowboard on my back. No lift service at this hour, and the night skiing lights have long been shut off. I travel uphill without my headlamp on because the clear skies and the full moon light up the snow as if it were dawn or dusk. I get to the top, all alone, and the only thing disturbing the peace is the howling wind blowing north east over the peak just behind me. It is cold. The sweat is quickly freezing to my body in the wind. I transition my ski setup from uphill to downhill mode as quickly as I can, and descend the first 100 feet into the double black diamond “S Chutes”. I pull off to the side, on the edge of the thick pine trees lining the narrow, steep run. Here, I am sheltered from the wind coming over the backside of the mountain, but I can still hear the subtle roar. It is much warmer here out of the wind, and I can recover from the long uphill climb. I can hear a distinctly different roar of the bustling, small town of Jackson some 1,500 feet below me. I can see my house from here (literally), and that’s what makes this so special. I sit there, by myself, and rejoice in how lucky I am to live in such a beautiful place; literally in my back yard. I sit in awe and peace for at least 20 minutes, or until I start to get cold again. Now it’s time to shred. I’ll crank my headlamp up to its max setting of 350 lumens and pick my way through over 1,500 vertical feet of knee deep, Wyoming “cowboy powder”. The top half is usually totally untouched, because you have to work hard to get to this part of the mountain. The extra effort is almost always worth it. I’ll ski down to my truck in the parking lot, which is only about 3 blocks from my house. But before I go home, I’ll walk just across the street to the brewery to sip on an IPA. I’ll look back up the mountain from there and admire my fresh tracks from top to bottom. This is exactly what I was looking for when I moved here.
I miss the trail life, and hope to do another thru hike in the future... but I continue to be so beyond happy here.
-Beast","Base of Snowking
",Snowking Summit,"Mar 06, Sat",0
