Hiker trail name,Hiker Journal Link,Journal Story,Start location,Destination,date,Today Miles
Chip Tillson,https://www.trailjournals.com//journal/entry/592527,"Oh boy did it rain last night! Buckets! And it didn’t stop till dawn. I was dry but I could hear the water running over the ground beneath me. When I poked my head out in the morning the people in the campsites nearby were all gone, got swamped in their tents I suppose. The trail went from running water to muddy quagmire all day but I still made good miles. 
Ran into my first bear. I was walking along and didn’t see him till I was about 20ft away. He was right next to the trail foraging in the low brush. I stopped and asked him to move. He just looked at me. I banged my hiking poles together and asked again but he just kept poking around eating stuff. I couldn’t continue on the trail without getting closer to him so I took a few steps back and stood there talking to him. Just as was about to take a picture 2 hikers came along from the other direction. Now there were 3 people talking at him so, just to get us to shut up, he decided to let us through. He slowly grazed his way away from the trail and we passed without incident. I kept moving till he was out of sight then realized I never took a picture. Just then I saw another bear running away from me on the trail ahead, missed that picture too. Oh well. 
It rained again this evening but the sun came out for a bit before setting. Maybe it’ll be dry tomorrow for a change.","Loft Mountain Campground 
",Hightop Hut,"May 31, Thu",16.20
Chip Tillson,https://www.trailjournals.com//journal/entry/592643,"Most of the day was clear and bright. The air felt a little dryer but the ground is still soaked from the torrential rains. I’m not in touch with the news but somebody must be getting slammed down river, so much water. The main road in and out of this area (Rt. 33?) is closed due to landslides. 
I felt good this morning and got an early start. The bruised leg was hardly noticeable, knee was good, energy level high. I hit the trail with a vigor I hadn’t felt in a few weeks. About an hour in there was a big boulder on my right with water trickling down the side...
“Hey, that looks just like the boulder I saw yesterd...oh no...I’m going the wrong way!!!” 
GPS confirmed that I was indeed headed back to Georgia. Dejected, I turned around and trudged two, now familiar,  miles back to where I began. When I got there I treated myself to a snack and a packet of jello mixed with water. The sugar didn’t improve my mood but it did keep the energy up. 
I soon arrived at a stream where I loaded up on water and washed my now sweaty shirt. As I was leaving a former thru hiker turned ATC Ridge Runner Ridge Runner walked up. I told him what happened and we laughed. He asked me when I had started my hike and I embarrassingly told him February 20. He said: “Tortise wins every time, you’re doing fine”. He was telling me what I already know but having him reinforce it meant a lot. We talked a while and as I was preparing to leave another thru hiker came up. I told her may tale of woe and she said I was the second person she saw today who had made the same mistake. Now I felt better. I bid them both farewell and continued NOBO with a spring in my step as she and Ridge Runner conversed. No doubt he had some magic words for her too. 
I saw another bear. It ran away as I surprised it coming around a bend. Again, no picture. I also saw a few deer. Curiously they didn’t run away, one actually followed me for a few hundred feet. What’s with that?
I’m in another “official” campground tonight. Again, I arrived, registered, and set up just before heavy rains began. A recurring theme, it seems. There’s a camp store so I’ll be stocked up for the next few days. On we go...","Hightop Hut
",Lewis Mountain Campground ,"Jun 01, Fri",11.60
Chip Tillson,https://www.trailjournals.com//journal/entry/592789,"Horray! More rain! Once you’re wet, you’re wet though so it’s only uncomfortable once a day. I really, really look forward to putting on wet socks every morning. Maybe I’ll keep a wet pair bedside at home when I’m done with this just to reminisce. Good times. 
I stopped for lunch and supplies at Big Meadows wayside. The restaurant menu lists the caloric value of each item so I scanned for the highest numbers and ordered over 2000 calories. Hey, it was mostly uphill all afternoon!
The mud has slowed everyone down so I’ve been seeing the same people each night for the last several days. One of the things that picks me up is hearing people talking through the trees as I approach a shelter after a long day. It’s also nice to see a familiar face or two upon arrival. I suppose we all feel the same way. 
One more rainy day tomorrow then it’s supposed to clear. It’ll be nice to see some of the world famous Shenandoah views before I leave the park.","Lewis Mountain Campground 
",Rock Spring Hut,"Jun 02, Sat",12.30
Chip Tillson,https://www.trailjournals.com//journal/entry/592924,"Hard, steady rain continued through the night and into this morning. It would’ve been impossible to get packed up without getting my sleeping gear wet so I slept in. I peered out from under the tarp and saw that the others were doing the same. 
By 9:00 the rain had lessened enough for me to venture out and retrieve my food from the provided  “bear pole” where it had hung overnight. To my dismay critters had somehow climbed up the 12ft steel pole, chewed a hole in the bag, and helped themselves to some oatmeal. They didn’t take much but water had spread sticky Maple & Brown Sugar flavor throughout the bag. I dumped everything out onto the picnic table outside the shelter and wiped it down as best I could as the downpour resumed and made a sticky mess of it all. 
Yuck. 
By 11:00 I was ready and hiked off into the rain leaving behind several hikers who had decided to spend the day at the shelter. After a few hours in the tempest I began to wish I’d done the same. Rivers of water ran off the hillsides turning sections of hiking trail into a route more suited for kayaking. The dirt and gravel had washed away in many spots leaving a jumble of sharp rocks and slippery roots. 
By 4:00 the rain began to lighten up and I sloshed into a picnic area with covered tables to prepare a hot meal. Soaked and chilly but reenergized I continued 2 more miles to where I am now. The rain stopped long enough for me to set up and hang my food...again on the bear pole. 
If, as I suspect, Noah is building somewhere nearby I have to accept the possibility that critters might be foraging, two by two, in order to provision his ark. There’s more oatmeal in the bag if you need it. But could you take the Apples and Cinnamon flavor this time? The Maple is my favorite.","Rock Spring Hut
",Byrd’s Nest #3 Hut,"Jun 03, Sun",10.90
Chip Tillson,https://www.trailjournals.com//journal/entry/593163,"Sometime before dawn the clouds moved on and allowed the sun to rise unobstructed. Eventually the trees stopped dripping and a cool northerly breeze began to dry the landscape. 
I had to spend much of the day drying out my stuff; everything I have was damp or soaked and leaving it packed would invite mildew. A parade of hikers passed by my clotheslines: lots of day-hikers, some of the crew who took a zero at the shelter yesterday, and some NOBEers I hadn’t seen in a month; Skywater among them. It was early afternoon by the time I donned dry socks and hit the trail for the short hike to this shelter area. 
I saw a huge bear shortly before I got here, too big to stop for a picture. Another hiker saw it too. A Ridge Runner stopped by to remind everyone to use the bear box despite the presence of two bear poles. I put my entire pack in there.
Back in Smoky Mountain National Park hikers were required to stay at the shelter areas and I didn’t like it. Here in Shenandoah you’re allowed to camp anywhere (within certain guidelines) but because there are so many bears around I feel better staying where I can easily store my stuff out of their reach. When I get out of “bear country” I hope to get back into the routine of camping between shelters. That flexibility will allow me to put in a few more miles each day. 
Till tomorrow...","Byrd’s Nest #3 Hut
",Pass mountain Hut,"Jun 04, Mon",4.40
Chip Tillson,https://www.trailjournals.com//journal/entry/593218,"Another pleasant day, mostly sunny and breezy with lots of picturesque views. Unfortunately after days of wetness the camera lens on my IPhone is fogged up so photos aren’t coming out well. Maybe it’ll clear up. 
There are lots of deer around here. They’re very tame and sometimes follow me for looking for a handout, a sure sign that people have been feeding them. That’s  against the rules! I hope they’re not feeding bears, signs are posted all around this shelter about a “problem bear” that comes foraging for people food. 
Tomorrow I’m getting picked up my Uncle Phil and Aunt Ellen for a zero. Phone service is bad here but we talked a few days ago about where and when to meet. Hopefully I’ll be able to contact them tomorrow to confirm.*Success, I was able to confirm pick up and post this in the morning.","Pass mountain Hut
",Gravel Springs Hut,"Jun 05, Tue",13.20
Chip Tillson,https://www.trailjournals.com//journal/entry/593380,"A pleasant hike on Wednesday with nice weather and easy terrain. Made it to the pick up spot right on time after meeting Aunt Ellen who had hiked in a bit to meet me. 
Uncle Phil kindly offered cookies and beverages to two NOBO thru hikers who I had seen earlier. Bear (from New Zealand) and Crazy Legs were looking for a ride to the Front Royal Library to research Bears injured knee. Packs and all were squeezed into the Subaru and they were Magically transported to the library before we headed to Lincoln. 
Traditional Daley family hospitality included: fine food, resupply, a garden tour, lawn tractor repair, phone calls home, NBA and NHL finals (yay Caps, finally!), and a trip to the Verizon store to deal with my waterlogged phone. 
It’s back to the trail in the morning...","Gravel Springs Hut
",VA Rt. 522,"Jun 07, Thu",13.30
Chip Tillson,https://www.trailjournals.com//journal/entry/594726,"Oh the suspense of it all! Sit back whilst I tell the remarkably unremarkable tale of The Lost Days...
Friday, June 8US Rt. 522 to Manassas Gap Shelter 10.7 miles 
The weather was clear and warm when Uncle Phil & Aunt Ellen dropped me off at Rt 522 after a nice breakfast. It was a great zero, thanks!!!
This is the day I disappeared from the journal. My water resistant iPhone X was no match for the recent wet weather. I had gone to a Verizon store and successfully claimed a new one through insurance but it wouldn't be delivered (to Bay Head) for a few days. I declined the non-Apple ""loaner"" phone they offered because I felt it could complicate the photo and data transfer and mine seemed to be drying out slowly. I reckoned it would get me through till I got the new one. WRONG! That evening after a few bright green flashes the screen went black. Fortunately it came back on occasionally over the next several days allowing me to get in a few calls and make plans for the coming week. I decided not to update this journal for a while to preserve the phone and took notes each day on paper...how primitive.
Saturday, June 9
Manassas Gap Shelter to Rod Hollow Shelter12.9 miles
Another nice day with thunderstorms in the evening. 
I saw Napoleon briefly as he hiked past my campsite in the morning. I thanked him for some food tips he gave me last month. A dozen or so Boy Scouts were hiking this part of the trail with their leaders, I saw them every day for a while. There were also a few groups of Japanese tourists out for the day.
While eating lunch a big filling fell out of my tooth. Great. That'll require a dentist.
Sunday, June 10
Rod Hollow Shelter to Bears Den Hostel
9.9 miles
On this dreary day I planned to go 13 miles. Because my phone GPS trail guide was unavailable I didn't note when exactly I passed mile 1000 but the weather had me in a non celebratory mood anyhow ...da,da,da,da... if I must. By mid afternoon it was pouring so hard I decided to stop early at Bears Den Hostel, just a stones throw from the trail. 
Bears Den is a visitor center and hostel operated by the Patomac Appalachian Trail club. It's an old, classy looking stone building with immaculately manicured grounds. As I approached I imagined those inside chatting politely while sipping tea and eating tiny sandwiches. Perhaps I was right because a sign on the door said:
""Closed for private event, thru hikers use back entrance.""
Behind the building there was a door to the basement, probably a former servants entrance. Another sign: ""Thru hikers only. No day visitors or scouts beyond this point."" The door had a push button lock with a note explaining how to get the entry code from my hikers guide by subtracting the mileage of one specific landmark from another. Very secure, what could they be hiding in there? No matter, it wasn't locked. 
Inside was a small ""mud room"" piled high with wet shoes, socks, and packs. The odor was impressive. The interior door was equipped with a floor seal to contain the smell, kinda like a space station air lock. I removed my wet things and opened the door to see filthy hikers sprawled out on well worn couches, chairs, and bunks. Among them: Honeybun, Crush, Buck, No Filter, and aptly named Trenchfoot (eewwww!). Wet gear hung from the bunk ends. As at most hostels a wall was posted with prices for the accommodations, common sense rules of conduct, useless WiFi login info, off color hiker art and humor, and a big ""2018"" poster board to sign and memorialize ones stay. A locked interior door leading upstairs bore another sign: ""This door will open at 5pm and close at 9am."" 
I hit the spartan but clean shower then joined the others watching a movie while we awaited release from our dungeon. At exactly 5pm the door opened and we all stomped up the stairs. 
The upstairs didn't smell and was equipped with a big kitchen, comfortable furniture, large dining tables, and two bunk rooms for those not belonging to the exclusive downstairs club. On the walls were paintings of spectacular views, inspirational hiking quotes, and photos of squeaky clean, hyper attractive people enjoying the outdoors (usually taken through a frosted lens with some dandelion fluff floating by). Pamphlets, books, and periodicals were available to help plan ones dreamy hike. 
Our amiable host and dungeon master, Glen, called everyone into the small gift shop to collect our fare. The $30 ""hiker special"" included a bunk, shower & towel, laundry, use of the kitchen, a frozen pizza, one soda, a pint of iced cream, and a self cook/clean pancake breakfast. It was a good night. The others reported that I did not snore. 
Monday, June 12
Bears Den Hostel to David Lesser Shelter
11.2 miles
After we all pitched in making pancakes and cleaning up I hiked out into the dreary weather while the others stayed back watching Shawn of the Dead. The weather soon improved nicely and by days end they all had passed me again. 
I think this was the day I hiked through the famous ""Roller Coaster"". It's an infamous stretch of trail named for its relentless ""PUDs"" (Pointless Ups and Downs). I found it quite refreshing to only hike uphill for 10 minutes or so before going downhill again. Back in Georgia and NC it seemed I walked uphill for days! There was also a long level section with sharp rocks sticking up ominously called ""The Devils Racetrack"". So it's level and all I have to do is step around things? HA-HA-HA!
Tuesday, June 12
David Lesser Shelter to Harpers Ferry, WV
9.3 miles
This day I FINALLY left Virginia and hiked into Harpers Ferry, the symbolic halfway point on the AT (the literal halfway spot is a bit further north). I had long planned to travel home for my parents 60th anniversary party on Saturday the 16th and from Harpers Ferry I could get there by train. There are many people (including friends Melissa and Steve in Harpers Ferry) who have offered to help me during my travels but not having a reliable phone made it difficult to coordinate so I decided to travel without the help. I'm remain thankful that it's available though!
When I got into town I went to the ATC headquarters to have my picture taken for inclusion in their 2018 hiker book and bought some copies as my phone no longer took pictures. After a nice dinner I stayed the night at a hotel where I booked Amtrak tickets back to Jersey on Wednesday. 
June 13-19 
Harpers Ferry, WV to Bay Head, NJ and back.
0.0 trail miles
I left the hotel at 5am to catch the local train to DC. From there Amtrak got me to Newark then NJ Transit to Bay Head and a short walk home. After being gone so long I thought it might be weird going home but it wasn't. I think traveling ""the long way"" by train helped.
I had a great week with Joyce, family, friends, firefighters, and with my parents to celebrate their big 60th anniversary. I got a new phone, a new bigger backpack, some fresh bug proofed clothes, drank some beers, and rested my knee. I also got to my dentist and as I feared Mr. Tooth requires major work so I will head home again in a few weeks for that. Ahhh...root canal and summer at the Jersey Shore. What could be better!
Today I reversed my train route from last week and am now back in Harpers Ferry ready to walk. Wasn't that exciting!
 Shall we continue? I think yes!
Back on the trail tomorrow...","Manasss Gap Shelter
","Harpers Ferry, WV","Jun 19, Tue",54
Chip Tillson,https://www.trailjournals.com//journal/entry/594841,"Left Harpers Ferry under cloudy skies. The trail passes through the historic area so I lingered there a bit. The trail leaves town on a railroad bridge. On the other side was Maryland. The first few miles followed the the old C&O Canal towpath which has been made into a bike path....very flat and smooth. 
 
The well worn trail soon turned away from the canal and up into the mountains. It rained briefly as if to welcome me back. My legs were a bit stiff as I neglected to do my daily stretches during the break...take a note on that. My knees are also bothering me, the rest seems to have made them worse. 
I'm using my new, slightly bigger pack now. It'll take a while to get the fit and load balance dialed in. One of the frame pieces broke already, that's disappointing but I can still use it until they send a new part.
I arrived at this shelter just as rain began to fall. Mule is here, I haven't seen him in a long time. If the terrain remains as nice as it was today I should be able to pick up the mileage quite a bit. We'll see.","Harpers Ferry, WV
",Rocky Run Shelter ,"Jun 20, Wed",15.60
Chip Tillson,https://www.trailjournals.com//journal/entry/594967,"It rained this morning but the rest of the day was fine. This piece of trail is very popular and there are lots of day hikers and others out for a few days. I passed the first Washington Monument (built 50 years before the one in DC) and skirted an area called Annapolis Rocks.
I was determined to cover at least 15 miles and the trail was rugged and slick for much of the way so extra attention to footing was in order. So much attention that I missed an obvious turn and ended up walking 30 minutes down a side trail before noticing. Arrggg!!!
Nonetheless, I did the miles. I'm hoping to  go farther each day now that the terrain is flatter. We'll see how my knee feels about that. On we go!!!","Rocky Run Shelter 
",Ensign Cowell Shelter,"Jun 21, Thu",15.80
Chip Tillson,https://www.trailjournals.com//journal/entry/595040,"Rain all day today, but what else is new. This afternoon I crossed the Mason Dixon Line and entered Pennsylvania. Goodbye south, I enjoyed you but it's time to move on. 
The trail is here very rugged. Trail maintainers joke about going out to ""sharpen the rocks"" and hikers call it ""Rocksylvania"". I've also heard that many hikers go home from here with foot injuries, more reason to continue to watch every step. Its mentally exhausting keeping up that level of attention hour after hour, especially in the rain, but I'm certain it's helped me avoid injuries so far. 
Steady rain is predicted for tomorrow but Sunday should be better.","Ensign Cowell Shelter
",Deer Lick Shelters,"Jun 22, Fri",14.40
Chip Tillson,https://www.trailjournals.com//journal/entry/595156,"Pouring rain this morning made sure everything was good and muddy before the weather turned nice. 
As it is Saturday and there are a few state parks in the area I passed a whole bunch of people headed in both directions. Dozens of scouts, some families, section hikers, and 2 SOBO thru hikers. One of them, Rambling Wraith, clued me in on an excellent burger joint called Timbers, just off the trail on US Rt 30. I gorged on a huge burger, bacon cheese fries, several Mountain Dews, and a Strawberry shake. They love filthy hikers, 5 Stars!! 
Here at the shelter this evening the conversation was getting deep, turning to religion and politics (in a non-confrontational way). I avoided chiming in until section hiker Mary, a fellow hammocker, saved me by asking some questions about my set up. We chatted hammocks and hiking for a spell, it was nice. 
Monk, a friend of friend Bob Hein, is also hiking NOBO and catching up to me quickly. I checked out his Facebook page and he's absolutely flying up the trail. I expect he'll overtake me in the next couple of days so I sent him a message describing myself. Maybe he'll slow down long enough for a picture.
I'm trying to make 15 miles a day the new ""normal"" but my knee doesn't like and is hurting pretty bad tonight. If I'm unable to bump up the daily distance I might not get to Maine before cold weather closes Mt. Kahtahdin (the finish line). If I have to I'll skip up to Maine and hike SOBO to where I skipped from to complete the trail but my heart is really set on finishing at Kahtahdin. Please, if you have a moment, direct positive thoughts to my left knee. Forging on regardless...","Deer Lick Shelters
",Quarry Gap Shelters ,"Jun 23, Sat",15.80
Chip Tillson,https://www.trailjournals.com//journal/entry/595236,"Horray! I passed the halfway point this afternoon...four months, feels like forever. The weather is great, only a brief thunderstorm this evening, wouldn't want the mud to dry out now, would we?
The trail here looks a lot like the Jersey Pine Barrens except there are small hills with long, gentle grades. Nice, easy hiking for a change. 
There is some excellent weather in store for this week. I've got 2 days of food left, just enough to get to Carlisle for resupply if I can keep up this pace while stepping gently to save the knee. Tomorrow I'll pass through a state park where the guide says there's a snack bar. I hope it's open so I can score a burger!
Let's continue...","Quarry Gap Shelters 
",Toms Run Shelter ,"Jun 24, Sun",13.60
Chip Tillson,https://www.trailjournals.com//journal/entry/595343,"Good weather + good terrain + light food bag = easy miles. Today's 19 were the most I've done in one day so far. In contrast to Saturday there have been very few people on the trail the past 2 days. Come to think of it NOBOs are getting scarce. Venus and her husband (no trail name as he's just joining her for a week) have been at the shelters the last 2 nights but no others. Maybe the bubble has finished passing me now? We'll see. 
This morning I timed my arrival at Pine Grove State Park for when the snack bar opened. It's where thru hikers traditionally celebrate the halfway point by attempting the ""Half Gallon Challenge"" - eat a half gallon of ice cream in an hour. That's a pretty big dairy bomb for 9am, especially with a long day on the trail ahead! I skipped it in favor of a big breakfast sandwich, yogurt, 2 bananas, Gatoraid, a Monster energy drink, and (couldn't help it) 3 scoops of carmel vanilla. As I dragged my stuffed self out of the park I came across a man from the local trail club giving out watermelon. There's always room for watermelon, especially when it's magic!
It's an easy day into Carlisle tomorrow for resupply, laundry, and a much needed shower. One day at a time...","Toms Run Shelter 
",Alec Kennedy Shelter ,"Jun 25, Mon",19
Chip Tillson,https://www.trailjournals.com//journal/entry/595470,"Yet another beautiful day as I entered Cumberland Valley farm country. The still swampy trail took me from dark woods to sunny cornfields and back several times with the nice village of Boiling Springs in the middle.
I passed a ridge runner and a man mowing trailside brush. Someone left a cooler full of Magic sandwiches near a stream crossing and as there were few people on the trail I ate four of them. As I was feasting I heard something big splashing in the water just upstream accompanied by the alarmed quacking of ducks. The brush was too thick to see what it was but shortly after the commotion stopped the clear stream water turned muddy. Ummmm...time to go, I think, and leave the mystery creature be. 
I got to Carlisle by 4:00: check-in, shower, laundry, diner dinner, then pack inventory. There is no grocery store nearby but I've got enough calories in the bag to get to a grocery store just off the trail in Duncannon 11 miles away. My cousin Stacey lives nearby and I had hoped to get in a short visit but she's also on a big adventure: in Alaska! Good for you Cuz! Let's continue...","Alec Kennedy Shelter 
","Carlisle, PA","Jun 26, Tue",11.80
