Hiker trail name,Hiker Journal Link,Journal Story,Start location,Destination,date,Today Miles
Chip Tillson,https://www.trailjournals.com//journal/entry/582767,"T-11 days...final gear selected, extra and summer gear is boxed and ready to be shipped if and when it’s needed. Getting nervous about this...","
",View Entry,"Feb 08, Thu",0
Chip Tillson,https://www.trailjournals.com//journal/entry/582805,"Couldn’t sleep last night. Excited/anxious. Worried/hopefull. Spent the hours meticulously weighing my gear...yes that’s a thing in backpacking circles. I’ve learned a lot reading gear lists posted online by other hikers so my stuff is listed here for others to refer to. (click “gear” in the menu). Everything I’m taking, sans food and water, weighs in at 21 lbs. That’s pretty dang good, and will ease the stress on my knees. If only I’d have put as much effort into loosing the 10 lbs extra around my waist! No matter, if my legs can hold up I’ll likely loose tripple that before this is over.",,View Entry,"Feb 10, Sat",0
Chip Tillson,https://www.trailjournals.com//journal/entry/582928,A week from now I’ll be living outside. Preparing myself to be away from home has been less stressful than preparing home for me to be away.,,View Entry,"Feb 13, Tue",0
Chip Tillson,https://www.trailjournals.com//journal/entry/583088,"I’m here in Georgia and ready to start tomorrow after 2 day’s travel with my incredible parents; without whom I would not be. Unending love to all time best girlie Joyce for her love, patience, and support; I hope the next 6 months are an adventure but pass quickly for us both. Massive pre-thank-you’s to everybody back home...family, friends, fellow BH firefighters; I know you’ve got me covered on the home front and are ready to render aid as needed on the trail. Now if I can get any sleep...",,View Entry,"Feb 19, Mon",0
Chip Tillson,https://www.trailjournals.com//journal/entry/583125,"It was a foggy, rainy, muddy, glorious day! I’m finally here at the top of Springer Mountain, in a wet cloud. Cool but not cold, record high temps for next few days. Most of today’s walking was on the “Approach Trail” so after 9.1 miles I’m camping at AT trail mile 0.3. Long way to go! My bad knee is not performing up to needed specs, lots of pain. That’s quite worrisome but I don’t have any control over it except to keep the daily mileage low and hope for the best. There’re a few peeps camping here tonite, all of us headed for Maine. We ate dinner together and had an enjoyable chat. They are: Marbles (from Texas I think). Georgia and Nick from Australia. Plodalong and Grandma Shortie from Massachusetts (they’re posting their hike on YouTube). John from Tabernackle, NJ. He’s the just retired DPW Supervisor of Medford...holy cows, just like me...incredible! He looks a bit familiar, I’m sure we’ve crossed paths. There’s another guy who’s name I forgot, sorry guy. I’ll call you guy. On we go...","
",View Entry,"Feb 20, Tue",0.30
Chip Tillson,https://www.trailjournals.com//journal/entry/583159,"Another very wet day. The sun did come out briefly at supper time drawing oohs and ahhs at the shelter. A few more people here tonite including another from Jersey. Australians Georgia and Nick got soaked and had a mouse chew into their tent last night. They were last seen headed out the way we came. I hope they’re just regrouping. I asked them if it rains much in their hometown, they said “maybe 2-3 times a year”. It’s gonna rain every day here for at least another week. Yikes! Keeping the miles low, planning about 8 tomorrow. I have supplies for 2 more nights.
Corrections from yesterday: Marbles is from NC and “guy” is Music Man from GA.","
",Hawk Mountain Shelter,"Feb 21, Wed",7.80
Chip Tillson,https://www.trailjournals.com//journal/entry/583231,"A nice warm partly sunny day. It was needed to dry out my stuff. I can’t believe how lucky we hikers are to have this first week be so warm. Even the wet first days were a blessing in disguise forcing us to learn learn efficient set up and beak down. Early this afternoon just as I was getting hungry I had my first Trail Magic! Snap and Lion-heart, “Class of 2017” thru hikers, were paying it forward at Cooper gap with an AWSOME spread. I filled up on fruits, veggies, and a doughnut.","
",Gooch Mountain Shelter,"Feb 22, Thu",7.60
Chip Tillson,https://www.trailjournals.com//journal/entry/583260,"9 hours walking up and down on this warm, sunny Georgia day. I’ve  spent each night so far at the shelter sites with the same several people. We see each other occasionally through the day but mostly we walk alone. The Appalachian Trail Conservancy (ATC) has lots of “Ridge Runners” here in Georgia, ran into 3 of them today. They make sure people follow the rules, especially with regards to carrying out trash and storing food properly. Kudos to them as the sites are in good shape. There are metal boxes at each shelter to store food overnight. Last night coyotes made some noise close by but stayed out of flashlight range. Big day tomorrow, gotta get up and over Blood Mountain. They say it’s as tough as it’s name but it doesn’t stand a chance: there’s a shower, laundry, and a bed on the other side!
As I’m typing this, at 8:30 pm, a big group of people arrived. Everybody is settled in and they’re tromping about in the dark  looking for flat spots to set up their tents...I hope they cook and store their food properly or say hello to Mr Coyote!","Gooch Mountain Shelter
",Woods Hole Shelter,"Feb 23, Fri",11.90
Chip Tillson,https://www.trailjournals.com//journal/entry/583287,"Blood Mountain whaaaa? Kicked it’s butt, so did all the other thru hikers. Staying tonight at Mountain Crossings hostel. I wasn’t the first one here but I was the first one to ask for a bunk and BINGO: Trail Magic again! Someone anonymously payed the $20 for today’s first hiker’s bunk, I proudly took the prize and some ribbing from my fellow travelers. There was a small festival here sponsored by the outfitter, they call it the “Kick Off” of hiking season. There were a few vendors, live music, and hot dogs. The Altra shoe rep gave me a beer (I’m wearing his shoes). The rumored laundry service proved to be just that but no matter, it’s gonna rain hard tomorrow. There are a surprising number of hikers around, 12 here and at least another couple dozen at a near by campsite and the hostel down the road. Eight (give or take) of us have formed a little group traveling at the same pace. I think we’ll begin to break up as each of our need for rest and showers spreads us out along the route. We’ll all no doubt form new groups, everybody’s going the same way!
Note: word is I’m entering a difficult area for cell reception, might miss a day or two posting.","Hawk Mountain Shelter
",Neels Gap,"Feb 24, Sat",3.60
Chip Tillson,https://www.trailjournals.com//journal/entry/583347,"Cold rain today. More rain tomorrow morning then still colder. Got more Magic at a road crossing. Billy was parked there with fresh fruit and a hot cup of Lady Grey tea. Thanks Billy! Lots of people in and around the shelter tonite although we’re spread over about 1/10 mile of slimy muddy trail. There is no “bear box” for food storage here and the trees are not conducive to hanging my bag so I sealed my food up as best I could. It’s laying right here under my hammock with my wet and stinky shirt, socks, and underwear laying on top. That ought’a to do the trick. There’s a dog in the shelter for back up. Marbles and I have been hiking near each other since the start. I pass him on the uphills and he passes me going down. We’ve agreed to stay that way until at least the next hostel, three days away. Rumor has it they do laundry...","Neels Gap
",Low Gap shelter,"Feb 25, Sun",11.50
Chip Tillson,https://www.trailjournals.com//journal/entry/583378,"Morning rain gave way to sunshine and it’s clear and cold tonite. The moon is bright enough to read by but I didn’t pack a book: too heavy! Marbles and I have become separated. He was beginning to struggle and may have gone into town for a “zero day” (zero miles, day of rest). I’m sure he’ll be fine and we’ll see each other further north. Everyone in the group I started with is now ahead of me, behind me, or headed home. 
Here tonite are Blaze and Mike, who I’ve run into a few times before, two brothers who have identical clothes, a father and son with whom I compared hammocks, the Ridge-runner Pete, and his wife. The shelter has a brand new privy (joy joy) and steel “bear cables” for hanging food. Pete taught us how to properly attach our bags before hauling them 15ft up. He says the bears north of here in the Smoky Mountains have learned to shake the cables so that improperly secured food will fall to the ground...uh, whuut?!!
I’m gonna try to push through to the hostel at Dicks Creek Gap on Thursday for cleanup, resupply, and maybe a zero. I’ll need to stretch my food but I haven’t been very hungry. They say the famous “Hiker Hunger”  doesn’t kick in for a week or two, I hope it’s closer to two for me! 

Shout out to Mrs Taft’s 4th grade class at Manasquan Elementary! Please, Mrs Taft, don’t mark me too harshly on spelling and grammar, it’s cold, my typing thumbs are numb, and I haven’t enough battery for too many proofreads.","Low Gap Shelter
",Blue Mountain Shelter,"Feb 26, Mon",7.30
Chip Tillson,https://www.trailjournals.com//journal/entry/583420,"This morning I watched the sun rise over Tray Mountain, where I am tonite, pretty cool. There was magic at Unicoi Gap. This time it came in the form of a Dr. Pepper and some chips from the trunk of Darren “The Encourager’s” car. I met several people including 2017 thru hiker Lion King. All of them knew with a glance and a sniff that I’m headed for Maine. One couple offered me a beer which I politely declined (what’s happening to me?!!). 
Plodalong and Grandma Shortie are back refreshed after a luxurious night in an actual hotel. They brought news that Music Man dropped out, at lease temporarily, with a dental emergency and Marbles indeed did head to nearby Hiawassee for some rest. Among others present tonight are Blaze, Motorcycle Mama, and Maple who is sporting an impressively small pack. 
Every day I walk through many areas of blowdown (fallen trees) caused when Hurricane Irma barreled through here last year. ATC volunteers have done an amazing job clearing debris from the trail. Fellow NOBO’er (northbounder) Mike was hiking here when Irma struck. Everyone was sternly ordered off the trail. Others tell tales of destruction in their hometowns nearby. 
Ironically, as I see the damage here Joyce is in Tortola, BVI seeing massive destruction from when the same storm passed directly over that small island. She’s there making arrangements to rebuild the severely damaged getaway she recently took over from her parents. 
I noticed today that acorns are beginning to sprout. Of the countless thousands I walked past some will survive to fill the voids left by the storm.","Blue Mountain Shelter
",Tray Mountain Shelter,"Feb 27, Tue",8.10
Chip Tillson,https://www.trailjournals.com//journal/entry/583473,"Hard, cold rain all day. I got soaked to the bone. It’s just water though. It’ll wash off. 
As soon as I got to the shelter area I set up my tarp, hung the hammock, put on dry clothes, and took a little nap in my cozy down cocoon. Later I went to the shelter to cook dinner with the group. They’re all sleeping inside on the hard floor there while mice run over and amongst them. No thank you, I’ll stay out here with Mr. Coyote!
Trail names. Some people make up their own: Plodalong and Grandma Shortie. Some are given one because of something they do. Weatherman got his because he checks the forecast early so people ask him instead of turning on their phones to check themselves. One of the rules out here is that you have to approve your trail name. Many don’t have one.  Mike and Pete. 
Plodalong keeps trying to tag me. Romano: I packed stinky cheese from home. Freebie: I always seem to get Magic. Cathole: I was dumb enough to bring that one up, thanks George.
I’m sticking with my lifelong nickname. Come on, my MOM gave it to me! Not that I’m not profoundly proud of being given the names of my father and grandfathers; all the finest of men. In fact I hold those names in such high regard that I’ll only use them on very important occasions: graduations, wedding, legal proceedings, tax time, etc. For everything else Chip has always worked just fine. Life is kinda like a trail right? So Chip it is. 
More rain on tap for tomorrow. Just 3.6 miles to Dicks Creek Gap and the long awaited laundry day! Fingers crossed...","Tray Mountain Shelter
",Deep Gap Shelter,"Feb 28, Wed",7.40
Chip Tillson,https://www.trailjournals.com//journal/entry/583515,"NERO day: nearly zero miles hiked. 
Rain held off till I reached the famous Top of Georgia Hostel where there was indeed laundry service. $35 dollars covers bunk, shower, laundry, shuttle into Hiawassee for dinner and supplies, breakfast tomorrow, then a ride back to the trail 1/2 mile up the road.
I ate massive heaps of salad and veggies at a buffet along with Blaze, a young man whose name eludes, and Marbles who “night hiked” in the pouring rain last night to arrive at Low Gap Shelter after 8:00. I also learned he is an excellent guitar player after he picked one up in the common area...super comfy couches there!
The weather turns dryer, much colder, and very windy tomorrow as we move up into higher altitudes. I am clean, dried out, and fully laden with provisions for 5 days. Should be in North Carolina by mid afternoon...saddle up!","Deep Gap Shelter
",Top Of Georgia Hostel,"Mar 01, Thu",3.60
Chip Tillson,https://www.trailjournals.com//journal/entry/583548,"Sunny, windy, and much colder. Very cold tonite but I’m super toasty in my hammock. 
Today was the first day that I struggled a bit and I arrived here exhausted. My pack is heavy with 5 days of food, the trail kept going up, up, up, and the cold just sucked the energy from me. It took 9 hours including several snack breaks to make it here. 
I got a little boost from crossing the border into North Carolina. One state down, 13 to go (but who’s counting). 
Onward tomorrow...","Top Of Georgia Hostel
",Muskrat Creek Shelter ,"Mar 02, Fri",11.80
Chip Tillson,https://www.trailjournals.com//journal/entry/583580,"Another crisp day, trail not as steep as yesterday, 8 relatively easy hours. Last night there was a guy at the shelter who seemed different. Couldn’t put my finger on it but he had an air of confidence and a bit of a Rock Star vibe. Having arrived too late for introductions it wasn’t till this morning that I learned he is Giggles: the first SOBO we’ve run into! He’s been on the trail since July and will be done in a week. I salute you sir!
Today near the top of Standing Indian Mountain I passed sign nailed to a tree. It’s been there so long the bark has begun to grow over it. It said “North Carolina Wildlife Bear Sanctuary”. I instantly recognized the font from the NC Wildlife magazines my Grandparents would subscribe to us as a holiday gift each year. Those subscriptions likely helped fund the sign. I used to read each issue cover to cover to learn about the plants and animals in these mountains, most of which are also common at home in New Jersey.
Fred and Edna Daley were good people who worked hard to provide for my mother, my aunts, and my uncles. I always thought of their home and Valley Road neighborhood in Glen Rock as a kind of Walton’s Mountain (as in the 70s TV show). A place where Father worked the earth, Mother made ends meet at home, and older siblings sometimes delayed following their dreams to care for younger ones. It was a place full of pictures and stories. A wonderful place to be a grandchild. I still see the house and yard as it was. Feel the rumble of freight trains passing at night. Smell the basement bedrooms with dark closets and mysterious cabinets filled with the last generations toys, stuffed animals, books, and games. 
There are no Daleys left on Valley Road. They moved north and south, mostly into states where this trail goes. We many grandchildren have spread wider. And so on. 
Why did they send us North Carolina Wildlife Magazine? I’ve always wondered. Although they did eventually move here it seemed a curious choice until today. Those subscriptions planted the seeds of this adventure in my young head. Thanks Fred and Edna, it was good seeing you on the mountain today. 
Goodnight Grandma. Goodnight Grandpa","Muskrat Creek Shelter 
",Carter Gap Shelter,"Mar 03, Sat",12.50
Chip Tillson,https://www.trailjournals.com//journal/entry/583635,"Beautiful day, perfect hiking weather. 
Decided not to push on another 3+ miles to the next shelter. That means I’ve gotta make 7.2 miles in the morning to catch the 11am shuttle to Baltimore Jacks hostel where there’s a bunk with my name on it. No cell service here, will post this tomorrow from Franklin, NC  
Tonites bed time: 7:30. G’nite.
—————-
Postscript: my eyes popped open at 5am this morning and it occurred I had a chance to make the 9am shuttle. Ate, packed up, and made it just in time!","Carter Gap Shelter
",Long Branch Shelter,"Mar 04, Sun",8.70
Chip Tillson,https://www.trailjournals.com//journal/entry/583662,"Worked hard this morning to beat the crowd of hikers into Franklin, bad weather rolling in tomorrow and many are getting off trail to avoid it. Ron, the operator of Baltimore Jacks Hostel, managed to fit 11 of us and our gear into his 6 passenger van (he said the record is 12). I rode squished between the back seat and the rear doors with packs on top of me. It reminded me of the “pre-seatbelt” days when we’d just pile in till the doors wouldn’t shut. Ron told us some cautionary tales about how quickly the weather can go bad in these mountains and offered tips on where to shop and eat. After restocking our food bags John (formerly Weather Man, he prefers John) and I had a burger then he, Mack Daddy, and I had dinner at Hardee’s then some beers at The Lazy Hiker Brewery. Got back to the hostel way after “Hiker Midnight” which is an hour after dark. An injured hiker is sleeping in the bunk above John. He fell and cut his face on a log then hiked 20 miles to get to town. Ron took him to the clinic and he’ll be OK but the bleeding hasn’t subsided. John will surely sleep with his mouth closed. Taking my first Zero tomorrow, partly because of the weather, partly to rest my bones, and partly because I’m enjoying the company.","Long Branch Shelter
","Franklin, NC","Mar 05, Mon",7.20
Chip Tillson,https://www.trailjournals.com//journal/entry/583717,"Nasty weather here in Franklin this morning though this evening was pretty nice. A few dozen hikers spent the day lollygagging about town at the many  businesses catering to us. There are food stores, cafes, pubs, and two outfitters one of which has a craft beer bar inside next to the shoe section (George: make a note for a future surf shop).
Businesses here are gearing up, no... bracing for a “Bubble” of hikers due in starting tomorrow. “Bubble” is the term for a large group of hikers traveling on a section of trail at the same time. This bubble is made up mostly of 20 somethings who started at Springer Mountain in the sunny days the week after I started in the rain on Feb 20th. They’re putting in more miles per day than us “Greybeards” and are predictably passing through our numbers now. The biggest bubble will begin hiking over the next 3 weeks and won’t catch me till April. By then attrition will have thinned us all out so crowding shouldn’t be a problem.
I’ll hit the trail refreshed tomorrow morning aiming to get to Fontana Dam on Sunday for some Magic courtesy of dear friend and hiking buddy Denise who is picking me up there for a zero.","Franklin, NC
",Franklin,"Mar 06, Tue",0
Chip Tillson,https://www.trailjournals.com//journal/entry/583788,After a few early Egg Muffins Ron dropped us off at the trailhead and we headed back into the woods. The forest is dusted with snow that fell last night and it is very cold. I’m warm now in the cocoon but getting set up and preparing dinner was unpleasant. Morning will be the same then I’ll hike to keep warm,"Winding Stair Gap
",Watah Bald Shelter,"Mar 07, Wed",11
Chip Tillson,https://www.trailjournals.com//journal/entry/583798,"Super cold this morning. Snow flurries all day with up to 3” of snow on the ground in some spots. Tonite’s low temperature will be about 18 with gusty winds. I’m confident my gear will suffice...toasty as I write this! The cold makes everything difficult but I’m slowly getting more efficient at setting up at night and breaking down each morning. 
At Amacalola State Park (the southern end of the trail) the ATC has a table set up  where prospective thru-hikers answer a few questions and sign in before they head up Springer Mountain. Sign in is not required and there is no fee. Each hiker is given a tag for their pack with a number on the back. I am Hiker #217. 
Of the 4000 people expected to sign in this year fewer than 1 in 4 will reach Mt. Katahdin in Maine. Several people I’ve hiked with have already left the trail. Among them: Georgia and Nick were rained out, Music Man got a bad toothache, Gabriel blew out his knee, Marbles got picked up in Franklin with a possible broken foot, Water Leaf just didn’t like climbing mountains, and today I learned John is headed home with a foot injury. I’ve enjoyed their company and wish all continued success on their journeys, on and off trail. Yesterday I heard a description of a hiking couple that sounded an awful lot like Georgia and Nick. Could it be?
Better weather tomorrow, high in the 40s. Back to rainy days after that. On we go, one careful step at a time...","Watah Bald Shelter
",Wesser Bald Shelter,"Mar 08, Thu",10.60
Chip Tillson,https://www.trailjournals.com//journal/entry/583848,"Peach of a day today. Sunny and cool. I managed to avoid the temptation of a burger lunch at The Natahalia Outdoor Center Complex. Instead I ate a Spam Burrito and some almonds from my food bag to lighten my load for the long, steep climb out of there. The grade didn’t look too bad in the guide book but in reality it seemed to go on forever and some of the terrain was very rocky. I didn’t arrive here till almost 6:00 and now my feet hurt. I need to be more careful and not push so hard as to get injured.
Nearly all of the hikers passing through NOC were smarter and are resting tonight at one of the nearby hostels or hotels. Among them are Class Act, Mac Daddy, Plodalong, and Grandma Shortie. Next time I’ll run into them will probably be in The Smokies. 
Rain moving in tonight. What else is new.","Wesser Bald Shelter
",Sassafras Gap Shelter,"Mar 09, Fri",12.80
Chip Tillson,https://www.trailjournals.com//journal/entry/583900,"A cold, drizzly, and unexpectedly short walk today. My feet have been sore the past couple of days and around noon I felt a growing pain in one foot. I’ve seen others push through minor problems only to head home with serious injuries so I decided to get off trail a day earlier than planned. I pulled out the guidebook and called Lonnie at Wolf Creek Hostel for a pick up at the next road crossing. Within an hour I was showered and doing laundry. Swagman, Mac Daddy, and Class Act are here as well and we had dinner together at the diner next door. I’m pretty sure my foot is fine but might not have been if I went on as planned. I may have been pushing too hard and the smart thing to do is get some rest...lots of miles to go...
Denise is coming here to pick me up in the morning. I’ll spend tomorrow and Monday with her in Murphy, NC. I’ve made plans with Lonnie to spend Tuesday and Wednesday nights here at Wolf Creek while he shuttles me to and from the trail for 2 days of “Slack Packing”. Slack Packing is when you hike with just a day’s supplies and leave your gear behind or have it delivered to you up the trail. In my case I’ll be doing easier miles while my heavy pack gets some rest back at the hostel. After 2 zeros and 2 days slacking I should be well healed and charged up for the big, bad Smokies.","Sassafras Gap Shelter
",Stecoah Wolf Creek Hostel,"Mar 10, Sat",6.80
Chip Tillson,https://www.trailjournals.com//journal/entry/583962,"Denise picked me up as planned and we headed to the house for lunch, then off to Walmart for supplies. I have enough food to last through the Smokies now but will it fit in the pack? It’s all de-packaged and sealed in zip lock bags now but I don’t know...I’m tired of looking at it all. And I’m tired. Zero days are exhausting!","Stecoah Wolf Creek Hostel
","Murphy, NC","Mar 11, Sun",0
