Hiker trail name,Hiker Journal Link,Journal Story,Start location,Destination,date,Today Miles
Chip Tillson,https://www.trailjournals.com//journal/entry/600869,"I was up early for a great breakfast made to order in the hotel lobby then napped till 9:00 when the rain stopped. The rest of the day was dry and I made good progress even with one arm in a ""sling"". 
Work Horse, VanGoh, and Hales are camped nearby tonight. There's a dirt road mearby and a bunch of cars and trucks came by at dusk headed to a party up the road. I can hear them living it up, sounds fun! 
Looks like good weather the next few days. Gonna try to make Hanover, NH before I zero with Dan. One more solid day then I can finalize those plans. Onward...","Killington, VT
",Mile 1716.5,"Aug 18, Sat",11.30
Chip Tillson,https://www.trailjournals.com//journal/entry/600871,"It was a beautiful Vermont summer day: sunny, dry, & cool. The trail is soft underfoot and there are many cool clear streams to cross. The woods are deep green and open areas are covered with flowering goldenrod and milkweed. I passed through a forest of maples strung with tubing for the late winter syrup harvest. 
Several of us took a long break on the porch of farm stand on the outskirts of Woodstock. VanGoh and I split a fresh baked blueberry pie. Some of his ended up in his beard then he had iced cream: beard ala-mode!
Conversations now turn to the next challenge: the White Mountains of New Hampshire. Consensus: no problem. There's an unspoken rock solid confidence that all of us still hiking will make it through to Katahdin - just the Varsity left in the game now.
The shoulder is still sore with sharp pain if I lift my arm. It feels exactly like it did when I hurt it back in March. I expect the recovery will be the same except I don't have the option of taking a week off. I'll continue to walk with my arm hanging from my sternum strap to minimize movement and ""deploy"" it only when terrain dictates. 
Cell service is not good through here but I was able to contact Dan to request a pick up tomorrow afternoon. Current plans are to slack-pack on Tuesday and zero on Wednesday. Tonight I'm camped in a dark pine forest near a hilltop, no one else is around as the owls, crickets, tree frogs, and...and whatever THAT is...sing me to sleep.
Zzzzzzzz....","Mile 1716.5
",Mile 1730.5,"Aug 19, Sun",14.10
Chip Tillson,https://www.trailjournals.com//journal/entry/600975,"Another great weather day, I could get used to this. Over grassy peaks with great views and through green fields and dark forests. I took a snack break at a shelter with a privy shaped like a tiny gazebo. 
I walked with Work Horse for a few hours. We had been told to expect Magic at a house somewhere in White River Jct. and sure enough as we crossed a bridge Trail Angel Linda called out an invitation to come over for snacks, sodas, and coffee. We stopped to enjoy the hospitality and conversed about her home town and ours. She was babysitting her young granddaughter who was cute as a button as she quietly listened to us talking. How awesome it is for her to meet people from all over the world right there on Grandma's porch. 
A few miles later I arrived at Podunk Road where Dan would pick me up to take me to the Griffins cabin for some R&R. WH moved on but I'll see him tomorrow as I slack pack SOBO from Hanover, NH after Dan drops me there in the morning. He'll pick me up at Podunk in the afternoon and take me back to the cabin for a second night.","Mile 1730.5
",Mile 1739.7,"Aug 20, Mon",9.10
Chip Tillson,https://www.trailjournals.com//journal/entry/601070,"First thing in the morning we hopped in the car and Dan drove me north into New Hampshire to drop me off for a SOBO walk back to where we met yesterday. Much of the trail follows the road on this section and along the way we saw many hikers (including Work Horse) carrying their heavy packs in both directions. I only had supplies for the day and was looking forward to hiking unladen. 
Headed SOBO it was an easy downhill walk into Hanover, NH where I stopped at a diner for breakfast. The town was crowded with newly arrived Dartmouth College students and their families; it's freshmen orientation week and signs along the trail warned that the college sponsored hiker services and facilities were not available until September. 
I spent much of the day following the trail along the road on nice smooth sidewalks. When the trail went through the woods I took time to photograph the many varieties of mushrooms popping up. It has been a banner season for them due to all the rain. They ranged through an amazing palate of colors from cinnamon brown to red, orange, and blue.
As a SOBO'er for the day I had the pleasure of crossing paths with dozens NOBO'ers during the course of the day. There were many new faces and some familiar ones I hadn't seen in some time: Granny Gear, Half Way, Joe, Autumn, One Foot, and Pilgrim. Somehow I never ran into Work Horse, he probably ate at a different diner. 
In another textbook example of precision hiking I arrived back at Podunk Rd. at exactly 4:00 where Dan was waiting to take me back to Griffin's Cabin - stopping (of course!) at Long Trail Brewery for dinner and a pint. 
Tomorrow is my hard earned zero day. Ellen and Mike are touring through here in a rented RV and we hope to at least meet for lunch. It's turning out to be an awesome week. 
Back to the trail on Thursday...","SOBO from mile 1753.2
",SOBO to mile 1739.7,"Aug 21, Tue",13.50
Chip Tillson,https://www.trailjournals.com//journal/entry/601144,"Tonight is my third night with Dan here at Griffins Cabin and today was my first true zero day in 3 weeks. Ellen and Mike pulled up in the RV this afternoon and we had lunch and dinner together while sharing stories of our respective adventures. They're hitting the road in the morning as Dan takes me back to the trail. Thanks to Ted and Joyce for making the place available to us. I've got my cold weather gear, a full food bag, and am ready to tackle the White Mountains despite lingering shoulder problems. Gonna power through...","
","Plymouth, VT","Aug 22, Wed",0
Chip Tillson,https://www.trailjournals.com//journal/entry/601246,"Super friend Dan dropped me off this morning after breakfast in Queechee. I felt I could have stayed all week at the cabin with him, Ellen, and Mike but I must get back to the task at hand. Today was my first full day in New Hampshire: two states and just over 400 miles to go. 
I have cold weather gear now, just in time as it's kinda chilly tonight. I also have my 5th pair of shoes and 3rd pair of hiking pole replacement tips. The poles themselves are bent from the rocky ground and corroded from the sweat running down from my hands, after cleaning them up I think they'll be ok. I was able to use both poles most of the day but the shoulder still hurts pretty bad, nothing to do but power through (and not fall again!).
Almost a dozen young (20-something) NOBOs are camped around me tonight. They are all good, funny, positive people and it cheers me to be amongst them.  
Let's continue...","Mile 1853.2
",Trapper John Shelter,"Aug 23, Thu",12.20
Chip Tillson,https://www.trailjournals.com//journal/entry/601374,"The terrain is beginning to get difficult as I approach the White Mountains. I hiked for 10 hours today and only covered 12 miles.  The weather is cool and dry but the rainy summer has left mud everywhere. 
I passed several groups of Dartmouth students, one group was singing a Taylor Swift song...until they saw me, it was a funny moment. I leapfrogged Ambassador (NOBO) from London most of the day and we are both camped in the same area. The large group I camped with yesterday have pulled ahead, I think...the woods are thick here and they could be nearby without me knowing.
The sun is slamming down earlier every day which is going to make getting big miles very difficult. Just gotta keep moving, all day, every day. On we go...","Trapper John Shelter
",Mile 1777.4,"Aug 24, Fri",12
Chip Tillson,https://www.trailjournals.com//journal/entry/601501,"An exhausting day covering lots of miles over relatively nice ground. The weather is too perfect to last. Lots of day hikers out along with more groups of backpacking students. Met NOBO Tapioca and leapfrogged Pepper several times. Rock Hopper and her dog Daisy provided some Gaitoraid at a road crossing, I've seen them almost everyday for a week as they provide support for a NOBO who always seems to be just ahead of me. 
The hard work today got me to the base of Mt. Moosilauke and sets me up well to get up and over it safely tomorrow. Dave sent a message from back home warning me that the terrain on the other side is very difficult: good intel Dave, thanks!
Time to rest my weary bones...","Mile 1777.4
",Jeffers Brook Shelter,"Aug 25, Sat",15.70
Chip Tillson,https://www.trailjournals.com//journal/entry/601525,"Wow, what a difficult day. Getting up and over Mt. Moosilauki was as difficult as Dave said it would be. Thanks to his warning I hiked further yesterday so I could take my time today on the treacherous descent. It was the trickiest piece of trail so far requiring sustained mental effort to see several steps ahead, planning where to put my feet on and amongst the slippery rocks like blocks in a game of Tetris.
The weather was nice and there were lots of hikers out and about. I saw Fishears, Roadrunner and her dog Daisy and finally ran into Route 66 (the hiker Roadrunner is supporting).
I also met two women participating in an LLBean sponsored thru hike relay. They are Gogo (Zulu for Grandma, I'm told) and Naddy and are equipped with matching purple packs and other gear courtesy of the Bean. They're taking video, maybe some of it is, or will be, up on the corporate site. 
From the top of the mountain today I could see the next challenge, The White Mountains, off in the distance. They sure look big, best get my beauty sleep. 
Onward tomorrow...","Jeffers Brook Shelter
",Mile 1801.9,"Aug 26, Sun",8.80
Chip Tillson,https://www.trailjournals.com//journal/entry/601594,"Another very difficult day, even more so than yesterday. I was mistaken when I mentioned looking ahead to the White Mountains, these ARE the White Mountains. They kinda snuck up on me!
Anyhows, did I mention that it was a tough day? Can't say it enough, if the last two mountains had been in Georgia I'd have gone home the first week. As I was clambering through the boulders and mud on today's endless 4000 footer I realized that other than occasional knee pain my legs don't complain at all, they just keep doing whatever I ask them to do. The problem is that it takes more and more willpower every day to ask them to do it.
It occurs to me that even with a bad shoulder I'm in the best shape of my life. A pretty bold statement at age 55 but it's true. I'm also sure that I'll never be in this good a shape again so I'd best keep going. Any other me, past or future, could never ever put in this effort day after day so it's now or never.
On a lighter note I ran into another group of hiking students singing Taylor Swift. This group didn't stop singing when they saw me. I told them about the other group and said (jokingly as we passed), ""Kids these days don't even know good music, get off of my trail!"" Some of them got it. 
Most of the hikers I saw today were slack packing this section. They chose...wisely. Four more trail names for you: Maxi, Mountaingoat, Gutpunch, and Squirrel.
I'm almost out of food so a trip into Lincoln, NH tomorrow is in order. I'll likely stay the night and might ZERO to rest the shoulder. We'll see...","Mile 1801.9
",Kinsman Pond Shelter ,"Aug 27, Mon",11.20
Chip Tillson,https://www.trailjournals.com//journal/entry/601643,"I took my sweet time coming down off the mountain today and am now relaxing in a hotel in Lincoln, NH. 
Getting a ride into town from the trail (6 miles) was a bit tricky. The highly advertised Appalachian Mountain Club Shuttle turned out to be completely useless: ""The afternoon shuttle doesn't go to Lincoln""...what? It's the only town here! Three shuttle and taxi companies didn't answer my call, the fourth suggested Uber. After an hour of trying an Uber driver responded and came for me: he's the only Uber driver in Lincoln and had just got off from his day job. I think most of the other hikers hitched but I just don't feel right doing that, tried once before with no success. 
Once in town I got cleaned up and walked to an outfitter to buy a new water filter, my old one is getting slow. Then I went to a restaurant for a beer and a burger. On the way back from there I went to another restaurant for another beer and a salad. I'm full now. And sleepy. 
While still on the trail this morning I met a SOBO flip-flop hiker from Phoenix named Woody. He hiked from Harpers Ferry to Georgia on his first leg and is now headed from Maine back to Harpers Ferry. He seemed familiar, I think met him down south. We shared info on trail conditions and wished each other luck. 
I'm a bit dinged up so I'm taking a zero tomorrow. I'll be at high altitudes for the next week without much chance for rest. Good night...","Kinsman Pond Shelter 
","Lincoln, NH","Aug 28, Tue",4.90
Chip Tillson,https://www.trailjournals.com//journal/entry/601750,"It was hot today, a good day to be off the trail. Got my shopping done and I'm all ready to go. 
I went to the movies for some mindless entertainment: The Meg. Did you ever wonder if they play a movie when nobody comes? They do. I walked in just as the movie was starting and was the only person there, got a great seat. 
With help from the hotel front desk I was able to arrange for a ride back to the trail in the morning so I won't have to hitch. It's up, up and up into the realy big mountains tomorrow...one step at a time...
Note: I very much appreciate the comments left on the message board here. I check it all the time and get a kick when there's a new one. I decided not to use social media for my daily updates and started this journal so I could easily send one way updates, like post cards, to my family and friends. I'm really surprised that so many people are following along. It makes me very happy, thank you!","
","Lincoln, NH","Aug 29, Wed",0
Chip Tillson,https://www.trailjournals.com//journal/entry/601828,"Holy cows, yet another day where it got more difficult! How many more can there be? 
I was dropped off in the morning rain with a 3800ft climb ahead of me in the 6 miles to the top of 5260ft Mt. Lafayette. Then it would be another 4 miles of ups and downs until the campsite. The rain soon stopped and Mr. Sun shone for a bit as I climbed into the clouds. 
By the time I got to the top visibly was about 100ft with 30-40mph winds and higher gusts. It was chilly and the wind drove the moisture like rain. I took a few quick pictures and some video then put the phone away to keep it dry. The wind knocked me off balance a few times, once I stumbled into a jagged rock tearing a small hole in one of my my new shoes. Occasionally the trail wound through boulders which blocked the wind and I stopped to snack and rest.
It went on that way for hours until I got back down below tree line where the terrain got very difficult on Mt. Garfield. I made it to camp and set up just as it got dark. It's cold tonight. More of the same tomorrow as I approach Mt. Washington. Just keep movin my feets...","Liberty Springs parking area @ Rt 93
",Garfield Ridge Campsite,"Aug 30, Thu",10
Chip Tillson,https://www.trailjournals.com//journal/entry/602058,"The weather was excellent today, cool and clear with great views of distant peaks including Mt. Washington. Unfortunately my energy level was very low. I recognized early on that forcing miles would not be good for body or spirit so I walked slowly and stopped often to take in the beauty.
I'm at an official campsite about a mile off the trail tonight. The camps here in the White Mountains are operated by the Appalachian Mountain Club (AMC). They charge a small fee to cover the cost of maintenance and staffing. Some thru hikers scoff at the idea of paying to camp but I don't mind paying for bear proof food storage, convenient access to water, and a privy. It's worth noting though that these things are available for free along most of the AT, why it's not the case here is a mystery to me. 
The AMC also maintains a series of ""Huts"" that offer meals, lodging, and nice bathrooms. You need reservations to stay overnight there and the cost is over $100 a night. Thru hikers can eat leftovers and sleep on the floor by doing chores, it's called ""work for stay"" and is only available for 2 or 3 each night. I payed to join the AMC to give myself the option of staying in the expensive Huts if I needed to - I need all the help I can get. Unfortunately my timing is bad and they are all booked for Labor Day Weekend. 
I did stop at the Galehead Hut this afternoon for a $1 cup of coffee and sat on the porch for well over an hour enjoying the view. While there I chatted and shared trail info with several passing hikers including ""127"" (SOBO). 
I came across chicken sized bird standing in the middle of the trail. It just stood there looking at me, like chickens do, and only moved to avoid getting stepped on. As you know, I left my Field Guide to North American Birds at home (too heavy) so I can't identify it. I'll call it a Trail Chicken. 
Hopefully I'll have more energy tomorrow. I'm getting close to Mt. Washington and I'd like to tackle that challenge before this spell of good weather passes. Fast or slow, on we go...","Garfield Ridge Campsite
",Goyot Campsite,"Aug 31, Fri",5.60
Chip Tillson,https://www.trailjournals.com//journal/entry/602059,"September. When I started this I figured I'd be near the finish line by now. Sorry Joyce, I'm doing the best I can. 
Cloudy but cool today, a good day for walking. The mountains are crowded with weekend hikers. I must have passed over a hundred people, no kidding. It's weird but I've been outside inthe clean air so long I can smell them coming. So many people use Tide! I didn't see anyone who looked like a thru hiker all day. I did see a pair of Trail Chickens. Same as yesterday they just stood there...looking at me. I think they're up to something. 
I stopped mid-day at Zealand Falls Hut for a bowl of soup, coffee, and some snacks to beef up my food bag. It was a flurry of activity there with overnight guests leaving for and returning from short hikes on the many trails crisscrossing the area. 
Hoping for a very early start tomorrow I arrived at this camp and retired before sunset to get plenty of sleep. Unfortunately a large and loud group of Dartmouth students are camped nearby. Oh well, they're just having a good time. At least they're not singing Taylor Swift. 
Yet...","Goyot Campsite
",Ethan Pond Shelter,"Sep 01, Sat",9
Chip Tillson,https://www.trailjournals.com//journal/entry/602060,"Goal achieved: hit the trail at 7am and arrived here at 4pm. Set up, ate, and got things organized for another early start tomorrow. I'll need it as it's at least 12 miles to the next stop with towering Mt. Washington in the way. 
This morning at a road crossing I got some great Magic from Stitches (NOBO class of 1999). She had soda, doughnuts, and a bag of baby carrots (I so miss baby carrots). She also shared info on conditions ahead and suggested I consider flipping up to Katahdan soon and hiking south to finish up. I'm glad she brought it up as it's something I've got to consider. 
For those who don't know: the top of Mt. Katahdan, the tallest peak in Maine, is the official end of the AT. The mountaintop is normally snowed in by mid to late October but some years winter arrives in late September. When that happens thru hikers have to wait at the base of the mountain, sometimes for a week or more, hoping for a break in the weather so they can sprint up the last 6 miles to the finish line. 
I've always imagined finishing my adventure there but at my current pace I won't get there for over a month. 
I'd be a shame if I got all the way to the base of Katahdan only to have Snow Miser slam the door in my face...he's too much. Something to think about while I walk. 
Today's cool trail names are Thumper and Tuffy, both NOBO. Tomorrow I cross Mt. Washington. They claim it's the place with the worst, most dangerous weather on earth. The forecast looks good so let's continue...","Ethan Pond Shelter
",Nauman Campsite ,"Sep 02, Sun",9.30
Chip Tillson,https://www.trailjournals.com//journal/entry/602201,"Wow. What a day! I was up at 5am and on the trail at 6:45. Yeah, it takes me a long time to get going. I've given up trying to figure out why...just is. 
By 8:00 I was over Mt. Pierce and Above tree line where I remained for the rest of the day. By 9:00 I was in the clouds, it was windy and damp and got wetter as I climbed.  
I stopped at Lake of the Clouds Hut at 10:00 for a bowl of soup, a brownie, and a cup of tea. I was mindful to eat something at least every hour all day to keep my energy level up, I would need it. 
At noon I arrived at the top of Mt. Washington. Visibility was less than 100ft and the place was mobbed with tourists who had driven or taken the train up. It was bizarre being amongst so many people so suddenly. There was a line of perhaps 50 people waiting to take a picture in front of a sign right outside the gift shop marking the summit. I went to the cafeteria for pizza and chili and answered random questions from several people about my hike (I'm a rock star, a smelly rock star). Then I headed back out into the fog, took some pictures, and wandered around looking for the trail: it was behind the gift shop and I had to cut through the picture line to continue my journey. Then just like that I was alone again in the cloud.
In a few hundred yards I came to the train tracks. The grade is so steep that the train runs up a set of cogs between the rails. I could hear one coming so I waited to take a picture. As it emerged from the fog the conductor pointed at me and everybody waved and took MY picture (rock star). I've heard that it is customary for thru hikers to moon the train as it passes. It goes by so slow though...there must be some awfully cold butts and long awkward moments...just waiting for it to be over. 
The terrain on the descent was awful. Soul and sole wearing jagged rocks, at least they were rough enough so that traction was not a problem. Oh, did I say ""descent""? It was thousands of feet down then UP again time after time over the same rugged rocks all afternoon. I did eventually come down out of the cloud and the views were spectacular. Some rain came through and I spotted a rainbow alongside Mt. Adams, got a great picture! 
My plan was to get below tree line on the other side of Mt. Madison. Yesterday Stitches had warned me not to underestimate the difficulty of that particular section so my intention was to find a camping spot when I got into the woods and finish going down in the morning. Another option would be to stop early and try to get an expensive bunk at The Madison Springs Hut which is 1.5 miles above tree line. About 5:00, as I was nearing the Hut, I heard thunder and could see a storm approaching across the mountains. I kicked it into high gear and got to the Hut just before the wind, lightning, and downpour arrived. 
So that decided it. I'm here tonight, they say it's the first night since June that they have open bunks - sold to capacity all summer. Lucky me! My stay includes a great dinner and breakfast in the morning. Then I'm off again...","Nauman Campsite 
",Madison Spring Hut,"Sep 03, Mon",11.80
Chip Tillson,https://www.trailjournals.com//journal/entry/602203,"Boy am I glad I stopped at that Hut last night, not that I had much choice. A few other hikers went on into the storm figuring that the weather would improve below tree line. It did not and they spent an uncomfortable, if not dangerous night in the storm (I saw them today and they're ok). I was in my expensive bunk looking out as the storm lashed the mountain with 70mph winds - worth every penny. 
By morning all was calm and the sun came out providing incredible views back to Mt. Washington and into the valley below. 
Most of today's hike involved a very steep hike over Mt. Madison and down into Pinkham Knotch where I'm staying tonight. My knees are in bad shape after all the rough trail recently. I bought enough food for 3 days and have 21 miles to the next stop. The mountains ahead are smaller but just as rugged as those I just got through. Just put one foot in front of the other...","Madison Spring Hut
",Joe Dodge Lodge,"Sep 04, Tue",7.80
