Hiker trail name,Hiker Journal Link,Journal Story,Start location,Destination,date,Today Miles
Chip Tillson,https://www.trailjournals.com//journal/entry/585772,"Back to work! A pleasant day for the climb out of Hot Springs. It started tough but got easier. 
I’m not staying near a shelter tonight. I just walked till I was tired and found a nice spot near a water source. I’ll have to do this more often as I slowly raise my daily miles. 
My feet are a little sore, maybe because my shoes are beginning to loose their cushioning, so tomorrow I’ll dial it back a bit. I expected these shoes to last at least 500 miles. The soles and uppers are holding up well so I’ll try to get new insoles in Erwin. Zzzzzzz...","Hot Springs, NC
",Mile 289.1,"Apr 02, Mon",14.10
Chip Tillson,https://www.trailjournals.com//journal/entry/585773,"Really good hiking weather today: sunny, breezy, and cool. Much of the first 6 miles were uphill. It was steep with almost no switchbacks or “steps”, just a long steep ramp up. 
Walking uphill like that is hard on your feet, particularly your achilles because it’s stretched to the max with each step. I was careful to stop and stretch my calfs and hamstrings frequently to keep things as loose as possible. Nonetheless my left achilles is now a bit tender. I’ll have to monitor that very closely. But I digress...
After the long climb the trail followed a rocky ridge line with a broad valley to the west. The scenery was spectacular but the terrain was torturous. The white blazes had me scrambling over and between boulders; up into the sun for a view, then down into the rhododendron thickets, then back up again, over and over. It went on like that for miles so by the time I got down into more reasonable terrain I was exhausted. Passing the 300 mile marker gave me a brief lift as I dragged myself to the shelter. Everyone there was beat up too and for the first time in weeks the nightly chat session did not include tales of how awful the snowy Smokies were. 
I got a text from Plodalong today. He too has a sore achilles, probably from the same climb I did today. They are a few days north of here approaching Erwin. I also heard from John, he got back on the trail several days ago and is just leaving the Smokies. 
I’m battened down tight in anticipation of a stormy night with rain ending mid morning. Should I pack out in the rain or sleep in? Decisions, decisions...","Mile 289.1
",Jerry’s Cabin Shelter,"Apr 03, Tue",12.30
Chip Tillson,https://www.trailjournals.com//journal/entry/585779,"It rained hard last night but I stayed dry. At dawn I decided to trust the forecast and sleep in till it stopped. As predicted it stopped at 10:00 and by the time I hit the trail it was sunny although very chilly. 
Soon after I started I came upon the world renowned and much studied rock formation: “Big Butt”. Once again a short side trail led to the iconic protuberance. When I arrived at Big Butt I took some pictures then had a snack at the foot of The Butt (not on The Butt because it was windy there). Had it not been so early I could have called my day complete but there were miles to go...with a Queen song in my head.
By 6:00 I was ready to stop and began looking for a suitable spot. The trail at that point followed a stream up a mountain for almost 2 miles. There were several beautiful, moss covered areas to camp and others had set up in some. It is always cold and damp in the mornings anywhere near water so I filled my water bag and kept climbing until I found a suitable dry spot for my hammock. There’s a couple in a tent nearby who reasoned likewise. It was almost dark by the time I got organized. I ate some cheese and a Cliff Bar, called Joyce to get the weather forecast (no internet the last few days), and here I am.
Most of the other hikers I’ve met on this stretch are stopping at a hostel tomorrow. I’m planning to push on to Erwin. I’ll try to time my arrival there for Saturday morning, it seemed to work well in Hot Springs that way.Musical reference:https://www.youtube.com/watch?v=VMnjF1O4eH0","Jerry’s Cabin Shelter
",Mile 312.6,"Apr 04, Wed",11.20
Chip Tillson,https://www.trailjournals.com//journal/entry/585841,"Sunny, calm, and chilly day, perfect day to bang out some miles.Double bonus Magic! Where the AT goes under Interstate 26 at the TN/NC border Paul (Class of 2007) was set up cooking scrambled eggs and hash browns. It was mid afternoon and hikers ahead of me told him I was coming so he kept the griddle hot just for me. He packed up as I feasted. Thanks Paul!! As I left Paul’s buffet Stan Ward and his wife Judy(?) pulled over and opened their hatchback full of candy and mini pies. Having just eaten I gratefully put a boxed pecan pie in my pocket and moved on. 
A few hours later as I climbed Bald Mountain I began to fade so I got out the pie. It was delicious but more importantly had 400 calories! It powered me up and over the grassy summit and I made the shelter just before sunset. 
This is a 12 person shelter but there are only three others here: Sparrows, Duracell, and Murphy. I don’t recall meeting any of them before today. There’s room to spread out in the shelter so I decided not to set up my hammock tonite. That’s  a good thing because Sparrows had a hot water bottle spill in her sleeping bag and it’s soaked. She was trying to dry it out over the fire with little success so I lent her my hammock under quilt, which I don’t really need when sleeping on the ground, to get her through the night. Magic!
I’m undecided about how far to go tomorrow. I’ll figure it out as I walk.","Mile 312.6
",Bald Mountain Shelter,"Apr 05, Thu",14.40
Chip Tillson,https://www.trailjournals.com//journal/entry/586060,"It was relatively warm today, packing up was pleasant for a change (cold hands and feet). It was even warm enough for a quick stream side “bandanna bath”. 
There are lots of small flowers popping up: yellow, white, pink, and purple. I was passing a patch of purple ones when tiny purple butterflies took off from them...like the flowers were taking flight.
Rain started just as I arrived at the shelter. I decided again to stay inside and claimed an end spot. There’s room for six and there are seven now plus several tents outside and more arriving in the dark. On the overfull platform with me are Which Way, Next Step, Impact, Zero, Sparrows, and Beans; all of whom I’ve run across before (Which Way and Next Step are the couple I camped near the other night and, as I know now, the ones who brought the boxes of food on Easter). The conversation is relaxed and lively. It’s amazing how much we all have in common on and off the trail. I like it.","Bald Mountain Shelter 
",No Business Knob Shelter,"Apr 06, Fri",10.60
Chip Tillson,https://www.trailjournals.com//journal/entry/586072,"A foggy, mostly downhill hike into Uncle Johnny’s Hostel just steps from the trail outside Erwin, TN. 
When I arrived they were cleaning the facilities after a sewer overflow in the shower and laundry building. Oh boy. I needed re-supply so I checked in and hung my hammock under a roofed area built just for that and hopped on their noon shuttle to shop and have lunch. Nine of us had all you can eat salad and pizza then hit the Dollar General until the van picked us up at 1:30. The showers and laundry were up and running upon our return, clean up and gear sorting filled the hours until the evening shuttle back into town. I finished my shopping at Walmart and ate way too much lasagna at a nice little Italian place before returning to hang a bit before turning in. 
I’m undecided about tomorrow. I’ve got a painful blister (my first so far) and I don’t know if I can hike without making it worse. Too soon for another Zero but we’ll see.","No Business Knob Shelter
",Uncle Johnny’s Hostel ,"Apr 07, Sat",7.10
Chip Tillson,https://www.trailjournals.com//journal/entry/586136,"Mr. Blister woke me this morning. The toe hosting him was red and throbbing. Uh-oh! I bought alcohol and bandages yesterday but failed to be proactive enough so I zeroed today and tended to things by frequently cleaning and changing bandages. By evening it was much better.
I’ve got three pairs of socks: Darn Tough wool hikers, Injinji “toe socks”, and Sealskinz waterproof socks. I’ve been wearing the Injinjis almost all the time and have had no blisters. I only wear the Seslskinz in camp or when it’s very cold and wet. I hadn’t worn the Darn Tough one’s at all until a few days ago and that’s when I got the blister. Lesson learned. 
There’s a group of local fishermen on an annual outing renting a cabin here. They call themselves “The Happy Hookers” and invited everyone to join them for dinner. The Hostel owners contributed a big pot of chili and everyone gathered around the fire to eat and drink beers with music blaring (country of course!). Nice guys, I enjoyed chatting with them, doing my best to represent Jersey well. I ate too much and they’re moving on to whiskey so I excused myself and am listening from my hang spot across the yard. 
I can see the mountains where I’m headed and they’re covered with snow. Overnight rain here means more white stuff up there. Despite that I hope Mr. Blister will allow me to proceed in the morning. Too many zeros and I’m raring to go...","Erwin, TN
","Erwin, TN","Apr 08, Sun",0
Chip Tillson,https://www.trailjournals.com//journal/entry/586262,"Cold, foggy, and super damp today. I left Erwin planning to go only 4.4 miles to a shelter but the blister felt ok so I kept going till dark. The snow at altitude is nearly all melted and turned to mud.
Trying to average 12+ miles a day this week so I’ll go for 15 tomorrow. I’m considering sending for my summer gear in a couple weeks to lighten my load. On we go...","Uncle Johnny’s Hostel 
",Mile 353.8,"Apr 09, Mon",10
Chip Tillson,https://www.trailjournals.com//journal/entry/586428,"A chilly day, perfect to keep moving. There’s still some lingering snow at higher elevations but it’ll be melted soon as temperatures are supposed to rise each day to near 80 on Friday. 
I stopped twice to change Mr Blister’s bandage, he slowed me down a little but didn’t get worse. Around 3:00 at a road crossing I got Magic from “Rob the Casper Van guy” (his van has Casper the Ghost on it). Cherry pie and soda, sweet! He recommended a hostel up the trail near Roan, TN. I might stop there but no zero...gotta log some miles. 
I’m trying to do a better job of remembering names and faces, something I’ve never been good at. It’s especially hard because most everybody here dresses the same and most of the guys have beards. Today I’m committed to remember Skywater, Manny, and Moose.
Onward...","Mile 353.8
",Mile 366.8,"Apr 10, Tue",13
Chip Tillson,https://www.trailjournals.com//journal/entry/586431,"I said it would be warmer today...wrong! It’s like a meat locker up here in the Roan highlands! Everything over 5000ft elevation is still frozen. At least the sun was out all day. 
I was thinking about staying at the Roan Mountain Shelter tonight. At 6249ft up it’s the highest shelter on the whole AT. There’s room for 15 so I figured I’d give it a try just for the novelty of it. The trail up there was very icy and the side trail to the shelter looked like a frozen waterfall so I passed it by. Instead I’m in a grove of trees on a bald (a grass covered mountain top) 2 miles up the trail. My GPS Trail App says I’m at 5795.3ft as I hang in my hammock. The trail across the bald is about 50ft from me and apparently quite popular. At sunset several people walked their dogs past without noticing me. I suppose I’ll have visitors at sunrise as well. 
I’m a little beat up after today. Not only was it cold but the trail was very rugged. For miles it consisted of loose, three to six inch rocks, tough on the feet and ankles. Gonna be cold in the morning but I should be back below 4000ft by tomorrow night. Yes, it’s everything I signed up for...and it’s still awesome!!","Mile 366.8
",Mile 380.6,"Apr 11, Wed",13.80
Chip Tillson,https://www.trailjournals.com//journal/entry/586537,"I said goodbye to North Carolina today. Two states down, twelve to go! 
All my days out here are good but today was hands down the best so far. Sunny and cool with incredible views all day long. The trail went up and over vast grassy balds, occasionally ducking down into surreal groves of stunted moss covered trees, still bare of leaves. Pictures could not come close to capturing it.
I decided to stop in the town of Roan Mountain for laundry and a shower. There are two hostels at the road crossing. One is a longstanding business that offered a spot to hang my hammock for $10. The other recently opened and has varied accommodations starting at $30. Sounds simple right? Not so fast: the $30 place has a craft beer bar on premises! 
About half a mile out of town there was a man cutting brush on what looked to be an unmaintained side trail just off the AT. He introduced himself as a hostel owner and said he planned to re-establish the side trail leading directly to his hostel. 
“Do you like beer?”, he asked...“Yes. Yes, I do”...“My hostel has a craft beer bar and it’s right up the road from the trail, we’ve got plenty of beds tonight.” 
I thanked him, wished him well with his new business, and headed to Mountain Harbor Hostel for a $10 hammock spot. It’s very nice here, there’s a food truck with a hearty menu, lots of washing machines, and hot showers. After dinner a nice man from Germany gave me a Budweiser. It tasted crafty. Most of the folks I’ve seen on the trail this week are here too including Mel, Spirit Man, Moose, Cackles, Blade, and Fin. 
All is good in my little world tonite. 
Food truck breakfast is at 8:00 then resupply, relax for a few hours, and back NOBO. Tomorrow I’ll hit 400 miles...","Mile 380.6
",Mountain Harbor Hostel,"Apr 12, Thu",14.50
Chip Tillson,https://www.trailjournals.com//journal/entry/586679,"Another lovely sunny day, not as warm as predicted. Got started late after a magnificent food truck breakfast at the hostel: bravo Chef Dave! My belly was stuffed but the terrain was flatter and less rugged making for easy miles, some of them along a grassy river bank. Had I not showered only yesterday I might have jumped in. 
This week everyone got sunscreen out and we’re working on our hiker sock tan lines. At lower elevations the ground is green and the vines and trees are leafing out. The only shade so far has been under stands of balsam and inside the rhododendron tunnels. 
Fin met a SOBOer who reported passing 68 NOBOers in one day. I recall Slow Motion passed about 30 a few weeks ago. That means the big bubble is getting closer. I hadn’t noticed because I haven’t stayed near the shelters much recently. Most nights I’ve been “stealth” camping. That means just finding a spot anywhere along the trail, usually away from established campsites. 
When hikers meet in the afternoon it’s often asked “where are you headed to?”. My answer has been “6 or 7:00”. I find it more efficient to hike till evening, load up on water, and continue until I find a nice spot. The hammock makes it easy because I don’t need level ground to set up. If I had a tent I think I’d need to hire a caddy to help me read the greens searching for a flat spot!
Till tomorrow...","Mountain Harbor Hostel
",Mile 407.0,"Apr 13, Fri",11.90
Chip Tillson,https://www.trailjournals.com//journal/entry/586746,"I got a text last night from Kathy Wiswell (Schroeder) offering food, rest, and company at her and John’s place in Boone, NC. I initially declined then tossed and turned all night regretting that choice. Why shouldn’t I visit old friends when given a chance? Duh! 
First thing in the morning I called back, arraignments were made, and John picked me up at 4:00 after a mostly downhill hike to the next road crossing. After I got cleaned up John treated me to burger, beer, and conversation (Kathy is out of town, due back late tonite). Now, here I am in a real bed for the first time in weeks. 
Once again there’s bad weather on the trail as I chill in town. The mountain forecast is for torrential rain turning to snow over the next few days. While that’s all happening I’ll enjoy catching up with friends and plotting my return. Sweet!","Mile 407.0
","Boone, NC","Apr 14, Sat",12.60
Chip Tillson,https://www.trailjournals.com//journal/entry/587102,"Back on the trail this morning after a few days in Boone visiting Kathy and John. I enjoyed their company, the excellent food, and the super comfy bed! I am grateful once again for the opportunity to spend time with good friends as part of my journey.
Last night John and I went to Appalachian State University (where they both work) to hear a presentation about abolitionist John Brown’s many children. It was interesting and relevant to learn more about the man as the AT will take me right through Harpers Ferry Historical Park in about a month.
This morning I hired one of Dr. Schroeder’s students to give me a ride back to the trail. Joshua dropped me off right where John picked me up and I was back in the rhododendrons. I followed a river for a bit. There was a big waterfall followed by some tricky waterside steps along a rock face. Saturday’s rain has swollen the river and it was overflowing onto the trail in spots. As I climbed uphill it got very windy and up high there was still snow on the ground. Someone made a snowman along the trail leading back down to Watauga Lake. 
They’ve had bear problems at Watauga the past few years so the shelter and camping areas are closed. Signs are posted banning anyone from entering the area except “Park Rangers, Firefighters, and AT Thru Hikers”. I’ve got two of those covered! The rules required me to hike through the area without stopping. I covered the five miles quickly, went a little further to be safe, and here I am on a ridgeline watching the sun set.
There’s decent weather predicted for the next few days so I should be able make good progress . It’s 37 miles to Damascus, I’d like to get there on Friday morning. 
Let’s continue...","Boone, NC
",Mile 433.1,"Apr 17, Tue",13.50
Chip Tillson,https://www.trailjournals.com//journal/entry/587198,"I felt good today so I just kept going until sunset. The weather was nice but it’s getting real windy now and beginning to rain. I hope my tree and limb spotting skills are good enough to keep me safe. Since I started in February I’ve heard three trees fall, none of them close by. Sooner or later they all come down.
The weather tomorrow won’t be as nice but I’d like to post 15 or so miles. That would set me up for a morning arrival in Damascus, Virginia on Friday for resupply. Damascus has declared itself “Trail-town USA” so I’m  looking forward to checking it out.
Note: I enjoy reading the messages posted in the guest book for this journal. It gives me a lift to see that people are enjoying my posts. If you are curious about any aspect of this thing I’m doing please let me know. I’ve got a lot of daily posts to go and it’ll give me something to write about! That said: 
Questions? Anyone? Mrs Taft’s class maybe?","Mile 433.1
",Mile 449.8,"Apr 18, Wed",16.70
Chip Tillson,https://www.trailjournals.com//journal/entry/587289,"Cold and windy today, VERY windy. I kept warm by walking and before I knew it I had my biggest mileage day yet. I said goodbye to Tennessee and will be calling Virginia home for the next 500 miles, the longest I’ll be in any one state during my hike.
While hiding from the wind for lunch at a shelter I met Louie from Canada and two women from Denmark: Dirty Girl and Valkyrie. Also there were Finn, Rebecca(?), and two gentlemen I’ve been leapfrogging for a few days. All of us would have liked to stay in Damascus tonite but alas, everything is booked. I stopped for the night a few miles short of town and called in a reservation for tomorrow. I’m guessing the others are doing the same.","Mile 449.8
",Mile 467.1,"Apr 19, Thu",17.30
Chip Tillson,https://www.trailjournals.com//journal/entry/587448,"I treated myself to a swanky room here in Damascus at the Virginia Creeper Lodge -   named for a popular bicycle path that runs through here. There’s a nice kitchen in the common area so I bought groceries and cooked myself dinner to celebrate my 2 month hiking anniversary. It was quite nice and healthy to boot.
After dinner I went to Damascus Brewing Co. to sample the suds. The place was full of filthy hikers, my kinda place! Had a long talk with Crazy Brit and bought a beer for the German guy, Marco, who gave me a Budweiser last week. He’s off trail tomorrow heading to NYC and a decidedly not swanky $40 lower east side hostel before returning home. I advised him to skip Tompkins Square Park and head west to Washington Square. He plans to return to the US and continue his AT adventure from here next year.
I’ll be outa here in the morning after cooking myself a hearty breakfast. I might linger a bit to meet up with fellow Jersey guy John. He’s all healed up, hiking fast, and will be arriving in this town tomorrow morning. It’ll be nice to see him. 
The weather today was spectacularly nice. I was glad to be able to enjoy it sitting down for a change. Back at it tomorrow...","Mile 467.1
","Damascus, VA","Apr 20, Fri",2.70
Chip Tillson,https://www.trailjournals.com//journal/entry/587562,"Another beautiful day. I left Damascus about noon after meeting long lost John for coffee, he’s finally caught up after his foot injury and is taking a zero there. It was good to see another Jersey hiker...so few of us out here.
There are no doubt statistics on all of this this but here is roughly what I see:
40%-50% of thru hikers are from southeastern states, 20%-30% are from the rest of the US, and the rest are from abroad: mostly Germany, England, and Australia. Sidebar: If you mistake an Australian accent for British they politely correct you. If you mistake British for Australian you get “the look”. I don’t guess anymore.
With few exceptions Americans and Canadians are either in their 20s or their 50s. Europeans are usually in their 30s-40s. 
20s are hiking fast to get back to school or job. Foreigners have visas that run out in 6 months. We greybeards generally aren’t in a hurry. A surprising number are retired from military service, teaching, or other government work. I’ve met more than a few retired firefighters/EMTs but no law enforcement folks.
Perhaps 4 of 10 hikers are women. Nearly every thru hiker I’ve met is white. The ATC recently established a program to expand the diversity the the hiking community. Interestingly the folks I see out hiking for a day or weekend are more racially diverse. 
In Damascus and along the trail today there was another group of travelers: bicycle people, lots of them. The famous Virginia Creeper Bike Trail parallels the AT for several miles here, with a river separating the two. It was full of cyclists of all ages, from families with young children to full blown, tights wearing, pro looking bike guys. From what I saw in town cyclists gravitate to the more swanky establishments. Hikers generally shop at Dollar General and sleep in bunks.
I stayed in an upscale lodge last night and talked touring bikes with one of the peddlists from an upstairs room. I asked him a few questions about expensive bike. He was happy to extol its many virtues and told me of the adventures they’d had together. He was decidedly not interested in my hiking gear or anything about my adventure. Hmmm...
Note: I’m entering another poor cell service area...posts might be delayed.","Damascus, VA
",Mile 479.5,"Apr 21, Sat",9.60
Chip Tillson,https://www.trailjournals.com//journal/entry/587784,"Big miles over varied terrain. The weather turned colder as the day went on, heavy rain predicted in the morning. 
I’m camped at over 5000ft close to the top of Mt Rogers, Virginia’s highest peak. So...that means it’s all downhill into Harpers Ferry?
The trees are still leafless but the rocky hillsides are covered with small white flowers with light pink stripes. There’s enough of them so that it looks like snow on the ground. Pretty cool. 
And wouldn’t ya know it, just after I said there are few Jersey guys out here I met Shawn wearing a Sevens Tech Lacrosse shirt. He’s originally from Ocean City and knows Bay Head as he used to take the train frequently. He was on a day hike with his dog and headed for the summit but wisely turned back before reaching it so he could get down to his car before dark. 
Tomorrow I’ll be in the Grayson Highlands, an area famous for the wild ponies that call it home. It’ll be nasty out so I’m not sure if I’ll see them, they might all head for a hostel to stay dry.","Mile 479.5
",Mile 497.4,"Apr 22, Sun",17.90
